409,409,The earth rotates,409.0,"423,1,0,0,,,"
410,410,The temperature suddenly dropped,410.0,"424,1,1,0,,,"
411,411,The earth rotates,411.0,"425,1,0,0,,,"
412,412,under pressure,412.0,"426,1,0,0,,,"
413,413,I have a low fever,413.0,"427,0,0,0,,,"
414,414,"The plastic gets hot and gets cold, which increases the pressure.",414.0,"428,1,0,0,,,"
415,415,It's because I was in a hot place and went to a cold place.,415.0,"429,1,0,0,,,"
416,416,Because the volume changes depending on the temperature,416.0,"430,1,0,0,,,"
417,417,.,417.0,"431,1,0,0,,,"
418,418,It's because of air pressure and water pressure,418.0,"432,0,0,0,,,"
419,419,This is because the temperature has changed dramatically.,419.0,"433,1,0,0,,,"
420,420,I don't know.,420.0,"434,1,0,1,,,"
421,421,This is because the volume decreases when the temperature decreases.,421.0,"435,1,1,0,,,"
422,422,It's hot,422.0,"436,1,0,0,,,"
423,423,The air pressure in the bottle decreases as the temperature drops,423.0,"437,1,0,0,,,"
424,424,"Since the temperature and volume are proportional, as the temperature decreases, the volume also decreases.",424.0,"438,1,0,0,,,"
425,425,This is because the volume decreased as the temperature suddenly decreased.,425.0,"439,1,0,0,,,"
426,426,This is because inflated air decreases in volume in the refrigerator.,426.0,"440,1,0,0,,,"
427,427,This is because the volume of the contents inside the plastic bottle decreases when it enters the refrigerator with a larger volume due to heat from outside.,427.0,"441,1,0,0,,,"
428,428,This is because the temperature decreases and shrinks.,428.0,"442,0,1,0,,,"
429,429,This is because the temperature suddenly changed and the air in the plastic bottle contracted.,429.0,"443,0,0,0,,,"
430,430,"This is because the gas became hot, expanded, and then cooled and contracted.",430.0,"444,1,0,0,,,"
431,431,It's because the water vapor contracts as it condenses,431.0,"445,1,1,0,,,"
432,432,It is because of the sudden temperature difference.,432.0,"446,0,0,0,,,"
433,433,It is crushed because the temperature decreases and the amount of gas in the bottle decreases.,433.0,"447,1,0,1,,,"
434,434,"This is because when the temperature decreases, the volume of the gas decreases, and the pressure of the plastic bottle decreases.",434.0,"448,0,0,0,,,449,0,0,0,,,"
435,435,"In summer, the temperature is relatively high, so the volume of gas expands in the plastic bottle, and when put into the refrigerator, the volume of gas decreases as the temperature of the gas decreases, so the plastic bottle is crushed.",435.0,"450,0,0,0,,,"
436,436,"The temperature is relatively high in the summer, so the gas is inflatedgo",436.0,"451,0,0,0,,,"
437,437,"When placed in a refrigerator at a lower temperature than outside, the plastic is crushed because the temperature decreases and the volume decreases.",437.0,"452,0,0,0,,,"
438,438,"""",438.0,"453,0,0,0,,,"
439,439,"The higher the temperature, the more the volume of the gas expands, because the temperature decreases when put in the refrigerator, and the volume of the gas in the plastic bottle decreases.",439.0,"454,1,0,0,,,"
440,440,The bottle is crushed due to the difference between the temperature in the bottle and the temperature outside the bottle.,440.0,"455,1,0,0,,,"
441,441,The temperature of the refrigerator is lower than outside. This is because the volume of the gas decreases as the temperature decreases.,441.0,"456,0,0,0,,,"
442,442,"Gas expands and contracts as the temperature increases, so when a plastic bottle containing hot air is put in the refrigerator, the temperature of the hot gas decreases and contracts, which causes the plastic bottle to be crushed.",442.0,"457,1,0,0,,,"
443,443,Because of the difference in air pressure,443.0,"458,0,0,0,,,"
444,444,"Han Hangyul, I love you. I love you",444.0,"459,1,0,0,,,"
445,445,Go from high temperature to low temperature,445.0,"460,0,0,0,,,"
446,446,a difference between temperature and air pressure,446.0,"461,0,0,0,,,"
447,447,This is because the volume of air inside decreases,447.0,"462,0,0,1,,,"
448,448,"This is because the molecular motion of the gas increases due to the active molecular motion at the temperature outside in summer, but since the refrigerator is at a low temperature, the molecular motion of the gas is less active and the volume decreases.",448.0,"463,1,1,0,,,"
449,449,I don't know,449.0,"464,0,0,0,,,"
450,450,I don't know,450.0,"465,1,0,0,,,"
451,451,(wink),451.0,"466,1,0,0,,,"
452,452,I don't know. I didn't even know that It's a new fact that I didn't know this time.,452.0,"467,1,0,1,,,"
453,453,I don't know.,453.0,"468,1,0,0,,,"
454,454,I don't know.,454.0,"469,1,0,1,,,"
455,455,The temperature difference between the refrigerator and the outside decreases in volume,455.0,"470,1,1,0,,,"
456,456,"Because of the temperature difference between the refrigerator and the outside,",456.0,"471,1,0,0,,,"
457,457,....?,457.0,"472,1,1,0,,,"
458,458,This is because the volume of air in the plastic bottle decreased as the temperature decreased.,458.0,"473,0,0,0,,,"
459,459,?,459.0,"474,1,0,0,,,"
460,460,The volume decreases because the temperature decreases,460.0,"475,1,1,0,,,"
461,461,I don't know.,461.0,"476,0,0,0,,,"
462,462,There's a big difference between the air inside and outside,462.0,"477,0,0,0,,,"
463,463,There's not enough air,463.0,"478,1,0,0,,,479,1,1,0,,,"
464,464,"Because of the air pressure difference caused by the temperature difference,",464.0,"480,1,0,0,,,"
465,465,"= temperature increases volume increase by, Charles.",465.0,"481,1,0,0,,,"
466,466,To reduce the volume of objects within the temperature and plastic bottles.,466.0,"482,1,0,0,,,"
467,467,Thermal expansion due to diseases the cooling due to contraction of the refrigerator.,467.0,"483,1,0,0,,,"
468,468,"기체는 온도가 높으면 움직임이 더 활발해져서 플라스틱 내 벽을 치면서 부피가 팽창 되어있는데, 냉장고 안에 넣으면 온도가 내려가 다시 움직임이 느려져서 찌그러지게된다.",468.0,"484,1,1,0,,,"
469,469,There is a plastic bottle of hot air volume drop to lower the temperature inside if you put it in the fridge.,469.0,"485,1,0,1,,,"
470,470,"Higher temperatures, more active and bulky, reduce the temperature is molecular motion, molecular motion to smaller in volume have grown sluggish.",470.0,"486,1,1,0,,,"
471,471,"The increase in temperature increasing in volume, with increased by as much as pressure being applied to try to keep to its original condition is crushed plastic bottles.",471.0,"487,1,1,0,,,"
472,472,And the heat.,472.0,"488,1,0,0,,,"
473,473,Microvariation of pressure due to temperature differences.,473.0,"489,1,1,0,,,"
474,474,Naver,474.0,"490,1,0,1,,,"
475,475,"Out of the summer temperature is high inflation and, in the refrigerator temperature is lowered and crushed.",475.0,"491,1,0,0,,,"
476,476,"Cooling, thereby increasing the pressure is because a refrigerator cooled air molecules high speed, and heavy Plastron by the volume of Still's disease.",476.0,"492,0,0,0,,,"
477,477,고체로 상태변화 할때  부피가 줄어들어서,477.0,"493,1,0,1,,,"
478,478,I don't know.,478.0,"494,1,1,0,,,"
479,479,Due to the temperature differential,479.0,"495,1,0,0,,,"
480,480,온도가 낮아지면서 압력이 높아져서 플라스틱 병이 수축한다,480.0,"496,1,0,0,,,"
481,481,"The temperature in accordance with the volume of plastic is on the high increase in volume and cold temperatures will be easy, contract volume in a place.",481.0,"497,1,0,0,,,"
482,482,Temperature.,482.0,"498,1,0,1,,,"
483,483,"Because of the temperature difference,",483.0,"499,1,0,1,,,"
484,484,Temperature difference,484.0,"500,0,1,0,,,"
485,485,"This is because the temperature is lowered and the volume of air in the plastic bottle is reduced, so the air pressure outside the plastic bottle is stronger than inside the plastic bottle.",485.0,"501,0,0,1,,,"
486,486,"This is because the higher the temperature, the more active the gas becomes, the larger the volume, and the lower the temperature, the slower the gas activity and the smaller the volume",486.0,"502,1,1,0,,,"
487,487,Shrink due to pressure difference due to temperature difference between the inside and outside,487.0,"503,1,0,0,,,"
488,488,"In summer, the temperature of the air in the plastic bottle is higher than in the refrigerator, so when the air in the plastic bottle is put into the refrigerator, the volume decreases, and the plastic bottle is crushed to meet the pressure.",488.0,"504,1,0,0,,,"
489,489,Because it's hot,489.0,"505,0,1,0,,,"
490,490,"When put in the refrigerator, the temperature decreases rapidly, and the internal pressure and volume of the plastic bottle decrease as the temperature decreases. PV=nRT",490.0,"506,0,0,0,,,"
491,491,"This is because gases are more active in places with higher temperatures, so when entering a refrigerator with lower temperatures, the gas is less active.",491.0,"507,1,0,0,,,"
492,492,This is because the volume decreases when the temperature decreases.,492.0,"508,0,0,0,,,509,1,0,0,,,"
493,493,Don't know,493.0,"510,0,1,0,,,"
494,494,"The plastic bottle is crushed as the temperature is high and then quickly moved to a place where the temperature is low, slowing the activity of air molecules that were actively moving.The pressure difference caused the volume to decrease momentarily because the temperature was high and then suddenly decreased",494.0,"511,1,0,0,,,"
495,495,"In the summer when the temperature is high, the volume expands and contracts in the refrigerator when the temperature is low",495.0,"512,1,0,0,,,"
496,496,This is because plastic bottles that expanded at high temperatures contract as they are rapidly exposed to low temperatures.,496.0,"513,1,0,0,,,"
497,497,The temperature changed dramatically,497.0,"514,1,0,0,,,"
498,498,"As the temperature decreases, the amount of motion of the gas decreases, so the pet plane is distorted.",498.0,"515,1,0,0,,,"
499,499,"If the temperature is high, the amount of motion of the gas becomes active and expands, and if the temperature is low, the amount of motion decreases and becomes distorted",499.0,"516,1,0,0,,,"
500,500,The air is gone,500.0,"517,1,1,0,,,"
501,501,"Because of the heat transfer of air,",501.0,"518,0,0,0,,,"
502,502,This is because the hot air in the plastic bottle is pressed against the cold air in the refrigerator.,502.0,"519,0,0,0,,,"
503,503,"In a hot bottle, the refrigerator meets the heavy gas and the cold gas meet and crush",503.0,"520,0,0,0,,,"
504,504,Because of the temperature difference,504.0,"521,1,0,0,,,"
505,505,It's because of the pressure,505.0,"522,1,1,0,,,"
506,506,It's getting bigger,506.0,"523,1,0,0,,,"
507,507,It suddenly got cold,507.0,"524,0,0,0,,,"
508,508,It's getting bigger,508.0,"525,0,1,0,,,"
509,509,The temperature changes suddenly,509.0,"526,1,0,0,,,"
510,510,Change in volume by pressure,510.0,"527,1,1,0,,,"
511,511,The temperature of the air suddenly changed,511.0,"528,1,0,0,,,"
512,512,The temperature was hot and then suddenly it got cold,512.0,"529,0,0,0,,,"
513,513,Summer crabs are crushed by plastic bottles,513.0,"530,0,0,0,,,"
514,514,From hot temperature to cold temperature.,514.0,"531,1,0,0,,,"
515,515,Because I went from a hot place to a cool place,515.0,"532,1,0,0,,,"
516,516,This is because the temperature has changed.,516.0,"533,1,0,0,,,"
517,517,"When the temperature goes down, the pressure goes up",517.0,"534,1,0,0,,,"
518,518,Plastic is hard,518.0,"535,1,1,0,,,"
519,519,I don't know.,519.0,"536,1,0,0,,,"
520,520,Don't know,520.0,"537,1,0,0,,,"
521,521,The temperature suddenly changed,521.0,"538,1,0,0,,,539,1,1,0,,,"
522,522,This is because the pressure decreases because the temperature of the air in the plastic bottle decreases.,522.0,"540,1,0,0,,,"
523,523,Because of the sudden change in temperature,523.0,"541,1,0,0,,,"
524,524,?,524.0,"542,0,0,0,,,"
525,525,There's no air,525.0,"543,1,0,0,,,"
526,526,"Because of the sudden change in temperature,",526.0,"544,1,0,0,,,"
527,527,"If the temperature is low and then suddenly high, the pressure decreases.",527.0,"545,1,0,0,,,"
528,528,Because of the pressure,528.0,"546,1,0,0,,,"
529,529,It is because the molecules expand and contract.,529.0,"547,0,0,0,,,"
530,530,Don't know,530.0,"548,0,0,0,,,"
531,531,"Because of the sudden change in temperature,",531.0,"549,0,0,0,,,"
532,532,Because of the temperature change,532.0,"550,0,1,0,,,"
533,533,due to extreme temperature differences,533.0,"551,1,0,0,,,"
534,534,a rapid deterioration of temperature,534.0,"552,1,0,0,,,"
535,535,This is because air pressure changes due to sudden temperature differences,535.0,"553,0,0,0,,,"
536,536,The temperature changed dramatically,536.0,"554,0,0,0,,,"
537,537,"Because of the sudden temperature change,",537.0,"555,0,0,0,,,"
538,538,There's a difference in temperature difference?,538.0,"556,0,0,0,,,"
539,539,"If you put the plastic bottle outside in the refrigerator when the temperature rises and the pressure rises, the temperature decreases, the pressure decreases, and the volume decreases",539.0,"557,1,0,0,,,"
540,540,The temperature suddenly changed,540.0,"558,1,0,0,,,"
541,541,It swells up when you put it outside and shrinks again when you put it in the refrigerator,541.0,"559,0,0,0,,,"
542,542,The ball is compressed,542.0,"560,1,0,0,,,"
543,543,It is because of the sudden temperature difference.,543.0,"561,1,0,0,,,"
544,544,The temperature changed dramatically,544.0,"562,1,0,0,,,"
545,545,"""In the summer, the temperature is high, but in the refrigerator,",545.0,"563,1,0,0,,,"
546,546,"Because of the low temperature, the plastic bottle in the refrigerator is crushed.""",546.0,"564,1,0,0,,,"
547,547,I think it's because of the temperature difference,547.0,"565,0,0,0,,,"
548,548,I don't know.,548.0,"566,1,0,0,,,"
549,549,I don't know.,549.0,"567,1,0,0,,,"
550,550,The plastic burns down.,550.0,"568,0,0,0,,,569,1,0,0,,,"
551,551,"Because of the lack of air and air pressure,",551.0,"570,0,1,0,,,"
552,552,The heat cannot go out and is crushed by freezing.,552.0,"571,0,0,0,,,"
553,553,Because the hot air met the cold air,553.0,"572,0,0,0,,,"
554,554,I don't know,554.0,"573,0,0,0,,,"
555,555,I don't know.,555.0,"574,0,0,0,,,"
556,556,This is because the air is compressed.,556.0,"575,0,0,0,,,"
557,557,I don't know.,557.0,"576,0,0,0,,,"
558,558,I was in the hot air and suddenly came into the cold air,558.0,"577,0,0,0,,,"
559,559,It's hot and then cold.,559.0,"578,1,0,0,,,"
560,560,.,560.0,"579,1,0,0,,,"
561,561,The temperature suddenly dropped,561.0,"580,1,0,0,,,"
562,562,It's because the cold air is so strong and cold,562.0,"581,0,0,0,,,"
563,563,The temperature suddenly changed,563.0,"582,0,1,0,,,"
564,564,It was hot so I absorbed heat because I put it in the refrigerator to send heat.,564.0,"583,1,1,0,,,"
565,565,It's cold and it swells up,565.0,"584,1,0,0,,,"
566,566,I don't know,566.0,"585,1,0,0,,,"
567,567,The plastic is weak against heat.,567.0,"586,0,0,0,,,"
568,568,I was in a hot place and went into a cold place,568.0,"587,1,0,0,,,"
569,569,I don't understand.,569.0,"588,0,0,0,,,"
570,570,This is because the cold air presses the bottle.,570.0,"589,0,0,0,,,"
571,571,Because the air pressure is weak,571.0,"590,0,0,0,,,"
572,572,I don't know.,572.0,"591,1,0,0,,,"
573,573,How do I know?,573.0,"592,1,0,0,,,"
574,574,????????????????????????????????????????,574.0,"593,0,0,0,,,"
575,575,I don't know.,575.0,"594,0,1,0,,,"
576,576,.....................................,576.0,"595,1,0,0,,,"
577,577,I don't know,577.0,"596,0,1,0,,,"
578,578,Because the volume is reduced,578.0,"597,1,0,0,,,"
579,579,"If it's in a hot place, it melts and if you put it in a cold place, it freezes and gets smaller",579.0,"598,0,1,0,,,599,1,0,0,,,"
580,580,"It was hot, but it suddenly got cold",580.0,"600,1,0,0,,,"
581,581,There's a change in the heat,581.0,"601,0,0,0,,,"
582,582,????????,582.0,"602,1,0,0,,,"
583,583,It's because of the atmospheric pressure.,583.0,"603,1,0,0,,,"
584,584,"The refrigerator is a colder place, so the air pressure rises. Therefore, the plastic bottle is crushed because the pressing force becomes stronger.",584.0,"604,0,0,0,,,"
585,585,The temperature is so different,585.0,"605,1,0,0,,,"
586,586,This is because water becomes bulky when the temperature drops.,586.0,"606,0,1,0,,,"
587,587,It's because of the air.,587.0,"607,1,1,0,,,"
588,588,Because of the temperature change,588.0,"608,1,0,0,,,"
589,589,Not because I'm too lazy,589.0,"609,1,0,0,,,"
590,590,"""?",590.0,"610,0,1,0,,,"
591,591,"""",591.0,"611,0,0,0,,,"
592,592,???,592.0,"612,0,0,0,,,"
593,593,"This is because the temperature is low.When the plastic freezes and becomes smaller, it gets bigger and smaller",593.0,"613,1,0,0,,,"
594,594,I don't know,594.0,"614,0,1,0,,,"
595,595,under pressure,595.0,"615,1,0,0,,,"
596,596,"In the summer, the plastic bottle heats up because of the high temperature. If you put it in the refrigerator here, the temperature suddenly drops, so the air in the PET rice became unstable.",596.0,"616,1,0,0,,,"
597,597,Because of the atmospheric pressure,597.0,"617,1,0,0,,,"
598,598,The temperature is different inside and outside,598.0,"618,1,0,0,,,"
599,599,"Because of the low and high pressures,",599.0,"619,1,0,0,,,"
600,600,"This is because if you put it in the refrigerator, it suddenly contracts because of the cold.",600.0,"620,0,0,0,,,"
601,601,It suddenly got cold.,601.0,"621,0,0,0,,,"
602,602,I don't know,602.0,"622,1,0,0,,,"
603,603,This is because the volume of water increases as the temperature goes from high to low.,603.0,"623,0,0,0,,,"
604,604,be due to a difference in heat,604.0,"624,1,0,0,,,"
605,605,The air suddenly expands,605.0,"625,0,0,0,,,"
606,606,"The air was in it, and it got cold and shrunk",606.0,"626,1,0,0,,,"
607,607,Because of the low pressure,607.0,"627,1,0,0,,,"
608,608,This is because low temperatures make the atmosphere hot,608.0,"628,0,0,0,,,629,0,0,0,,,"
609,609,Because of the heat difference.,609.0,"630,0,1,0,,,"
610,610,The temperature was hot and then suddenly it got cold,610.0,"631,1,0,0,,,"
611,611,Because the air pressure went up?,611.0,"632,1,1,0,,,"
612,612,??,612.0,"633,1,0,0,,,"
613,613,"When it freezes, the volume of water decreases and the empty space shrinks",613.0,"634,0,1,0,,,"
614,614,The bar heats up and crushes the plastic bottle.,614.0,"635,1,0,0,,,"
615,615,It's because the air in the bottle has decreased,615.0,"636,1,0,0,,,"
616,616,It's because of the change in temperature change.,616.0,"637,1,0,0,,,"
617,617,Low temperature of Gichenne causes gas to low gas,617.0,"638,1,1,0,,,"
618,618,The temperature changed,618.0,"639,1,0,0,,,"
619,619,Low air temperature causes dents.,619.0,"640,1,0,0,,,"
620,620,It was hot and then it got cold,620.0,"641,0,0,0,,,"
621,621,I don't know.,621.0,"642,1,0,0,,,"
622,622,I don't know,622.0,"643,0,0,0,,,"
623,623,Due to the temperature differential,623.0,"644,1,0,0,,,"
624,624,I don't know.,624.0,"645,1,0,0,,,"
625,625,There's a temperature difference,625.0,"646,1,0,0,,,"
626,626,I don't know.,626.0,"647,0,0,0,,,"
627,627,melted by the heat,627.0,"648,1,0,0,,,"
628,628,Because of the temperature,628.0,"649,0,0,0,,,"
629,629,I don't know.,629.0,"650,0,0,0,,,"
630,630,I don't know.,630.0,"651,1,0,0,,,"
631,631,The air pressure changed,631.0,"652,1,0,0,,,"
632,632,Plastic bottles that expand when it is hot contract because they enter the cold refrigerator.,632.0,"653,0,1,0,,,"
633,633,"This is because when it gets cold, the atmosphere decreases.",633.0,"654,1,0,0,,,"
634,634,"It is because the temperature fluctuates greatly. This is because the volume expands due to the high temperature outside the summer, but the temperature is low in the refrigerator and contracts.",634.0,"655,1,0,0,,,"
635,635,be out of air,635.0,"656,1,0,0,,,"
636,636,This is because it contracts in places where the temperature is low.,636.0,"657,1,0,0,,,"
637,637,Because of the temperature,637.0,"658,1,0,0,,,659,1,0,0,,,"
638,638,a temperature difference,638.0,"660,1,0,0,,,"
639,639,"The plastic bottle outside is stretched because it is hot outside, but the refrigerator is cold and the particle decreases, so it is crushed",639.0,"661,0,0,0,,,"
640,640,This is because the temperature inside the bottle and outside are different.,640.0,"662,1,0,0,,,"
641,641,Temperature difference,641.0,"663,1,0,0,,,"
642,642,?,642.0,"664,1,0,0,,,"
643,643,The heated plastic bottle will be crushed by the cold air in the refrigerator.,643.0,"665,1,0,0,,,"
644,644,I don't know,644.0,"666,0,0,0,,,"
645,645,Plastic bottles outside in summer expand and contract in a cold refrigerator because of the warm summer temperature.,645.0,"667,0,0,0,,,"
646,646,Because the temperature suddenly changed,646.0,"668,0,0,0,,,"
647,647,"The plastic bottle is expanding because it is hot outside in summer, but when the bottle is put in the refrigerator, the temperature decreases rapidly, contracts rapidly, and the plastic bottle is crushed.",647.0,"669,0,0,0,,,"
648,648,.,648.0,"670,0,0,0,,,"
649,649,It got cold,649.0,"671,0,0,0,,,"
650,650,Steel,650.0,"672,0,0,0,,,"
651,651,Beakers... I don't know,651.0,"673,1,1,0,,,"
652,652,The temperature changed dramatically,652.0,"674,0,0,0,,,"
653,653,It's because of the temperature difference,653.0,"675,0,1,0,,,"
654,654,It's because of the pressure,654.0,"676,0,0,0,,,"
655,655,There's a change in temperature,655.0,"677,0,0,0,,,"
656,656,The air in the plastic shrinks by the cold air and is crushed,656.0,"678,0,0,0,,,"
657,657,This is because the volume contracts when the temperature decreases.,657.0,"679,0,0,0,,,"
658,658,"Just as a person curls up when it gets hot and cold, plastic bottles are the same.",658.0,"680,0,1,0,,,"
659,659,This is because the volume decreases when it gets cold.,659.0,"681,1,1,0,,,"
660,660,It is because of a sudden change in temperature.,660.0,"682,1,0,0,,,"
661,661,"This is because if you put what you put in a hot place in summer in a cold refrigerator, the temperature went up.",661.0,"683,1,0,0,,,"
662,662,This is because the volume of the gas in the bottle decreases,662.0,"684,0,0,0,,,"
663,663,Heat-expanded plastic bottles are crushed due to rapid contraction as the temperature drops sharply.,663.0,"685,0,0,0,,,"
664,664,"In summer, the inside of the plastic is hot, causing thermal expansion, and the air expands, and when it is placed in the refrigerator, it shrinks as the temperature of the air decreases.",664.0,"686,0,0,0,,,"
665,665,Pet bottles that have been stretched due to thermal expansion are crushed due to rapid contraction due to rapid temperature drop,665.0,"687,1,0,0,,,"
666,666,It is caused by the difference between the hot temperature in summer and the cool temperature of the refrigerator.,666.0,"688,1,0,0,,,689,0,0,0,,,"
667,667,I don't know.,667.0,"690,1,0,0,,,"
668,668,d,668.0,"691,0,0,0,,,"
669,669,The air is gone,669.0,"692,0,0,0,,,"
670,670,This is because the volume increases as the water expands.,670.0,"693,0,0,0,,,"
671,671,Because the air is escaping,671.0,"694,0,0,1,,,"
672,672,Why?,672.0,"695,1,0,0,,,"
673,673,I don't understand.,673.0,"696,1,0,0,,,"
674,674,"The lower the temperature, the higher the pressure",674.0,"697,0,0,0,,,"
675,675,.......,675.0,"698,1,0,0,,,"
676,676,The pressure got low,676.0,"699,0,0,0,,,"
677,677,Yeah.,677.0,"700,1,0,0,,,"
678,678,I don't know because I haven't tried it,678.0,"701,0,0,0,,,"
679,679,....,679.0,"702,0,0,0,,,"
680,680,take no notice of,680.0,"703,1,0,0,,,"
681,681,It's because the pressure has decreased.,681.0,"704,1,0,0,,,"
682,682,Because the pressure is low because it's cold?,682.0,"705,1,0,0,,,"
683,683,Temperature,683.0,"706,0,0,0,,,"
684,684,The plastic bottle that got hot suddenly dropped,684.0,"707,0,0,0,,,"
685,685,I don't know,685.0,"708,1,0,0,,,"
686,686,You're right,686.0,"709,1,0,0,,,"
687,687,"Wow, hello I didn't understand the problem itself!Ahhhhhhh!",687.0,"710,0,1,0,,,"
688,688,It's too cold,688.0,"711,1,0,0,,,"
689,689,This is because the volume increases as the temperature increases and decreases as the temperature decreases.,689.0,"712,1,1,0,,,"
690,690,/,690.0,"713,1,1,0,,,"
691,691,Because the temperature is different.,691.0,"714,1,0,0,,,"
692,692,Chinese zodiac signSomething scientific started,692.0,"715,1,0,0,,,"
693,693,There's something very scientific about it,693.0,"716,1,0,0,,,"
694,694,It's going to be vaporized,694.0,"717,0,1,0,,,"
695,695,There's a lot of cold air around me,695.0,"718,1,0,0,,,719,1,1,0,,,"
696,696,I suddenly got cold,696.0,"720,1,0,0,,,"
697,697,issue,697.0,"721,1,1,1,,,"
698,698,The temperature is different,698.0,"722,1,0,0,,,"
699,699,in expansion,699.0,"723,0,0,0,,,"
700,700,"The warm plastic bottle was put in the refrigerator and suddenly became cold, so the plastic bottle was crushed in surprise.",700.0,"724,1,1,0,,,"
701,701,Hah!,701.0,"725,1,0,1,,,"
702,702,Because of the sun,702.0,"726,1,1,0,,,"
703,703,"""The temperature of the plastic bottle outside is hot, and the temperature of the refrigerator is cool.",703.0,"727,0,0,0,,,"
704,704,"So when it gets hot and then suddenly gets cold, the bottle gets crushed.""",704.0,"728,1,0,1,,,"
705,705,My temperature has changed,705.0,"729,1,0,0,,,"
706,706,Because of the cold air,706.0,"730,1,0,1,,,"
707,707,The volume of the gas gets smaller,707.0,"731,1,0,0,,,"
708,708,d,708.0,"732,0,0,1,,,"
709,709,It's because the temperature suddenly,709.0,"733,1,0,0,,,"
710,710,It's hot outside and cool inside the refrigerator,710.0,"734,0,0,0,,,"
711,711,This is because the pressure has increased.,711.0,"735,0,0,0,,,"
712,712,"When it gets hot and cold, it's the same as frostbite",712.0,"736,1,0,0,,,"
713,713,"When it's cold, the bottle swells up, so it bursts and collapses because it's full of air",713.0,"737,1,0,0,,,"
714,714,The temperature and air pressure are different,714.0,"738,1,0,0,,,"
715,715,The air was hot It suddenly got cold,715.0,"739,0,0,0,,,"
716,716,The air got hot and then cold,716.0,"740,1,0,0,,,"
