125,125,Hot air in contact with cold air and when you see the movement of air molecules by the cold air gets smaller and crushed by volume is reduced accordingly.,125.0,"129,1,0,1,,,"
126,126,"A higher temperature reduces the amount of air per unit volume. Putting plastic bottles in this state in the refrigerator lowers the temperature, increasing the amount of air per unit volume, reducing the volume of plastic bottles.",126.0,"130,0,0,0,,,"
127,127,"In the summer, the temperature of the plastic bottle increased due to the high temperature, and as soon as the temperature entered the refrigerator with the low temperature, the temperature decreased rapidly, and the volume contracted, so it was crushed",127.0,"131,0,0,0,,,"
128,128,"Gas molecules in warm air increase in volume because they move fast, but gas molecules in cold air decrease in volume because they move slowly.",128.0,"132,1,0,0,,,"
129,129,in contraction,129.0,"133,1,1,0,,,"
130,130,The steam evaporates,130.0,"134,1,0,0,,,"
131,131,"Because of the temperature difference,",131.0,"135,0,0,0,,,"
132,132,the temperature of atmospheric pressure,132.0,"136,0,0,0,,,"
133,133,Because the temperature suddenly changed,133.0,"137,1,0,0,,,"
134,134,I don't understand.,134.0,"138,1,0,0,,,"
135,135,I don't know,135.0,"139,0,0,0,,,"
136,136,Because of the temperature difference,136.0,"140,1,0,0,,,"
137,137,It is because warm air escapes from the bottle.,137.0,"141,0,0,0,,,"
138,138,The volume of air inside shrinks and shrinks,138.0,"142,1,0,0,,,"
139,139,a sudden change in temperature,139.0,"143,1,0,0,,,"
140,140,I don't know because it's suddenly,140.0,"144,1,0,1,,,"
141,141,Air contraction inside due to sudden coldness,141.0,"145,1,1,0,,,"
142,142,"""The plastic bottle outside is hot",142.0,"146,1,0,0,,,"
143,143,"If you put it in a cold refrigerator, the plastic bottle shrinks.""",143.0,"147,1,0,0,,,"
144,144,This is because the gap between the air at high temperatures was drastically narrowed due to low temperatures.,144.0,"148,0,0,0,,,149,1,0,0,,,"
145,145,There's a bigger difference in temperature and pressure than the pressure inside the bottle pressure,145.0,"150,1,0,0,,,"
146,146,The temperature is different,146.0,"151,1,0,0,,,"
147,147,It's hot,147.0,"152,0,1,0,,,"
148,148,I don't know,148.0,"153,0,0,0,,,"
149,149,"The plastic bottle, which had been inflated by the heat, was moved to the cold center and contracted",149.0,"154,1,0,0,,,"
150,150,This is because it contracts by hitting a cold temperature (wind) after being hot.,150.0,"155,1,0,0,,,"
151,151,Because there is a temperature difference,151.0,"156,0,0,0,,,"
152,152,It's crushed under pressure.,152.0,"157,1,0,0,,,"
153,153,I don't know,153.0,"158,1,0,0,,,"
154,154,The temperature suddenly changed,154.0,"159,1,0,0,,,"
155,155,I was in a warm place and moved to a cold place.,155.0,"160,1,0,0,,,"
156,156,I don't know.,156.0,"161,1,0,0,,,"
157,157,Because the air is cold.,157.0,"162,1,0,0,,,"
158,158,This is because the temperature is different.,158.0,"163,1,0,0,,,"
159,159,"As the hot air in the bottle escapes out, the pushing force in the bottle disappears and the bottle is crushed",159.0,"164,1,0,0,,,"
160,160,"If you put a warm plastic bottle in the cold refrigerator,",160.0,"165,1,0,0,,,"
161,161,"Outside, the temperature is higher, so the volume of the gas is larger than when the temperature is lower, but suddenly the temperature decreases, reducing the volume of the gas and crushing the bottle",161.0,"166,1,0,0,,,"
162,162,Because of the temperature,162.0,"167,1,1,0,,,"
163,163,"If you leave a plastic bottle outside in the summer, it's hot and the bottle swells, and if you put it in the refrigerator, the surroundings are cold and the bottle is crushed...",163.0,"168,1,0,0,,,"
164,164,Because it's so hot;,164.0,"169,1,0,0,,,"
165,165,"When you suddenly go from hot to cold temperatures, the volume decreases and collapses.",165.0,"170,1,0,0,,,"
166,166,The temperature suddenly changed,166.0,"171,0,1,0,,,"
167,167,The air pressure inside the bottle is different from the air pressure outside on a hot day,167.0,"172,1,0,0,,,"
168,168,"The heat temperature of the plastic bottle was high, but the temperature suddenly decreased, so the volume suddenly decreased.",168.0,"173,1,0,0,,,"
169,169,This is because the temperature was high and then lowered.,169.0,"174,0,0,0,,,"
170,170,"Refrigerator has a lower temperature than outside in summer, so the volume of gas in refrigerator is smaller than outside in summer",170.0,"175,0,0,0,,,"
171,171,with less air pressure,171.0,"176,1,0,0,,,"
172,172,This is because the volume of air and water in the plastic bottle decreases as the temperature decreases.,172.0,"177,1,0,0,,,"
173,173,It's too hot to bulk up and down,173.0,"178,1,0,0,,,179,0,0,0,,,"
174,174,The water is frozen,174.0,"180,1,0,0,,,"
175,175,Yeah.,175.0,"181,1,0,0,,,"
176,176,Because the temperature is cold,176.0,"182,0,0,0,,,"
177,177,This is because the volume increases when it is hot and decreases when the temperature decreases.,177.0,"183,0,0,0,,,"
178,178,The plastic bottle expands due to hot heat and suddenly contracts quickly due to cold air and is crushed.,178.0,"184,1,0,0,,,"
179,179,I don't know,179.0,"185,1,0,0,,,"
180,180,It's because of the temperature,180.0,"186,0,1,0,,,"
181,181,"If you put it in the refrigerator, the temperature will decrease, so it will be crushed as the volume decreases.",181.0,"187,1,0,0,,,"
182,182,I don't know.,182.0,"188,1,0,0,,,"
183,183,1) It is the same principle as this. ^^,183.0,"189,1,1,0,,,"
184,184,The temperature is different,184.0,"190,1,0,0,,,"
185,185,This is because the temperature changes.,185.0,"191,0,0,0,,,"
186,186,a difference in atmospheric pressure,186.0,"192,1,0,0,,,"
187,187,This is because the volume expands when the temperature decreases.,187.0,"193,1,0,0,,,"
188,188,"The temperature suddenly changed, and the plastic bottle couldn't adjust to the temperature",188.0,"194,1,1,0,,,"
189,189,"As the water inside cools, the pressure in the plastic bottle decreases",189.0,"195,0,1,0,,,"
190,190,"When it is hot, the plastic bottle expands and the cold air in the refrigerator meets and collapses.",190.0,"196,0,0,0,,,"
191,191,Because it expands,191.0,"197,1,0,0,,,"
192,192,Because the plastic bottle was at warm temperatures and hit the cold air,192.0,"198,1,0,0,,,"
193,193,This is because the plastic bottle was hot and suddenly became cold.,193.0,"199,1,0,0,,,"
194,194,This is because the temperature of the refrigerator increases and the air pressure is reduced,194.0,"200,1,0,0,,,"
195,195,"Because there is less air in the refrigerator, the air in the plastic bottle escapes",195.0,"201,1,0,0,,,"
196,196,I don't know.,196.0,"202,1,0,0,,,"
197,197,"There's a big difference in temperatureIf you suddenly put it in a hot place and put it in a cold place, it will be crushed because of a sharp temperature difference",197.0,"203,0,0,0,,,"
198,198,"The plastic bottle is hot, but when you put it in a cold refrigerator, the temperature difference is severe and it is crushed",198.0,"204,1,0,0,,,"
199,199,This is because the temperature outside the refrigerator is high and the temperature inside the refrigerator is low in summer.,199.0,"205,0,1,0,,,"
200,200,Because the temperature suddenly changed.,200.0,"206,1,0,0,,,"
201,201,"It was warm, but I went into a cold place",201.0,"207,1,0,0,,,"
202,202,I don't know.,202.0,"208,1,0,1,,,209,1,1,0,,,"
203,203,I was in a hot place and suddenly went into a cold place,203.0,"210,1,0,0,,,"
204,204,under a lot of pressure,204.0,"211,1,0,1,,,"
205,205,"If you put a plastic bottle in the hot air in the refrigerator, it hardens into a soft state",205.0,"212,1,0,0,,,"
206,206,It is because it is swollen because it is hot air and suddenly meets cold air,206.0,"213,0,1,0,,,"
207,207,"The plastic bottle, which became hot under the influence of sunlight, suddenly receives cold air, and hot air and cold air collide with each other, causing the plastic bottle to be crushed.",207.0,"214,1,0,0,,,"
208,208,This is because the temperature changes rapidly and the air pressure changes in the bottle.,208.0,"215,1,0,0,,,"
209,209,"This is because plastic bottles left outside in summer enter a refrigerator with a low temperature while the temperature is high, resulting in a temperature difference between the inside and outside of the bottle.",209.0,"216,1,1,0,,,"
210,210,This is because the movement of the particles became less and contracted as the temperature decreased.,210.0,"217,1,0,0,,,"
211,211,The temperature suddenly dropped,211.0,"218,0,0,0,,,"
212,212,This is because the air pressure in the plastic bottle is lower than the air pressure in the refrigerator,212.0,"219,1,0,0,,,"
213,213,The temperature inside the refrigerator is cold,213.0,"220,1,0,1,,,"
214,214,"As the temperature rises, oxygen is compressed",214.0,"221,0,1,0,,,"
215,215,"When it's hot, the air pressure is high, but when I go into the cool refrigerator, the air in the bottle decreases.",215.0,"222,0,0,0,,,"
216,216,"This is because the lower the temperature, the smaller the volume of the gas.",216.0,"223,0,1,0,,,"
217,217,It is a phenomenon that occurs because the volume of ice increases as the water freezes.,217.0,"224,1,0,0,,,"
218,218,"In summer, it receives a high temperature and suddenly becomes cold and crushed when put in the refrigerator.",218.0,"225,0,1,0,,,"
219,219,The temperature suddenly changed and the particles gathered,219.0,"226,0,0,1,,,"
220,220,"Because the pressure of the air has decreased,",220.0,"227,1,0,0,,,"
221,221,I don't know,221.0,"228,1,0,0,,,"
222,222,pressure difference,222.0,"229,1,1,0,,,"
223,223,The temperature is different,223.0,"230,1,0,0,,,"
224,224,It's because of the atmospheric pressure.,224.0,"231,1,0,0,,,"
225,225,The bonds between the molecules become narrow,225.0,"232,1,0,0,,,"
226,226,"Bottles left outside in hot summer have a high temperature, so if you put them in a refrigerator with a low temperature, the temperature difference increases and becomes crushed.",226.0,"233,1,0,0,,,"
227,227,The temperature suddenly changed (hot -- cold),227.0,"234,1,0,0,,,"
228,228,This is because of the difference in pressure outside and inside the refrigerator in the summer.,228.0,"235,1,0,0,,,"
229,229,The temperature difference between the outside and the refrigerator is so big,229.0,"236,1,0,0,,,"
230,230,It expands when the temperature is high and contracts when the temperature is low,230.0,"237,0,0,0,,,"
231,231,The temperature has risen,231.0,"238,0,1,0,,,239,1,1,0,,,"
232,232,There is a big difference between the water temperature in the plastic bottle and the temperature in the refrigerator,232.0,"240,1,0,0,,,"
233,233,Because it is affected by the hot temperature.,233.0,"241,1,0,0,,,"
234,234,"It is because the volume increased due to the temperature and then cooled again, so the volume decreased.",234.0,"242,1,0,1,,,"
235,235,"The room temperature was high, so it expanded, but it was crushed because the temperature decreased and contracted as it entered the refrigerator",235.0,"243,1,0,0,,,"
236,236,It's because the water has expanded,236.0,"244,1,1,0,,,"
237,237,This is because the pressure has become stronger.,237.0,"245,1,0,1,,,"
238,238,"As the temperature goes up, the pressure goes up, but as the temperature goes down, the pressure goes down, and the air in the plastic bottle decreases and becomes dented",238.0,"246,1,0,0,,,"
239,239,This is because the temperature difference occurred because the temperature moved from high to low.,239.0,"247,0,0,0,,,"
240,240,It's because there's a big difference in temperature.,240.0,"248,1,0,0,,,"
241,241,"Plastic at high temperatures expands as the distance between molecules increases as molecular activity becomes active, and when the plastic bottle is put in the refrigerator, the temperature decreases rapidly and the distance between molecules decreases rapidly and becomes crushed.",241.0,"249,1,0,0,,,"
242,242,Because the temperature of the air inside and the temperature of the air in the refrigerator are different,242.0,"250,1,0,0,,,"
243,243,"As the temperature rises, there is a difference in air pressure",243.0,"251,1,0,0,,,"
244,244,"Plastic was placed outside in the summer when the temperature was high, so the distance of air expanded, but when put into the refrigerator where the temperature was low, the distance between the air became close and the plastic was crushed.",244.0,"252,1,0,0,,,"
245,245,"Due to the sudden temperature difference,",245.0,"253,1,0,0,,,"
246,246,I don't know,246.0,"254,0,0,0,,,"
247,247,"Because the temperature went down,",247.0,"255,1,0,0,,,"
248,248,"There is warm air in it, but it is crushed in the cold place",248.0,"256,1,0,0,,,"
249,249,"It is hot outside, but the refrigerator is cold, so it must have been crushed",249.0,"257,1,0,0,,,"
250,250,The plastic gets hot and cold,250.0,"258,1,0,0,,,"
251,251,There's a lot of temperature difference,251.0,"259,0,1,0,,,"
252,252,There's a big difference in temperature,252.0,"260,0,0,0,,,"
253,253,Yeah.,253.0,"261,1,0,0,,,"
254,254,Because of the temperature,254.0,"262,1,0,0,,,"
255,255,"It was hot, but it suddenly got cold",255.0,"263,0,0,0,,,"
256,256,The temperature suddenly changed,256.0,"264,0,1,0,,,"
257,257,The plastic is exposed to hot air and suddenly meets cold air and shrinks,257.0,"265,1,0,0,,,"
258,258,under pressure,258.0,"266,1,1,0,,,"
259,259,I don't know,259.0,"267,0,1,0,,,"
260,260,Because of the temperature difference,260.0,"268,0,1,0,,,269,1,0,0,,,"
261,261,The temperature suddenly went down,261.0,"270,0,0,0,,,"
262,262,"""I know",262.0,"271,1,0,0,,,"
263,263,"""",263.0,"272,0,1,0,,,"
264,264,Because of the high atmospheric pressure,264.0,"273,1,0,0,,,"
265,265,crouching in the cold,265.0,"274,1,0,0,,,"
266,266,"""If you leave it outside in the summer, it gets hot, so the pressure of the air changes and the volume increases",266.0,"275,1,0,0,,,"
267,267,"It's because the volume decreases when you break up, and that's why this happens.""",267.0,"276,1,0,1,,,"
268,268,Because of the high atmospheric pressure,268.0,"277,1,0,0,,,"
269,269,The pressure is getting stronger,269.0,"278,1,0,0,,,"
270,270,"It's hot, and then it's",270.0,"279,1,0,0,,,"
271,271,There's no water,271.0,"280,1,0,0,,,"
272,272,"The air in the plastic bottle, which was at a high temperature, expanded because the air contracted as it entered the refrigerator.",272.0,"281,0,1,0,,,"
273,273,The pressure is high,273.0,"282,1,0,0,,,"
274,274,Go from hot to cold,274.0,"283,1,0,0,,,"
275,275,This is because the temperature of the plastic bottle that was at the outside temperature and the cyst inside are different.,275.0,"284,1,0,0,,,"
276,276,The temperature dropped sharply,276.0,"285,0,0,0,,,"
277,277,"Higher temperatures increase the momentum of atoms, and lower temperatures decrease the momentum of atoms",277.0,"286,1,0,0,,,"
278,278,This is because the plastic bottle at the outside temperature and the cold air of the refrigerator meet.,278.0,"287,1,0,0,,,"
279,279,It was hot on the surface and went into the middle,279.0,"288,0,0,0,,,"
280,280,"By Charles' law, the volume is directly proportional to the absolute temperature, so the volume becomes smaller in a refrigerator with a low temperature.",280.0,"289,1,0,0,,,"
281,281,It goes from a hot place to a cold place,281.0,"290,1,0,0,,,"
282,282,Because there's pressure,282.0,"291,0,0,0,,,"
283,283,Because it's hot,283.0,"292,1,0,0,,,"
284,284,This is because there is a cold temperature.,284.0,"293,0,0,0,,,"
285,285,Because it is hot in summer.,285.0,"294,0,0,0,,,"
286,286,I don't know,286.0,"295,0,0,0,,,"
287,287,The temperature dropped dramatically,287.0,"296,1,0,0,,,"
288,288,This is because the hot air in the plastic bottle suddenly cools down.,288.0,"297,1,0,0,,,"
289,289,I don't know,289.0,"298,0,0,0,,,299,0,0,0,,,"
290,290,The temperature goes up and down,290.0,"300,1,0,0,,,"
291,291,"Since it is hot in summer, there is heat in the plastic bottle. However, when the heat suddenly meets the cold air, the volume of air decreases and collapses.",291.0,"301,1,0,0,,,"
292,292,The air condenses and dents.,292.0,"302,0,0,0,,,"
293,293,The hot heat outside causes the expanded bottle to meet the cold air and the hot air inside to escape,293.0,"303,0,0,0,,,"
294,294,Changes in the volume of a gas,294.0,"304,1,1,0,,,"
295,295,I don't know.,295.0,"305,1,0,0,,,"
296,296,dㄹrㄹrㅈㄹThe temperature goes up and down,296.0,"306,1,0,0,,,"
297,297,Move from hot to cold and need air,297.0,"307,1,0,0,,,"
298,298,I doubt it.,298.0,"308,0,1,0,,,"
299,299,I have no idea.,299.0,"309,1,0,0,,,"
300,300,The shape of the plastic changed due to a sudden change in temperature.,300.0,"310,0,1,0,,,"
301,301,This is because there is a sudden temperature difference.,301.0,"311,1,0,0,,,"
302,302,The volume of air has decreased,302.0,"312,0,0,0,,,"
303,303,I don't know,303.0,"313,1,0,0,,,"
304,304,This is because the air gets cold and the volume increases. That's why it's so uncomfortable because it can't withstand the amount of air.,304.0,"314,0,0,0,,,"
305,305,a change in temperature,305.0,"315,1,0,0,,,"
306,306,The plastic bottle was crushed because the temperature suddenly changed,306.0,"316,1,0,0,,,"
307,307,The temperature went up and down,307.0,"317,1,0,0,,,"
308,308,Because of the pressure?,308.0,"318,1,0,0,,,"
309,309,The plastic bottle melted and then got cold,309.0,"319,0,0,0,,,"
310,310,It's too much pressure,310.0,"320,1,0,0,,,"
311,311,This is because the refrigerator has a low temperature and the air in the plastic bottle has shrunk.,311.0,"321,1,1,0,,,"
312,312,This is because the volume of air decreases.,312.0,"322,1,0,0,,,"
313,313,Shape changes due to sudden temperature changes,313.0,"323,1,0,0,,,"
314,314,I don't know.,314.0,"324,0,1,0,,,"
315,315,"When the temperature goes up, the temperature goes down",315.0,"325,0,1,0,,,"
316,316,The temperature of the plastic bottle suddenly changed.,316.0,"326,1,0,0,,,"
317,317,This is because the temperature has dropped sharply.,317.0,"327,0,0,0,,,"
318,318,It seems to be because the temperature of the plastic bottle drops sharply when it suddenly becomes cold after being in a hot place.,318.0,"328,1,0,0,,,329,1,0,0,,,"
319,319,I don't know,319.0,"330,1,0,0,,,"
320,320,The temperature difference between outside and inside is huge.,320.0,"331,1,0,0,,,"
321,321,"The plastic bottle outside in the summer is warm, but it cools quickly when put in the refrigerator, so water vapor containing water enters the water again, reducing the air in the Tef bottle and crushing it.",321.0,"332,1,0,0,,,"
322,322,"The temperature of the plastic bottle is high and the temperature of the payback decreases, so the bottle is crushed.",322.0,"333,1,0,0,,,"
323,323,This is because plastic bottles in hot places meet in cold places and cause objects to be crushed.,323.0,"334,1,1,1,,,"
324,324,It's because of the pressure.,324.0,"335,0,0,0,,,"
325,325,"When put in the refrigerator, the plastic bottle expands as more air enters than when put outside.",325.0,"336,0,0,0,,,"
326,326,I think it's because of the temperature difference.,326.0,"337,1,0,0,,,"
327,327,I know...,327.0,"338,0,0,0,,,"
328,328,It seems to be crushed by sudden temperature changes,328.0,"339,0,0,1,,,"
329,329,The temperature outside and the temperature of the refrigerator are different,329.0,"340,0,0,0,,,"
330,330,It is because the temperature suddenly dropped.,330.0,"341,1,0,0,,,"
331,331,It's a gate with different temperatures.,331.0,"342,0,1,0,,,"
332,332,It's crushed by the cold air,332.0,"343,1,0,1,,,"
333,333,I was in a hot place and suddenly it got cold,333.0,"344,1,0,1,,,"
334,334,"Since the movement of atoms in a plastic bottle is more active than that of Woonerza in the refrigerator, the pressure is high because there are more molecules in the refrigerator.",334.0,"345,1,0,0,,,"
335,335,.,335.0,"346,0,1,0,,,"
336,336,.,336.0,"347,1,0,0,,,"
337,337,This is because the volume of the gas decreases when the temperature is lowered,337.0,"348,1,0,0,,,"
338,338,Is it solid or gas in a plastic bottle? Or is it liquid?,338.0,"349,1,0,0,,,"
339,339,It is because of molecular activity.,339.0,"350,1,0,0,,,"
340,340,.,340.0,"351,1,0,0,,,"
341,341,There's a difference in temperature,341.0,"352,0,0,0,,,"
342,342,"Because of the sunlight, oxygen in the plastic disappears as it gets into the refrigerator",342.0,"353,1,0,0,,,"
343,343,"Lower temperatures also reduce molecular motion, resulting in reduced volume",343.0,"354,0,0,0,,,"
344,344,"As the temperature decreases, the movement of atoms slows down and the gap between atoms decreases, so it is crushed.",344.0,"355,1,0,0,,,"
345,345,Volume increases as temperature increases,345.0,"356,0,0,0,,,"
346,346,The pressure in the bottle is lower than the atmospheric pressure,346.0,"357,0,0,0,,,"
347,347,Temperature,347.0,"358,1,0,0,,,359,1,0,0,,,"
348,348,Change in gas volume with temperature,348.0,"360,1,0,0,,,"
349,349,"The lower the temperature, the more it expands.",349.0,"361,1,0,0,,,"
350,350,"Because of the temperature difference, the waves change",350.0,"362,0,1,0,,,"
351,351,The temperature and volume are proportional,351.0,"363,1,1,0,,,"
352,352,"It's similar to the one above, but the opposite is obvious",352.0,"364,0,0,0,,,"
353,353,"This is because when the air in the hot bottle enters the refrigerator, the air shrinks and the volume decreases.",353.0,"365,1,0,0,,,"
354,354,adiabatic absorption,354.0,"366,0,0,0,,,"
355,355,The temperature went down,355.0,"367,0,0,0,,,"
356,356,It is because there is a nature to follow the phenomena of nature.,356.0,"368,0,0,0,,,"
357,357,Um Jeonghwa sings it. I don't know,357.0,"369,1,0,0,,,"
358,358,"The inside of the bottle is warm and the outside is cold, so it's crushed Yes, yes, yes",358.0,"370,1,0,0,,,"
359,359,This is because the volume decreases when the temperature decreases,359.0,"371,1,0,0,,,"
360,360,It's hot,360.0,"372,1,0,0,,,"
361,361,be due to a drop in temperature,361.0,"373,1,0,0,,,"
362,362,Because there was a change in pressure.,362.0,"374,1,0,0,,,"
363,363,be compressed as the temperature drops,363.0,"375,1,0,0,,,"
364,364,"Since T decreases in PV=nRT and the remainder minus V and T is constant, the volume decreases and the bottle is crushed.",364.0,"376,0,0,0,,,"
365,365,"Because of the temperature difference,",365.0,"377,0,0,0,,,"
366,366,It can be explained by the ideal gas state equation.,366.0,"378,1,0,0,,,"
367,367,This is because the volume of air has become smaller.,367.0,"379,0,0,0,,,"
368,368,This is because the gas in the plastic bottle contracts when it enters the refrigerator,368.0,"380,1,0,1,,,"
369,369,The temperature went down,369.0,"381,1,0,0,,,"
370,370,"The temperature decreases and the volume decreases, and the bottle is crushed accordingly.",370.0,"382,1,0,0,,,"
371,371,Because it's hot,371.0,"383,0,0,0,,,"
372,372,The volume decreases due to a decrease in temperature.,372.0,"384,1,0,0,,,"
373,373,"This is because the volume decreases as the temperature decreases, and the air in the bottle contracts",373.0,"385,1,0,0,,,"
374,374,The heat shrinks the expanded air,374.0,"386,1,0,0,,,"
375,375,"According to Charles' law, the temperature and volume are proportional, so when the temperature decreases, the volume decreases.",375.0,"387,1,0,0,,,"
376,376,The gas contracted,376.0,"388,1,0,0,,,389,1,0,0,,,"
377,377,I don't know,377.0,"390,1,0,0,,,"
378,378,a change in temperature,378.0,"391,1,0,0,,,"
379,379,It's a little hard.,379.0,"392,1,0,0,,,"
380,380,"A higher temperature increases the distance between molecules, but a lower temperature increases the distance.",380.0,"393,1,0,0,,,"
381,381,The temperature went down,381.0,"394,1,1,0,,,"
382,382,"If the temperature goes down, the volume goes down",382.0,"395,1,0,1,,,"
383,383,Someone stepped on it,383.0,"396,1,0,0,,,"
384,384,"Because of the temperature difference,",384.0,"397,1,0,0,,,"
385,385,It's because the temperature has gone down,385.0,"398,1,0,0,,,"
386,386,"Plastic bottles outside in the summer expanded due to heat, and the expansion of them by putting them in cold refrigerators decreased.",386.0,"399,0,0,0,,,"
387,387,The temperature decreases and the volume of the gas decreases,387.0,"400,0,0,0,,,"
388,388,Dented due to high temperature,388.0,"401,0,0,0,,,"
389,389,Because of the temperature difference?,389.0,"402,1,0,0,,,"
390,390,The temperature has risen,390.0,"403,1,0,0,,,"
391,391,This is because the volume decreases when the temperature decreases,391.0,"404,1,0,0,,,"
392,392,"The air inside the plastic is hot, and if you put it in the refrigerator right away, the temperature of the air decreases and the volume of the air decreases",392.0,"405,1,0,0,,,"
393,393,"If you expand and go into the cold, there's a big difference in temperature difference?",393.0,"406,0,1,0,,,"
394,394,This is because air pressure decreases when the temperature increases.,394.0,"407,1,0,0,,,"
395,395,"As the temperature increases, the distance between the gases decreases, and as the temperature decreases, the distance between the gases decreasesThe plastic bottle is crushed because the volume decreases when the temperature decreases.",395.0,"408,1,0,0,,,"
396,396,There's a big difference in temperature,396.0,"409,1,0,0,,,"
397,397,by rapid freezing,397.0,"410,0,0,0,,,"
398,398,in contraction,398.0,"411,1,0,0,,,"
399,399,The plastic melted,399.0,"412,0,0,0,,,"
400,400,Put a lot of water,400.0,"413,1,0,0,,,"
401,401,"It was in the hot air, but suddenly the cold air touched it.",401.0,"414,1,0,0,,,"
402,402,Because it's hot,402.0,"415,1,1,0,,,"
403,403,It's cold,403.0,"416,1,0,0,,,"
404,404,It's hot outside,404.0,"417,1,0,0,,,"
405,405,The pressure is low,405.0,"418,0,0,0,,,419,0,1,0,,,"
406,406,There's a big difference in temperature.,406.0,"420,1,0,0,,,"
407,407,It felt like the hot air was moving to a place with cold air,407.0,"421,0,0,0,,,"
408,408,Because the temperature difference is different,408.0,"422,1,0,0,,,"
