,Unnamed: 0,2) Why do plastic bottles that are left outside in the summer get crushed when they are put in the refrigerator?,Unnamed: 0,", q38_temperature, q38_pressure, q38_gas molecule, q38_temperature.1,q38_Pressure.1,q38_a gas molecule.1"
0,0,Because oxygen is cold,0.0,"0,1,0, the temperature is lowered, so the volume decreases"
1,1,Because the air is cold.,1.0,"1,1,0,0 the temperature is lowered, the volume is reduced"
2,2,I don't know,2.0,"2,0,0, the temperature decreases, the volume decreases"
3,3,I didn't put air on it,3.0,"3,0,0, decreasing temperature, decreasing volume"
4,4,Because it melts,4.0,"4,0,0, the temperature decreases, the volume decreases"
5,5,The plastic bottle is weak,5.0,"5,0,0,0 due to the decrease in temperature, the volume decreases"
6,6,I think it's because of the temperature change because it suddenly gets cold after being in a hot place,6.0,"6,1,0, because of the decrease in temperature, the volume decreases"
7,7,It's melted,7.0,"7,0,0, the temperature decreases, so the volume decreases"
8,8,It was hot and I bought it in the cold,8.0,"8,1,0, the temperature is lowered, so the volume decreases"
9,9,"The plastic bottle is in contact with the hot air, so the air is inside, because the hot air inside disappears when it meets the cold air.",9.0,"9,1,0, the temperature decreases, and the volume decreases"
10,10,There's a big difference in temperature,10.0,"10,1,0,0, the temperature decreases, the volume decreases"
11,11,"Because the air temperature is different,",11.0,"11,1,0, the temperature has decreased, the volume has decreased"
12,12,"It is cold in the refrigerator, so the pressure is generated in the plastic bottle and it is crushed.",12.0,"12,1,1,0, the temperature is lowered, so the volume is reduced"
13,13,Is there dew when it touches the cold air?,13.0,"13,1,0, the temperature has decreased, so the volume has decreased"
14,14,"The plastic bottle is hot outside, and suddenly it seems to be crushed in the cold refrigerator",14.0,"14,1,0, the temperature is lowered, resulting in a decrease in volume"
15,15,The bottle that received the hot air suddenly received the cold air,15.0,"15,1,0, the temperature decreases, resulting in a decrease in volume"
16,16,because of the pressure,16.0,"16,0,1,0, the temperature decreases, so the volume decreases"
17,17,Because the temperature of the air is different.,17.0,"17,1,0, the temperature has decreased, so the volume decreases"
18,18,"The plastic bottle expands if it is hot, and if it is cold, the plastic bottle is crushed in reverse.",18.0,"18,1,0,0, the decrease in volume occurs due to the decrease in temperature"
19,19,Because the air in the plastic bottle is hot air and the air in the refrigerator is cold.,19.0,"19,1,0, the volume decreases due to the decrease in temperature"
20,20,"Because if you put it in the refrigerator, the warm bottle gets cold and contracts.",20.0,"The volume of gas molecules in the bottle decreases due to a decrease in temperature of 20,1,0,0"
21,21,"It was hot, but I think it happened because the temperature suddenly changed like it was getting cold",21.0,"21,1,0,0 due to the decrease in temperature, the distance between gas molecules in the bottle becomes close, reducing the volume"
22,22,Just,22.0,"22,0,0,0 because the volume decreases due to the phenomenon of lowering the temperature,"
23,23,Just,23.0,"23,0,0,0 The volume decreases due to the decrease in temperature."
24,24,This is because the air in the plastic bottle evaporated.,24.0,"24,0,0,0, the temperature and volume are proportional, and the volume decreases"
25,25,I don't know,25.0,"25,0,0,0, the law of Shahl, because the volume gets smaller"
26,26,"It's hot, but why doesn't my plastic get crushed?;;;;;;?",26.0,"26,1,0, the volume also decreases as the temperature decreases, the volume decreases"
27,27,"Because of the cold air in the refrigerator,",27.0,"27,1,0,0, the lower the temperature, the lower the pressure of the gas. The internal pressure is reduced and it is crushed inwards because the volume is reduced"
28,28,It's hot outside and cool inside the refrigerator,28.0,"28,1,0,0, the pressure decreases as the temperature decreases. Accordingly, there is a difference between the external pressure and the internal pressure, so the plastic bottle is crushed, reducing the volume29,1,0, the volume and temperature are proportional, the volume decreases as the gas molecules in the plastic bottle gather"
29,29,This is because it changed from a hot space to a cold space.,29.0,"There is a proportional relationship between 30,0,0, temperature and volume, and the volume of plastic decreases"
30,30,I don't know.,30.0,"31,0,1,0, there is a proportional relationship between volume and temperature. ,Internal volume reduction"
31,31,at a low air pressure,31.0,"32,0,1,0,""It decreases in volume. This is because, when the temperature decreases, gas molecular motion is not active"", and the internal volume decreases"
32,32,under heavy pressure,32.0,"As the temperature decreases, 33,1,0,0, the motion of the gas molecule slows down. Pressure is the force that gas molecules hit a substance, and the force weakens and the pressure decreases. This is internal pressure, so plastic decreases until it is balanced with external pressure, because the internal volume decreases"
33,33,This is because the plastic bottle was expanded by heat and then contracted due to a sudden decrease in temperature.,33.0,"34,1,0,0, the kinetic energy of gas molecules is proportional to the temperature. Since speed is also proportional to kinetic energy, the speed of gas molecules decreases as the temperature decreases. If so, the internal pressure will decrease and the plastic will be crushed, because the internal volume will decrease"
34,34,The plastic bottle froze and the water froze,34.0,"35,1,1,0 ""Temperature and pressure are proportional, and plastic has to have the same internal and external pressure, so it decreases until then"", because the volume decreases"
35,35,The temperature was atmospheric pressure. It's a low-pressure in-he compression pig,35.0,"36,1,0,0,""Temperature and pressure are proportional. When the temperature decreases, the pressure also decreases, which is the pressure inside the plastic bottle. The internal pressure decreases and the volume decreases"""
36,36,"From hot air to cold air,",36.0,"37,0,0,0, temperature and internal pressure of plastic bottle are proportional to each other. Lower temperature causes internal pressure to decrease and crush, because the volume decreases"
37,37,I don't know,37.0,"38,0,0, the temperature and the volume of the gas are proportional, and the volume is reduced"
38,38,"As the ice ran out of oxygen, oxygen seemed to meet at the bottom",38.0,"The distance between 39,1,0,0 temperature and gas molecules has a proportional relationship, because the internal volume decreases"
39,39,This is because the volume of air has decreased as it cools.,39.0,"The distance between 40,1,0,0 temperature and gas molecules is proportional, because the volume decreases"
40,40,"Because the temperature of the plastic bottle outside and the temperature of the refrigerator are different,",40.0,"41,1,0, stay in a hot place and go to a cold place to reduce the volume inside the bottle"
41,41,I think it's because the hot air suddenly got cold because of the summer,41.0,"42,1,0, it's because the heated plastic goes into the cold refrigerator, and the volume inside the bottle decreases"
42,42,This is because the temperature difference in the air in the PET bottle is getting worse.,42.0,"43,1,0,0 because the temperature decreases, the volume inside the bottle decreases"
43,43,This is because the temperature changes a lot.,43.0,"44,1,0, because the temperature is lowered, the volume inside the bottle is reduced"
44,44,It's because the temperature changes a lot,44.0,"45,1,0, the temperature goes down, the volume of the bottle goes down,"
45,45,I was in the middle of the heat and came to the cold,45.0,"Because 46,1,0, the temperature went down, the volume in the bottle decreased"
46,46,The low temperature reduced the volume of gas in the bottle,46.0,"47,0,0,0 because it gets cold, the volume in the bottle decreases"
47,47,The plastic bottle was crushed because it was full of water,47.0,"48,0,0,0, the temperature is lowered, so the volume of the bottle is reduced"
48,48,I don't know,48.0,"49,1,0, the temperature is lowered, so the volume inside the bottle is reduced"
49,49,It suddenly got cold,49.0,"50,0,0,0 because the temperature decreases, the volume of the bottle decreases"
50,50,Don't know,50.0,"51,1,0, because the temperature decreases, the volume of air in the bottle decreases"
51,51,The difference between the temperature outside and the temperature inside the refrigerator seems to cause dents.,51.0,"52,1,0, the temperature drops, and the volume of air in the bottle decreases"
52,52,"When it's hot, the oxygen decomposes",52.0,"53,1,0,0 because the temperature drops, the volume of air in the bottle decreases"
53,53,The temperature difference is different,53.0,"54,1,0, it gets cold, so the volume of air in the bottle decreases"
54,54,Temperature difference,54.0,"55,0, 0, 0, cooling, because the volume of air in the bottle decreases"
55,55,I doubt it.,55.0,"56,1,1,0, because the volume of air in the bottle decreases"
56,56,"In the summer, the air pressure gets hot and dented",56.0,"57,0,0,0, the temperature goes down, because the volume of air in the bottle decreases"
57,57,I don't know.,57.0,"58,1,0,0 because the temperature goes down, the volume of air in the bottle decreases59,1,0,0 because the temperature goes down, the volume decreases"
58,58,It is a book because the temperature suddenly changed and the plastic was soft.,58.0,"Because the temperature goes down, 60,1,0,0, the volume goes down"
59,59,It is moved from hot to cold and crushed,59.0,"61,1,0, because the temperature goes down, the volume in the plastic bottle decreases"
60,60,"I know that plastic bottles are made of polyethylene (?), but polyethylene changes its shape when heated, so plastic bottles outside seem to be crushed in summer.",60.0,"62,1,0, because the temperature decreases, the volume decreases"
61,61,"In summer, the temperature outside is high, but the refrigerator is low, so it is due to sudden temperature changes.",61.0,"63,1,0,0 because the temperature decreases, the volume decreases"
62,62,"Since the temperature is high, the plastic bottle seems to have melted and been crushed.",62.0,"64,1,0,0 because the temperature drops, the volume decreases"
63,63,It may be because the temperature changes.,63.0,"65,0,0, because it gets cold, the volume in the plastic bottle decreases"
64,64,The temperature difference got worse,64.0,"66,0,0, because the refrigerator has a low temperature, the volume of the container is reduced"
65,65,I don't know,65.0,"67,1,1,0, the refrigerator has a low temperature, so the volume of the container decreases rapidly"
66,66,an elder brother,66.0,"68,0,0, the refrigerator has a low temperature, so the volume of the container decreases"
67,67,"The warm air was surrounding the surface, but when the cold air suddenly touches the surface, it seems to have been crushed under pressure",67.0,"69,1,0, because the refrigerator has a low temperature, volume ↓"
68,68,I didn't put it in the fridge,68.0,"70,1,0, the temperature of the refrigerator is lower than outside, so the bottle is crushed as the volume of the container decreases"
69,69,"This is because when the temperature of the gas inside the bottle decreases, it contracts",69.0,"71,1,0, because the temperature of the refrigerator is lower than outside, the volume decreases and the container shrinks"
70,70,"Due to the increase in temperature, the air temperature in the expanded plastic bottle increases, contracts, and scratches.",70.0,"72,1,1,0, the temperature of the refrigerator is lower than outside, so the volume decreases and the size of the plastic bottle decreases"
71,71,"The ambient temperature is low. Therefore, the temperature of the air inside the plastic is lowered, so that the air is contracted.",71.0,"73,1,0, because the temperature of the refrigerator is lower than outside, the volume decreases and the size of the plastic bottle decreases"
72,72,"It's because the temperature has gone down. When the pressure is constant, the temperature and volume are proportional.",72.0,"74,1,0, the temperature of the air in the bottle decreases, and the bottle dents as the volume of the container decreases"
73,73,"As the temperature goes down, the volume goes down",73.0,"75,0,0, the temperature of the air in the bottle decreases, so the volume decreases rapidly"
74,74,"By Charles' law, the temperature decreases and the volume of the cylinder gas decreases.",74.0,"76,0,0, the temperature of the air in the bottle decreases, so the volume in the plastic bottle decreases"
75,75,The thermal expansion of the gas contracts.,75.0,"77,0,1,0, the temperature of the air in the bottle decreases, because the volume in the plastic bottle decreases"
76,76,by decreasing volume,76.0,"78,1,1,0, the temperature of the air in the bottle decreases, because the volume in the plastic bottle decreases"
77,77,Because of the high atmospheric pressure,77.0,"79,1,0, the volume of the container decreases because the temperature of the air in the bottle decreases"
78,78,"As the temperature inside the bottle decreases, the pressure inside the bottle decreases and the plastic bottle is crushed.",78.0,"80,1,0, the temperature of the air in the bottle drops, and the volume of the container decreases rapidly"
79,79,"This is because the gas in the expanded plastic bottle is put in the refrigerator due to the hot temperature, and the temperature decreases rapidly, causing the gas in the plastic bottle to contract.",79.0,"81,1,1,0, because the temperature of the air in the bottle decreases, the volume of the container decreases"
80,80,"If the temperature is high, the volume of the gas expands, and if the temperature is lowered, the volume of the gas decreases, so if you put the plastic bottle outside in the refrigerator, the volume of the gas decreases, so the bottle is crushed.",80.0,"82,1,0, because the air in the bottle cools down, the volume of the container decreases"
81,81,"The reason why the plastic bottle outside is crushed when put in the refrigerator in summer is that the temperature of the air in the refrigerator is lower, which is larger than the density of the air inside the plastic bottle, so the pressure is higher.",81.0,"83,1,0, cooling of the air in the bottle, reducing the volume inside the container"
82,82,"Gas in a plastic bottle has a volume suitable for a certain temperature, and when placed in a refrigerator, the temperature of the gas decreases and the volume of the gas decreases and is crushed.",82.0,"84,1,0, as the air in the bottle cools, the volume inside the container decreases rapidly"
83,83,"The temperature of the plastic bottle decreases, reducing the volume of the gas in the bottle",83.0,"85, 1, 1, 0, the temperature of the air in the bottle decreases, because the volume inside the container decreases rapidly"
84,84,The ambient temperature has decreased,84.0,"86,1,1,1 The temperature of the air in the bottle decreases, the volume decreases, and the size of the plastic bottle decreases"
85,85,"As the temperature of the air in the plastic bottle decreased, the volume of the air decreased, and the pressure decreased, and it was crushed by the surrounding pressure.",85.0,"87,1,0,1 Because the temperature of the air in the bottle decreases, the volume decreases rapidly"
86,86,"If a sealed plastic container is left at a high temperature, gas particles inside the plastic container receive heat energy, which activates molecular movement. Accordingly, the number of air particles hitting the inner wall of the plastic cylinder increases. On the other hand, gas particles in the refrigerator are deprived of heat energy from the surroundings due to low ambient temperature, and molecular motion is also slowed, reducing the number of gas particles hitting objects. When a heated plastic container is placed inside the refrigerator, the pressure inside the container is relative to the refrigerator (outside)",86.0,"88,1,1,0, because the temperature of the air in the bottle decreases, the volume decreases and the size of the plastic bottle decreases89,1,0,1 Because the temperature of the air in the bottle decreases, the size of the plastic bottle decreases"
87,87,"In summer, atoms inside plastic move actively because of the high temperature. At this time, if you put the plastic bottle in the refrigerator, the temperature suddenly decreases, so the atoms inside the plastic suddenly slow down. Therefore, if you put plastic bottles outside in the refrigerator in the summer, they will be crushed.",87.0,"90,1,0, because the temperature of the air in the bottle decreases, the size of the plastic bottle decreases"
88,88,"According to the gas abnormality equation, the temperature is proportional to the pressure when the volume is constant, so the plastic bottle in the refrigerator is crushed because the temperature decreases, the internal pressure decreases, and the internal pressure is relatively lower than the external pressure.",88.0,"91,1,0, because the temperature of the air in the bottle decreases, the bottle is crushed as the volume inside the container decreases"
89,89,"The higher the temperature, the more active the motion of the gas becomes. That is, when the temperature of the gas in the enclosed space is changed, the degree of motion is changed, and thus the volume is also changes. The plastic bottle outside heats up, increasing the volume of gas in the plastic bottle. Putting the bottle in a cold refrigerator reduces temperature, reducing gas motion, and reducing volume. Therefore, the bottle is crushed.",89.0,"92,1,0,0 because the temperature of the air in the bottle drops"
90,90,"This is because the gas in the plastic bottle, which has increased in volume because it is warm, entered the refrigerator filled with cold air, and the air in the plastic bottle contracted, reducing the volume.",90.0,"93,1,1,0, because the air in the bottle gets cold"
91,91,Because of the temperature difference,91.0,"94,1,0, the temperature gets lower"
92,92,"Gas increases in volume when the temperature increases, and decreases in volume when the temperature decreases. If you put a plastic bottle in the refrigerator where the temperature is high, the temperature decreases, reducing the volume of the gas in the plastic bottle, which causes the plastic bottle to be crushed.",92.0,"95,1,1,0 because the temperature gets lower"
93,93,"The air in the plastic bottle is heated, so the mass, or density, of air per same volume decreases. In this state, when the lid is closed and put into the refrigerator, the low-density air inside is cooled and the volume is reduced, so it is crushed.",93.0,"96,1,0,1, temperature drop,"
94,94,"The volume of the gas is related to the temperature, and the air in the plastic bottle has a high temperature, which increases the volume of the gas. However, because the temperature of the refrigerator is lower than outside, the volume of the gas decreases and becomes crushed.",94.0,"97,1,1,1, the temperature goes down"
95,95,"In summer, if a plastic bottle that is heated outside and the internal pressure increases suddenly enters the refrigerator and the temperature decreases, the internal pressure decreases and the plastic bottle decreases.",95.0,"Because 98,1,1,1, the temperature goes down"
96,96,"In summer, the temperature is high and the air in the plastic bottle is active, so there are many collisions with the plastic bottle, but when placed in the refrigerator, the temperature decreases, and the air in the plastic bottle slows down, causing the plastic bottle to crush.",96.0,"99,1,1,0, because the temperature gets lower,"
97,97,"When plastic bottles are placed outside in summer, the air inside becomes active and the air pressure is lowered. As the temperature increases, the molecular motion of air increases, so the volume increases, and as the volume increases with air of the same mass, the internal air pressure increases. But when you put it in the refrigerator, the temperature drops rapidly. When the temperature decreases, the molecular motion slows down, so the volume decreases and the internal pressure decreases because of the same mass of air, so the external pressure is relatively high and the force to press the plastic bottle becomes strong and crushed.",97.0,"Because 100,1,0,0, the temperature goes down"
98,98,"The air in the plastic bottle decreases in molecular motion and volume as the temperature decreases. As the air volume of the plastic bottle decreases and the air pressure decreases, the air pressure of the outside air increases relatively, and the volume of the bottle decreases in order to make the air pressure equal.When you put a plastic bottle outside in the summer, the air inside becomes hot due to heat energy. The volume of air increases as the temperature increases, which also occurs in plastic bottles placed outside. It exists in a state in which the volume is relatively large and the pressure inside the bottle is increased. If you put a plastic bottle in this state in a refrigerator with a low temperature, the temperature of the air whose temperature has risen decreases, and the volume of the air whose temperature has decreased also decreases. The reduced volume of air causes a decrease in the pressure of pushing the PET bottle, which causes the external pressure to be relatively strong and causes the PET bottle to be crushed.",98.0,"101,1,0, because the temperature of the refrigerator is low"
99,99,"Gas tends to expand as the temperature increases, and contracts as the temperature decreases. Comparing the temperature of room temperature in summer with the temperature inside the refrigerator, the temperature of room temperature in summer is relatively higher. So, when the gas in the bottle, which was placed at room temperature, enters the refrigerator, it means that it moves from a high temperature to a low temperature. Therefore, the gas in the bottle will shrink and the bottle will be crushed because it means that the temperature will move to a place where it is low.",99.0,"102,1,0, because the temperature of the refrigerator is low"
100,100,a decrease in volume by temperature,100.0,"103,1,0, because the temperature of the refrigerator is lower than the temperature outside the summer season"
101,101,Decreased volume as high-yield temperatures in plastic bottles decrease,101.0,"104,0,1,1 because the temperature of the refrigerator is lower than the outside temperature in summer"
102,102,This is because the volume contracts as the heated air cools.,102.0,"105,1,0, the lower the temperature, the less movement of the temperature decreases"
103,103,Molecular motion slows down and internal pressure decreases,103.0,"106,0,1,0, when the temperature decreases, the movement of the gas particles is not active"
104,104,"As the temperature drops, the volume decreases",104.0,"When the temperature decreases, the movement of the gas particles decreases"
105,105,Because of the high atmospheric pressure,105.0,"108,1,0, the lower the temperature, the lower the movement of the gas particles"
106,106,I don't know.,106.0,"109,1,0, the lower the temperature, the less movement of the gas particles"
107,107,"Because of the sudden change in temperature,",107.0,"It is because the temperature of the refrigerator is lower than the temperature outside of 110,1,0, and summer"
108,108,It is so hot that inflation rapidly cooled and plastic bottles that had been contacted.,108.0,"Because the temperature of the refrigerator is lower than the outside temperature in summer, 111,0,0"
109,109,Due to the temperature differential,109.0,"112,0,0,0, the lower the temperature, the less movement of the gas particles"
110,110,The temperature is lowered gas reduces the volume.,110.0,"113,0,1,0, the lower the temperature, the less movement of the particles"
111,111,I don't know.,111.0,"114,1,0, because particles do not move actively when the temperature decreases"
112,112,Pressure difference.,112.0,"115,1,0, because the movement of the particles decreases when the temperature decreases"
113,113,The air is compressed to temperature changes.,113.0,"116,1,1,0, decreasing the particle movement as the temperature decreases"
114,114,"The plastic bottle is only in the summer, temperatures rise if temperature is in the fridge to expansion and contraction nyaryeogamyeonseo Yes.",114.0,"117,1,1,0, the movement of the particles decreases as the temperature decreases"
115,115,"Keep plastic bottles outside a hot day, warmed up so the temperature in the summer because they crushed by pressure is increased by a sudden you move in a cool place.",115.0,"118,1,0,0,,,119,1,0,0,,,"
116,116,"The temperature is high in places, and objects in space with low temperature low temperature and barometric pressure.",116.0,"120,0,0,0,,,"
117,117,"Outside the temperature is high to low temperature while expansion is a plastic bottle of situation, because to retract.",117.0,"121,1,0,0,,,"
118,118,"The refrigerator is expanded outside because of the low temperature compared to the outside air, which is fewer.",118.0,"122,0,0,0,,,"
119,119,뭐라고 설명해야 할 지 모르겠다.,119.0,"123,1,0,0,,,"
120,120,Temperature too high.,120.0,"124,0,1,0,,,"
121,121,I don't understand.,121.0,"125,1,1,0,,,"
122,122,Will be be warm plastic bottles in the refrigerator temperature is lower.,122.0,"126,1,0,1,,,"
123,123,The barometer is high.,123.0,"127,1,1,0,,,"
124,124,"Because they have a higher pressure, temperature goes down.",124.0,"128,1,0,0,,,"
