346,346,Oxygen decreases and carbon dioxide increases,346.0,"357,0, 0, 0, oxygen is reduced.,increase in carbon dioxide ratio,"
347,347,There will be more carbon dioxide than oxygen.,347.0,"358,0,1,0, oxygen reduction, carbon dioxide ratio increase,359,1,1,0, oxygen reduction, higher carbon dioxide ratio,"
348,348,"During ho-ho, oxygen is consumed and carbon dioxide is released.",348.0,"360,0,1,0, oxygen decreases, carbon dioxide increases,"
349,349,The amount of carbon dioxide increased and the amount of oxygen decreased.,349.0,"361,1,1,0, oxygen decreases., higher carbon dioxide ratio,"
350,350,Reduced oxygen and increased carbon dioxide,350.0,"362,1,1,0, oxygen decreases, carbon dioxide ratio increases,"
351,351,Oxygen + carbon peroxide,351.0,"363,0,1,0, oxygen decreases.,increase in carbon dioxide ratio,"
352,352,The bag swells.,352.0,"364,0,1,0, oxygen reduction, carbon dioxide ratio increased,"
353,353,Oxygen has become carbon dioxide.,353.0,"365,1,1,0, decreasing oxygen, increasing the amount of carbon dioxide,"
354,354,"Increased carbon dioxide, decreased oxygen",354.0,"366,1,1,0, decrease in oxygen, increase in the amount of carbon dioxide,"
355,355,Carbon Dioxide Increase Causing Oxygen Reduction,355.0,"367,1,1,0, decreasing oxygen, increasing the amount of carbon dioxide,"
356,356,A bag of fresh air will be filled with carbon dioxide.,356.0,"368,1,1,0, decrease in oxygen ratio, increase in amount of carbon dioxide,"
357,357,a bagful of air,357.0,"369,0,1,0, decrease in oxygen consumption, increase in carbon dioxide,"
358,358,There would have been a lot of carbon dioxide in the bag,358.0,"370, 1, 0, decreasing oxygen consumption, increasing carbon dioxide content,"
359,359,There will be minor changes.,359.0,"371,1,1,0, decreasing oxygen ratio, and increasing Co2.,"
360,360,Um Jeonghwa sings it. I don't know,360.0,"372, 0, 0, 0, decreasing the consumption rate, increasing the Co2.,"
361,361,"Carbon dioxide is released through breathing, making it difficult to breathe in a plastic bag. For your information, the air is not circulating because it is blocked.",361.0,"373,0,1,0, decreasing oxygen ratio, increasing Co2.,"
362,362,"There is oxygen in the drinking air, but there is carbon dioxide in the exhaling air, so there is more carbon dioxide in the bag later",362.0,"The ratio of 374,1,0,0, and oxygen decreases, and the ratio of Co2 increases.,"
363,363,Full of carbon dioxide,363.0,"375,1,1,0, oxygen ratios are reduced.The rate of ,Co2 increases.,"
364,364,The amount of oxygen in the bag decreased and the amount of carbon dioxide increased.,364.0,"376,0,1,0, decreasing oxygen, increasing the ratio of Co2.,"
365,365,The oxygen partial pressure decreases and the carbon dioxide partial pressure increases.,365.0,"377, 1, 0, 0, decreasing oxygen, increasing the ratio of Co2.,"
366,366,There's a lot of carbon dioxide,366.0,"378,1,0,0, oxygen deficiency, Co2 concentration increases.,"
367,367,The amount of oxygen decreases and the amount of carbon dioxide increases.,367.0,"379,1,1,0, oxygen deficiency, Co2 concentration increases"
368,368,Oxygen becomes scarce and carbon dioxide becomes high.,368.0,"380, 0, 1, 0, oxygen deficiency, Co2 concentration increases.,"
369,369,All the oxygen in the plastic bag turns into carbon dioxide.,369.0,"The concentration of 381,0,1,0, and Co2 increases.,"
370,370,Oxygen would have decreased and carbon dioxide would have increased.,370.0,"382,1,1,0, oxygen disappear, and the concentration ratio of Co2 increases.,"
371,371,"Oxygen becomes scarce, carbon dioxide from exhalation increases, and water vapor increases",371.0,"383,0, 0, 0, oxygen is lost., the concentration ratio of Co2 increases.,"
372,372,It will be filled with carbon dioxide.,372.0,"384,1,1,0, and oxygen disappear, and the concentration ratio of Co2 increases.,"
373,373,Carbon dioxide and water vapor increased instead of oxygen.,373.0,"385,0,1,0, oxygen is lost., the concentration ratio of Co2 increases.,"
374,374,Oxygen disappeared and carbon dioxide was produced on Earth,374.0,"The number of moles of 386,0,0,0,0, oxygen is lost, and Co2 increases.,"
375,375,The air in the bag would have decreased.,375.0,"387,0,0,1, oxygen loss, increases the number of moles of Co2.,"
376,376,Breathe only in a plastic bag and is full of carbon dioxide because there is no air circulation,376.0,"388,0,0,0, the oxygen ratio goes down, the number of moles of Co2 increases389,0,1,0, and oxygen ratios increase the amount of endurance, Co2.,"
377,377,Oxygen is reduced,377.0,"The ratio of 390, 1, 0, and oxygen decreases, and the amount of Co2 increases.,"
378,378,Oxygen in the bag decreased and carbon dioxide generated by breathing increased.,378.0,"391,0,1,0, oxygen reduction, Co2 increase"
379,379,There's only carbon dioxide,379.0,"392,1,1,0, the proportion of oxygen in the air in the bag decreases.,Co2 is increasing.,"
380,380,Oxygen has gone down,380.0,"393,1,1,0, oxygen is lost.,increase in Co2 ratio,"
381,381,lack of oxygen,381.0,"394,1,1,0, less oxygen, higher Co2 ratio"
382,382,Less oxygen and more co2,382.0,"395,1,1,0, decreasing oxygen content, increasing Co2 ratio"
383,383,The percentage of carbon dioxide increases,383.0,"The ratio of oxygen to 396,1,1,0, decreases.,increase in the amount of Co2,"
384,384,There is a lot of carbon dioxide.,384.0,"397,0, 0, 0, 0, oxygen is reduced.,increasing the amount of Co2"
385,385,Oxygen has gone down Carbon dioxide has increased,385.0,"398,0,0,0,0 oxygen is gradually reduced, Co2 is increased"
386,386,The bag fills with breath.,386.0,"The ratio of 399,1,1,0, and oxygen decreases.CO2 is increasing"
387,387,Oxygen is gone and more carbon dioxide is left than oxygen,387.0,"400, 0, 0, 0, oxygen gone, Co2 ratio increased"
388,388,I think there's a lot of carbon dioxide,388.0,"401,0,0,0, less oxygen, increasing Co2 ratio. ratio"
389,389,Oxygen is reduced.,389.0,"402,0,0,0,0, decrease in oxygen ratio, increase in Co2 ratio"
390,390,be filled with breath,390.0,"403,0,0,0,Oxygen decreased,Co2 ratio increased"
391,391,Air changes because inhalation is bigger than exhalation,391.0,"404,0,0,0,Oxygen reduction,Co2 ratio increased"
392,392,increase in carbon dioxide,392.0,"405,0,0,0, the oxygen ratio decreases, the Co2 ratio increases"
393,393,Oxygen has decreased,393.0,"406,0,0,0,0, no oxygen, Co2 ratio increased"
394,394,There is more carbon dioxide,394.0,"407,1,0, the proportion of oxygen in the air in the bag decreases, the proportion of Co2 increases"
395,395,"The air is inhaled through inhalation, and oxygen in the air is used for cellular respiration, and carbon dioxide is emitted through exhalation, making it difficult to breathe due to less oxygen in the plastic bag.Oxygen has decreased and carbon dioxide has increased",395.0,"408,1,0,O2 decreased,Co2 ratio increased"
396,396,Breathing increases carbon dioxide and inhalation reduces oxygen.,396.0,"The 409,0,0,1,O2 ratio decreases., increase in the amount of Co2,"
397,397,Oxygen decreases and carbon dioxide increases.,397.0,"The ratio of 410, 0, 1, and O2 has decreased, increasing the amount of Co2"
398,398,The air in the bag reduces oxygen and increases carbon dioxide.,398.0,"411,0,0,0 and O2 ratio decreased, Co2 increased in quantity"
399,399,The air decreases,399.0,"412,0,0,1,O2 ratio decreased, Co2 increased"
400,400,have no air,400.0,"413,0,0,0, decreasing oxygen ratio, increasing the amount of Co2"
401,401,There's more carbon dioxide than oxygen,401.0,"414,0,0,1, decreasing the oxygen ratio, increasing the amount of Co2"
402,402,evaporation of air,402.0,"The ratio of 415,0,0,0,O2 decreases, and the co2 increases.,"
403,403,The bag swells up,403.0,"416,0,0,0,0, decreasing oxygen ratio, increasing co2.,"
404,404,Breathe in and air goes away.,404.0,"417,0,0,0,0, decrease oxygen content, increase co2.,"
405,405,"""",405.0,"The ratio of 418,0,1,0 ,co2 increases.,The ratio of 419,1,1,0 and co2 increases.,"
406,406,the swelling of a bag,406.0,"The ratio of 420, 0, 1, 0 and co2 increases.,"
407,407,I feel like I'm going to run out of air,407.0,"The ratio of 421,0,1,0,co2 increases.,"
408,408,It looks like it's going to shrink.,408.0,"The concentration of 422,1,1,0 and co2 increases.,"
409,409,It's shrunk.,409.0,"423,0,1,0 , the concentration of co2 increases"
410,410,Fresh air was consumed by our lungs and bad air was ingested.,410.0,"The concentration of 424,1,1,0 and co2 increases.,"
411,411,the loss of oxygen,411.0,"The concentration of 425,1,0,co2 increases.,"
412,412,It's getting hot,412.0,"The concentration ratio of 426,1,0,0 and co2 increases.,"
413,413,The plastic bag is damp,413.0,"The concentration ratio of 427,1,1,0 and co2 increases.,"
414,414,The air in the bag would have been reduced,414.0,"The concentration ratio of 428,1,1,0 and co2 increases.,"
415,415,The plastic bag is damp.,415.0,"The concentration ratio of 429,1,1,0 and co2 increases.,"
416,416,The air has shrunk,416.0,"The number of confiscations of 430,1,1,0 and co2 increases.,"
417,417,There is moisture and bad air,417.0,"The number of moles of 431,1,1,0 and co2 increases.,"
418,418,"If you breathe a lot, the air gets dirty and it's hard to hide.",418.0,"432,1,1,0 ,co2 has a larger number of confiscations"
419,419,People died because it was hard.,419.0,"The amount of 433,0,0,0 ,co2 increases.,"
420,420,"Because of inhalation and exhalation,",420.0,"The amount of 434,1,1,0 and co2 increases.,"
421,421,It's full of carbon dioxide,421.0,"435,1,0,co2 increase"
422,422,There would be less oxygen and more carbon dioxide.,422.0,"436,1,1,0,co2 more.,"
423,423,It contains carbon dioxide.,423.0,"437,1,1,0 ,co2 ratio increase"
424,424,"When a person exhales, it releases carbon dioxide.So a large plastic bag will be full of carbon dioxide.",424.0,"438,1,1,0 ,co2 ratio increased"
425,425,Oxygen would have decreased and carbon dioxide would have increased.,425.0,"439,1,1,0 ,co2 ratio increased"
426,426,"After breathing several times, the air in the bag would have increased the proportion of carbon dioxide",426.0,"440,0,1,0, increasing the amount of co2"
427,427,Oxygen has decreased and carbon dioxide has increased,427.0,"The amount of 441,0,1,0 ,co2 increased"
428,428,Oxygen in the plastic bag will gradually decrease and carbon dioxide will increase.,428.0,"442,1,1,0 ,co2 increase"
429,429,The proportion of oxygen in the air would have decreased.,429.0,"443,0,1,0...co2 is increasing"
430,430,Oxygen in vinyl is lost and carbon dioxide is increased.,430.0,"444,0,0,0 ,co2 ratio increase"
431,431,The oxygen ratio of the air in the bag decreased and the carbon dioxide ratio increased.,431.0,"445,0,0,0 ,co2 ratio increase"
432,432,The bag is filled with carbon dioxide and oxygen is reduced,432.0,"446,1,1,0 ,co2 ratio increase"
433,433,Breathe in the oxygen in the bag and release carbon dioxide,433.0,"447,0,1,0 ,co2 ratio increased"
434,434,Carbon dioxide is injected into the bag by inhaling oxygen and emitting carbon dioxide.,434.0,"448,0,0,1,co2 ratio increased449,0,0,0 ,co2 ratio increased"
435,435,"At first, it is full of oxygen, but then the carbon dioxide rate rises",435.0,"450, 0, 0, 0, increased co2 ratio"
436,436,The air would have decreased because I inhaled the air in the bag.,436.0,"451,0,0,0 ,co2 ratio increased"
437,437,"In the bag, the concentration of carbon dioxide is higher than the concentration of acidity due to breathing.",437.0,"452,0,1,0 ,co2 ratio increased"
438,438,"Oxygen also comes out when you exhale, but if you exhale several times, the proportion of oxygen decreases.",438.0,"453,1,1,0,,increase in amount of co2"
439,439,"Gas exchange occurs in the lungs through lung breathing, and the concentration of oxygen decreases when exhaling after breathing, and the concentration of carbon dioxide produced as a result of breathing increases, reducing the concentration of oxygen in the bag and increasing the concentration of carbon dioxide.",439.0,"454,0,1,0 , increasing the amount of co2"
440,440,"Gas exchange occurs in the lungs, and the concentration of oxygen in the bag decreases and the concentration of carbon dioxide increases because of the carbon dioxide produced as a result of breathing.",440.0,"455,0,1,0 ,co2 increase in quantity"
441,441,The concentration of oxygen decreases and the concentration of carbon dioxide increases.,441.0,"The amount of 456,0,1,0 ,co2 increased"
442,442,The oxygen in the bag turned into carbon dioxide,442.0,"457,1,1,0 ,the amount of co2 increased"
443,443,The bag is almost filled with carbon dioxide.,443.0,"458,1,1,0 ,co2 increased in quantity"
444,444,The air in the bag became carbon dioxide.,444.0,"459,0,1,0... Increase in carbon dioxide"
445,445,Change from oxygen to carbon dioxide by inhaling in and out,445.0,"460,1,0,0...increase in carbon dioxide"
446,446,It would be full of carbon dioxide,446.0,"461,0,0,0... More carbon dioxide"
447,447,It's blurry,447.0,"462,0,0,0 ,, carbon dioxide increases.,"
448,448,an increase in air pressure,448.0,"463,0,1,0 , carbon dioxide increases.,"
449,449,Oxygen concentration decreases and carbon dioxide concentration increases.,449.0,"464,1,1,0...there is more carbon dioxide"
450,450,It would be full of carbon dioxide.,450.0,"465,0,1,0... Increase carbon dioxide,"
451,451,Moistening sugar,451.0,"466,0,1,0,,increase in sugar dioxide,"
452,452,It's blurry,452.0,"467,1,1,0,,increased carbon dioxide,"
453,453,(wink),453.0,"468,0,1,0...Carbon dioxide increases.,"
454,454,"Later, it becomes hard to breathe",454.0,"469,0,1,0... Increased carbon dioxide,"
455,455,turn into carbon dioxide,455.0,"470,0,1,0... Carbon dioxide increases"
456,456,Oxygen is reduced and carbon dioxide is increased.,456.0,"471,0,0,1, increases carbon dioxide"
457,457,It's full of carbon dioxide,457.0,"472,0,1,0...Carbon dioxide increases.,"
458,458,Carbon dioxide has formed.,458.0,"473,0,1,0,,increase in carbon dioxide ratio,"
459,459,There would be carbon dioxide.,459.0,"474,1,0,0,,increase in carbon dioxide ratio,"
460,460,Oxygen decreases and carbon dioxide increases,460.0,"475,1,1,0,,increase in carbon dioxide ratio,"
461,461,Carbon dioxide went in instead of oxygen,461.0,"476,1,1,0,,increase in carbon dioxide ratio,"
462,462,The bag was filled with carbon dioxide,462.0,"477,1,1,0 , the carbon dioxide ratio increases"
463,463,the disappearance of oxygen is gone.,463.0,"478,0,1,0, the carbon dioxide ratio increases.,479,1,1,0 , the carbon dioxide ratio increases"
464,464,The amount of air in the bag decreases. Because the amount of air in the plastic bag is limited.,464.0,"480,1,1,0,,,the carbon dioxide ratio increases.,"
465,465,The air decreases,465.0,"481,0,0,0... the carbon dioxide ratio increases"
466,466,There is carbon dioxide left,466.0,"482,0,0,0... Increases carbon dioxide ratio"
467,467,Oxygen is gone and only carbon dioxide is left,467.0,"483,0,0,1, the carbon dioxide ratio increases"
468,468,Most of the air becomes carbon dioxide,468.0,"484,1,1,0,,,the carbon dioxide ratio increases"
469,469,Oxygen is used for human breathing and carbon dioxide is produced by exhalation.,469.0,"485,0,1,1, the amount of carbon dioxide increases"
470,470,"When you inhale (inhale), the fresh air in the bag goes into the body, and when you exhale the air in the body, carbon dioxide comes out and changes the air, making it harder to breathe as fresh air turns into carbon dioxide.",470.0,"486,0,1,0... Increases the amount of carbon dioxide"
471,471,The amount of carbon dioxide increases,471.0,"487,1,1,0... Increases the amount of carbon dioxide"
472,472,"""The concentration of carbon dioxide increases",472.0,"488,0,0,0... Increases the amount of carbon dioxide"
473,473,"""",473.0,"489,1,1,0... Increases the amount of carbon dioxide"
474,474,There is a lot of carbon dioxide has increased.,474.0,"490,1,1,0 , the amount of carbon dioxide increases.,"
475,475,Steam rises and steam rises,475.0,"491,1,1,0...the carbon dioxide ratio increases"
476,476,There's a lot of carbon dioxide,476.0,"492,0,0,0 , the carbon dioxide ratio increases.,"
477,477,It's full of carbon dioxide. Oh my,477.0,"493,1,1,0...the carbon dioxide ratio goes up"
478,478,be short of oxygen,478.0,"494,0,1,0...the carbon dioxide ratio goes up"
479,479,Oxygen is gone and only carbon dioxide is left.,479.0,"495,1,1,0,,more carbon dioxide,"
480,480,Reduced oxygen and increased carbon dioxide,480.0,"496,1,1,0... More carbon dioxide"
481,481,Oxygen decreases and carbon dioxide increases,481.0,"497,0,0,0... More carbon dioxide"
482,482,It's filled with carbon dioxide,482.0,"498,1,1,0,,carbon dioxide  ,"
483,483,O2 changes to CO2.,483.0,"499,1,0,0,,increase in carbon dioxide,"
484,484,The concentration of carbon dioxide increases and the concentration of oxygen decreases.,484.0,"500, 0, 0, 0, 2, 3, 2, 3 carbon dioxide"
485,485,The bag expands,485.0,"501,0,0,0 , the proportion of carbon dioxide in the air in the bag increases.,"
486,486,The bag expands.,486.0,"502,0,0,0 , the proportion of carbon dioxide in the air in the bag increases.,"
487,487,It's getting damp.,487.0,"503,0,1,0... carbon dioxide is produced"
488,488,"By hopping, the concentration of carbon dioxide increases and the concentration of oxygen decreases.",488.0,"504,0,0,0,0... It increases carbon dioxide.,"
489,489,"When you breathe, carbon dioxide is released and steam rises.",489.0,"505,0,0,1, the amount of carbon dioxide increased"
490,490,Carbon Dioxide Concentration,490.0,"506,0,0,0 , the proportion of carbon dioxide increases.,"
491,491,"As time goes by, oxygen decreases and carbon dioxide cools.",491.0,"507,0,0,1, carbon dioxide rises.,"
492,492,I can't fill it up any more,492.0,"508,0,0,0...the carbon dioxide is increasing.,509,0,0,1, carbon dioxide"
493,493,"Since you breathe in oxygen, the oxygen in the bag gradually decreases and emits carbon dioxide, so the concentration of carbon dioxide concentration in the bag increases.",493.0,"510,0,0,0,0... Increases carbon dioxide.,"
494,494,"When inhaling, inhaling oxygen in a plastic bag and exhaling carbon dioxide when exhaling, reducing oxygen in the bag and increasing the amount of carbon dioxide.Oxygen was lost and carbon dioxide was produced.",494.0,"511,0,0,0... the amount of carbon dioxide increased"
495,495,Don't know,495.0,"512,0,0,1, the proportion of carbon dioxide increases.,"
496,496,"It was full of oxygen, but breathing would have filled the bag with carbon dioxide.",496.0,"513,0,0,0,0...Carbon dioxide rises.,"
497,497,The amount of carbon dioxide will increase because carbon dioxide comes out when you breathe out,497.0,"514,0,0,0...Carbon dioxide is increasing.,"
498,498,Oxygen decreases and carbon dioxide increases,498.0,"515,0,1,0, there is carbon dioxide"
499,499,The fresh oxygen in the bag decreases and the carbon dioxide produced by breathing increases.,499.0,"516,0,0,0...increase in CO2,"
500,500,The air is inside,500.0,"517,0,1,0...CO2 ratio increases.,"
501,501,The amount of oxygen in the bag decreases and the amount of carbon dioxide increases because it inhales oxygen during inhalation and exhales carbon dioxide during exhalation.,501.0,"518,0,0,0,0... Carbon dioxide rises.,"
502,502,The concentration of oxygen decreases.,502.0,"519,0,0,0 , the percentage of carbon dioxide goes up"
503,503,"""",503.0,"520,0,0,1, increases carbon dioxide.,"
504,504,"""The air is gone""",504.0,"521,0,0,0,0... Increases carbon dioxide.,"
505,505,The air decreases,505.0,"522,0,1,0, there is carbon dioxide"
506,506,The air gradually disappears.,506.0,"523,0,1,0,,,"
507,507,It turns into carbon dioxide,507.0,"524,1,1,0,,,"
508,508,The air is getting less and less,508.0,"525,0,0,0,,,"
509,509,I think I got water drops,509.0,"526,1,1,0,,,"
510,510,I think the plastic bag will be full of air.,510.0,"527,0,0,1,,,"
511,511,The plastic bag is filled with moisture and a little water drop is smoothed,511.0,"528,1,1,0,,,"
512,512,I think the plastic bag will be full of air.,512.0,"529,1,1,0,,,"
513,513,I think the moisture will be cold and much less than the first air.,513.0,"530,0,1,0,,,"
514,514,The plastic seems to have expanded because of the air,514.0,"531,0,0,0,,,"
515,515,It's hard to breathe because there's no more air,515.0,"532,0,1,0,,,"
516,516,The air is getting hot,516.0,"533,0,0,0,,,"
517,517,"""How to Breathe""",517.0,"534,0,0,0,,,"
518,518,"""I'm going to put it on your mouth and drink it.""",518.0,"535,0,0,1,,,"
519,519,The air is gone.,519.0,"536,0,1,0,,,"
520,520,The air is likely to turn into carbon dioxide.,520.0,"537,0,1,0,,,"
521,521,I don't think there's much air.,521.0,"538,1,1,0,,,539,1,1,0,,,"
522,522,The amount of carbon dioxide increases,522.0,"540,1,1,0,,,"
523,523,I think the air would have cooled down a little,523.0,"541,1,1,0,,,"
524,524,I don't know.,524.0,"542,0,1,0,,,"
525,525,Water is forming,525.0,"543,1,1,0,,,"
526,526,The air stays as it is.,526.0,"544,1,0,0,,,"
527,527,Increase in carbon dioxide concentration,527.0,"545,1,1,0,,,"
528,528,It's filled with carbon dioxide,528.0,"546,0,0,1,,,"
529,529,Oxygen has been converted into carbon dioxide,529.0,"547,0,0,0,,,"
530,530,The air has shrunk.,530.0,"548,0,0,0,,,"
531,531,Oxygen has decreased and carbon dioxide has increased,531.0,"549,0,0,0,,,"
532,532,Moisture is cold. The air is gone,532.0,"550,0,1,0,,,"
533,533,The pressure is lowered.,533.0,"551,0,0,0,,,"
534,534,Oxygen is gone and carbon dioxide is formed.,534.0,"552,1,0,0,,,"
535,535,There's a lot of carbon dioxide,535.0,"553,0,0,0,,,"
536,536,The air is gone,536.0,"554,0,0,0,,,"
537,537,"""The bag is filled with carbon dioxide",537.0,"555,0,0,0,,,"
538,538,"""",538.0,"556,0,0,1,,,"
539,539,The oxygen in the bag turned into carbon dioxide.,539.0,"557,0,0,1,,,"
540,540,under pressure,540.0,"558,0,0,0,,,"
541,541,"Bubbles form on the surface of the plastic bag, creating moisture",541.0,"559,0,0,0,,,"
542,542,There's a lot of carbon dioxide,542.0,"560,1,0,0,,,"
543,543,Carbon dioxide filled the bag,543.0,"561,0,0,0,,,"
544,544,Oxygen gradually decreased and carbon dioxide increased,544.0,"562,1,0,0,,,"
545,545,Oxygen becomes scarce and carbon dioxide increases.,545.0,"563,0,0,1,,,"
546,546,More carbon dioxide and less oxygen,546.0,"564,0,0,0,,,"
547,547,Oxygen decreases and carbon dioxide increases,547.0,"565,0,0,1,,,"
548,548,There seems to be an increase in carbon dioxide in the bag,548.0,"566,0,0,1,,,"
549,549,The oxygen in the bag turned into carbon dioxide.,549.0,"567,0,0,0,,,"
550,550,There's a lot of oxygen in the plastic bag,550.0,"568,0,1,0,,,569,0,1,0,,,"
551,551,"At first, there was a lot of oxygen, but as time goes by, the amount of oxygen goes away and carbon dioxide goes up",551.0,"570,0,0,0,,,"
552,552,The bag has water on it because of breathing,552.0,"571,0,0,0,,,"
553,553,There would be less air in the bag.,553.0,"572,1,1,0,,,"
554,554,I don't know.,554.0,"573,0,0,0,,,"
555,555,The air will be reduced.,555.0,"574,0,0,0,,,"
556,556,The air turned into carbon dioxide and the air disappeared,556.0,"575,0,0,0,,,"
557,557,The air is gone.,557.0,"576,0,0,0,,,"
558,558,Breathing in fresh air is likely to contaminate the air because no other fresh air can enter.,558.0,"577,1,0,0,,,"
559,559,I don't know,559.0,"578,0,0,0,,,"
560,560,I don't know.,560.0,"579,0,0,1,,,"
561,561,I think it would have shrunk.,561.0,"580,0,0,0,,,"
562,562,Warm air and cold air mix.,562.0,"581,0,0,0,,,"
563,563,It's getting damp,563.0,"582,0,1,0,,,"
564,564,"Since the air went in and out,",564.0,"583,1,1,0,,,"
565,565,"When you breathe in, you will become less and less air because you suck in air",565.0,"584,0,0,0,,,"
566,566,I think all the fresh air is going to disappear,566.0,"585,0,1,0,,,"
567,567,The air has decreased,567.0,"586,0,0,0,,,"
568,568,The oxygen concentration has dropped,568.0,"587,0,0,0,,,"
569,569,The air will be warm.,569.0,"588,0,0,0,,,"
570,570,The air is filled with air.,570.0,"589,0,0,0,,,"
571,571,"""It will be very warm inside",571.0,"590,0,0,1,,,"
572,572,"""",572.0,"591,0,0,0,,,"
573,573,I'm getting dewy,573.0,"592,0,1,0,,,"
574,574,I don't know,574.0,"593,0,0,0,,,"
575,575,The air will be filled with carbon dioxide that is released from the human body.,575.0,"594,0,0,0,,,"
576,576,Carbon dioxide will go in.,576.0,"595,0,0,0,,,"
577,577,The air is gradually draining,577.0,"596,0,0,0,,,"
578,578,dwindling,578.0,"597,1,1,0,,,"
579,579,"This is because it turns into dirty carbon dioxide, not clean oxygen.",579.0,"598,0,0,1,,,599,1,0,0,,,"
580,580,The air has shrunk,580.0,"600,0,0,0,,,"
581,581,I don't know.,581.0,"601,1,1,0,,,"
582,582,It swelled up.,582.0,"602,0,0,0,,,"
583,583,I don't know,583.0,"603,0,0,0,,,"
584,584,It is filled with oxygen in the air,584.0,"604,0,1,0,,,"
585,585,I don't know.,585.0,"605,0,0,0,,,"
586,586,"Inside the bag, there are a few drops of moisture, and the transparent vinyl is blurred, so you won't be able to see what's inside.",586.0,"606,1,0,0,,,"
587,587,It's swelling up,587.0,"607,0,0,0,,,"
588,588,??/,588.0,"608,0,1,0,,,"
589,589,The air turns into carbon dioxide.,589.0,"609,0,0,0,,,"
590,590,Oxygen decreases and carbon dioxide increases.,590.0,"610,1,1,0,,,"
591,591,It's getting full,591.0,"611,0,0,0,,,"
592,592,The air is gone and carbon dioxide is cold.,592.0,"612,0,1,0,,,"
593,593,The bag swells up.The air would have been cold.,593.0,"613,0,0,0,,,"
594,594,Don't know,594.0,"614,0,0,0,,,"
595,595,The air increases.,595.0,"615,0,0,0,,,"
596,596,The dew will come to an end,596.0,"616,0,0,1,,,"
597,597,The air disappears.,597.0,"617,0,0,1,,,"
598,598,Because there's a lot of carbon dioxide in the air,598.0,"618,0,0,0,,,"
599,599,I don't know,599.0,"619,0,0,0,,,"
600,600,The air is polluted.,600.0,"620,0,0,0,,,"
601,601,The amount of air is gradually reduced because it absorbs air when breathing.,601.0,"621,0,1,0,,,"
602,602,I don't know,602.0,"622,0,1,0,,,"
603,603,This is because he breathes fresh air and emits carbon dioxide.,603.0,"623,0,0,1,,,"
604,604,Water is formed,604.0,"624,1,1,0,,,"
605,605,Oxygen is gone.,605.0,"625,0,0,1,,,"
