929,929,The air in the bag is likely to warm up,929.0,"961,1,1,0,,,"
930,930,Oxygen instead of fresh air,930.0,"962,0,0,0,,,"
931,931,"When you breathe in, there is no air, so oxygen disappears, and your breath warms you",931.0,"963,1,1,0,,,"
932,932,"The amount of carbon dioxide will increase, and the amount of air will decrease.",932.0,"964,1,1,0,,,"
933,933,The bag is filled with air,933.0,"965,0,0,0,,,"
934,934,The air in the bag has decreased,934.0,"966,0,0,0,,,"
935,935,The oxygen in the bag disappears and is filled with carbon dioxide.,935.0,"967,0,0,0,,,"
936,936,absorb oxygen and other substances into the body and exhale the rest,936.0,"968,1,1,0,,,"
937,937,"""Take oxygen and other substances into your body and exhale the rest, and you're done",937.0,"969,0,0,0,,,"
938,938,"""",938.0,"970,0,0,0,,,"
939,939,be filled with carbon dioxide,939.0,"971,1,1,0,,,"
940,940,The air in the bag will be reduced.,940.0,"972,0,0,1,,,"
941,941,The fresh air in the big plastic bag will be exhausted and only carbon dioxide will remain in the plastic bag.,941.0,"973,0,0,0,,,"
942,942,Full of carbon dioxide,942.0,"974,0,0,0,,,"
943,943,This is because the air turns into carbon dioxide.,943.0,"975,0,0,0,,,"
944,944,"This is because the air exhaled when breathing in and discharging fresh air turned into carbon dioxide, and the fresh air in the bag disappeared and turned into carbon dioxide.",944.0,"976,0,0,0,,,"
945,945,There will be a lot of carbon dioxide in the plastic bag,945.0,"977,0,0,0,,,"
946,946,There will be more carbon dioxide and less oxygen,946.0,"978,0,0,1,,,"
947,947,There is likely to be more carbon dioxide in the bag.,947.0,"979,1,1,0,,,"
948,948,"""The bag expands because of the air in it",948.0,"980,0,0,0,,,"
949,949,"""",949.0,"981,0,0,0,,,"
950,950,an increase in carbon dioxide,950.0,"982,0,0,0,,,"
951,951,The air in the bag would have changed from oxygen to carbon dioxide.,951.0,"983,0,0,0,,,"
952,952,The air in the bag must have disappeared a lot,952.0,"984,0,0,1,,,"
953,953,The air has turned into carbon dioxide.,953.0,"985,0,0,1,,,"
954,954,I think the air is going to cool off a little bit,954.0,"986,1,0,0,,,"
955,955,The temperature of the air in the bag warms up.,955.0,"987,0,0,0,,,"
956,956,I don't know,956.0,"988,0,0,1,,,989,0,0,0,,,"
957,957,The air has decreased.,957.0,"990,0,0,0,,,"
958,958,There will be wrinkles in the bag and some air will remain.,958.0,"991,0,0,0,,,"
959,959,Air gradually disappears from a large plastic bag,959.0,"992,0,0,0,,,"
960,960,The carbon dioxide we breathe and exhale in the bag mixes with the air in the bag.,960.0,"993,1,1,0,,,"
961,961,There will be more carbon dioxide,961.0,"994,0,1,0,,,"
962,962,be likely to swell,962.0,"995,1,1,0,,,"
963,963,There must have been some fresh air in the bag.,963.0,"996,1,1,0,,,"
964,964,"The bag, which has been breathed several times, seems to contain air.",964.0,"997,0,1,0,,,"
965,965,"The bag will be full of moisture, so the air will be bad and humid.",965.0,"998,1,0,0,,,"
966,966,"The air in the bag is inhaled through the breathing process and disappeared, and the space where the air is lost is filled with carbon dioxide that comes out when you exhale during the breathing process.",966.0,"999,1,0,1,,,"
967,967,"The bag will be full of moisture, so the air will be bad and humid.",967.0,"1000,1,1,0,,,"
968,968,The amount of air is gradually decreasing.,968.0,"1001,0,0,0,,,"
969,969,There was a change in the plastic bag that produced carbon dioxide.,969.0,"1002,1,1,0,,,"
970,970,"In the first big bag, there was a lot of oxygen that we could breathe, but if we continue to breathe, it becomes increasingly difficult to breathe because there is more carbon dioxide in the big bag than oxygen.",970.0,"1003,1,1,0,,,"
971,971,I'm sorry. I don't know,971.0,"1004,1,1,0,,,"
972,972,The fresh air is likely to change carbon dioxide,972.0,"1005,0,1,0,,,"
973,973,"There was a lot of oxygen in the first bag that we could breathe, but the more we breathe, the more carbon dioxide there is in the bag, so it will become increasingly difficult to breathe.",973.0,"1006,1,1,0,,,"
974,974,swelling of the bag,974.0,"1007,0,1,0,,,"
975,975,I don't know.,975.0,"1008,1,1,0,,,"
976,976,The bag is likely to be full of air.,976.0,"1009,1,0,0,,,"
977,977,Oxygen is gone and carbon dioxide is formed,977.0,"1010,0,1,0,,,"
978,978,It's swelling up,978.0,"1011,0,1,0,,,"
979,979,I can't breathe as the air in the bag disappears,979.0,"1012,0,1,0,,,"
980,980,Oxygen is gone and carbon dioxide is likely to form,980.0,"1013,1,1,0,,,"
981,981,I think the air will warm up,981.0,"1014,1,0,0,,,"
982,982,Don't know,982.0,"1015,1,0,0,,,"
983,983,The bag swelled up.,983.0,"1016,0,0,0,,,"
984,984,The bag will be wrinkled,984.0,"1017,0,0,0,,,"
985,985,I didn't learn it,985.0,"1018,1,1,0,,,1019,0,1,0,,,"
986,986,Air seems to have escaped,986.0,"1020,1,1,0,,,"
987,987,It will be warm because the temperature is high,987.0,"1021,0,0,0,,,"
988,988,It's filled with carbon dioxide from our mouths instead of oxygen,988.0,"1022,0,1,0,,,"
989,989,air disappearanceA lot of air disappears.,989.0,"1023,0,1,0,,,"
990,990,I don't know,990.0,"1024,0,0,1,,,"
991,991,I don't know,991.0,"1025,1,1,0,,,"
992,992,The air in the bag gets warm.,992.0,"1026,0,0,0,,,"
993,993,"""It will be damp",993.0,"1027,0,0,0,,,"
994,994,"""",994.0,"1028,0,1,0,,,"
995,995,There is less oxygen.,995.0,"1029,1,0,0,,,"
996,996,I don't know,996.0,"1030,1,0,0,,,"
997,997,Moisture and air temperature is high,997.0,"1031,0,1,0,,,"
998,998,"When we breathe air, the air disappears, and when we exhale, the air comes back.",998.0,"1032,0,1,0,,,"
999,999,The air disappeared in the bag because of the inhalation of air.,999.0,"1033,0,1,0,,,"
1000,1000,Bubbles formed and air was carried on my back,1000.0,"1034,1,1,0,,,"
1001,1001,The air inside the plastic bag will look blurry,1001.0,"1035,0,1,0,,,"
1002,1002,"When clean air is in a bag and breathes, CO2 is released, and oxygen is lost, making it difficult to breathe.",1002.0,"1036,0,1,0,,,"
1003,1003,The proportion of carbon dioxide in the air increases,1003.0,"1037,1,1,0,,,"
1004,1004,Part of the oxygen would have been converted to carbon dioxide.,1004.0,"1038,0,1,0,,,"
1005,1005,Oxygen disappears and carbon dioxide increases,1005.0,"1039,0,1,0,,,"
1006,1006,contain carbon dioxide,1006.0,"1040,1,1,0,,,"
1007,1007,I'm running out of oxygen,1007.0,"1041,0,0,0,,,"
1008,1008,"When hyperventilation occurs, the body is forced to supply too much oxygen to prevent more oxygen from entering the body by inhaling and exhaling using the bag, resulting in water in the bag",1008.0,"1042,0,1,0,,,"
1009,1009,"The oxygen in the bag goes into the body, the carbon dioxide in the body fills the bag, and the oxygen concentration decreases, making it difficult to breathe",1009.0,"1043,0,1,0,,,"
1010,1010,The atoms in the air must be running wild.,1010.0,"1044,0,0,1,,,"
1011,1011,"Carbon dioxide in the body is released, which increases carbon dioxide in the bag and reduces oxygen concentration because humans consume oxygen.",1011.0,"1045,0,1,0,,,"
1012,1012,"The number of oxygen decreased and carbon dioxide increased. Therefore, as the number of oxygen decreases, you may have felt discomfort in breathing.",1012.0,"1046,0,0,0,,,"
1013,1013,Oxygen became carbon dioxide,1013.0,"1047,0,0,0,,,"
1014,1014,The carbon dioxide from the exhalation fills the bag and becomes hazy.,1014.0,"1048,1,1,0,,,1049,0,1,0,,,"
1015,1015,Oxygen water decreases and carbon dioxide water increases.,1015.0,"1050,0,1,0,,,"
1016,1016,There's a lot of carbon dioxide,1016.0,"1051,0,0,0,,,"
1017,1017,There's less oxygen and more carbon dioxide,1017.0,"1052,1,0,0,,,"
1018,1018,Oxygen has decreased,1018.0,"1053,1,1,0,,,"
1019,1019,Carbon dioxide is really,1019.0,"1054,0,1,0,,,"
1020,1020,It fills up with exhaled carbon dioxide,1020.0,"1055,1,1,0,,,"
1021,1021,The amount of carbon dioxide will increase,1021.0,"1056,1,1,0,,,"
1022,1022,I think there is less oxygen and more carbon dioxide.,1022.0,"1057,0,1,0,,,"
1023,1023,Oxygen is almost gone,1023.0,"1058,0,0,0,,,"
1024,1024,This is because oxygen disappears.,1024.0,"1059,0,1,0,,,"
1025,1025,It's swelling up,1025.0,"1060,0,1,0,,,"
1026,1026,It's swelling up,1026.0,"1061,0,1,0,,,"
1027,1027,"The carbon dioxide in our body is in the bag, and all the oxygen is gone, and only carbon dioxide is left",1027.0,"1062,1,0,0,,,"
1028,1028,There's only carbon dioxide left,1028.0,"1063,0,0,0,,,"
1029,1029,Oxygen is reduced and carbon dioxide is produced,1029.0,"1064,1,1,0,,,"
1030,1030,I think it's going to decrease,1030.0,"1065,0,1,0,,,"
1031,1031,More carbon dioxide,1031.0,"1066,0,1,0,,,"
1032,1032,"""When you breathe out, carbon dioxide comes out",1032.0,"1067,1,1,0,,,"
1033,1033,"The more you breathe, the higher the amount of carbon dioxide in the bag air.""",1033.0,"1068,1,1,0,,,"
1034,1034,Water drops form,1034.0,"1069,1,0,0,,,"
1035,1035,Oxygen has decreased and carbon dioxide has increased.,1035.0,"1070,1,0,0,,,"
1036,1036,It's disappearing,1036.0,"1071,1,1,0,,,"
1037,1037,Is there a bubble?,1037.0,"1072,1,1,0,,,"
1038,1038,There is only carbon dioxide left.,1038.0,"1073,1,1,0,,,"
1039,1039,There is less oxygen.,1039.0,"1074,0,1,0,,,"
1040,1040,with reduced oxygen,1040.0,"1075,1,1,0,,,"
1041,1041,The percentage of carbon dioxide in the bag increases,1041.0,"1076,1,1,0,,,"
1042,1042,It produces carbon dioxide,1042.0,"1077,0,1,0,,,"
1043,1043,carbon dioxide production,1043.0,"1078,0,1,0,,,1079,1,1,0,,,"
1044,1044,Does oxygen gradually decrease and carbon dioxide increase?,1044.0,"1080,0,1,0,,,"
1045,1045,There's a lot of carbon dioxide,1045.0,"1081,1,1,0,,,"
1046,1046,Carbon disulfide becomes relatively high compared to oxygen.,1046.0,"1082,0,0,1,,,"
1047,1047,Oxygen has decreased and carbon dioxide has increased.,1047.0,"1083,0,1,0,,,"
1048,1048,The carbon dioxide concentration of the air in the bag has increased.,1048.0,"1084,0,1,0,,,"
1049,1049,Carbon dioxide is increasing,1049.0,"1085,1,1,0,,,"
1050,1050,The amount of oxygen decreases and the amount of carbon dioxide increases.,1050.0,"1086,0,1,0,,,"
1051,1051,Air enters the bag,1051.0,"1087,0,0,1,,,"
1052,1052,Becoming Carbon Dioxide,1052.0,"1088,0,0,1,,,"
1053,1053,It is full of carbon dioxide,1053.0,"1089,0,1,0,,,"
1054,1054,It's getting damp,1054.0,"1090,1,1,0,,,"
1055,1055,Carbon dioxide is produced,1055.0,"1091,0,1,0,,,"
1056,1056,The air is not clean,1056.0,"1092,0,1,0,,,"
1057,1057,The air has disappeared a lot compared to the first time.,1057.0,"1093,1,1,0,,,"
1058,1058,"There will be carbon dioxide in the bag, not oxygen",1058.0,"1094,0,1,0,,,"
1059,1059,It's full of carbon dioxide,1059.0,"1095,1,1,0,,,"
1060,1060,The amount of CO2 has increased,1060.0,"1096,0,0,0,,,"
1061,1061,I don't know,1061.0,"1097,1,1,0,,,"
1062,1062,"The bag will run out of oxygen, making it difficult to breathe",1062.0,"1098,1,1,0,,,"
1063,1063,Oxygen has been converted into carbon dioxide,1063.0,"1099,1,1,0,,,"
1064,1064,There's more carbon dioxide increases,1064.0,"1100,1,1,0,,,"
1065,1065,"""While drinking Sansol, my body releases carbon dioxide when I'm angry, so the bag",1065.0,"1101,1,1,0,,,"
1066,1066,"It's full of carbon dioxide.""",1066.0,"1102,0,0,0,,,"
1067,1067,There would be less oxygen and more carbon dioxide inside.,1067.0,"1103,1,1,0,,,"
1068,1068,Carbon dioxide has increased in the air in the bag.,1068.0,"1104,1,1,0,,,"
1069,1069,There is less air in the bag,1069.0,"1105,1,1,0,,,"
1070,1070,The amount of carbon dioxide has increased,1070.0,"1106,0,0,0,,,"
1071,1071,More carbon dioxide,1071.0,"1107,1,1,0,,,"
1072,1072,There is a lot of carbon dioxide has increased,1072.0,"1108,1,1,0,,,1109,0,1,0,,,"
1073,1073,Oxygen has decreased,1073.0,"1110,1,1,0,,,"
1074,1074,I don't know.,1074.0,"1111,1,1,0,,,"
1075,1075,Oxygen in the air disappears and carbon dioxide is produced,1075.0,"1112,1,1,0,,,"
1076,1076,The carbon dioxide has become full,1076.0,"1113,0,1,1,,,"
1077,1077,Carbon dioxide has increased.,1077.0,"1114,1,1,0,,,"
1078,1078,There will be less oxygen and more carbon dioxide,1078.0,"1115,1,1,1,,,"
1079,1079,Oxygen is reduced and carbon dioxide is produced,1079.0,"1116,1,1,0,,,"
1080,1080,Oxygen is reduced,1080.0,"1117,0,0,1,,,"
1081,1081,Oxygen would have been lost in the bag.,1081.0,"1118,0,1,0,,,"
1082,1082,The oxygen in the plastic bag is gradually reduced due to inhalation and the amount of carbon dioxide is increased by exhalation,1082.0,"1119,1,1,0,,,"
1083,1083,"""I was breathing in the air from the balloon, and I was breathing in oxygen and exhaling carbon dioxide, so the concentration of carbon dioxide in the balloon increased",1083.0,"1120,1,1,0,,,"
1084,1084,I must have been frustrated because I couldn't drink a lot of oxygen,1084.0,"1121,0,0,0,,,"
1085,1085,The oxygen in the bag gradually disappears and fills up with carbon dioxide,1085.0,"1122,0,0,0,,,"
1086,1086,Tin dioxide has increased,1086.0,"1123,0,0,0,,,"
1087,1087,The amount of oxygen in the bag decreases and the amount of carbon dioxide increases,1087.0,"1124,0,0,0,,,"
1088,1088,Oxygen decreases and carbon dioxide increasesThe carbon dioxide composition ratio increases as you breathe,1088.0,"1125,0,1,0,,,"
1089,1089,The composition ratio of carbon dioxide increases.,1089.0,"1126,0,1,0,,,"
1090,1090,The oxygen content of the air in the plastic bag decreased and the carbon dioxide content increased.,1090.0,"1127,0,0,0,,,"
1091,1091,Increased carbon dioxide,1091.0,"1128,0,1,0,,,"
1092,1092,Oxygen has been converted into carbon dioxide,1092.0,"1129,1,0,0,,,"
1093,1093,Water droplets have formed.,1093.0,"1130,1,1,0,,,"
1094,1094,Carbon dioxide is mixed in the bag.,1094.0,"1131,1,1,0,,,"
1095,1095,The air is gone and carbon dioxide is filled,1095.0,"1132,0,1,0,,,"
1096,1096,"At first, there was oxygen in the bag, but carbon dioxide is produced by inhaling and breathing",1096.0,"1133,0,1,0,,,"
1097,1097,More carbon atomization,1097.0,"1134,0,1,0,,,"
1098,1098,It'll be white and steamy,1098.0,"1135,0,1,0,,,"
1099,1099,It'll be white and steamy,1099.0,"1136,0,0,0,,,"
1100,1100,full of carbon dioxide,1100.0,"1137,0,0,0,,,"
1101,1101,Oxygen becomes thin and carbon dioxide increases,1101.0,"1138,0,1,0,,,1139,0,0,0,,,"
1102,1102,More carbon dioxide from exhalation.,1102.0,"1140,0,0,0,,,"
1103,1103,It's full of carbon dioxide,1103.0,"1141,0,1,0,,,"
1104,1104,There's less oxygen and more carbon dioxide,1104.0,"1142,0,0,0,,,"
1105,1105,The percentage of carbon dioxide in the bag air has increased.,1105.0,"1143,0,1,0,,,"
1106,1106,Full of carbon dioxide from oxygen,1106.0,"1144,0,1,0,,,"
1107,1107,Circulation,1107.0,"1145,0,1,0,,,"
1108,1108,"Fresh air enters me, carbon dioxide goes out of my body and breathes many times, and then the air in the bag is filled with carbon dioxide.",1108.0,"1146,0,0,0,,,"
1109,1109,"When I breathe in, I breathe in oxygen, I breathe out carbon dioxide and oxygen",1109.0,"1147,1,1,0,,,"
1110,1110,The fraction of oxygen decreases and the fraction of carbon dioxide increases.,1110.0,"1148,1,1,0,,,"
1111,1111,Both inhale oxygen and exhale carbon dioxide when exhale. There will be a lot of carbon dioxide in the air.,1111.0,"1149,0,0,0,,,"
1112,1112,There is a lot of carbon dioxide. Oxygen is reduced.,1112.0,"1150,0,1,0,,,"
1113,1113,The composition of the air changes.,1113.0,"1151,0,1,0,,,"
1114,1114,The specific gravity of carbon dioxide increases and the specific gravity of oxygen decreases.,1114.0,"1152,0,0,0,,,"
1115,1115,Carbon dioxide concentration increases and humidity increases. Oxygen concentration decreases.,1115.0,"1153,0,1,0,,,"
1116,1116,"Reduced oxygen, increased carbon dioxide",1116.0,"1154,1,1,0,,,"
1117,1117,The composition of the air changes.,1117.0,"1155,1,1,0,,,"
1118,1118,"Breathing fills up with carbon dioxide, not oxygen.",1118.0,"1156,0,1,0,,,"
1119,1119,"Oxygen decreases, carbon dioxide increases",1119.0,"1157,1,1,0,,,"
1120,1120,The partial pressure of carbon dioxide has increased.,1120.0,"1158,0,1,0,,,"
1121,1121,The oxygen ratio decreases and the carbon dioxide ratio increases.,1121.0,"1159,0,0,0,,,"
1122,1122,"Because exhalation has a lot of carbon dioxide and less oxygen, the oxygen concentration decreases and the carbon dioxide concentration increases.",1122.0,"1160,0,0,0,,,"
1123,1123,Oxygen concentration decreases and carbon dioxide concentration increases.,1123.0,"1161,0,0,0,,,"
1124,1124,Increased carbon dioxide concentration. the temperature rises a decrease in oxygen concentration,1124.0,"1162,0,0,0,,,"
1125,1125,Oxygen is flowing down. Carbon dioxide increases.,1125.0,"1163,0,0,0,,,"
1126,1126,"The amount of oxygen in the bag decreases, the amount of carbon dioxide increases, and water vapor increases.",1126.0,"1164,0,0,1,,,"
1127,1127,I think the fresh air and carbon dioxide in the bag were mixed.,1127.0,"1165,0,1,0,,,"
1128,1128,"It's getting harder to breathe in and out.""",1128.0,"1166,0,0,0,,,"
1129,1129,Water vapor has formed,1129.0,"1167,0,0,0,,,"
1130,1130,"This excess carbon dioxide is a result, instead of air.",1130.0,"1168,0,0,0,,,1169,0,0,0,,,"
1131,1131,A carbon dioxide and oxygen is gone.,1131.0,"1170,1,1,0,,,"
1132,1132,"In a bag, the oxygen to carbon dioxide.",1132.0,"1171,1,1,0,,,"
1133,1133,"Kim Yeong-cheol, The phone rings at a lot, please.",1133.0,"1172,1,1,0,,,"
1134,1134,Dilatableness,1134.0,"1173,0,0,0,,,"
1135,1135,Which enables jjogeuradeu,1135.0,"1174,0,1,0,,,"
1136,1136,It is growing less and less.,1136.0,"1175,0,0,0,,,"
1137,1137,Full of carbon dioxide and difficult to breathe.,1137.0,"1176,0,0,0,,,"
1138,1138,This excess carbon dioxide is a result.,1138.0,"1177,0,0,0,,,"
1139,1139,Puff.,1139.0,"1178,1,1,0,,,"
1140,1140,This excess carbon dioxide is a result.,1140.0,"1179,0,0,1,,,"
1141,1141,Oxygen is reduced.,1141.0,"1180,0,0,1,,,"
1142,1142,Oxygen and a lot of carbon dioxide reduced.,1142.0,"1181,0,1,0,,,"
1143,1143,Only carbon dioxide and oxygen.,1143.0,"1182,0,1,0,,,"
1144,1144,This excess carbon dioxide is a result.,1144.0,"1183,0,0,0,,,"
1145,1145,Filled with carbon dioxide.,1145.0,"1184,0,0,0,,,"
1146,1146,The oxygen in the bag was converted to carbon dioxide,1146.0,"1185,0,1,0,,,"
1147,1147,It produces a lot of carbon dioxide,1147.0,"1186,0,0,0,,,"
1148,1148,The air in the bag escapes out.,1148.0,"1187,0,0,0,,,"
1149,1149,I don't know,1149.0,"1188,0,1,0,,,"
1150,1150,be filled with carbon dioxide,1150.0,"1189,1,1,0,,,"
1151,1151,I don't know,1151.0,"1190,0,1,0,,,"
1152,1152,I don't know.,1152.0,"1191,0,0,0,,,"
1153,1153,It will be full of carbon dioxide,1153.0,"1192,0,0,0,,,"
1154,1154,It's swelling up,1154.0,"1193,0,0,0,,,"
1155,1155,It will be fogged up with carbon dioxide.,1155.0,"1194,0,1,0,,,"
1156,1156,There is a lot of carbon dioxide has increased,1156.0,"1195,1,0,0,,,"
1157,1157,be full of carbon dioxide,1157.0,"1196,1,1,0,,,"
1158,1158,It's getting full,1158.0,"1197,1,1,0,,,"
1159,1159,Oxygen is gone and carbon dioxide is formed,1159.0,"1198,1,1,0,,,1199,0,0,0,,,"
1160,1160,Oxygen will be mostly converted to carbon dioxide.,1160.0,"1200,0,0,0,,,"
1161,1161,I don't know,1161.0,"1201,0,1,0,,,"
1162,1162,It becomes carbon dioxide.,1162.0,"1202,0,0,0,,,"
1163,1163,be full of carbon dioxide,1163.0,"1203,1,1,0,,,"
1164,1164,It's shrunk,1164.0,"1204,0,0,0,,,"
1165,1165,"As you breathe out carbon dioxide, the air in the bag increases the amount of carbon dioxide you breathe",1165.0,"1205,0,1,0,,,"
1166,1166,Oxygen has decreased and carbon dioxide has increased since the beginning.,1166.0,"1206,1,1,0,,,"
1167,1167,Oxygen has decreased and carbon dioxide has increased since the beginning.,1167.0,"1207,0,0,0,,,"
1168,1168,There is a lot of carbon dioxide in the bag.,1168.0,"1208,0,1,0,,,"
1169,1169,"Oxygen enters the body and emits carbon dioxide, so there will be carbon dioxide in the bag.",1169.0,"1209,1,1,0,,,"
1170,1170,Carbon dioxide has a higher proportion.,1170.0,"1210,0,1,0,,,"
1171,1171,It's getting smaller.,1171.0,"1211,0,1,0,,,"
1172,1172,It's getting bigger,1172.0,"1212,1,1,0,,,"
1173,1173,The air would have gone bad.,1173.0,"1213,0,1,0,,,"
1174,1174,It's getting murky.,1174.0,"1214,0,1,0,,,"
1175,1175,It's getting bigger,1175.0,"1215,0,0,0,,,"
1176,1176,It's getting warm,1176.0,"1216,0,0,0,,,"
1177,1177,"If you inhale the air in the bag, the process of carbon dioxide entering the bag is repeated, so after inhaling several buckets, most of the air in the bag will have carbon dioxide.",1177.0,"1217,0,0,0,,,"
1178,1178,"If you breathe several times, the air in the bag will disappear, and the reason why it disappears is because if you breathe continuously, the air will be inhaled",1178.0,"1218,0,0,0,,,"
1179,1179,"If you breathe several times, the air in the bag will disappear, and the reason why it disappears is because if you breathe continuously, the air will be inhaled",1179.0,"1219,0,0,0,,,"
1180,1180,"""When the air is compressed and bound together, the air is collected and the size of the bag increases",1180.0,"1220,0,0,0,,,"
1181,1181,"If you breathe several times, the air in the bag will disappear, and if you breathe continuously, the air will be consumed.""",1181.0,"1221,0,1,0,,,"
1182,1182,It's getting dirty,1182.0,"1222,0,0,0,,,"
1183,1183,"Originally, people breathe in a plastic bag made of only oxygen, breathe in oxygen, breathe out carbon dioxide, so oxygen disappears from the plastic bag and only carbon dioxide remains, making it frustrating and difficult for people to breathe",1183.0,"1223,0,0,0,,,"
1184,1184,I can't breathe if I do it many times.,1184.0,"1224,0,0,0,,,"
1185,1185,"I can't breathe well because there's a lack of oxygen and a lot of carbon dioxide.""",1185.0,"1225,0,0,1,,,"
1186,1186,The air in the bag that has been breathed several times will disappear and there will be more carbon dioxide because I emit more carbon dioxide than oxygen,1186.0,"1226,0,1,0,,,"
1187,1187,"foul-mouthedAs the air decreases, carbon dioxide cools.",1187.0,"1227,1,1,0,,,"
1188,1188,It's so puffy,1188.0,"1228,0,0,0,,,1229,0,1,0,,,"
1189,1189,"This is because repeated oral respiration does not filter out harmful substances in the air, so it does not protect the neck and lungs.",1189.0,"1230,0,1,0,,,"
1190,1190,I don't know.,1190.0,"1231,1,1,0,,,"
1191,1191,Oxygen has decreased and carbon dioxide has increased.,1191.0,"1232,0,0,0,,,"
1192,1192,The air gets hot and humid.,1192.0,"1233,0,0,0,,,"
1193,1193,The air gets hot and humid,1193.0,"1234,1,1,0,,,"
1194,1194,Because the bag is full of carbon dioxide,1194.0,"1235,0,0,0,,,"
1195,1195,"I think there is more carbon dioxide in the air than oxygen, but maybe not",1195.0,"1236,0,0,0,,,"
1196,1196,It's full now,1196.0,"1237,0,0,0,,,"
1197,1197,It's full now,1197.0,"1238,0,1,0,,,"
1198,1198,an increase in carbon dioxide,1198.0,"1239,0,0,0,,,"
1199,1199,It would have become full,1199.0,"1240,0,0,0,,,"
1200,1200,This is because a lot of public houses have disappeared.,1200.0,"1241,0,0,1,,,"
1201,1201,It's foggy. More carbon dioxide,1201.0,"1242,0,0,0,,,"
1202,1202,This is because oxygen has decreased and carbon dioxide has increased.,1202.0,"1243,0,0,0,,,"
1203,1203,Carbon dioxide concentration intensifies,1203.0,"1244,0,0,0,,,"
1204,1204,I don't know.,1204.0,"1245,0,0,0,,,"
1205,1205,It's getting blurry,1205.0,"1246,0,0,0,,,"
1206,1206,The bag will swell.,1206.0,"1247,0,1,0,,,"
1207,1207,Oxygen in the air was converted into carbon dioxide by inhalation and exhalation.,1207.0,"1248,0,0,0,,,"
1208,1208,Oxygen concentrations drop.,1208.0,"1249,0,0,0,,,"
1209,1209,The proportion of carbon dioxide increases and the proportion of oxygen decreases,1209.0,"1250,1,0,0,,,"
1210,1210,"At first, there would have been oxygen-mixed air, but later it would have breathed several times and increased the percentage of carbon dioxide",1210.0,"1251,0,0,0,,,"
1211,1211,"At first, it was a bag of oxygen, but after a few breaths, carbon dioxide becomes full.",1211.0,"1252,0,0,0,,,"
1212,1212,The bag of cookies is about to swell.,1212.0,"1253,0,0,0,,,"
1213,1213,The bag will be filled with wind,1213.0,"1254,0,0,0,,,"
1214,1214,This is because the air in the bag contains carbon dioxide that is produced when we breathe.,1214.0,"1255,0,0,0,,,"
1215,1215,"As the breathing air gradually accumulated in the bag, there was no more room for air to escape.",1215.0,"1256,0,0,0,,,"
1216,1216,"It's because you drink oxygen when you inhale, but you exhale carbon dioxide when you exhale",1216.0,"1257,0,0,0,,,"
1217,1217,be filled with air,1217.0,"1258,0,1,0,,,1259,0,0,0,,,"
1218,1218,"More carbon dioxide, less carbon",1218.0,"1260,0,0,0,,,"
1219,1219,More carbon dioxide and less oxygen,1219.0,"1261,0,1,0,,,"
1220,1220,It's getting tight,1220.0,"1262,0,0,0,,,"
1221,1221,It is likely to produce carbon dioxide,1221.0,"1263,0,1,0,,,"
1222,1222,The plastic bag will contain more carbon dioxide than oxygen.,1222.0,"1264,0,0,0,,,"
1223,1223,There will be a lot of carbon dioxide,1223.0,"1265,0,0,0,,,"
1224,1224,There will be more carbon dioxide,1224.0,"1266,0,1,0,,,"
1225,1225,Oxygen becomes thin and carbon dioxide becomes high,1225.0,"1267,0,1,0,,,"
1226,1226,The amount of carbon dioxide increases.,1226.0,"1268,0,0,0,,,"
1227,1227,There is a lot of carbon dioxide.,1227.0,"1269,0,0,0,,,"
1228,1228,..,1228.0,"1270,0,0,0,,,"
1229,1229,"Yes, yes, I agree",1229.0,"1271,0,0,0,,,"
1230,1230,The air has escaped,1230.0,"1272,0,1,0,,,"
1231,1231,You're,1231.0,"1273,0,0,0,,,"
1232,1232,M and D,1232.0,"1274,0,0,1,,,"
1233,1233,The air is gone,1233.0,"1275,0,1,0,,,"
1234,1234,Carbon dioxide generation ,1234.0,"1276,0,0,0,,,"
1235,1235,I don't know.,1235.0,"1277,0,0,0,,,"
1236,1236,I don't know,1236.0,"1278,0,1,0,,,"
1237,1237,I don't know,1237.0,"1279,0,0,0,,,"
1238,1238,Water is formed,1238.0,"1280,0,0,0,,,"
1239,1239,There is a lot of carbon dioxide.,1239.0,"1281,0,0,0,,,"
1240,1240,"The air was full of oxygen, but it would be full of carbon dioxide",1240.0,"1282,0,0,0,,,"
1241,1241,I don't know.,1241.0,"1283,0,0,0,,,"
1242,1242,carbon dioxide,1242.0,"1284,0,0,0,,,"
