592,592,"The power used by shipyards to move ships is buoyancy. Buoyancy is the force to push an object upward by the pressure difference in the direction of gravity on the upper and lower surfaces of a particular object (solid, liquid, or gaseous mass) submerged in a fluid. Due to this pressure difference, the object stops at a height at which the force to push upward is equal to the weight of the object.Through this principle, the shipyard can drag the ship to the sea without having to lift the ship directly.",592.0,"612,1,0"
593,593,"An object submerged in a fluid, such as water or air, receives a force from the fluid in an upward direction opposite to gravity, which is called buoyancy. The above principle is the use of buoyancy. When water is filled around the boat, buoyancy, which is the force that pushes it upward, acts and makes the boat float easily.Since the buoyancy of the ship and the water is stronger than the buoyancy between the ship and the air, the ship can float on the water, so fill the dry dock with water to match the level of the sea level, and open the door of the song to move the ship to the sea.",593.0,"613,1,0"
594,594,This is because they used the principle of buoyancy.,594.0,"614,1,0"
595,595,"If there's water around your stomach, you can move it more easily if you let it flow",595.0,"615,0,0"
596,596,The answer lies in Raftel. I left everything in the world there...,596.0,"616,1,0"
597,597,The ship floats by the principle of buoyancy.,597.0,"617,1,0"
598,598,Ha ha ha ha.,598.0,"618,1,0"
599,599,It uses the principle of buoyancy.,599.0,"619,1,0"
600,600,It is to use buoyancy to float the ship so that it can be easily moved.,600.0,"620,1,0"
601,601,"The ship pushes the water away, and that much water power floats the ship.",601.0,"621,1,0"
602,602,"""It's buoyancy",602.0,"622,1,0"
603,603,"""",603.0,"623,1,0"
604,604,"This is because the water around the ship weakens the frictional force, making it easier for heavy ships to move.",604.0,"624,1,0"
605,605,A boat floats on the water by buoyancy,605.0,"625,1,0"
606,606,"There is a huge air tank in a huge ship. When water is filled around the boat, buoyancy acts on it, causing the boat to float above the water. When it rises above the water, it can be easily moved using the ship's motor.",606.0,"626,0,0"
607,607,It is much easier to take with you because of buoyancy caused by water,607.0,"627,1,0"
608,608,"If you fill your stomach with water, you can easily move it by floating it in water.",608.0,"628,1,0629,1,0"
609,609,The air in the ship is smaller than water.,609.0,"630,1,0"
610,610,It is to carry a heavy boat by water.,610.0,"631,1,0"
611,611,The water is jumping,611.0,"632,1,0"
612,612,The ship makes the base light enough for the water to float and rides,612.0,"633,0,0"
613,613,The weight of air in a ship is less than that of water,613.0,"634,1,0"
614,614,"The principle of floating a ship is the principle of buoyancy. Buoyancy means the force that floats, more specifically, the force that the weight of the fluid acts as a force and acts in the opposite direction to the original weight. But the idea of weight is gravity, so that means that the force acts in the opposite direction to the direction of gravity. So this large boat can also float on water through the principle of buoyancy.",614.0,"635,1,0"
615,615,"The frictional force with water is much smaller than the friction force between the ship and the floor, so it is easy to move, and the influence of gravity is offset by buoyancy, so it may be easily moved.",615.0,"636,1,0"
616,616,It uses the principle of buoyancy.,616.0,"637,1,0"
617,617,Floating a ship through buoyancy.,617.0,"638,1,0"
618,618,"Using the difference in buoyancy and density between the two densities, a low-density material floats on high-density water.",618.0,"639,1,0"
619,619,An object can move due to buoyancy.,619.0,"640,1,0"
620,620,The buoyancy of the ship,620.0,"641,1,0"
621,621,1,621.0,"642,1,0"
622,622,"A force called buoyancy acts, and water floats the boat, so it can be transferred with a small force.",622.0,"643,1,0"
623,623,buoyancy,623.0,"644,0,0"
624,624,"Boiling with buoyancy, which is the power of water to support the ship.",624.0,"645,0,0"
625,625,"Because the boat is buoyed by water, it can be moved with less force.",625.0,"646,1,0"
626,626,It's buoyancy.,626.0,"647,0,0"
627,627,The balance of power in the water causes the boat to float in the water.This is called supplementary.,627.0,"648,1,0"
628,628,buoyancy,628.0,"649,1,0"
629,629,buoyancy,629.0,"650,0,0"
630,630,.,630.0,"651,0,0"
631,631,Use buoyancy. This is because the water pushes the ship away.,631.0,"652,1,0"
632,632,Use the buoyancy of water to reduce vertical drag,632.0,"653,1,0"
633,633,"Buoyancy and water have a force to float the ship, so it can be moved with less force due to less friction.",633.0,"654,0,0"
634,634,It's buoyancy. It's the force that pushes an object toward the surface of the water because the pressure increases as the water gets deeper.,634.0,"655,1,0"
635,635,the floating of buoyancy,635.0,"656,1,0"
636,636,It's buoyancy.,636.0,"657,1,0"
637,637,buoyancy,637.0,"658,1,0659,1,0"
638,638,"Use buoyancy to float, reduce friction, and drag.",638.0,"660,1,0"
639,639,It is to move the ship using the buoyancy that the water supports the ship.,639.0,"661,1,0"
640,640,buoyancy,640.0,"662,1,0"
641,641,Eliminates friction,641.0,"663,1,0"
642,642,buoyancy,642.0,"664,1,0"
643,643,the principle of buoyancy,643.0,"665,1,0"
644,644,buoyancy,644.0,"666,1,0"
645,645,"A ship floats by buoyancy. Therefore, float it in water and move it.",645.0,"667,1,0"
646,646,"It uses the principle of buoyancy. When a ship is submerged, the volume of water corresponding to its submerged volume pushes the ship in all directions, and the force in the direction of floating the ship acts, allowing it to move lighter than when there is no water",646.0,"668,1,0"
647,647,buoyancy,647.0,"669,0,0"
648,648,"When water is filled around the ship, buoyancy, which is the force of water to lift the ship, can be applied to move the ship easily.",648.0,"670,1,0"
649,649,I used buoyancy. A ship floats due to a difference in density over the water.,649.0,"671,0,0"
650,650,"Use buoyancy. As much as the ship presses the water, the water pushes the ship away, so the ship is floated by its force.",650.0,"672,1,0"
651,651,"The boat can be moved by buoyancy, the force that floats objects in water.",651.0,"673,0,0"
652,652,I used the principle of buoyancy,652.0,"674,1,0"
653,653,"When a rigid body enters a fluid, it will use the principle of buoyancy, which is the force that a solid rises as much as its volume.",653.0,"675,1,0"
654,654,"If you fill the boat with water, it is easy for the boat to move on top of the water due to buoyancy",654.0,"676,1,0"
655,655,buoyancy,655.0,"677,1,0"
656,656,the principle of buoyancy,656.0,"678,1,0"
657,657,It is the principle of using buoyancy to pull a ship.,657.0,"679,1,0"
658,658,buoyancy,658.0,"680,1,0"
659,659,It's using scientific principles.,659.0,"681,1,0"
660,660,I don't know. Is it buoyancy?,660.0,"682,1,0"
661,661,"If you fill the surroundings with water, the boat floats.",661.0,"683,1,0"
662,662,"The floodgates are installed and the water is drained during repair, and when the floodgates are opened, they are filled with water and floated with buoyancy.",662.0,"684,1,0"
663,663,buoyancy,663.0,"685,1,0"
664,664,"When filled with water, the boat floats and buoyancy acts, making it much easier to move.",664.0,"686,1,0"
665,665,I don't know,665.0,"687,1,0"
666,666,I don't know,666.0,"688,1,0689,1,0"
667,667,I used the principle of buoyancy.,667.0,"690,1,0"
668,668,We used the principle that ships would float on water.,668.0,"691,1,0"
669,669,"When repairing a ship using a sluice gate, remove the water and when the ship needs to be moved after the repair, add water to float the ship with buoyancy",669.0,"692,0,0"
670,670,buoyancy,670.0,"693,1,0"
671,671,Use buoyancy to float the boat in the water.,671.0,"694,1,0"
672,672,"By filling the ship with water, the action of buoyancy, which is the force that floats objects, is greatly increased, so the ship can be easily lengthened.",672.0,"695,1,0"
673,673,Buoyancy something,673.0,"696,1,0"
674,674,Use buoyancy to float and move the boat by the force of water.,674.0,"697,1,0"
675,675,buoyancy,675.0,"698,1,0"
676,676,float by buoyancy,676.0,"699,1,0"
677,677,use buoyancy,677.0,"700,1,0"
678,678,It's using buoyancy.,678.0,"701,1,0"
679,679,buoyancy,679.0,"702,1,0"
680,680,buoyancy and pushing power,680.0,"703,0,0"
681,681,float a ship with buoyancy,681.0,"704,1,0"
682,682,buoyancy,682.0,"705,1,0"
683,683,Use water to float and move objects.,683.0,"706,0,0"
684,684,"The water floats the boat, so it can be moved a little easily.",684.0,"707,1,0"
685,685,"Buoyancy, I don't know because I don't do physics.",685.0,"708,0,0"
686,686,"The ship floats in the water, so it seems to have used the principle of density.",686.0,"709,1,0"
687,687,Buoyancy and water make it easy to move by making the mass of an object pulled by gravity close to zero gravity.,687.0,"710,1,0"
688,688,.,688.0,"711,0,0"
689,689,"Using buoyancy, I want to move objects with even a little less effort.",689.0,"712,0,0"
690,690,It can be easily moved through water by the buoyancy force that floats the object.,690.0,"713,1,0"
691,691,"When the boat is filled with water, the boat floats on the water using buoyancy.",691.0,"714,1,0"
692,692,"On water, buoyancy, a floating force, can move heavy objects with less force.In a fluid with a smaller density than that object, a buoyancy force occurs that floats upward.",692.0,"715,1,0"
693,693,The buoyancy of floating water is used to allow the boat to float in water.,693.0,"716,0,0"
694,694,"If you fill the boat with water, the boat floats due to buoyancy, so it will be much easier to float and move the boat than to move it from the ground.",694.0,"717,1,0"
695,695,It uses the principle of buoyancy.,695.0,"718,0,0719,1,0"
696,696,"The force that floats an object is called buoyancy, and buoyancy is the force that a fluid, such as water or air, is submerged in an object that is subjected to a force as a fluid in an upward direction opposite to gravity. Therefore, the principle of buoyancy is used because it is more efficient to use buoyancy to float the ship and drag it out to the sea than to drag the ship from the ground without water.",696.0,"720,1,0"
697,697,Buoyancy makes the boat lighter when it floats.,697.0,"721,1,0"
698,698,"The ship has buoyancy to float on the water. Therefore, if you fill the boat with a lot of water, it will be easy to move it from the ground slightly by the buoyancy of the boat.",698.0,"722,1,0"
699,699,The principle of buoyancy is that a ship can float. It can be said that water is the power to support the ship.,699.0,"723,1,0"
700,700,"It uses the principle of buoyancy that objects float in water, and when water is filled around the ship, the ship floats in water, making it easier to move (the ship) to the sea.",700.0,"724,1,0"
701,701,"The force that floats an object is called buoyancy. Buoyancy is the force to push an object upward as much as the pressure difference in the direction of gravity on the upper and lower surfaces of a specific object submerged in a fluid. Due to this pressure difference, the object stops at a height at which the force to push upward is equal to the weight of the object. For this reason, a locked object sinks when it is denser than a liquid. Conversely, if an object is less dense than a liquid or shaped into a particular shape, such as a ship above it, the object floats by force.",701.0,"725,0,0"
702,702,"It's using buoyancy. As much as the volume of the ship, the water will float the ship above the water, and using this force, it will be able to move the ship to the defense.",702.0,"726,1,0"
703,703,"If you fill the boat with water, the boat's submerged volume increases. The ship needs less force to move because it pushes out as much water as its submerged volume and receives buoyancy such as its pushed weight.",703.0,"727,0,0"
704,704,"This is because when water is filled around the ship, buoyancy acts on the ship and floats on the water.",704.0,"728,0,0"
705,705,"When water is filled around the ship, buoyancy, which is the force of water to lift objects, causes the buoyancy to float the ship against gravity. Just as it is easier for us to push an object on the water than it is to push an object on the ground, if we fill the boat with water around it, the boat will float on the water and consequently become more mobile.",705.0,"729,1,0"
706,706,This is because the water floats on the water using buoyancy that pushes the ship up.,706.0,"730,1,0"
707,707,"This is because when the boat is filled with water, a part of the boat is submerged in water and floats.",707.0,"731,1,0"
708,708,"If the boat is filled with water, it can be easily moved. The reason is that buoyancy, the power to float the ship, was applied. The boat will be able to move much more easily than before because some of it is submerged and floated upward.",708.0,"732,1,0"
709,709,"This is closely related to buoyancy. An object submerged in a fluid, such as water or air, receives a force from the fluid in an upward direction opposite to gravity, which is called buoyancy. Usually, if the difference between the water pressure that an object receives from the bottom and the water pressure from the top is greater than the gravity that the water bottle receives, the water bottle floats above the water. In the case of a ship, it is not subjected to water pressure from the top, but only from the bottom. If this water pressure is greater than the gravity the ship receives, the ship floats. Therefore, if you add water, the boat floats, so that the boat can move along the flow of water.",709.0,"733,1,0"
710,710,"Buoyancy is the force that allows an object to float in water or air. A force equal to the weight of water pushed by an object acts upward, allowing it to float as opposed to the weight of the object, and the magnitude of the buoyancy is equal to the magnitude of the weight of one object pushing water.",710.0,"734,1,0"
711,711,"""",711.0,"735,1,0"
712,712,"An object floats on the water because it receives buoyancy. Buoyancy will create a floating force that acts in the opposite direction to gravity, so it will be able to carry the ship with less force than moving the ship from the ground.",712.0,"736,0,0"
713,713,It is to use buoyancy to float a ship,713.0,"737,0,0"
714,714,buoyancy,714.0,"738,0,0"
715,715,the principle of buoyancy,715.0,"739,0,0"
716,716,the principle of buoyancy,716.0,"740,0,0"
717,717,buoyancy,717.0,"741,1,0"
718,718,Science,718.0,"742,0,0"
719,719,It can be easily transferred using buoyancy.,719.0,"743,1,0"
720,720,tidal difference,720.0,"744,0,0"
721,721,I don't know.,721.0,"745,0,0"
722,722,"If you put water around a heavy object, it creates buoyancy and can be easily moved.",722.0,"746,1,0"
723,723,"(Singing ""Looloolala"")",723.0,"747,1,0"
724,724,using buoyancy,724.0,"748,0,0749,0,0"
725,725,use buoyancy,725.0,"750,0,0"
726,726,We used the palace because the ship was aflame,726.0,"751,0,0"
727,727,A ship can easily be on the water.,727.0,"752,1,0"
728,728,I used buoyancy to float.,728.0,"753,1,0"
729,729,It moves with buoyancy.,729.0,"754,1,0"
730,730,be easy to carry by buoyancy,730.0,"755,1,0"
731,731,Fill the ship with water and remove it from the ground and move it easily,731.0,"756,0,0"
732,732,You can use buoyancy.,732.0,"757,1,0"
733,733,"When water is filled around the ship, friction between the ship and the ground decreases, making the ship move well. This makes it easier for the ship to move and move.",733.0,"758,1,0"
734,734,It's using buoyancy.,734.0,"759,0,0"
735,735,the principle of buoyancy,735.0,"760,1,0"
736,736,We used the principle of buoyancy.,736.0,"761,1,0"
737,737,The boat is floating in the water and can move easily,737.0,"762,1,0"
738,738,"Using buoyancy, he lifted a ship with a large base area",738.0,"763,0,0"
739,739,Use buoyancy to move a ship when it rises,739.0,"764,0,0"
740,740,use frictional force,740.0,"765,1,0"
741,741,It's using buoyancy.,741.0,"766,1,0"
742,742,The water is making him slippery,742.0,"767,0,0"
743,743,Water makes it easy for the ship to go by using the force of buoyancy.,743.0,"768,0,0"
744,744,"When submerged, buoyancy increases and floats well.",744.0,"769,1,0"
745,745,It is because buoyancy occurs when water meets the bottom of the ship,745.0,"770,0,0"
746,746,Use buoyancy.,746.0,"771,0,0"
747,747,floating power,747.0,"772,1,0"
748,748,"It has the property of floating matter when filled with water, so no matter how heavy a ship is, it can float with buoyancy.",748.0,"773,1,0"
749,749,This is because boats float easily using buoyancy.,749.0,"774,1,0"
750,750,"When I fill it with water, I get buoyancy and a boat rises",750.0,"775,0,1"
751,751,"The boat floats by the buoyancy of the water, so it fills the water and cuts it off",751.0,"776,1,0"
752,752,"When water is filled around, the water pushes the ship in the opposite direction of gravity, so gravity is offset, which is called buoyancy.",752.0,"777,0,0"
753,753,The boat floats in the water by buoyancy and can be easily moved along the flowing water.,753.0,"778,1,0779,0,0"
754,754,Hello,754.0,"780,1,0"
755,755,"A ship is a means of transportation to the sea, so it can be easily transported by filling it with water.",755.0,"781,0,0"
756,756,It is the principle that buoyancy works in liquids,756.0,"782,1,0"
757,757,Being on the water makes it easier to move objects than being on the ground.,757.0,"783,1,0"
758,758,This is because filling the surroundings with water increases buoyancy.,758.0,"784,1,0"
759,759,Principle of buoyancy: I know,759.0,"785,1,0"
760,760,"The boat is heavy in the water, just as it floats when a person enters the water",760.0,"786,0,0"
761,761,buoyancy,761.0,"787,1,0"
762,762,buoyancy,762.0,"788,1,0"
763,763,be strong in strength,763.0,"789,1,0"
764,764,I don't know.,764.0,"790,1,0"
765,765,"I'm not a science student, I don't know.",765.0,"791,1,0"
766,766,"Because ships are made of floating objects, they can be easily moved by filling them with water",766.0,"792,1,0"
767,767,buoyancy,767.0,"793,1,0"
768,768,It used the force of buoyancy.,768.0,"794,1,0"
769,769,used buoyancy,769.0,"795,1,0"
770,770,the principle of buoyancy,770.0,"796,1,0"
771,771,I don't know,771.0,"797,1,0"
772,772,to use buoyancy to lift an object,772.0,"798,1,0"
773,773,buoyancy,773.0,"799,0,0"
774,774,Use the buoyancy of the ship to make it lighter than water,774.0,"800,1,0"
775,775,the act of moving a ship using buoyancy,775.0,"801,1,0"
776,776,buoyancy,776.0,"802,1,0"
777,777,I think he used buoyancy!,777.0,"803,1,0"
778,778,I don't know,778.0,"804,0,0"
779,779,It's easier to smuggle in water,779.0,"805,1,0"
780,780,The belly can easily float and move due to buoyancy.,780.0,"806,1,0"
781,781,the principle of buoyancy,781.0,"807,1,0"
782,782,Gravity,782.0,"808,1,0809,1,0"
783,783,I don't know,783.0,"810,0,0"
784,784,buoyancy,784.0,"811,0,0"
785,785,The principle seems to explain the principle of movement,785.0,"812,1,0"
786,786,I don't know.,786.0,"813,0,0"
787,787,buoyancy,787.0,"814,0,0"
788,788,It is the principle of moving a ship by using buoyancy of floating objects in the water,788.0,"815,1,0"
789,789,It is because of buoyancy.,789.0,"816,0,0"
790,790,Because the ship is lighter than water.,790.0,"817,1,0"
791,791,buoyancyarmed forces,791.0,"818,1,0"
792,792,the use of floating forces in the water,792.0,"819,1,0"
793,793,I think I'm going to float.,793.0,"820,0,0"
794,794,"An object submerged in a fluid, such as water or air, receives a force from the fluid in an upward direction opposite to gravity, which is called buoyancy.",794.0,"821,1,0"
795,795,"Because ships float in water by buoyancy, the principle of buoyancy was used.",795.0,"822,0,0"
796,796,centrifugal force,796.0,"823,1,0"
797,797,"The larger the buoyancy principle area, the better it floats",797.0,"824,1,0"
798,798,buoyancy,798.0,"825,1,0"
799,799,buoyancy,799.0,"826,0,0"
800,800,I don't understand.,800.0,"827,0,0"
801,801,buoyancy,801.0,"828,1,0"
802,802,Increases buoyancy,802.0,"829,0,0"
803,803,buoyancy,803.0,"830,1,0"
804,804,water power,804.0,"831,1,0"
805,805,buoyancy,805.0,"832,1,0"
806,806,It's using buoyancy.,806.0,"833,1,0"
807,807,the force to float an object,807.0,"834,1,0"
808,808,To float a ship using water is to float and move the ship using buoyancy.,808.0,"835,,"
809,809,"Because of buoyancy, the boat floats on the water",809.0,"836,,"
810,810,the use of buoyancy,810.0,"837,64.2%,1.2%"
811,811,buoyancy,,
812,812,buoyancy,,
813,813,I don't understand.,,
814,814,Use buoyancy to float a ship.,,
815,815,It uses the principle that buoyancy repels the gravity of the object and consequently the force applied vertically of the object decreases.,,
816,816,used buoyancy,,
817,817,Use buoyancy to float a heavy ship.,,
818,818,I don't know,,
819,819,buoyancy,,
820,820,buoyancy,,
821,821,Add water to move the boat by creating buoyancy for the boat to float.,,
822,822,buoyancy,,
823,823,to float an object using buoyancy,,
824,824,M and D,,
825,825,I don't understand.,,
826,826,This is because buoyancy rises.,,
827,827,"""I don't know about that",,
828,828,"""",,
829,829,All right.,,
830,830,Let's go up with buoyancy,,
831,831,"When you fill it with water, the boat floats by water",,
832,832,Use buoyancy to transfer,,
833,833,to be able to lift easily using buoyancy The belly is large and buoyant,,
834,834,You can float the boat with buoyancy and move it with less effort.,,
835,835,the principle of a ship floating in water,,
836,836,buoyancy,,
837,837,the law of universal gravitation,,
838,838,buoyancy,,
839,839,It's easy to send down because of buoyancy,,
840,840,It is because of buoyancy.,,
841,841,The force to float an object can be relatively easily transferred using the difference in relative density.,,
842,842,e,,
843,843,buoyancy,,
844,844,the principle of relativity,,
845,845,buoyancy,,
846,846,"Since the boat floats in the water due to buoyancy, it is easier to move the boat to the sea than when there is no buoyancy.",,
847,847,"The boat floats, so if you fill it with water around it, it will float and be easy to move.",,
848,848,The buoyancy is at work.,,
849,849,"Using buoyancy, objects with less density than water float in water, which can easily move ships by receiving force from water",,
850,850,Evaluation Only. Created with Aspose.Cells for Python via Java.Copyright 2003 - 2022 Aspose Pty Ltd.,,
