629,629,"When water vapor is in the sky, it becomes a cloud.",629,,,,,,,,,
630,630,Solar energy causes liquid to evaporate and become gas to form clouds.,630,,,,,,,,,
631,631,Water vapor rises and condenses.,631,,,,,,,,,
632,632,"Clouds are formed by condensation of water vapor by adiabatic expansion. In abstention, the higher the altitude, the lower the air pressure.",632,,,,,,,,,
633,633,"Water vapor evaporates and rises, and then the temperature decreases to cause water vapor to condense.",633,,,,,,,,,
634,634,That's because there's a sky,634,,,,,,,,,
635,635,The water by the river becomes water vapor and rises upward to form clouds.,635,,,,,,,,,
636,636,I don't know.,636,,,,,,,,,
637,637,Because evaporated water vapor condenses in the air by cold temperatures,637,,,,,,,,,
638,638,Water vapor in the atmosphere condenses to form clouds,638,,,,,,,,,
639,639,"Water vapor rise, temperature fall, heat vaporization, liquefaction, descent",639,,,,,,,,,
640,640,That's true,640,,,,,,,,,
641,641,Vaporized water vapors form in the sea,641,,,,,,,,,
642,642,I don't know,642,,,,,,,,,
643,643,Water vapor condenses into clouds in a low-temperature sky.,643,,,,,,,,,
644,644,Water vapor gathers in the sky and solidifies to form a cloud.,644,,,,,,,,,
645,645,"When water evaporates and gathers in a vapor state, it becomes a cloud.",645,,,,,,,,,
646,646,"Go, go, go, go, go",646,,,,,,,,,
647,647,I don't know.,647,,,,,,,,,
648,648,It is water produced by the aggregation of water vapor.,648,,,,,,,,,
649,649,"Clouds form when water vapor rises, expands, falls, and reaches the dew point.",649,,,,,,,,,
650,650,I don't know,650,,,,,,,,,
651,651,Clouds are crystals of water vapor that are produced by evaporation of water on land or in the sea.,651,,,,,,,,,
652,652,"As the air rises at low pressure and elevations increase, the pressure decreases, causing the air masses to expand, the temperature to drop, and the condensation point to drop, creating clouds as the temperature of the air masses reaches the condensation point.",652,,,,,,,,,
653,653,"When the air rises due to some factor, the air pressure decreases and adiabatic expansion occurs, resulting in a lower temperature of the air. In this case, the water vapor is condensed to form a cloud.",653,,,,,,,,,
654,654,Water rises to underwater -> clouds,654,,,,,,,,,
655,655,Because of the steam,655,,,,,,,,,
656,656,Water vapor rises above the sky and clumps together into clouds,656,,,,,,,,,
657,657,It occurs when the underwater plane rises and clumps up.,657,,,,,,,,,
658,658,Water vapor rises into the sky and the underwater vapor gathers and becomes visible to our eyes. That's the cloud,658,,,,,,,,,
659,659,Clouds are formed by the collection of water vapor,659,,,,,,,,,
660,660,The humidity of the air and the rising underwater air combine to form clouds,660,,,,,,,,,
661,661,"Water evaporates to form water vapor, and water vapor merges to form clouds",661,,,,,,,,,
662,662,"When water vapor forms and goes up, the water vapor gathers up in the sky and creates clouds.",662,,,,,,,,,
663,663,Water vaporizes and clumps up,663,,,,,,,,,
664,664,The reason for clouds is that water vapor moves around in the air layer and then bumps into each other to create clouds.,664,,,,,,,,,
665,665,The steam goes up to the sky,665,,,,,,,,,
666,666,"When water is boiled or rained, and the sun rises, the water turns into water vapor and rises above the sky to form clouds.",666,,,,,,,,,
667,667,The earth turns and the sky changes,667,,,,,,,,,
668,668,Clouds form when steam rises,668,,,,,,,,,
669,669,Clouds form as water vapor rises.,669,,,,,,,,,
670,670,Because it's about to rain,670,,,,,,,,,
671,671,Steam goes up into the sky,671,,,,,,,,,
672,672,Steam gathered from the sky,672,,,,,,,,,
673,673,The gases form water vapor and go up into the sky and clump together.,673,,,,,,,,,
674,674,"""Clouds are created by water vapor, and when it is vaporized, the weather becomes cloudy",674,,,,,,,,,
675,675,"""If there's no increase in the number, the weather will be clear without clouds.""",675,,,,,,,,,
676,676,"Water vaporizes as water evaporatesAs the steam rises, it becomes a cloud",676,,,,,,,,,
677,677,Water vaporizes as it evaporates. The steam rises to form clouds.,677,,,,,,,,,
678,678,"Water evaporation or plant evaporation produces water vapor and water vapor gathers so much that clouds are created When it is cloudy, the pressure is weakened by low pressure and reaches the temperature at which clouds are formed, creating a lot of clouds and clouds",678,,,,,,,,,
679,679,Because evaporated water vapor condenses in the air by cold temperatures,679,,,,,,,,,
680,680,Water vapor is the core of evaporation,680,,,,,,,,,
681,681,Clouds form clouds as droplets in the air condense and clump together.,681,,,,,,,,,
682,682,Water evaporates into vapor and condenses in the sky. The condensing droplets clump together to form clouds.,682,,,,,,,,,
683,683,The dew point condenses to form clouds.,683,,,,,,,,,
684,684,"When the water in the ground evaporates and rises, it expands adiabatically, creating clouds in the sky.",684,,,,,,,,,
685,685,"Water on the ground is heated and evaporated, and water vapor rises, and the air pressure that has increased due to the altitude weakens, causing insulation expansion, and the temperature decreases, reducing the amount of saturated water vapor, so clouds exist even on sunny days.",685,,,,,,,,,
686,686,I don't know.,686,,,,,,,,,
687,687,"If the water vapor in the atmosphere continues to rise upward, insulation expansion occurs, and the temperature of the water vapor rises to become water and clumps together, which becomes clouds.",687,,,,,,,,,
688,688,I don't know.,688,,,,,,,,,
689,689,"The reason for cloud formation is that as a lot of water vapor is generated, the water vapor insulates and expands, and it is combined with an electrolyte in the atmosphere to form a cloud.",689,,,,,,,,,
690,690,The evaporated water vapor rises high and condenses into clouds.,690,,,,,,,,,
691,691,"Water evaporates from lakes, rivers, and seas on the surface to become water vapor. As the water vapor rises upward, the surrounding temperature gradually decreases, reaching the dew point. The water vapor that has reached the dew point condenses to form water droplets, and clouds are generated as several water droplets gather.",691,,,,,,,,,
692,692,"Clouds are part of the water cycle and are part of the process by which water is distributed in the atmosphere). As water evaporates, water vapor rises to the atmosphere, and in this process, as the altitude increases, the air pressure decreases, resulting in insulation expansion, and later, the water vapor condenses at a high altitude where the temperature decreases, creating clouds.As the altitude of the water vapor increases, the temperature decreases and insulation expands. Clouds are made of these vapors.",692,,,,,,,,,
693,693,"Clouds expand insulation as water vapor evaporates into the sky, and inversely, when the temperature of water vapor decreases and the volume increases during the expansion process, clouds can occur regardless of the weather.",693,,,,,,,,,
694,694,"When water evaporates due to solar energy, it becomes water vapor. When a mass of air containing water vapor is heated or climbed up a high mountain range, the pressure decreases and the volume expands, and the temperature decreases due to the insulation expansion and condenses when the water vapor reaches the dew point to become a cloud.",694,,,,,,,,,
695,695,"The air on the ground rises upward as it heats up. As the air that has risen in this way consumes heat and expands, the temperature decreases, and the water vapor condenses to form a huge cloud.",695,,,,,,,,,
696,696,"On a sunny day, the dew point is high, but if there is more water vapor than saturated water vapor, clouds can be generated even in high skies. In this case, a cloud is formed. However, on cloudy days, this is not the case, so many clouds are created in the low sky, and the whole sky is filled with clouds",696,,,,,,,,,
697,697,Air rise-insulation expansion-temperature drop-dew point reach-condensation-cloud generation,697,,,,,,,,,
698,698,"Clouds are formed by the rise of water on the ground. Usually on sunny days, the temperature is high and dry, so the moisture on the ground does not rise. On the other hand, on cloudy days, moisture rises well because it is humid.",698,,,,,,,,,
699,699,?,699,,,,,,,,,
700,700,Umm,700,,,,,,,,,
701,701,There's a cloud,701,,,,,,,,,
702,702,I don't know,702,,,,,,,,,
703,703,"Because of the cloudy moonlight,",703,,,,,,,,,
704,704,water circulation,704,,,,,,,,,
705,705,Moisture goes up and clumps up with dust and stuff like that,705,,,,,,,,,
706,706,The steam gathered together,706,,,,,,,,,
707,707,The car's fumes go up,707,,,,,,,,,
708,708,yes,708,,,,,,,,,
709,709,The ocean evaporated,709,,,,,,,,,
710,710,Clouds are formed by the rise of water vapor on the ground.,710,,,,,,,,,
711,711,Water vapor evaporates to create clouds,711,,,,,,,,,
712,712,I don't know.,712,,,,,,,,,
713,713,Water vapor in the air condenses to form clouds.,713,,,,,,,,,
714,714,This is because evaporation of water vapor always occurs.,714,,,,,,,,,
715,715,I'm sorry.,715,,,,,,,,,
716,716,Water evaporates and water vapor clumps together to form clouds.,716,,,,,,,,,
717,717,"Water vapor in the air gathers to form clouds, because rain clouds have much more concentrated water vapor.",717,,,,,,,,,
718,718,I don't know.,718,,,,,,,,,
719,719,It is produced when there is a lot of downstream air or water or when the weather is clear,719,,,,,,,,,
720,720,God farted,720,,,,,,,,,
721,721,condensation of water vapor,721,,,,,,,,,
722,722,I don't understand.,722,,,,,,,,,
723,723,Clouds are formed as water from the land and the sea rises into the atmosphere and forms a liquid mass.,723,,,,,,,,,
724,724,"When the seawater evaporates and the water in the river evaporates, the water vapor rises above the sky, which condenses into clouds.",724,,,,,,,,,
725,725,Well...,725,,,,,,,,,
726,726,This is because clouds are formed by humidity and temperature in the atmosphere regardless of the sunny degree of the weather.,726,,,,,,,,,
727,727,"As water vapor rises into the sky, the water vapor gathers and clouds are formed.",727,,,,,,,,,
728,728,Water evaporation is caused by a collection,728,,,,,,,,,
729,729,M and D,729,,,,,,,,,
730,730,"D, D, D",730,,,,,,,,,
731,731,Mall,731,,,,,,,,,
732,732,I don't understand.,732,,,,,,,,,
733,733,I don't understand.,733,,,,,,,,,
734,734,I don't know.,734,,,,,,,,,
735,735,I don't know,735,,,,,,,,,
736,736,M and D,736,,,,,,,,,
737,737,I don't understand.,737,,,,,,,,,
738,738,I don't understand.,738,,,,,,,,,
739,739,I don't understand.,739,,,,,,,,,
740,740,I don't understand.,740,,,,,,,,,
741,741,The steam gathered together,741,,,,,,,,,
742,742,I don't know.,742,,,,,,,,,
743,743,I don't know,743,,,,,,,,,
744,744,The steam turns into clouds,744,,,,,,,,,
745,745,I don't understand.,745,,,,,,,,,
746,746,M and D,746,,,,,,,,,
747,747,I don't know,747,,,,,,,,,
748,748,It's going to rain,748,,,,,,,,,
749,749,.,749,,,,,,,,,
750,750,I don't understand.,750,,,,,,,,,
751,751,I don't know,751,,,,,,,,,
752,752,M and D,752,,,,,,,,,
753,753,I don't know.,753,,,,,,,,,
754,754,.,754,,,,,,,,,
755,755,Each lake of the sea river is flooded with water and clouds form as it goes up into the sky,755,,,,,,,,,
756,756,"""The steam in the air went up,",756,,,,,,,,,
757,757,"""",757,,,,,,,,,
758,758,"The air, including the steam, which has risen as it warms up, becomes colder and more humid, making it a cloud",758,,,,,,,,,
759,759,"The air, including water vapor, which has risen as it warms up, gradually cools down and increases humidity, making it a cloud.",759,,,,,,,,,
760,760,"The air, including water vapor, which has risen as it warms up, gradually cools down, increases humidity, and becomes clouds.",760,,,,,,,,,
761,761,It is caused by condensation of water vapor by adiabatic expansion.,761,,,,,,,,,
762,762,"""Clouds are the wish of all",762,,,,,,,,,
763,763,"Therefore, it is in heaven at any time",763,,,,,,,,,
764,764,"That's why people get refreshed by looking at the sky """,764,,,,,,,,,
765,765,"If there's no cloud, it's all over the place",765,,,,,,,,,
766,766,"""Water on the Earth's surface is evaporated by solar heat or vaporized by plant evaporation. The steam goes up into the air and becomes a cloud.",766,,,,,,,,,
767,767,"Clouds repeatedly fall into the ground and sea with rain or snow and then evaporate again.""",767,,,,,,,,,
768,768,"When the air mass rises further and the temperature falls below the dew point, the water vapor condenses into small droplets, and when the temperature of the air mass falls below 0Â°C, it becomes ice grains. It is a cloud that these water droplets or ice grains float high in the sky. At this time, if there is a small dust in the air, such as incense smoke, water vapor condenses more easily, so clouds are easily formed.",768,,,,,,,,,
769,769,"Air heated up from the surface. ??As it rises above the air, the volume of the air becomes larger and the temperature decreases. ??Water vapor in the air condenses in the high sky, creating clouds floating in small droplets or ice grains.",769,,,,,,,,,
770,770,"The temperature of the air mass continues to decrease, and when the water vapor condenses, water droplets form, which gather to form clouds.",770,,,,,,,,,
771,771,"Clouds are caused by the vapor in the air turning into droplets as the air rises. Clouds are produced as follows. In order for clouds to form, air must rise first rise.",771,,,,,,,,,
772,772,"The air, including steam, which has risen as it warms up, becomes colder and cooler, releasing humidity into clouds",772,,,,,,,,,
773,773,"""As air converges near the surface, it rises and clouds are formed.",773,,,,,,,,,
774,774,"It occurs when two air masses with different temperatures come into contact. Clouds are formed when warm, humid air rises above cold air.""",774,,,,,,,,,
775,775,"When air gathers around the low pressure and descends, the air on the surface rises by heating, or when cold air raises hot air",775,,,,,,,,,
776,776,Air mass rises ??Insulation expansion of air mass due to lower ambient air pressure (volume expansion) ??Temperature decreases to reach dew point ??Water vapor condenses to create clouds,776,,,,,,,,,
777,777,It is formed by condensation of water vapor by adiabatic expansion,777,,,,,,,,,
778,778,"When the air near you goes up, the air pressure decreases and the volume increases.",778,,,,,,,,,
779,779,"As the volume of air increases, the temperature decreases, and when the temperature fluctuates below the dew point, the water vapor in the air becomes entangled and becomes water droplets.",779,,,,,,,,,
780,780,"These little drops of water come together into the clouds.""",780,,,,,,,,,
781,781,"Clouds are formed by condensation of water vapor by adiabatic expansion. In abstention, the higher the altitude, the lower the air pressure. As the air mass containing water vapor rises, as shown in Figure III-14, the pressure outside the air mass is lower than the pressure inside the air mass, which insulates and expands and the temperature is lowered.",781,,,,,,,,,
782,782,"""As the air rises, insulation expands and cools,",782,,,,,,,,,
783,783,Clouds form when you reach the dew point,783,,,,,,,,,
784,784,"""",784,,,,,,,,,
785,785,Small droplets of water (at 0Â°C or higher) or ice crystals (at 0Â°C or lower) formed by condensation of water vapor gather to form clouds.,785,,,,,,,,,
786,786,"The air, including steam, which has risen as it warms up, becomes colder and more humid, becoming clouds",786,,,,,,,,,
787,787,"""The creation of clouds is",787,,,,,,,,,
788,788,"When air cools in the atmosphere, it easily leads to saturation. There are three ways to cool the air: contact, mixing, and rising. When relatively warm air stays on the cold ground or on the surface of the water, the air on the contact surface is cooled by contact. At this time, when it reaches saturation, fog or stratified clouds may occur. On the other hand, when air rises without heat exchange with the surroundings, it is insulated and expanded to cool the rising air as it works outside. The most common method of cooling air can be said to be cooling by rising. Clouds are created as the air rises to reach saturation by adiabatic cooling and the water vapor condenses. """,788,,,,,,,,,
789,789,"When air cools in the atmosphere, it easily leads to saturation. There are three ways to cool the air: contact, mixing, and rising. When relatively warm air stays on the cold ground or on the surface of the water, the air on the contact surface is cooled by contact. At this time, when it reaches saturation, fog or stratified clouds may occur. On the other hand, when air rises without heat exchange with the surroundings, it is insulated and expanded to cool the rising air as it works outside. The most common method of cooling air can be said to be cooling by rising. Clouds are created as the air rises to reach saturation by adiabatic cooling and the water vapor condenses.",789,,,,,,,,,
790,790,Clouds are made of water vapor,790,,,,,,,,,
791,791,"Air rises and becomes a single expansion, which lowers the temperature. After that, the dew point is reached and the water vapor condenses to form a cloud.The water evaporated",791,,,,,,,,,
792,792,as water evaporates,792,,,,,,,,,
793,793,The steam went up,793,,,,,,,,,
794,794,The formation of clouds is the reaction of increasing entropy in the universe,794,,,,,,,,,
795,795,moving box,795,,,,,,,,,
796,796,I don't know,796,,,,,,,,,
797,797,"""The water evaporated and created an underwater plane",797,,,,,,,,,
798,798,"""",798,,,,,,,,,
799,799,Water vapor rises to cloud.,799,,,,,,,,,
800,800,Water vapor is formed by gathering together,800,,,,,,,,,
801,801,It's cloudy,801,,,,,,,,,
802,802,The underwater plane went up and clumped up,802,,,,,,,,,
803,803,"It's a rainy day on a cloudy day, so the water evaporates and goes up to the clouds",803,,,,,,,,,
804,804,"Steam rises above the sky and meets other clouds, creating large clouds.",804,,,,,,,,,
805,805,"This is because the humidity is high on cloudy days, so the water evaporates and becomes a cloud.",805,,,,,,,,,
806,806,Clouds are clouds where water vapor is collected. Water vapor is caused by evaporating water.,806,,,,,,,,,
807,807,"When water evaporates and water vapor rises, the temperature is low, so it becomes water droplets and clouds are formed.",807,,,,,,,,,
808,808,Water vapor condenses through adiabatic expansion.,808,,,,,,,,,
809,809,...,809,,,,,,,,,
810,810,"On a cloudy day, the water evaporates and the vapor becomes a cloud",810,,,,,,,,,
811,811,It could be raining,811,,,,,,,,,
812,812,"On a sunny day, the water turns into water vapor and rises, and on cloudy days, it's low pressure, so the water vapor condenses easily and becomes clouds",812,,,,,,,,,
813,813,????????????????,813,,,,,,,,,
814,814,The steam goes up into the sky,814,,,,,,,,,
815,815,"On cloudy days, underwater planes gather in one place and become full of clouds.",815,,,,,,,,,
816,816,Water vapor gathers to form clouds.,816,,,,,,,,,
817,817,Rain falls and the net vaporizes into clouds,817,,,,,,,,,
818,818,"On cloudy days, there is more water vapor, so water vapor is collected and many clouds are formed.",818,,,,,,,,,
819,819,Clouds insulation expansion,819,,,,,,,,,
820,820,Clouds form when water turns into steam,820,,,,,,,,,
821,821,This is because there are less clouds in high pressure and a lot of clouds in low pressure.,821,,,,,,,,,
822,822,"When the water vapor rises and expands, the temperature drops and condenses.",822,,,,,,,,,
823,823,"When the air rises and expands, it vaporizes and condenses water vapor.",823,,,,,,,,,
824,824,by adiabatic expansion,824,,,,,,,,,
825,825,"Since the volume increases as the air rises and the air pressure decreases, the temperature decreases and insulates and expands. Consequently, water vapor condenses to form clouds.",825,,,,,,,,,
826,826,"As the air rises, the air pressure decreases, increasing the volume and lowering the temperature (insulation expansion). This causes water vapor to condense and form clouds.",826,,,,,,,,,
827,827,It's insulation expansion,827,,,,,,,,,
828,828,Clouds are formed by condensation after water evaporates and rises high.,828,,,,,,,,,
829,829,"The higher the amount of water vapor in the air, the higher the dew point, and the higher the dew point, the higher the cloud.",829,,,,,,,,,
830,830,"As it rises, it reaches condensation and creates clouds.",830,,,,,,,,,
831,831,Condensation of water vapor through adiabatic expansion process,831,,,,,,,,,
832,832,Water vapor rises and liquefies,832,,,,,,,,,
833,833,This is because water vapor condenses.,833,,,,,,,,,
834,834,"In the atmosphere, as the height increases, the temperature decreases, so that water vapor liquefies to become small droplets and forms clouds.",834,,,,,,,,,
835,835,It's because of the steam,835,,,,,,,,,
836,836,Clouds bring travel rain and water to steam to make clouds and rain when you are sad,836,,,,,,,,,
837,837,The steam gathered together,837,,,,,,,,,
838,838,"If the moisture of the ground becomes vapor and rises to the sky, clouds",838,,,,,,,,,
839,839,Dust rises and piles up to form clouds,839,,,,,,,,,
840,840,"The water in the sea is evaporated by the sun and goes up into the sky. The steam goes to the sky and gathers, which creates clouds. When this cloud grows to some extent, it becomes rain, and when the temperature drops, it solidifies and becomes snow.",840,,,,,,,,,
841,841,Evaporated water vapor is caused by boiling and clumping together.,841,,,,,,,,,
842,842,This is because water on the ground evaporates and combines with dust in the air to form clouds.,842,,,,,,,,,
843,843,"As seawater or river water evaporates, it rises to the sky and condenses into clouds.",843,,,,,,,,,
844,844,The temperature went down and dust and steam met and became clouds,844,,,,,,,,,
845,845,Because of the steam,845,,,,,,,,,
846,846,Evaporated water is made by clumping together with dust in the atmosphere.,846,,,,,,,,,
847,847,"The moisture on the ground evaporates and goes up to the sky, and the clouds are formed by the aggregation of moisture that cannot go out of the atmosphere due to gravity",847,,,,,,,,,
848,848,Is it factory smoke?,848,,,,,,,,,
849,849,.,849,,,,,,,,,
850,850,"The liquid turns into a gas, and it goes up into a cloud^^)",850,,,,,,,,,
851,851,?,851,,,,,,,,,
852,852,"The water of the sea goes to the river, and it evaporates, and it becomes a crab rain and goes back to the sea."" (Repeat)",852,,,,,,,,,
853,853,"As the word ""flyfall"" in the dry sky, clouds can form even if it is clear.",853,,,,,,,,,
854,854,I don't know,854,,,,,,,,,
855,855,"Clouds are formed by combining water and water vapor, so they can also occur on sunny days.",855,,,,,,,,,
856,856,Clouds form because of the rain,856,,,,,,,,,
857,857,Because the weather is not good,857,,,,,,,,,
858,858,Clouds are formed when water evaporates and gathers.,858,,,,,,,,,
859,859,"Heat evaporates the water on Earth, and the steam gathers in the sky to form clouds",859,,,,,,,,,
860,860,The clouds are weird,860,,,,,,,,,
861,861,Clouds are humid on cloudy days because they vary in size depending on the amount of water vapor,861,,,,,,,,,
862,862,The steam turns into clouds,862,,,,,,,,,
863,863,"Cloudy days have high humidity, so there is more water in the air, so clouds are caused by evaporation of water such as the sea or river, so there are more clouds",863,,,,,,,,,
864,864,The water evaporates and becomes water vapor and goes up into the sky.,864,,,,,,,,,
865,865,It's because water vapor gathers and makes clouds,865,,,,,,,,,
866,866,I don't know. Help me,866,,,,,,,,,
867,867,Because of the moisture in the sky,867,,,,,,,,,
868,868,Water evaporated into water vapor and agglomerated.,868,,,,,,,,,
869,869,Condensation,869,,,,,,,,,
870,870,"It rains and evaporates again, creating clouds",870,,,,,,,,,
871,871,Water evaporates to form clouds,871,,,,,,,,,
872,872,Water evaporates to form clouds,872,,,,,,,,,
873,873,Water droplets evaporate to form clouds.,873,,,,,,,,,
874,874,I don't know because the water evaporates and clumped together,874,,,,,,,,,
875,875,Water drops go up and gather,875,,,,,,,,,
876,876,Water vapor is produced by the evaporation of water,876,,,,,,,,,
877,877,The air rises to form clouds,877,,,,,,,,,
878,878,Water vapor gathers and becomes clouds,878,,,,,,,,,
879,879,"Even on a sunny day, water vapor can be produced in seawater, lakes, etc., and the steam can expand as it rises",879,,,,,,,,,
880,880,d,880,,,,,,,,,
881,881,Clouds cause water vapor in the air to agglomerate,881,,,,,,,,,
882,882,"Steam rises, gathers, condenses, and becomes clouds",882,,,,,,,,,
883,883,Water such as rivers and seas evaporates to create clouds.,883,,,,,,,,,
884,884,Clouds are formed when you fly into the sky while eating cotton candy,884,,,,,,,,,
885,885,"As water evaporates, underwater planes gather in the sky to form clouds",885,,,,,,,,,
886,886,Moisture evaporates to form a lump of water vapor.,886,,,,,,,,,
887,887,"""Cloud""",887,,,,,,,,,
888,888,??Small droplets or ice crystals produced by condensation of water vapor are floating high in the skyGeneration process,888,,,,,,,,,
889,889,,,,,,,,,,,
890,890,"Air lump rise-insulation expansion (volume expansion)-temperature drop-dew viscosity moon-water vapor condensation-cloud generation""",,,,,,,,,,
891,891,This is because water vapor is gathered and united in the sky.,,,,,,,,,,
892,892,This is due to evaporation of water on the surface and condensation of water in the air.,,,,,,,,,,
893,893,Clouds are formed by vapor evaporation in the air.,,,,,,,,,,
894,894,Clouds form clouds in which water from the sea gathers in evaporation.,,,,,,,,,,
