305,305,"When the water on the ground evaporates and goes up to the sky, it becomes liquid again and forms clouds",305,,,,,,,,,
306,306,"When moisture on the ground evaporates and goes to the sky, it becomes a liquid and gathers to form a cloud.",306,,,,,,,,,
307,307,"When the moisture of the ground evaporates and goes up to the sky, it becomes liquid again and forms clouds",307,,,,,,,,,
308,308,Small drops of water or ice that are formed by condensation of water vapor are floating high in the sky,308,,,,,,,,,
309,309,"""Losing and hot air rises rapidly. As the rising hot air gradually decreases in air pressure and temperature and expands, the relative humidity increases further, and the temperature drops below the dew point to condense, creating clouds.",309,,,,,,,,,
310,310,,310,,,,,,,,,
311,311,,311,,,,,,,,,
312,312,"""",312,,,,,,,,,
313,313,Clouds are made by water particles becoming steam and going up into the sky and condensing.,313,,,,,,,,,
314,314,"As the volume of air increases, the temperature decreases, and as it falls below the dew point of the air, the underwater air becomes entangled with each other, and it is a cloud that water droplets have gathered.",314,,,,,,,,,
315,315,"""Clouds are made of droplets of water or small grains of ice. When hot air rises above the ground, air pressure decreases, increasing in volume and lowering temperatures.",315,,,,,,,,,
316,316,"The temperature continues to decrease and then when it reaches a certain point, the water vapor becomes entangled and becomes water droplets. These drops of water come together and become clouds.",316,,,,,,,,,
317,317,,317,,,,,,,,,
318,318,"""",318,,,,,,,,,
319,319,"Clouds are gases. When the ground gets warm, the gas gets warmIt goes up like this.They clump up together and the clouds pop up",319,,,,,,,,,
320,320,"When moisture on the ground evaporates and goes to the sky, it becomes liquid and gathers to form clouds.",320,,,,,,,,,
321,321,Moisture on the ground evaporates and spills and becomes a hill.,321,,,,,,,,,
322,322,Water vapors under the sky gather together.,322,,,,,,,,,
323,323,"When moisture on the ground evaporates and goes to the sky, it becomes liquid and gathers to form clouds.",323,,,,,,,,,
324,324,"When the temperature of an airplane in the sky is low, clouds form",324,,,,,,,,,
325,325,"As the air rises, it cools and condenses the water vapor into very small droplets.",325,,,,,,,,,
326,326,Water vapor condenses.,326,,,,,,,,,
327,327,"As the volume of air increases, the temperature decreases, and when the temperature drops below the dew point, the water vapor in the air lumps together to form water droplets, and these small droplets are gathered in clouds",327,,,,,,,,,
328,328,Clouds are formed even on sunny days because clouds are produced as water evaporates in the sea,328,,,,,,,,,
329,329,Clouds are formed as water vapor condenses in the air.,329,,,,,,,,,
330,330,Clouds are formed by the gathering of underwater aircraft up into the sky.,330,,,,,,,,,
331,331,"As the water vapor rises to the sky, it gradually cools, increases humidity, and increases the water vapor grains, which becomes clouds.",331,,,,,,,,,
332,332,It rises to reach saturation by adiabatic cooling and is generated as water vapor condenses.,332,,,,,,,,,
333,333,Water vapor condenses into clouds,333,,,,,,,,,
334,334,This is because the water above the ground vaporizes and turns it into water vapor.,334,,,,,,,,,
335,335,"The water evaporated by sunlight rises into the sky, and then the air pressure gradually decreases and expands, the temperature decreases, the saturated vapor decreases, the humidity increases, and clouds form when the water vapor condenses.",335,,,,,,,,,
336,336,I don't know.,336,,,,,,,,,
337,337,"""Hook Moisture Belt""",337,,,,,,,,,
338,338,"""",338,,,,,,,,,
339,339,I don't know,339,,,,,,,,,
340,340,I wanted to get a cloud,340,,,,,,,,,
341,341,I don't know.,341,,,,,,,,,
342,342,"""I don't know,""",342,,,,,,,,,
343,343,"""",343,,,,,,,,,
344,344,I don't understand.,344,,,,,,,,,
345,345,I don't know,345,,,,,,,,,
346,346,The steam gathered together,346,,,,,,,,,
347,347,I don't know,347,,,,,,,,,
348,348,I don't understand.,348,,,,,,,,,
349,349,I don't understand.,349,,,,,,,,,
350,350,I don't know,350,,,,,,,,,
351,351,I don't know.,351,,,,,,,,,
352,352,"In order to rain,",352,,,,,,,,,
353,353,I don't know.,353,,,,,,,,,
354,354,Water evaporates to become water vapor,354,,,,,,,,,
355,355,Water vapor in the air clumps together to form clouds.,355,,,,,,,,,
356,356,I don't understand.,356,,,,,,,,,
357,357,I don't know.,357,,,,,,,,,
358,358,I don't know,358,,,,,,,,,
359,359,Moisture forms from the earth's surface and rises to the sky to form clouds,359,,,,,,,,,
360,360,Don't know,360,,,,,,,,,
361,361,Evaporated water gathers and becomes clouds That's why it rains when the water in the clouds is full.,361,,,,,,,,,
362,362,I don't know,362,,,,,,,,,
363,363,I don't know,363,,,,,,,,,
364,364,I don't know,364,,,,,,,,,
365,365,There's a difference in air pressure and there's something like smoke. Cloudy,365,,,,,,,,,
366,366,Water vapor in the air gradually rises and then becomes a cloud and rains,366,,,,,,,,,
367,367,M and D,367,,,,,,,,,
368,368,Clouds form when water rises to the sky by evaporation in the sea or river lake,368,,,,,,,,,
369,369,Clouds are made of water vapor,369,,,,,,,,,
370,370,"Clouds are formed by the circulation of water. Therefore, clouds can be seen even on sunny days because water is continuously evaporated through the water cycle.",370,,,,,,,,,
371,371,"As the water on the ground evaporates and rises upward, it expands insulation, increasing its volume and turning into a cloud when the temperature drops and reaches the dew point.",371,,,,,,,,,
372,372,The rising air current is under low pressure. A downward airflow comes from an upward airflow.,372,,,,,,,,,
373,373,The clouds will stay because the background of the times was gloomy at that time.,373,,,,,,,,,
374,374,"Water on the ground evaporates to form an air mass, and when the air mass adiabatically expands and the air mass reaches the dew point, it is liquefied and clouds are formed.",374,,,,,,,,,
375,375,Water vapor evaporates and rises up in the ascending air stream to form clouds.,375,,,,,,,,,
376,376,"With the air around the water absorbing moisture, the temperature rises, forming a low pressure, and the raised air mass insulates and expands, and clouds are formed when it reaches the dew point.",376,,,,,,,,,
377,377,"As water on the ground vaporizes and rises, the air pressure gradually decreases, so the temperature decreases and the volume of water vapor increases. At this time, if the temperature is below the dew point, the water vapor vapor is vaporized and liquefied into water. It is a cloud that combines the water that is made like that",377,,,,,,,,,
378,378,"Clouds are formed by the increase in droplets on the surface of the ground and insulation expansion to form clouds. Eventually, water droplets evaporate and condense anywhere.",378,,,,,,,,,
379,379,"Clouds are clouds that are caused by insulation expansion as the air mass rises, and accordingly, the temperature decreases and the water vapor in the air mass condenses.",379,,,,,,,,,
380,380,"Clouds occur depending on the degree of air in the air, and if the air is not completely dry, clouds will inevitably form in the sky.",380,,,,,,,,,
381,381,"When water vapor generated by evaporation rises to the sky, it condenses due to the low temperature surroundings, so there may be clouds in the sky.",381,,,,,,,,,
382,382,"When water vapor with relatively low density rises above, the air pressure decreases, resulting in adiabatic expansion. When the temperature reaches the dew point due to the drop in temperature due to insulation expansion, water vapor condenses, which is called clouds.",382,,,,,,,,,
383,383,"Water droplets heated and evaporated on land and sea expand insulation and rise upward, then reach the dew point and condense, and these condensed water droplets gather to form clouds.",383,,,,,,,,,
384,384,"Yes, yes",384,,,,,,,,,
385,385,I really don't know,385,,,,,,,,,
386,386,"I don't know, uh... ...because the fog turns into a cloud and the clouds drink water?",386,,,,,,,,,
387,387,rain and fog are made together,387,,,,,,,,,
388,388,I don't know,388,,,,,,,,,
389,389,"Even if it's a sunny day, if there's a lot of moisture, there will be clouds",389,,,,,,,,,
390,390,It's because the steam gets together and becomes clouds.k,390,,,,,,,,,
391,391,Because water vapor turns into clouds,391,,,,,,,,,
392,392,?¹á„‹???‹á…¡?£ã„±,392,,,,,,,,,
393,393,The water on the ground goes up to the sky and makes clouds,393,,,,,,,,,
394,394,I don't know,394,,,,,,,,,
395,395,There should be cloudsI don't know.,395,,,,,,,,,
396,396,Clouds are precious,396,,,,,,,,,
397,397,Clouds are created by water on the ground rising into the sky and creating water vapor.,397,,,,,,,,,
398,398,Country.,398,,,,,,,,,
399,399,Because of Seulgi,399,,,,,,,,,
400,400,There's a lot of watercraft,400,,,,,,,,,
401,401,I don't know,401,,,,,,,,,
402,402,cloudiness from the evaporation of rain,402,,,,,,,,,
403,403,I don't know,403,,,,,,,,,
404,404,"The water on land evaporates, and water vapor clumps and clumps together to form clouds",404,,,,,,,,,
405,405,The weather is just weird,405,,,,,,,,,
406,406,I don't know,406,,,,,,,,,
407,407,water vapor,407,,,,,,,,,
408,408,the steam that went up,408,,,,,,,,,
409,409,"When water evaporates, water vapor is generated, and the steam gathers to create clouds.",409,,,,,,,,,
410,410,"Clouds are made up of gases. Water vapor rises to the sky in places with prices such as the sea and rivers, creating clouds.",410,,,,,,,,,
411,411,The water on the ground gets vaporized,411,,,,,,,,,
412,412,The water in the sea evaporates into clouds,412,,,,,,,,,
413,413,The water evaporates and it gathers to form a lump.,413,,,,,,,,,
414,414,"Water vapor is generated as seawater or river water evaporates, and it becomes clouds as water vapor evaporates.",414,,,,,,,,,
415,415,The water in the air condenses in the sky,415,,,,,,,,,
416,416,"""The steam goes up",416,,,,,,,,,
417,417,"""",417,,,,,,,,,
418,418,The steam on the surface of the earth went up into the sky,418,,,,,,,,,
419,419,Why are you asking me?,419,,,,,,,,,
420,420,cloud,420,,,,,,,,,
421,421,The steam on the surface of the earth goes up into the sky,421,,,,,,,,,
422,422,High pressure,422,,,,,,,,,
423,423,"""Water vapor meets in the air, condenses, rises, and there are raindrops or grains of ice floating",423,,,,,,,,,
424,424,"""",424,,,,,,,,,
425,425,Clouds move (don't know),425,,,,,,,,,
426,426,The steam evaporated and gathered in the sky because of the clouds,426,,,,,,,,,
427,427,"The underwater atmosphere in the air condenses and rises into the high sky, leaving more drops of water or grains of ice",427,,,,,,,,,
428,428,Water vapor in the air condenses in the high sky and floats in small droplets or ice grains,428,,,,,,,,,
429,429,"It is because the underwater flag floats in the high sky and condenses to form clouds, so there are more underwater flags.",429,,,,,,,,,
430,430,The water in the air becomes small drops of water or ice grains and rises into the sky to form clouds,430,,,,,,,,,
431,431,The underwater atmosphere in the air condenses in the high sky and floats in the form of small droplets or ice grains.,431,,,,,,,,,
432,432,The underwater in the air turns into small drops of water or ice grains and becomes clouds.,432,,,,,,,,,
433,433,a phenomenon caused by condensation of water vapor into the high sky,433,,,,,,,,,
434,434,Water vapor in the air condenses in a high sky and floats in a state of small droplets or ice grains.,434,,,,,,,,,
435,435,"On a sunny day, it is high pressure, and if there are many cloudy, it is low pressure",435,,,,,,,,,
436,436,condensation in the sky high in the air and floating in small droplets or ice grains,436,,,,,,,,,
437,437,water vapor,437,,,,,,,,,
438,438,Water on the ground goes up and drops of water or ice are floating,438,,,,,,,,,
439,439,Let's not involve humans in weather events,439,,,,,,,,,
440,440,evaporation of water,440,,,,,,,,,
441,441,.,441,,,,,,,,,
442,442,This is due to condensation of water vapor due to rising air currents.,442,,,,,,,,,
443,443,Water vapor rises due to rising air flow due to high pressure and condenses by adiabatic expansion,443,,,,,,,,,
444,444,go away,444,,,,,,,,,
445,445,I don't know.,445,,,,,,,,,
446,446,This is because the air containing water vapor becomes heavier and descends close to the ground,446,,,,,,,,,
447,447,"Clouds are created along the wire. Therefore, there can always be clouds along the front surface in the area where I am.",447,,,,,,,,,
448,448,a rising air current,448,,,,,,,,,
449,449,I don't know,449,,,,,,,,,
450,450,The water evaporates,450,,,,,,,,,
451,451,I don't know.,451,,,,,,,,,
452,452,I don't know,452,,,,,,,,,
453,453,The steam rises into the sky and becomes clouds.k.a. cloud.,453,,,,,,,,,
454,454,I don't know.,454,,,,,,,,,
455,455,The warm water vapor in the air rises to form clouds.,455,,,,,,,,,
456,456,"The steam rises and becomes clouds, and the more steam there is, the heavier the clouds become",456,,,,,,,,,
457,457,Water vapor rises and is made into a cloud-like shape.,457,,,,,,,,,
458,458,"Cloudy days are more humid, so more water droplets evaporate from the surface and rise, resulting in more clouds.",458,,,,,,,,,
459,459,The steam goes up and merges,459,,,,,,,,,
460,460,"When water evaporates, clouds form when water vapor rises into the sky.",460,,,,,,,,,
461,461,This is because there is a change in the climate.,461,,,,,,,,,
462,462,"As water vapor rises, clouds form, and as water vapor increases, clouds increase and become heavier",462,,,,,,,,,
463,463,"""Because the steam goes up into the sky",463,,,,,,,,,
464,464,"""",464,,,,,,,,,
465,465,"Because it's a low pressure on cloudy days, clouds are more likely to form.",465,,,,,,,,,
466,466,"This is because water evaporates and binds to different objects (dust, etc.).",466,,,,,,,,,
467,467,Because there is a low pressure.,467,,,,,,,,,
468,468,"It is because of the movement of water. This is because the pool of water, a sea, a river, or water rises to create clouds.",468,,,,,,,,,
469,469,I don't know.,469,,,,,,,,,
470,470,I don't know.,470,,,,,,,,,
471,471,evaporation of water,471,,,,,,,,,
472,472,I don't know.,472,,,,,,,,,
473,473,.,473,,,,,,,,,
474,474,It's low pressure,474,,,,,,,,,
475,475,Clouds form under low pressure,475,,,,,,,,,
476,476,It's caused by the water droplets going up,476,,,,,,,,,
477,477,Clouds form under low pressure,477,,,,,,,,,
478,478,A lot of water vapor gathers to form clouds.,478,,,,,,,,,
479,479,"As the air rises and adiabatic expansion occurs, water increases and condenses to form clouds",479,,,,,,,,,
480,480,I don't know.,480,,,,,,,,,
481,481,Because clouds are created by air pressure differences,481,,,,,,,,,
482,482,"When air with low humidity gathers at low pressure and rises, air pressure and temperature decrease, so that air expands and relative humidity increases, resulting in moisture condensation and clouds.",482,,,,,,,,,
483,483,This is because clouds are created by air pressure differences.,483,,,,,,,,,
484,484,The steam condenses,484,,,,,,,,,
485,485,"Clouds have a relatively low pressure than the surrounding area, and the wind blows to match the low pressure with the atmosphere, because the air rises and condenses",485,,,,,,,,,
486,486,Clouds are created when warm and cold winds meet.,486,,,,,,,,,
487,487,"And small clouds gather to make a big cloud.""",487,,,,,,,,,
488,488,Warm air meets cold air and becomes clouds,488,,,,,,,,,
489,489,I don't know.,489,,,,,,,,,
490,490,I don't know.,490,,,,,,,,,
491,491,The warm wind and the cold wind meet and create clouds,491,,,,,,,,,
492,492,I don't know.,492,,,,,,,,,
493,493,Warm air and cold air meet to form clouds.,493,,,,,,,,,
494,494,Warm air and cold air meet.M and D,494,,,,,,,,,
495,495,None.,495,,,,,,,,,
496,496,Because it's humid,496,,,,,,,,,
497,497,I don't know.,497,,,,,,,,,
498,498,This is because moisture rises to the sky and solidifies in the sky to form clouds.,498,,,,,,,,,
499,499,Clouds come naturally,499,,,,,,,,,
500,500,The water evaporated,500,,,,,,,,,
501,501,Elevated air Flow Descent air,501,,,,,,,,,
502,502,"The underwater plane on the ground rises to the sky, and water droplets gather to form clouds.",502,,,,,,,,,
503,503,This is because water molecules that excessively absorb solar energy go into the sky in a water vapor state.,503,,,,,,,,,
504,504,Evaporated water gathers to form clouds.,504,,,,,,,,,
505,505,"""Because of the steam,",505,,,,,,,,,
506,506,"""",506,,,,,,,,,
507,507,This is because clouds created elsewhere were carried over by the wind.,507,,,,,,,,,
508,508,Earthquake,508,,,,,,,,,
509,509,I'm not sure,509,,,,,,,,,
510,510,It is caused by cloud water vapor.,510,,,,,,,,,
511,511,It evaporates in the ocean,511,,,,,,,,,
512,512,.,512,,,,,,,,,
513,513,Clouds are water that evaporates and rises to the sky to condense.,513,,,,,,,,,
514,514,"There is a lot of evaporated water, so there is a cloud because it rains.",514,,,,,,,,,
515,515,That's what happens when a lot of water vapor rises into the air and rises in the air,515,,,,,,,,,
516,516,It is a cloud that is created by the vaporization of water into the sky,516,,,,,,,,,
517,517,"When water evaporates from the surface and is in a water vapor state, it is a cloud that rises and changes its state to water again in the atmosphere when the temperature decreases.",517,,,,,,,,,
518,518,"When air with high humidity gathers at low pressure and rises, the air pressure and temperature decrease, so that the air expands, the relative humidity increases, and the temperature decreases, and moisture condenses into clouds.",518,,,,,,,,,
519,519,"Clouds are formed by gathering water vapor, so clouds are more likely to form on cloudy days than on sunny days.",519,,,,,,,,,
520,520,It evaporated into steam and liquefied in the stomach.,520,,,,,,,,,
521,521,Because of the temperature,521,,,,,,,,,
522,522,..,522,,,,,,,,,
523,523,Clouds are the gathering of water vapor. I don't know the details.,523,,,,,,,,,
524,524,This is because water vapor builds up up.,524,,,,,,,,,
525,525,"Moisture in the air gathers,",525,,,,,,,,,
526,526,Water evaporates and water vapor builds up to form clouds.,526,,,,,,,,,
527,527,The steam is going up,527,,,,,,,,,
528,528,This is because water vaporizes into water vapor,528,,,,,,,,,
529,529,This is because water vaporizes and gathers in the air.,529,,,,,,,,,
530,530,The water vapor in the sea creates clouds.,530,,,,,,,,,
531,531,"The water from the sea, rivers, and rivers evaporates due to solar heat and the evaporated water gathers from the sky",531,,,,,,,,,
532,532,Water evaporates to form clouds.,532,,,,,,,,,
533,533,The water evaporated,533,,,,,,,,,
534,534,Every cloud forms from steam,534,,,,,,,,,
535,535,The degree of cloud formation varies depending on the amount of water evaporated,535,,,,,,,,,
536,536,It seems that water from the ground evaporates and they are gathered together.,536,,,,,,,,,
537,537,BAE JONG BACTERIUM,537,,,,,,,,,
538,538,?‡ã„´??538.0,"548,1,0,1,1,,,,549,1,0,1,0,,,,",,,,,,,,,
539,539,The moisture at the bottom goes up,539,,,,,,,,,
540,540,I just wanted to do it,540,,,,,,,,,
541,541,M and D,541,,,,,,,,,
542,542,the d-hope,542,,,,,,,,,
543,543,Droplets of water come together,543,,,,,,,,,
544,544,"Because water on the surface evaporates, it can occur regardless of the weather.",544,,,,,,,,,
545,545,This is because water evaporates.,545,,,,,,,,,
546,546,1,546,,,,,,,,,
547,547,Clouds can occur regardless of weather because water on the surface evaporates.,547,,,,,,,,,
548,548,1,548,,,,,,,,,
549,549,I don't know,549,,,,,,,,,
550,550,6??5656,550,,,,,,,,,
551,551,I don't know,551,,,,,,,,,
552,552,Evaporated water becomes water vapor and they clump together,552,,,,,,,,,
553,553,"Water vapor forms and clouds form when it goes up into the sky When the amount of water vapor increases, it rains down from the clouds",553,,,,,,,,,
554,554,The water evaporated,554,,,,,,,,,
555,555,It's a lump of water,555,,,,,,,,,
556,556,I don't know,556,,,,,,,,,
557,557,Clouds are the concentration of water vapor in the air with foreign matter on a dust lamp,557,,,,,,,,,
558,558,I don't know.,558,,,,,,,,,
559,559,"Water evaporated from the sea or river condenses in a high sky to form small droplets, and it is a cloud.",559,,,,,,,,,
560,560,"When water evaporates and rises, it freezes to form clouds.",560,,,,,,,,,
561,561,This is because water vapor evaporated from the sea or a place with a lot of water gathers and condenses.,561,,,,,,,,,
562,562,"The reason is that water on the ground, such as the sea and lakes, turns into water vapor, and water vapor gathers from the sky to form clouds.",562,,,,,,,,,
563,563,I don't know,563,,,,,,,,,
564,564,The underwater planes gather together to form clouds,564,,,,,,,,,
565,565,I don't know,565,,,,,,,,,
566,566,Because the rain evaporated.,566,,,,,,,,,
567,567,"As water evaporates, lumps form as it evaporates, which is a cloud. When the cloud becomes heavy, it falls to the ground and drops water. This is the rain.",567,,,,,,,,,
568,568,I don't know,568,,,,,,,,,
569,569,It's raining because of the clouds,569,,,,,,,,,
570,570,Because the underwater plane turns into a cloud,570,,,,,,,,,
571,571,Dust builds up in the air,571,,,,,,,,,
572,572,Oxygen is clumped together,572,,,,,,,,,
573,573,The steam rises to cloud.,573,,,,,,,,,
574,574,The moisture in the air goes up and clumps up,574,,,,,,,,,
575,575,God made it for me,575,,,,,,,,,
576,576,"This is because as water evaporates, it becomes a cloud when the water vapor rises high",576,,,,,,,,,
577,577,The water in the sea evaporates due to the heat of the sun and the net rises and gathers,577,,,,,,,,,
578,578,The moisture on the ground turns into steam and goes up to the sky to form clouds,578,,,,,,,,,
579,579,I don't know the answer because I don't know science well,579,,,,,,,,,
580,580,Let's clear up the mole.,580,,,,,,,,,
581,581,"When the water on the ground evaporates, water vapor comes out, because the water vapor rises into the sky and clumps together.",581,,,,,,,,,
582,582,This is because the underwater plane goes up and clumps up.,582,,,,,,,,,
583,583,Clouds are made of water droplets and dew.,583,,,,,,,,,
584,584,Oxygen is clumped together,584,,,,,,,,,
585,585,I'm turning it off,585,,,,,,,,,
586,586,Clouds are cotton candy!,586,,,,,,,,,
587,587,The sea evaporates and becomes a cloud,587,,,,,,,,,
588,588,Clouds are formed by water vapor rising up,588,,,,,,,,,
589,589,Water in rivers and oceans evaporates,589,,,,,,,,,
590,590,Because the water evaporates,590,,,,,,,,,
591,591,I don't understand.,591,,,,,,,,,
592,592,"Too much moisture evaporates to form clouds. When it gets heavy, it rains",592,,,,,,,,,
593,593,The moisture in the air is made by clumping togetherIt is caused by evaporation of water from the ground and water from the sea.,593,,,,,,,,,
594,594,Water vapor evaporated from the sea gathers to form a cloud.,594,,,,,,,,,
595,595,Because of the circulation,595,,,,,,,,,
596,596,"Because of the circulation, the clouds became rain",596,,,,,,,,,
597,597,Clouds are made of water droplets and gases,597,,,,,,,,,
598,598,"""As the water circulates, it is made into clouds to rain",598,,,,,,,,,
599,599,"""",599,,,,,,,,,
600,600,It's because of the steam,600,,,,,,,,,
601,601,It's because there's a lot of water vapor floating in the sky,601,,,,,,,,,
602,602,Clouds are formed by a collection of tiny droplets under low pressure,602,,,,,,,,,
603,603,"Human water can be solid, liquid, or gas, of which gas is made into clouds.",603,,,,,,,,,
604,604,It is because a lot of seawater evaporates when the sun shines.,604,,,,,,,,,
605,605,"""",605,,,,,,,,,
606,606,Clouds appear when cold and warm temperatures meet or when the surface is heated unevenly.   It depends on the movement of the wind.,606,,,,,,,,,
607,607,be caused by climate change,607,,,,,,,,,
608,608,"When the ground gets warmer, the air in the atmosphere gets colder and colder, and then the water vapor in the gas turns into water droplets and clumps together to form clouds",608,,,,,,,,,
609,609,"Because of the evaporation of water from the sea or river,",609,,,,,,,,,
610,610,The clouds are clear,610,,,,,,,,,
611,611,The steam went up,611,,,,,,,,,
612,612,It's caused by steam rising,612,,,,,,,,,
613,613,There's steam,613,,,,,,,,,
614,614,It's because the steam rises,614,,,,,,,,,
615,615,"Clouds are formed by the collection of water vapor and are made by evaporation of water. In other words, the more evaporation occurs, the more clouds form.",615,,,,,,,,,
616,616,"Clouds are formed by the collection of water vapor and are formed by the double action of water. In other words, when a lot of evaporation occurs, a lot of clouds are formed.",616,,,,,,,,,
617,617,Clouds are formed by the collection of water vapor and are formed by evaporation of water.,617,,,,,,,,,
618,618,"Clouds are formed by water vapor gathering and evaporating. In other words, if there is a lot of evaporation, there is a lot of cloud",618,,,,,,,,,
619,619,Small droplets or ice crystals condensed by insulation expansion of air float in the sky.,619,,,,,,,,,
620,620,"As the air rises, the volume expands, the temperature drops, the dew point reaches, and water vapor forms clouds",620,,,,,,,,,
621,621,"As the air rises and the volume expands, the temperature drops, which leads to the dew point, condensing the water vapor and creating clouds",621,,,,,,,,,
622,622,The steam goes up and clumps up with the other steam,622,,,,,,,,,
623,623,I don't know,623,,,,,,,,,
624,624,The drops of water in the atmosphere gather and cloud over,624,,,,,,,,,
625,625,a rise in water vapor,625,,,,,,,,,
626,626,Yeah.,626,,,,,,,,,
627,627,water vapor,627,,,,,,,,,
628,628,Water vapor condenses in the atmosphere,628,,,,,,,,,
