895,895,Moisture in the atmosphere aggregates due to the supercooling effect and exists as a cloud. This cloud falls in the rain when it is impacted.,,,,,,,,,,
896,896,Clouds are formed by condensation of water vapor from high in the sky when water on the surface evaporates.,,,,,,,,,,
897,897,"Clouds are formed by the vapor evaporated near the surface of the earth, which rises to the sky and the temperature drops to form small droplets, which gather to form clouds.",,,,,,,,,,
898,898,I don't know.,,,,,,,,,,
899,899,"Clouds are when moisture evaporates and rises to a certain height, and moisture becomes a liquid from the water vapor and collects moisture.",,,,,,,,,,
900,900,Water vapor evaporated near the surface rises to the sky and gathers to form a cloud.,,,,,,,,,,
901,901,"Moisture on the ground evaporates and creates clouds, but on cloudy days, a lot of clouds occur because there is a lot of moisture to evaporate.",,,,,,,,,,
902,902,"Water from places like the sea or lake evaporates and rises above the sky in the state of water vapor, and the steam aggregates to form small droplets, and the state in which they are gathered is clouds.",,,,,,,,,,
903,903,Unknowingness,,,,,,,,,,
904,904,The underwater air condenses to form clouds.,,,,,,,,,,
905,905,The underwater air condenses to form clouds.,,,,,,,,,,
906,906,"Clouds are formed by the collection of water droplets in the air. On cloudy days, air flows from high pressure due to the influence of low pressure, which affects making a lot of clouds.",,,,,,,,,,
907,907,Water vapor clumps together to form clouds.,,,,,,,,,,
908,908,"As the heated water vapor rises upward, clouds form when there is more water vapor than the amount that air can accommodate.",,,,,,,,,,
909,909,"At the place where the low pressure occurs, the water vapor rises up by the rising air current and condenses to form clouds.",,,,,,,,,,
910,910,"When a low pressure occurs, the water vapor rises up by the rising airflow and condenses the water vapor by the condensation nucleus, creating clouds.",,,,,,,,,,
911,911,Unknowingness,,,,,,,,,,
912,912,"Clouds occur a lot when air gathers around the center of the low pressure, but on cloudy days, there are many clouds because of the low pressure.",,,,,,,,,,
913,913,"As the air rises, the air pressure decreases, increasing the volume and lowering the temperature, which is called adiabatic expansion. When the temperature decreases to below the dew point due to insulation expansion, water vapor gathers around dust in the atmosphere and clouds are formed.",,,,,,,,,,
914,914,Unknowingness,,,,,,,,,,
915,915,"As the temperature of the ground changes, the gas temperature difference occurs, and the air relatively warmer than the surrounding area rises, resulting in insulation expansion and condensation point as the volume increases in the upper layer, which is low pressure, due to lack of air. Then you have clouds that are in the state of water droplets.",,,,,,,,,,
916,916,I don't know,,,,,,,,,,
917,917,Unknowingness,,,,,,,,,,
918,918,Air rise ??Insulation expansion ??Temperature drop ??Dew point reached ??Water vapor condensation ??Cloud generation,,,,,,,,,,
919,919,Clouds are formed when water vaporizes and rises to the sky in the form of water vapor.,,,,,,,,,,
920,920,Water vapor evaporated by solar radiation becomes water droplets when it meets cold air while rising. It is the cloud that the droplets produced in this way form a group.,,,,,,,,,,
921,921,"The gaseous state of the water vapor water rises up because it is lighter than other atmospheric gases and pulls each other. (molecular structure) And light enters the pooled water vapor, scattering, or blocking it to make it look white or black.",,,,,,,,,,
922,922,"When the moisture on the surface evaporates, it rises to the sky. Then, when the temperature decreases, they clump together, which is a cloud.",,,,,,,,,,
923,923,Unknowingness,,,,,,,,,,
924,924,Isn't a cloud formed by the collection of water vapor? I don't know.,,,,,,,,,,
925,925,Moisture condenses like dust in the air,,,,,,,,,,
926,926,Unknowingness,,,,,,,,,,
927,927,"Clouds are centered on low pressure, and if there is a high pressure around them, water vapor gathers at a relative low pressure position and clouds are generated.",,,,,,,,,,
928,928,Water on the ground evaporates and rises into the atmosphere in the form of water vapor. It's a cloud that's made of water vapor clumped together.,,,,,,,,,,
929,929,"As the steam rises, it condenses and forms clouds",,,,,,,,,,
930,930,Evaluation Only. Created with Aspose.Cells for Python via Java.Copyright 2003 - 2022 Aspose Pty Ltd.,,,,,,,,,,
