327,"It works in the kidneys, but if you don't work, it doesn't work out",0,0,0,0
328,It filters out the wastes.,0,0,1,0
329,It allows you to filter out impurities and release them out of your body.,0,0,0,0
330,There is diabetes in which glucose is excreted in urine due to impaired absorption function of glucose.,0,0,0,0
331,environmental pollution,0,0,0,0
332,I need to dialysis,0,0,0,0
333,It filters out the wastes. kidney disease,0,0,1,0
334,It filters out no-feather water,0,0,0,0
335,"The kidney is responsible for separating waste and nutrients from the body, but it causes disease due to poor separation",0,0,1,0
336,"""If the kidneys filter out the ingredients that we need and don't need, we send them back to the body, and we filter out the things that we don't need, and if there's something wrong with this kidney, we're going to",0,0,0,0
337,"the energy the body needsThis is because the ingredients disappear.""",0,0,0,0
338,It gets rid of the waste,0,0,1,0
339,"It helps with excretion in the kidneys, which filters, reabsorbs, and releases the wastes from our capillaries and takes them into our bodies, and throws away the harmful things, such as waste, so it's harmful because they can stay in our bodies if they's not functioning",0,0,1,0
340,"Since the kidney is an organ that removes waste, if a problem occurs, waste cannot be removed from the body, resulting in disease or even death.",0,0,1,0
341,filter out waste matter,0,0,1,0
342,It filters out the wastes. kidney disease,0,0,1,0
343,I don't know,0,0,0,0
344,I don't know.,0,0,0,0
345,.,0,0,0,0
346,Beans and red beans are nutritious (Laughing),0,0,0,0
347,a function of collecting debris from the body and sending it out to pee,1,0,0,0
348,The role is to remove nutrients from the urine and transfer the wastes to the bladder,0,0,1,0
349,I don't know.,0,0,0,0
350,"""Yes",0,0,0,0
351,I don't know,0,0,0,0
352,Yes,0,0,0,0
353,"ㅈ""""",0,0,0,0
354,This is because blood becomes strange when there is an abnormality in the kidney.,0,0,0,0
355,"""The role of releasing substances that are not good for the kidneys and absorbing nutrients that are good for the body",0,0,0,0
356,"If the kidney is not functioning well, toxins can accumulate in the body, resulting in various diseases.""",0,0,0,0
357,I can't get my pee out.,1,0,0,0
358,I can't get my pee out.,1,0,0,0
359,It filters out the waste that's accumulated in your body,0,0,1,0
360,Because we can't poo and we have intestinal problems,0,0,0,0
361,"Since the kidney is in charge of urine, urine does not come out well or urine problems occur.",0,0,0,0
362,I have no idea.,0,0,0,0
363,be unable to decipher the poison,0,0,0,0
364,an organ that produces and discharges urine,0,0,0,0
365,Kidney eliminates waste,0,0,1,0
366,I don't know,0,0,0,0
367,The kidneys filter out blood waste.,0,0,1,0
368,"The kidneys play a role in filtering out waste from our bodies, because if we can't filter it out, this waste travels around the body.",0,0,1,0
369,get bladder inflammation filter out waste matter,0,0,1,0
370,It purifies toxins in the body.,0,0,0,0
371,It filters out the wastes.,0,0,1,0
372,"The kidney plays a role of filtering waste, and when a disease occurs, it cannot play a role properly, causing waste to accumulate in the body, which can lead to death.",0,0,1,0
373,Kidney has its own role. What is not is degenerated and disappeared.,0,0,0,0
374,Let the blood flow.,0,0,0,0
375,Pee,0,0,0,0
376,to die from the accumulation of waste in one's body,0,0,1,0
377,I don't know,0,0,0,0
378,"The kidneys filter out the nope when we urinate At this time, if the kidney does not function properly, it will cause problems because it cannot filter the waste directly.",0,0,1,0
379,be unable to filter out the waste that flows through one's body,0,0,1,0
380,I need a kidney to live.,0,0,0,0
381,The kidneys release body waste and have a direct effect on the heart.,0,0,1,0
382,to pee waste into the blood,1,0,1,0
383,filter out waste matter,0,0,1,0
384,"The kidneys are all connected, so if there is even one disease, abnormalities occur",0,0,0,0
385,It acts as a filter for waste.,0,0,1,0
386,It acts as a filter for waste.,0,0,1,0
387,"The kidneys play a role in filtering out the wastes in our bodies, but when the kidneys fail, diseases occur in our bodies.",0,0,1,0
388,The kidneys filter out bad substances.,0,0,0,0
389,Kidney boosts our metabolism of matter metabolism,0,0,0,0
390,I don't know,0,0,0,0
391,"In the kidneys, it filters out wastes, but if the kidneys don't function properly, it's bad because they can't filter out bad substances",0,0,1,0
392,M and D,0,0,0,0
393,I don't know,0,0,0,0
394,Urine,0,0,0,0
395,What class is it?ㄱ and ㅈ,0,0,0,0
396,I don't know.,0,0,0,0
397,The kidneys filter out the wastes in our body's blood and make us pee.,1,0,1,0
398,Because blood vessels are connected.,0,0,0,0
399,"The kidneys filter blood, and if there is an abnormality in the kidneys, waste accumulates in the blood and diseases occur in the body.",0,0,1,0
400,"The kidneys are responsible for heat. In other words, if there is a kidney problem, our bodies cannot control heat on their own and can achieve death.",0,0,0,0
401,"The kidneys filter through good and bad things before absorbing nutrients into our bodies. Therefore, it is one of the important kidneys that cannot be found without.",0,0,0,0
402,It functions as a filter for waste,0,0,1,0
403,Kidney is important because it acts as a digestive system in our body,0,0,0,0
404,It filters out waste in the blood and produces urine.,0,0,1,0
405,The kidneys filter out the wastes in our bodies.,0,0,1,0
406,"The kidneys function as dialysis, which is easily said to clear the blood. If the kidney fails to function properly, the body easily gets tired and if artificial dialysis is not performed, it can lead to death.",0,0,0,0
407,It accumulates in the body because it cannot remove waste.,0,0,1,0
408,"Since the kidneys interact with other organs and make urine, wastes accumulate in the body when kidney problems occur.",0,0,1,0
409,"Since wastes in the body are filtered out and made into urine, abnormalities in the kidneys cause diseases.",0,0,1,0
410,"The kidneys circulate throughout the body and filter the whole blood. So, wastes generated there are sent to the bladder, and when wastes remain in the blood or nutrients are discharged together with wastes, problems occur in the body.",0,0,1,0
411,"Since the kidneys play a role in filtering waste from our bodies, if there is an abnormality in the kidneys, they cannot properly filter waste, increasing the risk of getting sick.",0,0,1,0
412,"This is because the kidneys remove unnecessary waste from the body, excrete it, maintain water content or acidity in the body, and work related to various hormones.",0,1,1,0
413,Kidney is kidney and I honestly don't know what it does.,0,0,0,0
414,"In the kidney, impurities such as ammonia, which are mixed with necessary substances such as proteins and minerals in the blood, are selectively filtered and sent to the bladder. When kidney problems occur, impurities cannot be effectively filtered, causing abnormalities in the body and causing various diseases.",0,0,0,0
415,"The kidneys filter out waste. However, if there is a problem with the function of the kidney, it is impossible to filter out the waste. Therefore, waste remaining in the body causes disease.",0,0,1,0
416,"The kidneys play a role in filtering waste products in the blood in our body, and if there is an abnormality in the function of the kidneys, the waste products in the blood cannot be filtered, which adversely affects the body.",0,0,1,0
417,You get diabetes because you can't skip glucose or get reabsorbed in your borman pocket,0,0,0,0
418,"The kidney is one of the excretory organs, and its representative function is to discharge harmful substances such as urea through urine, and if there is an abnormality in the kidney, it is difficult to filter out wastes and requires dialysis.",0,0,1,0
419,"The kidneys play a role in spreading salt evenly through the body. If there is an abnormality in this place, the whole body becomes swollen and blood pressure rises.",0,0,0,0
420,.,0,0,0,0
421,Filtration of waste and urine,0,0,1,0
422,Ankimchi. (Ankimchi in Korean),0,0,0,0
423,It filters out the wastes from the cones,0,0,1,0
424,This is because the kidney is an important organ that discharges waste and plays an important function in which blood pressure is important.,0,0,1,0
425,"The function of the kidneys can be summarized as: first, excretion of metabolites and wastes into urine; second, endocrine function that keeps body water content, electrolytes, and acidity constant within a narrow range; and third, blood pressure maintenance; anemia correction; and endocrine function that produces and activates various hormones",0,1,1,0
426,"The function of the kidney can be summarized as a function of excretion by filtering metabolites and wastes, a function of maintaining biohomogeneity that keeps water content, electrolytes, and acidity in the body constant within a narrow range, and an endocrine function that produces and activates various hormones important for calcium and phosphorus.",0,1,1,0
427,to be unable to release toxins into the body,0,0,0,0
428,It filters out the wastes.,0,0,1,0
429,"The kidney filters out waste and releases urine, and if something goes wrong with it, it cannot release urine and nutrients are released in large quantities.",0,0,1,0
430,It filters out the wastes,0,0,1,0
431,"If something goes wrong with your kidney, you can use it",0,0,0,0
432,"If there's something wrong with the empty red beans, you can use the red beans",0,0,0,0
433,"First, the function of the kidneys is to filter out metabolites and wastes and excrete them into urine",0,0,1,0
434,filter waste from the blood,0,0,1,0
435,It has the function of purifying bad ingredients in our body,0,0,0,0
436,filter out the waste and let it go outside,0,0,1,0
437,"It causes waste in the blood. However, if there is an abnormality in the kidney, it cannot play this role and becomes sick.",0,0,1,0
438,It discharges waste.,0,0,1,0
439,It does not discharge waste.,0,0,1,0
440,Excretory function that excrete metabolites and no-fee substances into urine,0,0,0,0
441,"It is responsible for removing and discharging toxic wastes from the body, but when abnormalities occur, toxic wastes accumulate in the body Therefore, the disease develops",0,0,1,0
442,be an organ that excrete waste,0,0,1,0
443,"There are many kinds of germs, and such children come in and nourish themselves",0,0,0,0
444,Dialysis machines should be used.,0,0,0,0
445,The kidneys change and filter the elements in the urine,0,0,0,0
446,It allows unnecessary waste to escape from the body.,0,0,1,0
447,"As the bottle moves to the side, the bottle becomes bigger",0,0,0,0
448,"Since it plays a role in filtering waste, waste accumulates in the body when abnormalities occur.",0,0,1,0
449,"Since waste is removed and the concentration of body fluid is adjusted, waste cannot be removed without kidneys, and waste accumulates.",0,0,1,0
450,The kidneys filter out waste from the body.,0,0,1,0
451,"If you do something that requires a lot of physical strength, you will",0,0,0,0
452,"It creates urine, wastes build up in the body",0,0,1,0
453,It's because it filters out wastes from the body from the kidneys and acts as excretion,0,0,1,0
454,"The kidneys filter waste, but if you don't do this function, waste accumulates in the body.",0,0,1,0
455,Filter out the no-feet water,0,0,0,0
456,I don't know,0,0,0,0
457,filter out toxins from the body,0,0,0,0
458,Filter out the waste in the blood.,0,0,1,0
459,It filters out the wastes,0,0,1,0
460,It filters out waste and releases it out of the body.,0,0,1,0
461,Diabetes,0,0,0,0
462,an abnormality in one's urine,0,0,0,0
463,Urinary function,0,0,0,0
464,"filter out body wastes and toxins If it's gone, it's almost dead",0,0,1,0
465,"Since water ash absorption occurs in the kidneys, there will always be a problem in controlling sex if water ash absorption is not properly performed.",0,0,0,0
466,detoxification,0,0,0,0
467,The kidneys are expensive,0,0,0,0
468,an important role,0,0,0,0
469,"The kidney is a good organ that filters out the body's waste. If you don't have it, it hurts a lot",0,0,1,0
470,"It filters out waste products in our body through filtration, reabsorption, and secretion in the kidneys, and when abnormalities occur in the kidneys, they are not properly carried out, causing waste products to accumulate and cause diseases.",0,0,1,1
471,Reabsorb essential ingredients such as glucose and filter out residues such as urine.,0,0,0,0
472,I don't know.,0,0,0,0
473,Filtrate our body's no-feathers.,0,0,0,0
474,"When ammonia is extremely high, it is difficult to produce the element. That's why I got sick.",0,0,0,0
475,"It filters out the body's waste, but if it's broken, it can't be filtered, so it builds up in the body, which causes disease",0,0,1,0
476,"In the kidney, it plays a role in filtering ammonia and waste products synthesized as elements in the body.",0,0,1,0
477,It can lead to a disease in which toxins accumulate. It detoxifies and benefits the body.,0,0,0,0
478,"Since waste is discharged and necessary substances are reabsorbed again, if it is not done smoothly, various nutrients may be insufficient and diseases may occur.",0,0,1,0
479,It's responsible for filtering out the wastes in our bodies,0,0,1,0
480,"In the kidney, it functions to remove waste from our body, but if the kidney has an abnormality in function, it cannot remove waste, which accumulates waste in the blood vessels and hurts a lot.",0,0,1,0
481,It helps you digest smoothly.,0,0,0,0
482,It releases waste from our bodies.,0,0,1,0
483,"The kidney discharges wastes generated from the body and functions as osmotic pressure and pH control in the body. If the kidneys are broken, waste cannot be discharged first, so the whole body swells up and rotten water begins to flow out of the arms and legs over time. Additionally, there is a high risk of complications if kidney disease is solved through surgery.",0,0,1,0
484,"Since our body's waste is filtered out and discharged, problems in the kidneys cause abnormalities in the body.",0,0,1,0
485,"The kidneys function to filter waste in the blood. If the function of filtering out unnecessary substances, or if necessary substances are filtered out of the body and discharged out of the body, hemolytic uremic syndrome, proteinuria, and diabetes occur, respectively. There is a problem in controlling the concentration of substances inside the body.",0,0,1,0
486,I don't understand.,0,0,0,0
487,Red bean paste,0,0,0,0
488,Hmm... Why is that?,0,0,0,0
489,I don't know,0,0,0,0
490,Moreㅑㅓㅑㅐㅐ더,0,0,0,0
491,"It filters out bad substances, dregs, etc. in the body",0,0,0,0
492,a deadly disease,0,0,0,0
493,have a filter,0,0,0,0
494,DiseaseI don't know.,0,0,0,0
495,"It's because I can't excrete... It's the part of removing bad things from my body, but I cry when it's ruined",0,0,0,0
496,It releases the poison in our bodies.,0,0,0,0
497,I don't know,0,0,0,0
498,It breaks down toxins in our bodies and releases them.,0,0,0,0
499,It doesn't work to filter out the wastes,0,0,1,0
500,You have to take good care of it,0,0,0,0
501,I don't knowㅕㅕㅕㅕㅕㅕㅕㅕㅕㅕㅕㅕ^^,0,0,0,0
502,I think it'll be good for you,0,0,0,0
503,I don't know about kidney disease.,0,0,0,0
504,It creates something like secretions that allow us to digest.,0,0,0,0
505,"The kidneys are the organs that filter our body's excrement.Therefore, if you don't filter the excrement well, your body will have problems.",0,0,0,0
506,I don't know.,0,0,0,0
507,I don't know,0,0,0,0
508,excretion of waste,0,0,1,0
509,It is used to digest and dispose of the wastes smoothly.,0,0,1,0
510,The function of the kidneys is to filter out metabolites and wastes and excrete themselves,0,0,1,0
511,Waste detection,0,0,0,0
512,It purifies the blood in the body.,0,0,0,0
513,"The function of the kidney can be summarized as a function of excretion by filtering metabolites and wastes, a function of maintaining biohomogeneity that keeps water content, electrolytes, and acidity in the body constant within a narrow range, and an endocrine function that produces and activates various hormones important for calcium and phosphorus.",0,1,1,0
514,"The function of the kidneys can be summarized as: first, excretion of metabolites and wastes into urine; second, endocrine function that keeps body water content, electrolytes, and acidity constant within a narrow range; and third, blood pressure maintenance; anemia correction; and endocrine function that produces and activates various hormones",0,1,1,0
515,The kidneys filter out waste from our bodies.,0,0,1,0
516,.,0,0,0,0
517,It arrests waste and turns dirty blood into clean blood.,0,0,1,0
518,.,0,0,0,0
519,We may die from physical problems as we pile up old plaques on our bodies,0,0,0,0
520,"There are two kidneys each in the human body, and if there is an abnormality in two kidneys, a person dies.",0,0,0,0
521,Diseases occur because the kidneys filter out wastes from our bodies and discharge them.,0,0,1,0
522,You'll get sick,0,0,0,0
523,It is not possible to discharge excrement.,0,0,0,0
524,"As waste accumulates in every corner of our body, it can cause abnormalities in our body and die. In other words, kidneys are a place where waste is treated in our bodies.",0,0,1,0
525,I don't remember.,0,0,0,0
526,"The kidneys are at a disadvantage in the body and let out toxins into the urine. However, without a kidney, toxins are not at a disadvantage, so they can reach death.",0,0,0,0
527,I don't know,0,0,0,0
528,"The kidney is an organ that makes urine, and in other words, it is an organ that collects and discharges waste. However, if this kidney is damaged, the waste will not be released properly, which can lead to abnormalities in the body",0,0,1,0
529,I can't remember.,0,0,0,0
530,The disease is not like this,0,0,0,0
531,It keeps the urine,0,0,0,0
532,He's running hard,0,0,0,0
533,an important role,0,0,0,0
534,The lungs let you breathe and the heart keeps you alive,0,0,0,0
535,"You may have a disease in another person, or you may have a disease because you just don't have immunity.",0,0,0,0
536,"As you eat fast food, oil builds up in your kidneys",0,0,0,0
537,pee in one´s pants,1,0,0,0
538,be blind to the west,0,0,0,0
539,collecting and sending urine down,0,0,0,0
540,I don't know,0,0,0,0
541,I don't know,0,0,0,0
542,I don't know.,0,0,0,0
543,My kidneys are moving,0,0,0,0
544,"If there is an abnormality in the kidney, bubbles appear in the urine, so I think it has a function that makes things like urine come out well.",0,0,0,0
545,"The kidneys can manipulate our nerves, create or manipulate our heart's speed, and the air we breathe, but if any of them goes wrong, of course it's natural that the body will have problems",1,0,0,0
546,I don't know.,0,0,0,0
547,"Wow, it's really hard",0,0,0,0
548,I don't know much about the human body. Let's move on,0,0,0,0
549,"In the kidney, waste in the blood is selected and sent to the bladder to discharge it into a liquid, and if the kidney does not do so, waste accumulates in the blood and eventually dies due to blood pain.",0,0,1,0
550,The kidneys change into urine by choosing strange substances or scraps.,0,0,0,0
551,I don't know.,0,0,0,0
552,I don't know,0,0,0,0
553,"Perhaps the kidneys are filtering out urine, so if there is a problem, diabetes.",0,0,0,0
554,I don't know,0,0,0,0
555,"As wastes in the body are not filtered out, toxins accumulate in the body, and abnormalities occur in the body, leading to death.",0,0,1,0
556,I'm going to pee?,1,0,0,0
557,It filters out the waste in the blood.,0,0,1,0
558,"Because it filters out blood waste, toxins accumulate in the body and die when there is a problem.",0,0,1,0
559,"In the kidneys, it filters out waste from our bodies. If the kidneys that play this role are destroyed, the body cannot properly filter and detoxify wastes, and the body accumulates wastes, causing disease.",0,0,1,0
560,He's a warrior.,0,0,0,0
561,The blood is filtered to excrete the final product of body metabolism in the form of urine and to control the concentration of the electrolyte.,0,0,0,0
562,Excretion,0,0,0,0
563,Our body generates waste in the process of making and using energy necessary for the body by utilizing nutrients. The kidneys filter out waste carried through the blood to make urine.,0,0,1,0
564,I don't know ........................,0,0,0,0
565,Cigarettes cause kidney damage,0,0,0,0
566,"We use nutrients to make and use energy, such as cellular respiration, and waste is generated in this process. The presence of this waste in the body is harmful to our body. These wastes are excreted as urine, which is created in the kidneys. Therefore, abnormalities in the kidneys can occur.",0,0,1,0
567,"Filter out impurities. If there is an abnormality in the kidney, it cannot filter out impurities, which causes abnormalities in the body.",0,0,0,0
568,Filter out the necessary parts of the urine and remove the urine,0,0,0,0
569,"""Because kidneys filter impurities on the body, the body's immune system is reduced without kidneys.k.a. kidney.",0,0,0,0
570,"""",0,0,0,0
571,"The kidneys filter waste in our blood. Therefore, kidney problems can lead to various diseases related to waste.",0,0,1,0
572,"Since we discharge waste from our bodies through the kidneys, it is difficult to discharge waste if there is a problem with the kidneys.",0,0,1,0
573,Kidney is an important role,0,0,0,0
574,"The kidneys... well, they do something very important, so... I'm in the kidney. It looks like, hmm...",0,0,0,0
575,"The kidney plays an important role, and if the kidney has a problem, it becomes unhealthy and if it is severe, it becomes Samam.",0,0,0,0
576,"Our body generates waste in the process of making and using energy necessary for the body by utilizing nutrients. It is harmful if waste remains in our bodies. The kidneys filter out waste carried through the blood to make urine. Blood is sent back into the body, and urine is released out of the body through the bladder. The process of releasing waste from the blood out of the body is called excretion, and kidneys are involved in excretion",0,0,1,0
577,"It produces urine, releases toxins, and filters out wastes.It also balances the acid and alkali of the body fluid, helps absorb potassium, and controls pressure and red blood cell levels.",0,0,1,0
578,It filters out waste through the blood to make urine. It also filters out waste and keeps the blood clean.,0,0,1,0
579,It filters out waste through the blood to make urine.,0,0,1,0
580,"The kidneys are responsible for removing waste from the blood. Therefore, if a kidney problem occurs, it is not possible to remove waste from the blood, which can lead to diabetes or high blood pressure.",0,0,1,0
581,"The kidneys function to discharge no-femul, but if the kidneys do not function, various toxins in nofemul harm the body and accordingly get sick.",0,0,0,0
582,r,0,0,0,0
583,"The kidneys filter out the waste carried through the blood and release the urine into the bladder, and the clean blood with the waste filtered out becomes active in our body again.",0,0,1,0
584,The kidney stores toxin elements and releases them out of the body with moisture through the urethra.,0,0,0,0
585,It filters out the wastes.,0,0,1,0
586,I don't know,0,0,0,0
587,"If the kidneys can't work, they can't throw away the waste in the body, so the dead blood keeps going around, and our bodies get sick and die",0,0,1,0
588,I don't know...,0,0,0,0
589,discharge of waste,0,0,1,0
590,I couldn't filter out the no-fefe water.,0,0,0,0
591,"It is to urinate what the kidney does, but if you have a kidney problem, you cannot pee.",1,0,0,0
592,"First, the function of the kidneys is to filter out metabolites and wastes and excrete them into the urine",0,0,1,0
593,"""In chronic kidney disease, kidney function gradually decreases over months or years. In the early stages, most patients' bodies compensate or adapt to metabolic abnormalities, so they are relatively asymptomatic. However, symptoms of uremia or water retention begin to develop when kidney function is severely degraded.What are the symptoms of chronic kidney disease?",0,0,0,0
594,Symptoms of chronic kidney disease vary depending on the degree of kidney damage. Chronic kidney disease is divided into five stages according to kidney function and glomerular filtration rate (GFR). The glomerular filtration rate can be calculated with serum creatinine and must normally exceed 90 mL/min.,0,0,0,0
595,,0,0,0,0
596,Stage 1 of chronic kidney disease (90-100% kidney function,0,0,0,0
597,"Stage 1 Chronic kidney disease refers to cases where glomerular filtration rates are 90 mL/min/1.73 m2 or higher, but only tests such as proteinuria are accompanied; structural damage to the kidneys in X-rays, ultrasound, MRI or CT; or family history of polycystic kidney disease. There are no symptoms you feel at this stage.",0,0,0,0
598,,0,0,0,0
599,Chronic kidney disease stage 2 (60-89% kidney function),0,0,0,0
600,"In stage 2 chronic kidney disease or mild chronic kidney disease, the glomerular filtration rate is 60-89 mL/min/1.73 m2. There are usually no symptoms at this stage, but some patients urinate frequently at night, have high blood pressure, normal or small increases in serum creatinine, or have abnormal urine tests.""",0,0,0,0
601,"Since the kidneys filter out waste in the blood, if there is a problem with function, they cannot filter out waste and get sick.",0,0,1,0
602,I don't know.,0,0,0,0
603,I don't know,0,0,0,0
604,We collect the leftover from our bodies and release them,0,0,0,0
605,It filters out the waste from the blood,0,0,1,0
606,An abnormality in the kidneys is very dangerous because they cannot be discharged or the debris can remain in the body.,0,0,0,0
607,I don't know.,0,0,0,0
