,"20. Abnormal kidney function can lead to various diseases and, in severe cases, death. What does the kidney do in our body, so if something goes wrong, will it cause disease? Let's explain it in detail using knowledge of kidney function. ",pee,hormone,waste,reabsorption
0,Moon Byul,0,0,0,0
1,It's hard to get rid of toxins,0,0,0,0
2,I get sick because I can't filter out the wastes well,0,0,1,0
3,It filters out the wastes from New Year's Eve,0,0,1,0
4,"Kidney filters out the waste, and if it doesn't work, it can lead to death by wrapping upholstery",0,0,1,0
5,The kidneys filter out waste.,0,0,1,0
6,I don't know,0,0,0,0
7,I'll let you live,0,0,0,0
8,get rid of waste,0,0,1,0
9,It filters out the wastes,0,0,1,0
10,The kidney is responsible for filtering out wastes and elements in the body.,0,0,1,0
11,It's where the kidneys filter out the wastes,0,0,1,0
12,"Wastes (ammonia, elements, and excess water in the body that occurs when cells breathe with proteins) cannot be released.",0,0,0,0
13,"Filtration, absorption, re-secretion and urine.",0,0,0,0
14,"""Excuse""",0,0,0,0
15,"The waste in the house is piled up, and the amount of water is out of control.""",0,0,1,0
16,the act of filtering out wastes,0,0,1,0
17,I don't know,0,0,0,0
18,I don't know.,0,0,0,0
19,I don't know,0,0,0,0
20,Kidneys are vital organs for our bodies,0,0,0,0
21,I work on urine.,0,0,0,0
22,This is because the kidneys play a role in filtering out waste.,0,0,1,0
23,This is because the kidneys play a role in filtering out waste.,0,0,1,0
24,Kidneys help people live.,0,0,0,0
25,It filters out the wastes.,0,0,1,0
26,It detoxifies the bad components of the body.,0,0,0,0
27,Urinary stones occur because of poor urine,0,0,0,0
28,a place for waste discharge,0,0,1,0
29,"Glucose, amino acids cannot be reabsorbed",0,0,0,0
30,"I don't know exactly, but I know it's a body purification.",0,0,0,0
31,It secretes hormones and produces waste.,0,1,1,0
32,"The kidney reabsorbs sodium components and water by various hormones, and if there is an abnormality in the kidney, the body cannot perform these activities, causing problems.",0,1,0,0
33,Unbelievable,0,0,0,0
34,"Hormones are released, wastes are discharged abnormally",0,0,1,0
35,This is because the kidneys play an important role in our bodies.,0,0,0,0
36,The kidneys are essential because they filter out the wastes in our bodies,0,0,1,0
37,I can't pee,1,0,0,0
38,"If there is something wrong with the kidneys, it causes problems in the excretory system and affects our entire body",0,0,0,0
39,"The kidneys are the digestive system and are responsible for various aspects such as the breakdown of nutrients in the body, and when abnormalities occur, problems such as nutrient deficiency in the body occur.",0,0,0,0
40,"The kidneys are responsible for our excretion, so there will be abnormal excretion.",0,0,0,0
41,The excretory organ discharges wastes out of the body.,0,0,1,0
42,The kidneys are responsible for filtering out urine.,0,0,0,0
43,The filtration will be eliminated and waste will not escape into the blood.,0,0,1,0
44,It will not allow waste to be removed. That's why there's something wrong with the body.,0,0,1,0
45,It releases wastes,0,0,1,0
46,It releases wastes.,0,0,1,0
47,The kidneys are responsible for filtering out wastes from our bodies.,0,0,1,0
48,Kidneys are kidneys and work related to urine.,0,0,0,0
49,"It plays a role in allowing waste and substances that the body does not need to be discharged from the body, and if this function is abnormal, it causes diseases because it cannot properly discharge waste.",0,0,1,0
50,"The kidneys filter waste from blood vessels and reabsorb essential ingredients in our bodies, such as amino acids and glucose. Diabetes and proteinuria can occur when kidney problems occur, and amino acids and glucose are released through urine.",0,0,1,0
51,It excrete wastes from the body.,0,0,1,0
52,"If my kidneys, which filter wastes from the blood, fail to function, the release of wastes is not smooth, causing diseases.",0,0,1,0
53,I couldn't pee,1,0,0,0
54,"This is because it plays a role in filtering out waste, so if there is an abnormality in the kidneys, waste accumulates in the body, causing an abnormality",0,0,1,0
55,"The kidneys filter out the elements in our bodies from the blood and release them out of our bodies However, if it does not work properly, it does not remove the elements in the body properly, which causes problems in the body.",0,0,0,0
56,I don't know,0,0,0,0
57,"Since the kidney is an organ that discharges waste accumulated in our body through digestion and circulation, various diseases can appear in the body if kidney abnormalities occur.",0,0,1,0
58,a buildup of waste in the body,0,0,1,0
59,"The kidneys can absorb water to control osmotic pressure, and they can filter out carbohydrates or proteins needed in our bodies. Therefore, abnormal kidneys can cause abnormalities in the body.",0,0,0,0
60,I don't know.,0,0,0,0
61,I don't know,0,0,0,0
62,I don't know,0,0,0,0
63,"Yes, yes",0,0,0,0
64,I don't know.,0,0,0,0
65,I don't know.,0,0,0,0
66,.....................................,0,0,0,0
67,I don't know,0,0,0,0
68,I don't know,0,0,0,0
69,I don't know,0,0,0,0
70,purify the blood,0,0,0,0
71,in a roundabout way,0,0,0,0
72,I don't know the human body :>,0,0,0,0
73,a dying disease,0,0,0,0
74,"Our organs prevent harmful cells from entering our bodies, and if something goes wrong with our organs, we cannot filter out all harmful cells, and some enter our bodies and reproduce, causing disease",0,0,0,0
75,66 88 - 혀ㅜTongue66 ㅑ,0,0,0,0
76,Disease 1 diabetes 2 peam 3 drugs,0,0,0,0
77,The kidneys let the bad ingredients out of the pee and poop.,1,0,0,0
78,We collect toxic or unhealthy things in our kidneys,0,0,0,0
79,"When you eat food and dispose of scraps,",0,0,0,0
80,"The kidneys filter out the waste accumulated in our body's blood. If there is an abnormality in the kidney, it cannot filter out the waste in the blood, which increases the risk of getting sick.",0,0,1,0
81,The kidneys filter out waste because they don't know that.,0,0,1,0
82,"The kidneys play a role in discharging waste from the human body, and if something goes wrong, it is impossible to discharge waste, which poses a health risk.",0,0,1,0
83,This is because kidneys manage waste from our bodies and turn dirty blood into clean blood.,0,0,1,0
84,The kidneys cleanse the blood of our bodies,0,0,0,0
85,It's because it causes disease,0,0,0,0
86,"FG/LK;FD,GL,GL;",0,0,0,0
87,The kidneys filter out toxins and bad substances in our blood.,0,0,0,0
88,I do not remember.,0,0,0,0
89,There's a foreign substance stuck in the bean pop,0,0,0,0
90,I don't know exactly. I don't think I can pee well,1,0,0,0
91,"Since wastes accumulated in our bodies are sent outside with urine, if this function is abnormal, nasal wastes accumulate in our bodies, causing problems in most of our bodies.",0,0,1,0
92,The kidney is responsible for filtering out bad substances in our bodies.,0,0,0,0
93,An abnormality in the kidney causes indigestion,0,0,0,0
94,I don't know.,0,0,0,0
95,filter out the no-fee water in the blood,0,0,0,0
96,"No-fe water filter. If you don't, it will pile up, so your face will look bad, and you will have a rock engraved inside",0,0,0,0
97,I don't know,0,0,0,0
98,"To purify the poison? (I don't know)Blood takes oxygen and sends the remaining residue to the kidneys to discharge it, but it fails to discharge the residue and is wrapped in the body, causing a disease.",0,0,0,0
99,"There are two kidneys, so even if there is something wrong with one, you can take it out from the kidneys, but there is only one heart, lungs, intestines, etc., so you can die because there is a risk to the kidneys.",0,0,0,0
100,"The kidneys play a role in converting dirty blood, that is, blood accumulated with waste, into clean blood.It serves to filter waste from the blood.Therefore, if there is an abnormality in this, the blood vessels may be blocked and collapse because waste is not filtered from accumulating in the blood.",0,0,1,0
101,"The kidneys do the job of filtering blood clean. Therefore, if there is an abnormality in the kidney, blood is not clean and waste accumulates, resulting in diabetes.",0,0,1,0
102,"""The kidneys cleanse our body's waste, and they cleanse it",0,0,1,0
103,"Diabetes occurs if the kidneys are not properly filtered out.""",0,0,0,0
104,"""Because the kidneys work to get rid of wastes,",0,0,1,0
105,"If the kidneys don't get rid of the waste, it's going to build up in your body",0,0,1,0
106,"It causes a disease.""",0,0,0,0
107,A person's body can be destroyed at any time So it can cause abnormalities,0,0,0,0
108,It makes me live,0,0,0,0
109,Makes our pee.,1,0,0,0
110,You have to keep your blood clean,0,0,0,0
111,The function of the kidneys is necessary to deliver nutrients from our bodies and to filter out the residue to make urine,0,0,0,0
112,"The kidneys filter out waste carried through the blood and make urine. Blood from which waste has been removed is sent back into the body, and urine is released out of the body through the bladder. The process of releasing waste products from the blood out of the body is called excretion, and kidneys are involved in excretion. It filters out waste from the body and sends it outside to keep the blood clean.",0,0,1,0
113,"If there's something wrong with the kidneys that filters out the nope and releases it out of the body through urine, the wastes will build up in our bodies and cause disease",0,0,1,0
114,"When I eat food, I digest and come out as poop.",0,0,0,0
115,filter out the waste and keep the blood clean,0,0,1,0
116,The body generates waste in the process of making and using energy necessary for the body by utilizing nutrients. It is harmful if waste remains in our bodies. The process of releasing waste from the blood out of the body is called excretion. It filters out waste from the body and sends it outside to keep the blood clean.This allows us to live a healthy life.,0,0,1,0
117,"Kidneys purify the blood, but if the kidney gets worse, it becomes a disease because the blood is not purified well and is not purified",0,0,0,0
118,"The kidneys filter out waste carried through the blood to make urine. Blood from which waste has been removed is sent back into the body, and urine is released out of the body through the bladder. In this way, waste from the body is filtered out and sent to the outside to keep the blood clean.",0,0,1,0
119,M and D,0,0,0,0
120,I don't understand.,0,0,0,0
121,"If there is no function in the kidney, the body's function is lost, so there is a problem.",0,0,0,0
122,Because it keeps us from getting sick?,0,0,0,0
123,I don't understand.,0,0,0,0
124,The kidneys filter out the waste from our dreams,0,0,1,0
125,I don't know,0,0,0,0
126,Blood gets dirty because it cannot filter out foreign substances in the blood,0,0,0,0
127,I don't know.,0,0,0,0
128,I don't know. I don't know,0,0,0,0
129,I don't know,0,0,0,0
130,"Kidney. So, what do we do in our bodies? I need to find out",0,0,0,0
131,You have to trust the doctor,0,0,0,0
132,"Because kidneys filter out blood that is bad for our body, our body can live healthy, but if we don't have kidneys, harmful substances accumulate.",0,0,0,0
133,I don't know,0,0,0,0
134,I don't know.,0,0,0,0
135,Cancer develops,0,0,0,0
136,Cigarettes or non-smokers develop diseases,0,0,0,0
137,I don't know.,0,0,0,0
138,Kidney is important to our body,0,0,0,0
139,The kidneys have the function of separating the scraps in our bodies,0,0,0,0
140,"When we eat and live in our lives, we filter out bad substances such as instant and harmful substances.",0,0,0,0
141,Kongji and Patji,0,0,0,0
142,"Urine is the place where it is made, and if there is an abnormality, it cannot discharge waste and causes an abnormality",0,0,1,0
143,It covers up the excrement,0,0,0,0
144,You get sick because we don't do hygiene thoroughly,0,0,0,0
145,Because all the elements in the body are important.,0,0,0,0
146,I'm going to take out the pee out,1,0,0,0
147,"When you eat the wrong food,",0,0,0,0
148,It's dangerous to have kidney problems because it filters out wastes,0,0,1,0
149,Kidneys can make us move and grow taller.,0,0,0,0
150,I don't know.,0,0,0,0
151,We haven't been able to filter out the waste that's been created in our bodies,0,0,1,0
152,"If you can't filter out the waste, your stomach will get damaged",0,0,1,0
153,This is because it filters out the body's waste and discharges it into urine.,0,0,1,0
154,My stomach hurts because I can't filter out the no-fefe water in my blood,0,0,0,0
155,"The kidney filters out the body's no-feather, because it becomes unable to function.",0,0,0,0
156,The kidneys take away the old vandalism in the blood,0,0,0,0
157,This is because the kidneys filter out the no-fefe water in the blood.,0,0,0,0
158,I don't know.,0,0,0,0
159,This is because the kidneys play a role in filtering out waste in the blood.,0,0,1,0
160,The kidneys are responsible for filtering out the wastes,0,0,1,0
161,It causes inflammation and damages other organs.,0,0,0,0
162,"If the kidneys have abnormal functions, they may die because they cannot clean the blood, and if they do not have a liver, they cannot break down alcohol.",0,0,0,0
163,I don't know.,0,0,0,0
164,I don't know,0,0,0,0
165,"No Minseung, scissors",0,0,0,0
166,"Yes, kidneys are very important",0,0,0,0
167,Kidney is important,0,0,0,0
168,I don't know.,0,0,0,0
169,It has the function of relieving poison.,0,0,0,0
170,"""Because the kidneys filter waste from the blood circulation, blood that has passed through the kidneys becomes clear, so abnormal kidney conditions can lead to poor health.",0,0,1,0
171,"""",0,0,0,0
172,It removes impurities.,0,0,0,0
173,filter out waste matter,0,0,1,0
174,have a kidney disease,0,0,0,0
175,maintain proper body temperature and blood pressure,0,0,0,0
176,Filtrate waste and make a pee.,1,0,1,0
177,"The kidney is a place to filter waste to the bladder, and if there is a problem with the kidney, the nutrients necessary for the body to go out of the waste through the bladder will also escape.",0,0,1,0
178,It's dangerous if there's something wrong with cleaning up the waste,0,0,1,0
179,I don't know.,0,0,0,0
180,It filters out the wastes in the urine,0,0,1,0
181,Maintain proper body temperature and blood pressure,0,0,0,0
182,I don't know.,0,0,0,0
183,"The kidney filters out the body's waste and reabsorbs nutrients that cannot be absorbed by the body, so when teeth break down, waste accumulates in the body and energy efficiency decreases",0,0,1,0
184,I don't know.,0,0,0,0
185,It filters out the wastes.,0,0,1,0
186,"""It's about taking elements and water out of the blood to make a pee",1,0,0,0
187,"This is because abnormalities in the kidneys cause problems in urine discharge.""",0,0,0,0
188,"Since the kidneys filter out the wastes in our bodies, if the kidneys fail, they can be dangerous due to the accumulation of wastes in the body.",0,0,1,0
189,"The function of the kidney is to filter waste and absorb water, but life will be uncomfortable if this function is lost",0,0,1,0
190,Remove and discharge wastes,0,0,1,0
191,.,0,0,0,0
192,The toxins that are harmful to the body increase and break down every corner of the body.,0,0,0,0
193,"This is because it affects plasma osmotic pressure as a target organ of anti-diuretic hormones, and as a representative excretory organ of our body, it plays a role in releasing unhealthy substances out of the body.",0,1,0,0
194,"The filtration function is not working properly, so the waste in the blood cannot be filtered",0,0,1,0
195,"Since the kidneys filter wastes from our bodies and create urine, wastes accumulate in the body if there is an abnormality in the kidneys.",0,0,1,0
196,"Kidney removes the toxin called urea from our body, but if it can't play a role in kidney, it will die.",0,0,0,0
197,"I don't know.The kidneys are an organ of the excretory system, and the nephrons that make up the kidneys play a role in filtering waste through filtration, reabsorption, and secretion processes. However, if there is an abnormality in the kidney, these excretory activities cannot be carried out properly, resulting in an abnormality in the body.",0,0,1,1
198,"If it is unable to filter out waste from urine and absorb nutrients, the waste is also absorbed into the body, resulting in a disease.",0,0,1,0
199,Filter functionality of filtration,0,0,0,0
200,"Since the kidneys excrete waste products in the blood and maintain water content and acidity in the body, various diseases occur when kidney abnormalities occur.",0,0,1,0
201,...,0,0,0,0
202,I don't know.,0,0,0,0
203,organ trading,0,0,0,0
204,"The kidneys are responsible for metabolizing waste matter and maintaining body balance along with the surrounding ureter, bladder, and urethra. These kidneys not only have the main function of excreting waste, but they also maintain the balance of acid bases and control blood pressure by maintaining the appropriate amount of body fluid with the balance of water and electrolytes.",0,0,1,0
205,Maintaining body fluids and controlling blood pressure,0,0,0,0
206,"Even if you don't have a kidney, you can die if something goes wrong with your body",0,0,0,0
207,"I have two kidneys, so I don't need one",0,0,0,0
208,I know that kidneys do important things for the body,0,0,0,0
209,I don't know.,0,0,0,0
210,The kidneys are responsible for filtering out the wastes in the body,0,0,1,0
211,"In the kidney, it filters out waste from the blood, and if it does not play its role properly, waste accumulates in the blood, resulting in various diseases.",0,0,1,0
212,I don't know what the kidneys are doing.,0,0,0,0
213,It filters out the wastes,0,0,1,0
214,"If there is an abnormality in the kidneys by releasing wastes from the body, they can not be released and die.",0,0,1,0
215,The kidney is responsible for filtering out waste.,0,0,1,0
216,"The kidney collects waste from the body and sends it to the bladder to discharge it. If there is an abnormality in the function of the kidney, it is fatal because the waste remains in the body",0,0,1,0
217,It filters out toxins in the urine,0,0,0,0
218,hormones and excreted wastes,0,1,1,0
219,"The body comes out in the form of urine, such as moisture powder and residue, and the kidney absorbs the energy in the urine.",0,0,0,0
220,The kidneys are responsible for filtering out the waste in our bodies,0,0,1,0
221,The secretions that need to come out of the body don't come out and they're piled up,0,0,0,0
222,The role of filtering out waste from the body,0,0,1,0
223,I don't know,0,0,0,0
224,"The kidneys filter out our body's waste and let us pee. In the event of abnormalities in this kidney, the waste may not be filtered well and the waste may continue to flow through the blood, causing vascular disease",1,0,1,0
225,"We need a kidney to filter out nutrients, so if we have a kidney problem, we can't excrete",0,0,0,0
226,It's the kidneys that release the urine that's supposed to be released from the body,0,0,0,0
227,The kidneys support the role of the heart in our body,0,0,0,0
228,It functions to purify food that enters our body and to urinate the no-fefe water.,0,0,0,0
229,Filter out the no-feet water,0,0,0,0
230,This is because it is properly separated from the kidneys to prevent the body from excreting necessary nutrients or unnecessary nutrients.,0,0,0,0
231,The role of filtering out no-feathers in our bodies,0,0,0,0
232,"The kidney filters out bad things, but if the kidney doesn't work, the bad things enter the body and cause diseases",0,0,0,0
233,"Kidneys are about releasing the right amount of waste, such as our urine and feces, to help us discharge well But if there's something wrong with the kidneys, we're releasing all the nutrients that our bodies need along with urine and feces",0,0,1,0
234,"The kidneys are responsible for metabolizing waste matter and maintaining body balance along with the surrounding ureter, bladder, and urethra. These kidneys not only have the main function of excreting waste, but they also maintain the balance of acid bases and control blood pressure by maintaining the appropriate amount of body fluid with the balance of water and electrolytes.",0,0,1,0
235,"Kidney is responsible for high waste mass production and body balance along with the surrounding ureter, bladder, and urethra",0,0,1,0
236,to do something important,0,0,0,0
237,"We filter out bad diseases in the kidneys, but if something goes wrong, we can't filter out bad diseases.",0,0,0,0
238,"""",0,0,0,0
239,"The kidneys are responsible for metabolizing waste matter and maintaining body balance along with the surrounding ureter, bladder, and urethra. These kidneys not only have the main function of excreting waste, but they also maintain the balance of acid bases and control blood pressure by maintaining the appropriate amount of body fluid with the balance of water and electrolytes.",0,0,1,0
240,"The kidney is an organ with a very important function that allows each part of the body to function properly. In other words, all organs are always indebted to the kidney, so if a disease occurs in the kidney, other organs are also affected.",0,0,0,0
241,"The kidney is an organ with a very important function that allows each part of the body to work properly. In other words, all organs are always indebted to the kidney, so if a disease occurs in the kidney, other organs are also affected.",0,0,0,0
242,"""Because each kidney is important.",0,0,0,0
243,"""",0,0,0,0
244,"In addition to the main function of excreting waste, the kidneys maintain the acid base group, help with water and hematopoietic action, activate vitamin D, etc., and when this function is abnormal, disease occurs",0,0,1,0
245,"In addition to the main functions of excreting waste, the kidneys function in various ways, such as maintaining balance of acid bases, helping water and hematopoietic action, and activating vitamin D.",0,0,1,0
246,"The kidneys not only have a major function of excreting nope, but also have a number of functions, such as balancing acid bases, helping with water and hematopoietic action, and activating vitamin D If this function is abnormal, our bodies will no longer be able to live.",0,0,0,0
247,Displacement function Poor bladder function,0,0,0,0
248,"If these activities are not carried out normally, such as the excretion function of filtering and discharging waste products, the function of maintaining constant water content, electrolyte, and acidity in a narrow range, kidney disease may occur.",0,0,1,0
249,"""It excrete waste and maintains homeostasis in the body",0,0,1,0
250,"""If you have kidney abnormalities, your constancy decreases and you die.""",0,0,0,0
251,Air went into the kidneys,0,0,0,0
252,The element is not removed.,0,0,0,0
253,edwedwedwed,0,0,0,0
254,I don't know.,0,0,0,0
255,M and D,0,0,0,0
256,I don't know,0,0,0,0
257,I don't understand.,0,0,0,0
258,I don't know,0,0,0,0
259,I don't know.,0,0,0,0
260,I don't know.,0,0,0,0
261,I don't understand.,0,0,0,0
262,I don't know,0,0,0,0
263,I don't understand.,0,0,0,0
264,I don't understand.,0,0,0,0
265,I don't know,0,0,0,0
266,Mall,0,0,0,0
267,I don't know.,0,0,0,0
268,I don't know,0,0,0,0
269,Yeah.,0,0,0,0
270,I don't know,0,0,0,0
271,I don't know,0,0,0,0
272,I don't know,0,0,0,0
273,I don't understand.,0,0,0,0
274,I don't know.,0,0,0,0
275,I don't understand.,0,0,0,0
276,Make and drain urine,0,0,0,0
277,I don't know,0,0,0,0
278,"The kidney is an organ that filters out waste from our body Without a kidney, waste accumulates in our bodies and eventually dies.",0,0,1,0
279,I don't know.,0,0,0,0
280,Filtration of contaminants into excreta,0,0,0,0
281,I don't understand.,0,0,0,0
282,I don't know,0,0,0,0
283,?,0,0,0,0
284,M and D,0,0,0,0
285,........,0,0,0,0
286,There are organs in the kidneys,0,0,0,0
287,Because the kidneys filter the blood.,0,0,0,0
288,yes,0,0,0,0
289,"The kidneys play a role in filtering out waste from our bodies, because they cannot filter out waste, and when waste accumulates, diseases occur.",0,0,1,0
290,ㅑㅑ,0,0,0,0
291,It filters out the contaminants,0,0,0,0
292,I don't know.,0,0,0,0
293,Filter out foreign substances in the blood,0,0,0,0
294,Radioactivity k,0,0,0,0
295,infect a person's nails,0,0,0,0
296,I don't knowThe kidneys have the same function of making a pee,1,0,0,0
297,I don't know,0,0,0,0
298,You get sick because you don't function normally,0,0,0,0
299,It filters out waste,0,0,1,0
300,Die.,0,0,0,0
301,Kidneys help us live. Can't be without,0,0,0,0
302,It filters out germs,0,0,0,0
303,Cancer breaks out,0,0,0,0
304,The kidneys are responsible for filtering out wastes in our bodies,0,0,1,0
305,It's dangerous without it,0,0,0,0
306,Filtrate waste and make a pee,1,0,1,0
307,ㄹ휴ㅕ라ㅗㅛㅓㅕㅣ곧ㄹ셔ㅗㄱ두쇼호ㅕ,0,0,0,0
308,catch any disease,0,0,0,0
309,"It's because if there's a problem with the kidneys, the residue gets stuck in the body",0,0,0,0
310,"""The kidneys filter out the body's waste and keep it clean",0,0,1,0
311,"If this function is broken, you have to do dialysis artificially.""",0,0,0,0
312,The kidneys allow me to pee,1,0,0,0
313,"If you don't have it, it'll strain your heart",0,0,0,0
314,What does a kidney do?,0,0,0,0
315,The kidneys play an important role in our bodies.,0,0,0,0
316,It's good for removing germs,0,0,0,0
317,"Kidneys play important roles in our bodies, so it's dangerous to lose one",0,0,0,0
318,The kidney suffers from a disease in which this role cannot be performed in treating body waste.,0,0,1,0
319,It is difficult to play a role in catching waste.,0,0,1,0
320,waste-filtering excretion,0,0,1,0
321,"Helps metabolize waste and maintain body balance, balance acid bases, control body fluids, maintain homeostasis, and help hematopoietic action",0,0,1,0
322,Excretion (filtering waste),0,0,1,0
323,Filtrate the waste and make a pee.,1,0,1,0
324,Remove the waste from the blood.,0,0,1,0
325,Reabsorption,0,0,0,0
326,Excretion-related effects,0,0,0,0
