,1. The sentences below misunderstand the meaning of 'human dignity'. So humans are not the real reason for dignity. So what is the real reason for human dignity?,q56_Features,q56_Unique
670,Every human being is born with dignity.,,
671,Human beings have human dignity since birth.,,
672,"Knowing the importance of life with intelligence,",,
673,ABCDEFG and everyone is dignified from birth.,,
674,"Regardless of gender, race, wealth, age, appearance, power, and educational background, it is dignified in itself.",,
675,This is because humans are dignified beings from the moment they are born.,,
676,It is because of the dignity of man himself.,,
677,This is because it is a warrant of all things and there is a valuable thing called death.,,
678,f,,
679,be dignified by man himself,,
680,be dignified because one was born with life,,
681,Human existence itself is dignified.,,
682,"Born as a human being, he is endowed with dignity.",,
683,Because I'm alive,,
684,Everyone has to be dignified,,
685,Because I'm a person,,
686,Human beings are dignified.,,
687,Because we all have to treat each other as equal creatures in equal positions,,
688,Because dignity is what man thought,,
689,What we all think is the same,,
690,Because I'm a human being.,,
691,Human beings are dignified by themselves,,
692,"Because I'm a human beingHuman beings should be respected because they are human beings. Human rights should be respected because humans have natural human rights from birth like the idea of natural human rights. Rather than being respected for special reasons or conditions, it should be respected as a human being.",,
693,"If someone says that he or she is the only one with dignity or that someone can be ignored for some reason, people will ignore each other and say that they are the only ones with dignity.But human beings are all dignified.This is because all humans have rights from birth.In addition, since no one can infringe on the right, humans recognize each other as dignity, and thereby their dignity is recognized.Therefore, humans cannot be ignored by someone and can be said to be dignified beings who cannot ignore someone.",,
694,"The reason why humans are dignified is that they are worth their existence just because they are humans. Therefore, deformed babies, disabled people, and everyone can be dignified for whatever reason. It can be said that it is really wrong that something is good and that a person who is not superior and lacking compared to others cannot be dignified. Human beings have dignity from the point of birth.",,
695,Humans are dignified because they have innate dignity from their existence.,,
696,Man is dignified just because he was born.,,
697,"If human dignity is human, all human beings are dignified",,
698,Human beings are all human rights and dignity from birth.,,
699,Human beings are all equals.,,
700,And human dignity.,,
701,Anyone deserves respect and the value of their recognized right.,,
702,Man is just because you're a man must be respected.,,
703,Because he is with dignity in itself.,,
704,""" because anyone deserves respect.",,
705,"""",,
706,Human beings are human dignity because it is.,,
707,"Big, mature.",,
708,Every human being is there social dignity must be respected by the very existence.,,
709,Human beings are born in itself deserves respect and humanity was born with.,,
710,Human beings are human dignity.,,
711,Man is on its own existence that must be respected.,,
712,Human beings are born not discriminated against because they have the right to be respected.,,
713,I have one,,
714,Human dignity be if I could find their target.,,
715,Seems to be human ... jomeomseong f.,,
716,"Regardless of gender, race, property, age, appearance, power, or good university, human beings themselves are dignified, regardless of the above because they are guaranteed dignity from birth.",,
717,This is because the concept of human dignity is a concept accumulated by humans.,,
718,Human beings are dignified in their very existence.,,
719,Because I'm a human being,,
720,"Natural human rights, human beings are human beings from birth, so they are dignified.",,
721,It is dignified because it has life.,,
722,Human beings are dignified in their own way.,,
723,Because I'm a human being,,
724,This is because the existence of humans itself gives the meaning of dignity.,,
725,That's what I think,,
726,The existence itself is dignified.,,
727,Human beings think. And it can be said that humans are dignified because they act responsibly for the idea.,,
728,Because they are all the same human beings.,,
729,Human beings are dignified because they are human.,,
730,Because human rights exist,,
731,Human beings are dignified because they are human beings.,,
732,It is because of its uselessness,,
733,Because every human being has the right to dignity,,
734,I think about it myself,,
735,There is no condition for human dignity. Humans are human beings and should be respected.,,
736,This is because humans have signed a social contract under the provision of human rights in order to ensure their own safety.,,
737,It is because the existence of human beings is dignified.,,
738,Because it's human.,,
739,All human beings are dignified because they are human beings.,,
740,be dignified because one is human,,
741,Human beings have special meanings in themselves,,
742,The reason why humans are dignified is not because they are just humans for some reason.,,
743,Because it's human.,,
744,"It's a natural right, so humans are born with dignity.",,
745,be dignified because one is human,,
746,All men are equally dignified.,,
747,Human beings are dignified by themselves.,,
748,"Humans are not dignified for any reason, but dignified in themselves.",,
749,be dignified because of life,,
750,Every human being is dignified for no reason.,,
751,Because humans are precious in themselves.,,
752,Man is an animal of morality and is dignified in its existence.,,
753,"Human dignity should be valued and respected because it is a human being, not judged by conditions and situations. Therefore, the real reason why humans are dignified is because they are humans.",,
754,be dignified because one is human,,
755,Human beings are dignified by themselves because they are human. It is not about judging dignity and non-dignity by people's personal characteristics.,,
756,"Human beings are not dignified under any conditions, but dignified by their existence alone",,
757,Because I was born,,
758,Human beings are dignified in their very existence.,,
759,This is because he was born under the same sky and had cognitive abilities differentiated from animals.,,
760,Human beings are all equal because they are human. There is no reason to be different.,,
761,Because I'm a human being human,,
762,This is because all of them contain discriminatory words.,,
763,"Because he is a person with a personality, he should be respected even if he is not pretty and handsome.",,
764,Because I was born.,,
765,"From birth, man is born with dignity",,
766,Man is dignified because he has life.,,
767,Because people are equal!,,
768,Human beings survive because they are human,,
769,Every human being is born with dignity.,,
770,Human beings have human dignity since birth.,,
771,"Knowing the importance of life with intelligence,",,
772,ABCDEFG and everyone is dignified from birth.,,
773,"Regardless of gender, race, wealth, age, appearance, power, and educational background, it is dignified in itself.",,
774,This is because humans are dignified beings from the moment they are born.,,
775,It is because of the dignity of man himself.,,
776,This is because it is a warrant of all things and there is a valuable thing called death.,,
777,f,,
778,be dignified by man himself,,
779,be dignified because one was born with life,,
780,Human existence itself is dignified.,,
781,"Born as a human being, he is endowed with dignity.",,
782,Because I'm alive,,
783,Everyone has to be dignified,,
784,Because I'm a person,,
785,Human beings are dignified.,,
786,Because we all have to treat each other as equal creatures in equal positions,,
787,Because dignity is what man thought,,
788,What we all think is the same,,
789,Because I'm a human being.,,
790,Human beings are dignified by themselves,,
791,"Because I'm a human beingIt is to judge humans objectively, and I think that judging humans by their appearance, character, property, and power is an act that ignores human dignity.",,
792,This is because humans are dignified by themselves.,,
793,"Human beings are dignified by themselves, so they cannot weigh dignity with other factors",,
794,This is because one should be respected.,,
795,Because every human being has basic rights,,
796,It is because humans are dignified by themselves.,,
797,Because there is only one person in the world.,,
798,be dignified because one is human,,
799,I don't know.,,
800,"Regardless of age, appearance, academic background, skin color, and property, humans are dignified in themselves.",,
801,Human beings are dignified because they are human beings themselves.,,
802,Because all men are equal,,
803,People's values are different from person to person,,
804,Humans are precious lives,,
805,Human beings are dignified in their own right,,
806,You don't have to distinguish,,
807,Human beings are dignified in themselves,,
808,All,,
809,Human beings are dignified in their own right,,
810,"All living things, including humans, are dignified",,
811,Because they have their own values,,
812,Because humans have dignity in themselves.,,
813,Existence,,
814,"Since existence itself has dignity, it is not a reason to have dignity conditionally.",,
815,"The existence of a human being in itself has human dignity, not related to competence, gender, or race",,
816,There is no reason for human dignity. It's just dignity because it's human.,,
817,Every human being is dignified in its very existence,,
818,Because existence alone is worth it.,,
819,Human beings have dignity in themselves,,
820,"People are valuable in their own way, regardless of gender, race, or property.",,
821,"""There should be no reason for dignity other than being human.",,
822,"Because that's what human dignity is.""",,
823,be dignified because one is human,,
824,Because every human being has the right to be respected,,
825,I don't know,,
826,Because everyone has a right to live.,,
827,Human beings themselves are dignified,,
828,This is because human beings themselves are dignified.,,
829,Because I was born,,
830,Everyone has human dignity,,
831,C,,
832,I don't understand.,,
833,It's because humans were born.,,
834,"""It's better than an animal",,
835,"""",,
836,Your superiors say you're dignified,,
837,This is because humans divide the top and bottom into classes.,,
838,It's because you'really smart,,
839,Because we have dignity as a human beings,,
840,I was born with life,,
841,All men are equal and dignified.,,
842,be dignified because one is human,,
843,"Article 10 of our Constitution stipulates that ""all citizens have dignity and value as humans and have the right to pursue happiness."" This provision is a regulation in which our Constitution proclaims human dignity, and aims to protect it by stipulating human inherent values in the Constitution. The emergence of totalitarianism after World War I ignored human dignity and individual values and committed inhumane treatment such as genocide and forced labor without hesitation. After World War II, each country stipulated human dignity and values in the Constitution, followed by the United Nations Charter, the Universal Declaration of Human Rights, the European Convention on Human Rights, and the United Nations Convention on Human Rights.",,
844,Because I'm breathing,,
845,All men are dignified.,,
846,Because I'm a human being,,
847,"This is because they are all human beings regardless of gender, skin color, appearance, educational background, and age, so they all have the right to be human and have human dignity.",,
848,This is because you can think and record it unlike other living things.,,
849,e,,
850,"All human beings are precious, so they are dignified",,
851,All men are dignified without discrimination,,
852,Human beings are dignified because they exist as creatures.,,
853,"Humans are dignified by themselves regardless of gender, nationality, or race.",,
854,be dignified as a human being,,
855,This is because humans are special in themselves and have different characteristics from each human being.,,
856,"In fact, human beings are not dignified beings. All life is equal and all life is shallow.",,
857,Evaluation Only. Created with Aspose.Cells for Python via Java.Copyright 2003 - 2022 Aspose Pty Ltd.,,
