,1. The sentences below misunderstand the meaning of 'human dignity'. So humans are not the real reason for dignity. So what is the real reason for human dignity?,q56_Features,q56_Unique
390,"Human beings have dignity by themselves. Therefore, with human rights, dignity cannot be violated in any case. If the sentences are correct in the meaning of dignity understood, humans can be dignified only in limited cases, so the rest of us do not have dignity.",,
391,Because I live in this world as a human being.,,
392,"As can be seen in the Constitution and the Universal Declaration of Human Rights, it stipulates that any human being, regardless of educational background, gender, or race, deserves dignity and should be guaranteed.",,
393,"Humans have a dignified value for the reason that any human being, regardless of gender, race, property, age, or appearance, is a human being.",,
394,"This is because humans are just a part of the world and affect many things around them. And because everything is connected like a thread, it is not an exaggeration to say that humans make up this world.",,
395,"Humans have lives that cannot be created even if science develops, and unlike other animals, they have reason, so they are dignified because they have the power to think about society or develop society or science.Because it's all fair.",,
396,Because humans are humans,,
397,be dignified because it is a life,,
398,"Humans have their own shortcomings and strengths, so they are different depending on the individual and everyone is precious",,
399,Because I was born with life.,,
400,It's alive,,
401,"Everyone has their own personality, strengths and weaknesses, and everyone is dignified.",,
402,It's dignity because it's a person.,,
403,Because he's alive,,
404,be dignified as a human being,,
405,Because they have lives and they all have human rights.,,
406,"""Because he has life and deserves respect",,
407,"""",,
408,"Because they're all thoughtful, emotional, and talkative lives",,
409,Human beings themselves are dignified,,
410,"Because you're considerate, respectful, and think?",,
411,It is because humans are precious creatures from heaven and have the ability to do so,,
412,It is wrong to judge a person's dignity on any condition.Because it depends on the person.,,
413,a man of moral high opinion,,
414,It is dignified because it does what it should do as a human being.,,
415,"Human dignity is not classified by human gender, race, power, and wealth.",,
416,"The meaning of human dignity I thought is ordinary to do everything in daily life that talks, eats, and wraps without treating humans.""",,
417,There is a certain possibility in human nature.,,
418,All men are dignified.,,
419,"Human dignity is not based on gender, physical difference, property, age, and power, but every human being has dignity.",,
420,"Humans cannot evaluate the high and low of dignity according to nationality, person, age, appearance, power, and property. Dignity is something that applies equally to everyone.",,
421,Because humans can share thoughts and help others,,
422,These are all visible.,,
423,"For example, ""H"" respects people."""" That's the right answer.""",,
424,be due to one's moral character,,
425,Someone who can think and respect others,,
426,"This is because humans can think with their heads and act at their disposal, not according to instinct.",,
427,Human beings live by doing good things,,
428,Because all human beings are precious.,,
429,"Since humans are worthy and deserve to be respected by themselves from birth,",,
430,It's because I can respect and be considerate of someone,,
431,"Unlike animals, they have thoughts and live according to reason",,
432,This is because humans can think differently from animals and make their own lives.,,
433,It's because it has an ego unlike animals,,
434,"Unlike animals, humans feel precious and think a lot",,
435,"The reason why humans are dignified is that unlike other animals, they have intelligence to think about.",,
436,"You can use tools and have excellent ability to solve problems. It is also because there is a language, so we can have a conversation.",,
437,This is because humans have intelligence that can think differently from other animals and reason that can translate the idea into action.,,
438,The reason why humans are dignified is that they have the intelligence to think differently from other animals and can carry out what they think.,,
439,"Unlike other creatures, humans can use tools and do things that animals cannot do.",,
440,"It is because he knows how to use tools, is more intelligent than other living things, and is more capable of knowing and solving certain problems",,
441,A man who treats people equally is dignified.,,
442,Human beings are precious lives,,
443,"Human beings have emotions, they can do what robots can't do, and they can develop many things",,
444,Man is dignified because he is born as a man,,
445,"""The reason why people are dignified is that unlike animals, they use tools, and animals live instinctively, but people live with their own ideas.",,
446,"""",,
447,Human beings are dignified because they are human,,
448,G,,
449,A man who is a living and driven man is worthy of dignity,,
450,Because I am precious myself.,,
451,It's dignified because there's only one in the world.,,
452,Because we're all the same human beings,,
453,be dignified because one is a person,,
454,Because I can think,,
455,have power and dignity,,
456,We're the same people and we live in the same world,,
457,Because I was born.,,
458,be dignified because one has power,,
459,The reason why humans are so respectful is that they can think,,
460,Each and every one of us is dignified because we have different values,,
461,Because I have power,,
462,"You can think, you can talk, you can talk to other peoples",,
463,That's because humans were born one in 4.5 billion minutes.,,
464,The reason why humans are dignified is that they can think and judge,,
465,"Because humans are all different, they have different values and different thoughts. Therefore, all human beings are dignified.",,
466,be dignified because one is a man,,
467,I don't know.,,
468,I have emotions,,
469,I don't have it's,,
470,E,,
471,Yukmingwan Middle School,,
472,F,,
473,Man is dignified because he cannot be changed by anything and is the only one in the world.,,
474,"Human dignity is not determined by standards, but there is dignity because it is human itself. Since human dignity must be equal, these sentences are not based on equality, so they are not the real reason for human dignity.",,
475,"This is because everything, such as gender, status, and age, is irrelevant and is a thinking entity.",,
476,"All human beings are dignified. So it is not right to weigh dignity by any standard. Humans live in a community while living in this world, and everyone lives equally. So all human beings are dignified.",,
477,"Human beings have dignity just by being human. Therefore, human beings are dignified.",,
478,"Humans are dignified regardless of gender, race, or ability because they are dignified in themselves.",,
479,Of course human beings are dignified because they were born as human beings,,
480,"Since all humans are equal and born with natural rights, it is impossible to judge humans on a specific basis, so all humans are dignified.",,
481,"Human dignity is gender, race, education, private property, age, appearance.It is not because of power, but because of dignity as a person himself.",,
482,There is no reason for human dignity. The reason a person is dignified is just because he is.,,
483,Because it's just human.,,
484,"Humans are not dignified only when certain conditions are satisfied, but they are dignified beings that deserve respect from their birth itself.",,
485,Human beings are dignified by themselves.,,
486,"It is dignified that it exists regardless of gender, race, property, age, appearance, power, study, etc.",,
487,"The reason why I think humans are dignified is that humans are living creatures and have a wide variety of emotions and reason at the same time. In addition, humans can control and control themselves and try to live accordingly with their values.",,
488,"Humans are dignified because they are all equal and guaranteed human rights regardless of gender, occupation, religion, race, degree of wealth, education, and class.",,
489,"Human beings have dignity by themselves. Therefore, with human rights, dignity cannot be violated in any case. If the sentences are correct in the meaning of dignity understood, humans can be dignified only in limited cases, so the rest of us do not have dignity.",,
490,Because I live in this world as a human being.,,
491,"As can be seen in the Constitution and the Universal Declaration of Human Rights, it stipulates that any human being, regardless of educational background, gender, or race, deserves dignity and should be guaranteed.",,
492,"Humans have a dignified value for the reason that any human being, regardless of gender, race, property, age, or appearance, is a human being.",,
493,"This is because humans are just a part of the world and affect many things around them. And because everything is connected like a thread, it is not an exaggeration to say that humans make up this world.",,
494,"Humans have lives that cannot be created even if science develops, and unlike other animals, they have reason, so they are dignified because they have the power to think about society or develop society or science.Because all men are equal.",,
495,This is because humans are dignified just because they are humans without conditions.,,
496,It's because it's,,
497,be dignified as a human being,,
498,Human beings are dignified because they are human.,,
499,745465,,
500,We are dignified because we are all the same human beings,,
501,All men are born equal and dignified,,
502,There is no reason to be discriminated against by being born as a human being.,,
503,F,,
504,Because I'm a human being,,
505,"Humans have dignity because they are just humans, regardless of gender, race, or property.",,
506,Humanity itself is dignity,,
507,He is dignified because he is a man.,,
508,Because humans have dignity unconditionally as soon as they are born,,
509,Human beings are dignified because they are life.,,
510,Because humans have dignity unconditionally as soon as they are born,,
511,Human beings are dignified because they are life,,
512,The world is a scary place,,
513,Because I was born when I was born.^^,,
514,"Humans all have personalities from birth, and humans are worth being dignified by themselves.",,
515,Human beings are not beings of dignity.,,
516,respect for human beings,,
517,Because humans can think and live by helping each other,,
518,B is dignified because he is white-eyed.,,
519,yes,,
520,Because humans are dignified.,,
521,Human beings are also dignified because everything that has life is dignified.,,
522,be dignified as a human being,,
523,Because I was born as a human.,,
524,Because it's human.,,
525,Human dignity has no particular characteristics,,
526,This is because humans were all born in the same way and each person thinks differently.,,
527,Because humans think and have morality.,,
528,This is because humans have decided at will that they are dignified.,,
529,Human beings are dignified to be alive.,,
530,I think we think humans are dignified because we are humans. All living things must be identified.,,
531,Because it's human.,,
532,I don't know.,,
533,He is dignified because he was born a human being.,,
534,I don't know.,,
535,"Man is not dignified. But not everyone is not without dignity. A dignified human being is dignified because he tried to be dignified. Therefore, people who have not tried like them are not dignified. Therefore, all humans are not dignified, but there is a dignified person among them. This means that not having dignity is not dignity, but just as all are not dignity, dignity is dignity, but not all are dignity. Dignity and non-dignity work at the same rate in everyone.",,
536,Because it's human.,,
537,I can feel the emotions,,
538,be dignified because one is human,,
539,Because all human beings have equal rights.,,
540,Because life is precious,,
541,Human beings are dignified because they are human,,
542,"I understand the meaning of ""human dignity""",,
543,"There is no reason for human dignity, just dignity.",,
544,We are dignified as a life. I don't need a condition for dignity.,,
545,Because we're all equal,,
546,"It's dignity because it's a human being, not because of what you have.",,
547,Human beings are dignified by themselves.,,
548,All men are equal,,
549,People born in the world are obligated to receive equal rights and freedom,,
550,Human beings are dignified as human beings.,,
551,be a man of property,,
552,Every human being has dignity from birth,,
553,"Human beings have life, so everyone is dignified",,
554,I'm just a person,,
555,Having a natural right by birth represents human dignity in itself,,
556,Because all men are equal,,
557,The real reason for human dignity can only be known when it comes out of prejudice.,,
558,"Since all humans are dignified, they cannot judge dignity by university, status, age, or gender.",,
559,"Human dignity refers to the ideology that a person is worthy of existence just because he or she is human, and that personality should be respected. Human dignity is an expression of the idea of natural human rights that humans are born with rights from birth, and it refers to the principle that the value of dignity should be guaranteed and respected just because it is human.",,
560,"Human beings are dignified only by their existence with life, and there is no standard for judging the position of each other's dignity in humans.",,
561,"Human beings are dignified only by their existence with life, and there is no standard for judging the position of each other's dignity in humans.",,
562,"Human dignity is worth its existence just because it is human.Therefore, A, B, C, D, E, F, and G are all wrong because they judge people by men, whites, property, age, appearance, power, and university.",,
563,There is no need for a reason for human dignity.,,
564,There is no reason for human dignity.,,
565,"Humans as humans themselves should be respected by others and should not be discriminated against by appearance, property, gender, or educational background. Human beings have dignity because they are human.",,
566,"Because humans were born, because they exist in this world, and because they exist according to the laws of nature, I think humans themselves should be dignified.",,
567,"Human beings are dignified, no matter what conditions they are, for their own reasons",,
568,"Human dignity refers to the ideology that a person is worthy of existence just because he or she is human, and that personality should be respected. Human dignity is an expression of the idea of natural human rights that humans are born with rights from birth, and it refers to the principle that the value of dignity should be guaranteed and respected just because it is human.",,
569,"Human beings are born with human rights. Humans are dignified in themselves because they have inviolability that no one can infringe on and have the natural rights granted by heaven. For thousands of years, humans have formed a society and lived as top predators. It can be said that it has made a clear distinction from animals, such as uniting and fighting to protect ourselves, and establishing laws and systems to protect our rights. Humans have the ability to think differently from animals and have lived with that ability, so humans can be said to be dignified.",,
570,"The reason for human dignity cannot be related to the reasons for the above examples. This is because humans are beings that are precious and should be respected by themselves. If one respects those people just because they are handsome and have a lot of money, this society will not operate normally. Recognizing everyone's dignity in a democratic society would be a shortcut to a desirable society.",,
571,Humans are all dignified regardless of any conditions because everyone is born equal with character.,,
572,I think humans are dignified and valuable just because they are humans.,,
573,"The reason why humans are dignified is because they are humans themselves. Not because he graduated from a good university, but because he is not a specific gender, he is the only one and should be respected. Human beings are dignified in their very existence.",,
574,"Humans are equal as humans themselves. The above examples classify humans into gender, skin color, property, age, appearance, power, and educational background. It is wrong to divide humans into specific groups and think that only that group is dignified. Humans have the right to be respected from birth, and this right cannot be violated by anyone, and is given equally to everyone. Therefore, all human beings are dignified.",,
575,"Humans are dignified and valuable beings in human beings themselves. Therefore, freedom and rights should not be violated by anyone, nor should they be violated. Recognizing and respecting human dignity is also directly related to peace in the world.",,
576,"This is because humans are dignified without missing a single person just by ""human being."" It is endowed from birth, so it has a natural personality.",,
577,"Humans all have personalities, do not pursue a selfish life, and live by reason, not a life faithful to instinct. I think it's dignified because of this.",,
578,"Humans can be said to be dignified in that they can think a little higher-order than any other animal. I can sympathize, understand, and care for the pain of other lives. In addition, humans can be said to be dignified because they are irreplaceable beings.",,
579,"Every human being was born with the right to freedom and equality. Therefore, humans are dignified in their existence and their values deserve respect by everyone. There is no foot in the sand after that.",,
580,The ideology of human dignity is that human beings themselves are valuable and should respect their character.,,
581,"By birth, humans are granted rights from heaven, naturally have rights, and not to be violated by someone. Therefore, from this point of view, the above fingerprints are not the real reason because there is a common reason for dignity. This is why it is reasonable that human beings are born and survive in this world toward their goals and dreams.",,
582,"""The primary reason for human dignity is that we can understand the dignity of others by thinking rationally",,
583,It's because there is. We are all born with dignity. But it's not like we're going to be able to do our best,,
584,The reason why we can maintain dignity is because we have the ability not to violate the dignity of others,,
585,"It's because I have it. But sometimes there are cases where irrational thinking violates the dignity of others, and that's why we organize a group, a state, to make rules, to make rules for others",,
586,"It prevents infringement of dignity. Nevertheless, those who violate the dignity of others",,
587,"In general, a corresponding punishment is imposed to remind and reflect on dignity again.",,
588,"The standard of dignity has always changed with the times. In the past, black people and women used to have dignity",,
589,"Although it was not guaranteed, even the dignity of animals is considered in modern times.",,
590,"This means that over time, humanity has expanded the scope of dignity, allowing us to take a broader leap forward",,
591,"It means that we tend to respect each other, and that's why we're so dignified",,
592,"This is because they recognize and respect the dignity of others.""",,
593,"Human dignity refers to the noble nature that humans cannot deny or commit because they are humans in advance. Therefore, humans have human dignity because they are human, and no one can't help but have it. The above sentences are not correct because they limit people with human dignity, and the only reason why humans are dignified is that they are human. However, this alone has every reason to have human dignity.Human beings should be respected because they are human beings. Human rights should be respected because humans have natural human rights from birth like the idea of natural human rights. Rather than being respected for special reasons or conditions, it should be respected as a human being.",,
594,"If someone says that he or she is the only one with dignity or that someone can be ignored for some reason, people will ignore each other and say that they are the only ones with dignity.But human beings are all dignified.This is because all humans have rights from birth.In addition, since no one can infringe on the right, humans recognize each other as dignity, and thereby their dignity is recognized.Therefore, humans cannot be ignored by someone and can be said to be dignified beings who cannot ignore someone.",,
595,"The reason why humans are dignified is that they are worth their existence just because they are humans. Therefore, deformed babies, disabled people, and everyone can be dignified for whatever reason. It can be said that it is really wrong that something is good and that a person who is not superior and lacking compared to others cannot be dignified. Human beings have dignity from the point of birth.",,
596,Humans are dignified because they have innate dignity from their existence.,,
597,Man is dignified just because he was born.,,
598,"If human dignity is human, all human beings are dignified",,
599,Human beings are all human rights and dignity from birth.,,
600,Human beings are all equals.,,
601,And human dignity.,,
602,Anyone deserves respect and the value of their recognized right.,,
603,Man is just because you're a man must be respected.,,
604,Because he is with dignity in itself.,,
605,""" because anyone deserves respect.",,
606,"""",,
607,Human beings are human dignity because it is.,,
608,"Big, mature.",,
609,Every human being is there social dignity must be respected by the very existence.,,
610,Human beings are born in itself deserves respect and humanity was born with.,,
611,Human beings are human dignity.,,
612,Man is on its own existence that must be respected.,,
613,Human beings are born not discriminated against because they have the right to be respected.,,
614,I have one,,
615,Human dignity be if I could find their target.,,
616,Seems to be human ... jomeomseong f.,,
617,"Regardless of gender, race, property, age, appearance, power, or good university, human beings themselves are dignified, regardless of the above because they are guaranteed dignity from birth.",,
618,This is because the concept of human dignity is a concept accumulated by humans.,,
619,Human beings are dignified in their very existence.,,
620,Because I'm a human being,,
621,"Natural human rights, human beings are human beings from birth, so they are dignified.",,
622,It is dignified because it has life.,,
623,Human beings are dignified in their own way.,,
624,Because I'm a human being,,
625,This is because the existence of humans itself gives the meaning of dignity.,,
626,That's what I think,,
627,The existence itself is dignified.,,
628,Human beings think. And it can be said that humans are dignified because they act responsibly for the idea.,,
629,Because they are all the same human beings.,,
630,Human beings are dignified because they are human.,,
631,Because human rights exist,,
632,Human beings are dignified because they are human beings.,,
633,It is because of its uselessness,,
634,Because every human being has the right to dignity,,
635,I think about it myself,,
636,There is no condition for human dignity. Humans are human beings and should be respected.,,
637,This is because humans have signed a social contract under the provision of human rights in order to ensure their own safety.,,
638,It is because the existence of human beings is dignified.,,
639,Because it's human.,,
640,All human beings are dignified because they are human beings.,,
641,be dignified because one is human,,
642,Human beings have special meanings in themselves,,
643,The reason why humans are dignified is not because they are just humans for some reason.,,
644,Because it's human.,,
645,"It's a natural right, so humans are born with dignity.",,
646,be dignified because one is human,,
647,All men are equally dignified.,,
648,Human beings are dignified by themselves.,,
649,"Humans are not dignified for any reason, but dignified in themselves.",,
650,be dignified because of life,,
651,Every human being is dignified for no reason.,,
652,Because humans are precious in themselves.,,
653,Man is an animal of morality and is dignified in its existence.,,
654,"Human dignity should be valued and respected because it is a human being, not judged by conditions and situations. Therefore, the real reason why humans are dignified is because they are humans.",,
655,be dignified because one is human,,
656,Human beings are dignified by themselves because they are human. It is not about judging dignity and non-dignity by people's personal characteristics.,,
657,"Human beings are not dignified under any conditions, but dignified by their existence alone",,
658,Because I was born,,
659,Human beings are dignified in their very existence.,,
660,This is because he was born under the same sky and had cognitive abilities differentiated from animals.,,
661,Human beings are all equal because they are human. There is no reason to be different.,,
662,Because I'm a human being human,,
663,This is because all of them contain discriminatory words.,,
664,"Because he is a person with a personality, he should be respected even if he is not pretty and handsome.",,
665,Because I was born.,,
666,"From birth, man is born with dignity",,
667,Man is dignified because he has life.,,
668,Because people are equal!,,
669,Human beings survive because they are human,,
