688,quickness of breath,,,,,,,,,
689,I don't know.,,,,,,,,,
690,"When you exercise, your body temperature rises and you sweat as calories burn. The heat is released by the sweat, but it does not overheat even if you exercise because it is sweaty",,,,,,,,,
691,Heart beating fast,,,,,,,,,
692,My heart is beating faster and I'm out of breathI feel like I've gotten bigger.,,,,,,,,,
693,I don't know.,,,,,,,,,
694,My heart beats a lot.,,,,,,,,,
695,an increase in the heart rate,,,,,,,,,
696,It's getting hot. It allows blood to move around,,,,,,,,,
697,My heart is beating fast.,,,,,,,,,
698,My body is sweating. Waste is discharged.,,,,,,,,,
699,I'm out of breath,,,,,,,,,
700,I don't know.,,,,,,,,,
701,Because my body is tired (Laughing),,,,,,,,,
702,Our bodies become stronger,,,,,,,,,
703,I'm very tired...,,,,,,,,,
704,g,,,,,,,,,
705,I'm sweating and out of breath,,,,,,,,,
706,The heart rate increases and the body becomes healthy.,,,,,,,,,
707,It's hard to breathe,,,,,,,,,
708,The heart rate increases and our bodies become stronger,,,,,,,,,
709,"When we run, our bodies get hot because of heat.The role is to sweat when it's hot, but the body cools down due to the sweat.",,,,,,,,,
710,The lack of oxygen causes alpine disease,,,,,,,,,
711,"After running, my heart beats fast and I sweat",,,,,,,,,
712,"When I run, I need to breathe fast, so blood flows fast in my body, so my heart beats fast",,,,,,,,,
713,I'm sweating a lot,,,,,,,,,
714,"I sweat and my heart beats fast, so I'm out of breath",,,,,,,,,
715,Muscles become stronger and healthier,,,,,,,,,
716,"Muscles contract, sweat, and shortness of breath.",,,,,,,,,
717,My heart is beating fast.It is to supply oxygen and nutrients to the whole body.,,,,,,,,,
718,"I'm out of breath, fever, and sweaty",,,,,,,,,
719,My calves are flabby,,,,,,,,,
720,"The body heats up and sweats come down. And my heart is beating fast. Because the body gets hot when it is active, the body temperature increases, and then you sweat to remove moisture from the body.",,,,,,,,,
721,"After exercising rapidly, your heart beats fast and you feel out of breath.",,,,,,,,,
722,My heart beats fast and my breath gets rough,,,,,,,,,
723,Muscles develop actively and change our physical body,,,,,,,,,
724,"I'm sweating, thirsty, and my legs hurt. Muscles are stretched, healthy, and tall",,,,,,,,,
725,I have a strong body,,,,,,,,,
726,My heart beats fast and I'm out of breath,,,,,,,,,
727,It's hard to breathe,,,,,,,,,
728,Your heart is beating fast. It speeds up blood circulation,,,,,,,,,
729,Breathing gets faster,,,,,,,,,
730,The heart rate increases. It speeds up the heart rate to quickly oxygenate the body.,,,,,,,,,
731,PASS,,,,,,,,,
732,"""I'm sweating and out of breath",,,,,,,,,
733,It's called homeostasis,,,,,,,,,
734,"It is a phenomenon that tries to keep the body as usual in a short time.""",,,,,,,,,
735,Breathing gets faster,,,,,,,,,
736,"Once you exercise, your heart beats and you have to supply that much oxygen, so your body generates heat and releases sweat to heat it up",,,,,,,,,
737,The lack of oxygen makes my heart beat fast and I gasp,,,,,,,,,
738,"The biggest phenomenon is the beating of the heart, and the supplying of oxygen by supplying blood quickly. And because we used a lot of ATP energy while exercising, we need additional oxygen to make ATP. That's why the lungs breathe quickly. In addition, the brain promotes the production of many hormones, making people comfortable.",,,,,,,,,
739,"Your heart beats faster, oxygen moves into your muscles.",,,,,,,,,
740,"The heart speeds up, pupils dilate.",,,,,,,,,
741,"The heart rate increases, and the breathing increases. It maintains constancy by sweating to reduce body temperature changes.",,,,,,,,,
742,"Pupils get smaller, hearts beat fast, and sweat a lot. It is to cool down and get oxygen.",,,,,,,,,
743,This is because exercising builds up the active oxygen that our bodies need,,,,,,,,,
744,1234,,,,,,,,,
745,I don't know,,,,,,,,,
746,lose weight,,,,,,,,,
747,You can breathe faster,,,,,,,,,
748,You lose body fat,,,,,,,,,
749,"Yes, it is",,,,,,,,,
750,I can sing in harmony,,,,,,,,,
751,"""You're going to lose weight",,,,,,,,,
752,"""",,,,,,,,,
753,To lose weight,,,,,,,,,
754,You lose body fat,,,,,,,,,
755,be out of breath and have a hard time with one's heart,,,,,,,,,
756,"When you exercise, it stimulates your muscles and makes you short of breath, and through exercise, your body sweats out waste",,,,,,,,,
757,"If you sweat a lot and breathe quickly, you lose strength and get excited quickly. I get mentally excited",,,,,,,,,
758,You do it,,,,,,,,,
759,"If you sweat a lot and breathe quickly, you lose strength and get excited quickly. I get mentally excited",,,,,,,,,
760,He's having a hard time,,,,,,,,,
761,My heart beats fast and I can't breathe,,,,,,,,,
762,"There are changes that make your muscles build up, you run faster, and there are many good changes.",,,,,,,,,
763,"The lighter your body is, the easier it is to exercise",,,,,,,,,
764,"There are changes that make your muscles build up, you run faster, and there are many good changes.",,,,,,,,,
765,"As the body's atmosphere continues mentally rapidly, it uses strength by applying strength rapidly.",,,,,,,,,
766,Sweat is flowing. Sweat is proof that blood is flowing well. Sweat is flowing well through blood,,,,,,,,,
767,I don't know.,,,,,,,,,
768,"""I'm out of breath",,,,,,,,,
769,My heart is beating fast,,,,,,,,,
770,"""I'm sweating""",,,,,,,,,
771,"Our bodies feel good when we go up After you work out, your body becomes fresh. So if you work out, you can live a long time",,,,,,,,,
772,I don't know.,,,,,,,,,
773,It's hard,,,,,,,,,
774,"Breathing is fast, I drink a lot of oxygen, my heart beats fast, and blood circulation is good",,,,,,,,,
775,My heart is beating faster,,,,,,,,,
776,....,,,,,,,,,
777,"I'm hungry, tired, and cursing",,,,,,,,,
778,Bone injuries and muscles surprise.,,,,,,,,,
779,Sweat is released and the heart beats fast,,,,,,,,,
780,I'm sweating,,,,,,,,,
781,My ears are ringing.The organs that control the high pressure in the ear do not work well because the high pressure is reversed,,,,,,,,,
782,We're running 100 meters and we're out of oxygen in our blood,,,,,,,,,
783,Heart rate increases after exercise and inhales oxygen while breathing hard to lower it to a normal level,,,,,,,,,
784,I'm out of breath and my heart is beating. This change causes sweat and blood circulation.,,,,,,,,,
785,"People breathe while running. The breathing should only be exhaled through the nose, but it's harder because it releases carbon dioxide through the mouth. And the pulse is beating fast. Because when you use up a lot of energy, you get cold sweat, and the organs in your body are working smoothly.",,,,,,,,,
786,"Because lactic acid forms between our muscles, our muscles get tired.",,,,,,,,,
787,"When you climb a high mountain, you start to lose your breath due to lack of oxygen due to air pressure.",,,,,,,,,
788,gasp for breath,,,,,,,,,
789,I'm out of breath. My body loses moisture.,,,,,,,,,
790,"There are some people who sweat because it is hard to exercise. If you do this hard exercise, your body will get heat.",,,,,,,,,
791,"Faster heart rate, dilated exocrine glands, and faster blood circulation.gasp for breath",,,,,,,,,
792,"Lactic acid fermentation, breathing",,,,,,,,,
793,It promotes metabolism and tries to get a lot of oxygen.,,,,,,,,,
794,The heart rate increases and the body temperature rises.,,,,,,,,,
795,I'm out of breath.,,,,,,,,,
796,"The heart beats, adrenaline is released, hair lies down, and lactic acid is released.",,,,,,,,,
797,Because you breathe faster,,,,,,,,,
798,Rapid ATP consumption causes muscles to clump.,,,,,,,,,
799,"As energy consumption increases, a lot of oxygen is required for cellular respiration, and the amount of breathing increases and the heart rate increases to provide sufficient oxygen and remove carbon dioxide.",,,,,,,,,
800,I'm out of breath. My heart is beating fast.,,,,,,,,,
801,oxygen reduction,,,,,,,,,
802,My heart is beating fast.,,,,,,,,,
803,My heart is pounding and I'm out of breath.,,,,,,,,,
804,"Sweat comes out, breathing becomes rough. (Annoyed)",,,,,,,,,
805,"When the body needs more oxygen, breathing and heart rate are accelerated, and body temperature is increased, so the body can supply enough oxygen required by the body to perform exercise smoothly.",,,,,,,,,
806,"My heart is beating fast, I'm out of breath, because the number of gas exchanges has to increase",,,,,,,,,
807,"After exercising, our body's heart rate increases, our body temperature rises, and sweat comes out to get back to normal, so we lower our body temperature",,,,,,,,,
808,Rapid exercise leads to a lack of oxygen in the body and shortness of breath to fill the oxygen.,,,,,,,,,
809,I'm sweating a lot and I'm out of breath,,,,,,,,,
810,I don't know,,,,,,,,,
811,It's getting hard,,,,,,,,,
812,Faster heart rate and harder to breathe,,,,,,,,,
813,sweaty insulin secretion,,,,,,,,,
814,I'm out of breath. I need to take a deep breath.,,,,,,,,,
815,I'm out of breath because my heart rate is getting faster.,,,,,,,,,
816,"Heat comes out of the body, sweat is released, and constancy is maintained.",,,,,,,,,
817,Blood pressure rises and sweat is secreted to maintain homeostasis,,,,,,,,,
818,"Exercise raises a person's body temperature, so they sweat to maintain homeostasis.",,,,,,,,,
819,Heartbeats are faster Heartbeats are responsible for sending blood to the body,,,,,,,,,
820,I'm sweating and my heart is pounding,,,,,,,,,
821,Sweat and heart rate spikes,,,,,,,,,
822,Hardness,,,,,,,,,
823,"My heart is beating faster, and my body is sweating. The reason is that our bodies speed up the heart rate, facilitating the supply of blood, and discharging sweat to release waste from the body.",,,,,,,,,
824,"My body needs a lot of oxygen and water to make my heart beat fast, so I can breathe fast and get thirsty",,,,,,,,,
825,My heart is beating faster It helps blood circulation,,,,,,,,,
826,It's hard,,,,,,,,,
827,The gap between inhalation and exhalation narrows,,,,,,,,,
828,It uses up oxygen and energy by exercising in the body.,,,,,,,,,
829,"As the cells of the human body consume energy during rapid exercise, oxygen is needed to replenish energy. So your heart beats faster and your breathing becomes rough.",,,,,,,,,
830,"Because it requires a lot of oxygen, it makes you gasp.",,,,,,,,,
831,My heart stops beating,,,,,,,,,
832,My body is sweating. I have to drink water again. This is because dehydration can occur.,,,,,,,,,
833,I'm out of breath because I want to make my blood circulation more active and get oxygen into my body faster,,,,,,,,,
834,"You will have muscle pain, sweat, pain, daze, or no strength.",,,,,,,,,
835,"Heart rate increases, adrenaline is released, and sweat glands are stimulated and sweaty",,,,,,,,,
836,grow faster,,,,,,,,,
837,"If you exercise, you need to use a lot of energy Therefore, blood needs to move fast, but if blood moves fast, it needs a lot of air Therefore, the brain needs air and feels wheezing symptoms If you run a lot, you will receive energy and your muscles, which you used too much, will get tired and accumulate fatigue.",,,,,,,,,
838,out of breath,,,,,,,,,
839,Hormones in the blood move fast,,,,,,,,,
840,"Breathing becomes difficult because when you exercise rapidly, you do anaerobic exercise.",,,,,,,,,
841,"My heart beats fast and I get a lot of heat, so I will sweat and get hot",,,,,,,,,
842,Sweat is released and the weight is lost as sweat is released.,,,,,,,,,
843,My breath is getting better,,,,,,,,,
844,"If you exercise, you burn the fat to get rid of it.",,,,,,,,,
845,"If you suddenly exercise hard, your physical strength is basic and your lung capacity increases. Therefore, your body can develop rapidly or your muscles can grow rapidly",,,,,,,,,
846,"Because people generate heat when they exercise, they cool down by sweating to release heat from the body.",,,,,,,,,
847,"The heartbeat accelerates as the heart beats. And I sweat in my body, and sweat controls my body temperature.",,,,,,,,,
848,My heart beats fast and gasps because I sweat to cool down after exercise and need more oxygen,,,,,,,,,
849,Pumping is more active in the heart to create energy.,,,,,,,,,
850,"After rapid exercise, the cell needs more oxygen, so it needs more and more oxygen, so it is panting.",,,,,,,,,
851,"As oxygen demand increases, sympathetic nerves become excited. This causes the heart to beat fast, sweat, and body temperature to rise. And there is also muscle pain due to fine damage to the muscles.",,,,,,,,,
852,"After rapid exercise, the heart rate increases and breathing increases. It serves to supply the body with insufficient oxygen and energy.",,,,,,,,,
853,"After rapid exercise, the heart rate increases and breathing increases. It serves to supply the body with insufficient oxygen and energy.",,,,,,,,,
854,"As you sweat, your body temperature decreases. The heart beats fast and delivers blood quickly, supplying a lot of oxygen to the muscles. Breathe fast and take in a lot of oxygen.",,,,,,,,,
855,"I get shortness of breath and muscle pain. Because of the lack of oxygen, lactose accumulates in the muscles and feels tired because of the lack of oxygen. It is sweat that moisture, inorganic salts, and waste are released together.",,,,,,,,,
856,The heart beats fast and the breathing gets faster. It absorbs oxygen faster and releases carbon dioxide faster.,,,,,,,,,
857,The heart is beating faster. Because I need to supply oxygen to my body quickly.,,,,,,,,,
858,"Rapid exercise increases the heart rate, which is to supply glucose to the blood.",,,,,,,,,
859,Glycogen is broken down into glucose in the liver to obtain energy,,,,,,,,,
860,"After exercise, blood sugar decreases and glucagon breaks down glycogen into glucose.",,,,,,,,,
861,"Immediately after exercising, our bodies needed a lot of oxygen in our muscles, so our heart beats faster and our breathing volume increased.",,,,,,,,,
862,I don't know,,,,,,,,,
863,"After rapid exercise, a lot of cellular respiration occurs in the body, and oxygen is scarce, so the body's sugar drops, causing glucagon to break down glucose synthesized with glycogen in the liver. Also, if you exercise harder than usual, lactic acid can be secreted and cause muscle pain.",,,,,,,,,
864,I sweat and my heart beats fast to control my body's temperature and blood supply,,,,,,,,,
865,I don't know,,,,,,,,,
866,My heart is racing. I'm sweating,,,,,,,,,
867,"Rapid exercise boosts your metabolism. The heart beats fast and supplies blood to various organs. It is to supply oxygen. I'm also sweating, but it's to lower my body temperature because blood is supplied quickly. And breathing becomes rough. It is to fill up the lack of oxygen.",,,,,,,,,
868,"When breathing is applied and the pulse increases, the blood vessels expand. This allows blood to circulate all over the body.",,,,,,,,,
869,"The organ requires a large amount of energy, which requires oxygen, which leads to an increase in heart rate and an increase in breathing frequency. And sweat to cool off the heat generated by consuming a lot of energy. It increases the surface area of the skin to release heat better.",,,,,,,,,
870,"When you do rapid exercise, you consume the atp stored in your body and then use glycogen. After that, glucose is decomposed to generate energy, and when rapid exercise occurs, glucose is not completely decomposed and ferments, producing lactic acid, and is stored in the muscles. This can cause muscle pain.",,,,,,,,,
871,I get tired because I have lactic acid in my muscles.,,,,,,,,,
872,"My heart is beating fast. In order to supply blood quickly, the pump speed of the heart increases.",,,,,,,,,
873,"""I lose my breath and my muscles get bigger.""",,,,,,,,,
874,"It takes in more oxygen, releases carbon dioxide, and muscles bulk up with blood.""",,,,,,,,,
875,"My body temperature rises and I sweat. This requires a lot of oxygen, which makes you gasp.",,,,,,,,,
876,"Oxygen is produced, and unlike the oxygen we usually make, oxygen is produced through an oxygen production process that is shortened so that it can be made in a hurry without going through the whole process.",,,,,,,,,
877,"After exercising, you may feel short of breath, sweat, thirsty, and complain of muscle pain. When you exercise, your body's oxygen demand increases more than usual, so you lose breath, and you sweat to lower your body temperature, which has risen due to exercise. Muscle pain is caused by rapid exercise, which causes muscle cells to breathe anaerobic and accumulates lactic acid, the product of anaerobic respiration. Overall, changes occur to maintain homeostasis in the body.",,,,,,,,,
878,A high level of adrenaline causes the body to become excited,,,,,,,,,
879,Evaluation Only. Created with Aspose.Cells for Python via Java.Copyright 2003 - 2022 Aspose Pty Ltd.,,,,,,,,,
