,"2) What happens in the future if you use a lot of fossil energy, such as coal or oil?",q44_depleted,q44_environmental pollution
0,Fossil energy disappears,,
1,"Later, coal, oil, etc. become scarce, and energy is no longer available.",,
2,Fossil energy such as coal and oil is lost,,
3,That would be nice,,
4,the collapse of the earth,,
5,"Later, oil or coal becomes scarce",,
6,Global warming will get worse,,
7,The earth is going to perish...,,
8,It's going to be ruined.,,
9,People will not be able to live due to lack of resources.,,
10,No oil or coal for later use,,
11,I don't know,,
12,The environment will improve.,,
13,The environment of the earth will be polluted and it will be difficult for people to live.,,
14,It will be difficult to use electricity later,,
15,"In the future, there will be a lot of power outages due to lack of electricityThere will also be a shortage of resources",,
16,"Global warming comes, and there's no seoktin or oil",,
17,It will be contaminated.,,
18,The environment improves.,,
19,The limited resources are used up and the resources are lost.,,
20,"The environment will be more polluted and resources will be exhausted, making life uncomfortable.",,
21,I don't think I can use it later because it's not enough.,,
22,You're going through it,,
23,You're going through it,,
24,It can run out of resources and become the destruction of mankind.,,
25,I think I'll get better,,
26,The world will perish.,,
27,The number of employees decreases,,
28,I don't think I'll last long,,
29,"It seems that people will have a hard time in the future, and it will be difficult to get air and water.",,
30,I don't know.,,
31,Limited energy such as coal and oil will disappear.,,
32,Our descendants will not be able to use coal or oil.,,
33,"When environmental pollution becomes serious and fossil fuels run out, alternative energy should be found.",,
34,Oil will be gone and there will be garbage,,
35,Nature is destructive and mankind becomes difficult.,,
36,The air is bad,,
37,"In the future, coal or oil will be gone and the atmosphere will be bad because it is used by burning",,
38,Full of fossils due to real gas,,
39,It'll be ruined. That's why you asked the question,,
40,"It will be easier to make food, but it will consume a lot of energy",,
41,I think it will be a bad future for environmental pollution,,
42,It gets contaminated,,
43,"In the future, it seems that we can make light through solar power rather than using electricity.",,
44,"In the future, it seems that we can make more light through solar power rather than using electricity.",,
45,The air gets bad,,
46,Global warming accelerates due to increased greenhouse gases,,
47,The earth becomes dirty and life is hard to live.,,
48,I don't know.,,
49,be short of resources,,
50,deterioration of air,,
51,I don't know.,,
52,The air becomes clear,,
53,The country will be destroyed,,
54,can't see the light,,
55,"If coal and oil are lost, all cars and electricity will be useless.",,
56,The earth is going to perish,,
57,Energy is depleted and energy is no longer available.,,
58,have no future,,
59,Because bad things happen in the future and the air can get bad in the future,,
60,I don't think I can use electricity because of lack of resources.,,
61,Resources run out.,,
62,I'm afraid I'm running out of coal or oil.,,
63,The environment is ruined,,
64,I'm sorry,,
65,I don't know,,
66,"""G-R-Seyo"" (Korean wordplay",,
67,It can vary depending on future movements.,,
68,I think the earth is going to get worse,,
69,be exhausted and unavailable for energy,,
70,Coal and oil are depleted. The average temperature of the Earth increases due to carbon dioxide emissions.,,
71,The greenhouse effect intensifies global warming.,,
72,The air gets bad. The earth is getting hot.,,
73,Global warming,,
74,The temperature of the earth increases and a great cycle occurs.,,
75,Environmental pollution and waste increase.,,
76,The ozone layer is destroyed. Global warming intensifies.,,
77,It's getting hot.,,
78,"In the future, resources will be depleted, making it difficult for everyone to live or starve.",,
79,"The amount of fossil energy will decrease and the fuel that drives the car will be lost, so the vehicle will not be able to move, and the thermal power plant that generates electricity using fossil energy will not be able to operate In addition, global warming caused by the destruction of the ozone layer and the destruction of the ozone layer will also become serious due to the increase in Freon gas from burning fossil energy.",,
80,"If coal or oil is used a lot, harmful gases are emitted, deepening the greenhouse effect, which is the main culprit of global warming. If so, sea levels can rise and various unexpected natural disasters can occur.",,
81,"At some point, fossil fuels such as coal and oil will be depleted and many objects used will be unavailable, leading to great confusion.",,
82,"Because it emits a lot of effects that accelerate global warming such as carbon dioxide, disasters such as abnormal weather may occur in the future",,
83,Fossil energy will be depleted in the future,,
84,"Fossil energy reserves are limited, so if used a lot, energy will be depleted in the future and pollutants such as carbon dioxide will be generated, which will increase human damage such as rising sea levels, flooding in surrounding countries, and natural disasters.",,
85,"The concentration of carbon dioxide in the Earth's atmosphere will increase, resulting in global warming, which will cause ecological confusion and melting of polar glaciers, increasing the risk of flooding in low-lying areas.",,
86,"First of all, the reserves of coal or petroleum energy are limited, so relying heavily on these two could lead to serious energy shortages in the future. In addition, since the main component of fossil energy is carbon, carbon dioxide is generated when energy using coal or petroleum, so the greenhouse effect occurs greatly, and natural disasters occur due to rising global temperature.",,
87,"Using a lot of fossil energy will thicken the ozone layer, which will intensify global warming. This will deepen the problem of desertification and ecosystem destruction caused by the weather, and may no longer be able to live on Earth in the future.",,
88,.,,
89,"To make energy using coal or oil, we need to heat it up.",,
90,"In this case, carbon dioxide is generated during the heating process, and since this carbon dioxide generates a greenhouse effect, global warming occurs. If the temperature of the earth rises due to global warming, glaciers can melt and sea levels rise, causing various problems such as sinking the island.""",,
91,"No matter how much coal or oil is buried in the Arctic Ocean or Antarctica, and ""a lot"" is buried in the Middle East, so there is an inevitable limit. There is also a limit to infinitely satisfying the human desire to spend 80 million barrels of oil every day. It also emits greenhouse gases such as carbon dioxide and carbon monoxide through the combustion of fossil fuels, which have a greenhouse effect on the Earth's atmosphere. And the average temperature of the Earth is bound to rise because the solar radiation energy coming in from the Earth is absorbed more and the energy released is reduced. So, as global temperatures rise, glaciers rise and water levels rise, flooding low-lying countries.",,
92,Collapse,,
93,.,,
94,"A lot of greenhouse gases are produced in the process of power generation. As a result, over time, negative things continue to occur to members of the global biological community, such as abnormal weather and global warming, making it difficult to live slowly.",,
95,"Global warming will become acute. The reason is that the greenhouse gas concentration increases due to the increase in greenhouse gas emissions along with carbon dioxide, so the greenhouse effect in the Earth's atmosphere becomes extreme, and the average temperature of the Earth gradually increases. In other words, it can bring about results that lead to ecosystem instability.",,
96,The environment is polluted and the earth is destroyed and we all die.,,
97,I'm glad to see you.,,
98,"High use of coal or oil also increases the amount of carbon dioxide produced by burning fossil fuels, accelerating the greenhouse effect, which causes acceleration of global warming. The acceleration of global warming will cause sea levels to rise, deepening abnormal weather.If coal and petroleum energy continue to be used, the price of fossil energy will increase, and then not only will it be hit hard by exhaustion or fossil energy, but carbon dioxide will increase, resulting in a greenhouse effect, deepening global warming. If global warming intensifies, various natural disasters will occur and glaciers will melt, reducing the space for humans to live. In addition, the use of fossil fuels increases fine dust, so humans may not be able to breathe freely.",,
99,"If a lot of greenhouse gases such as carbon dioxide are emitted by the use of fossil energy, a greenhouse effect occurs, accelerating global warming, which can lead to various problems such as rising sea levels.",,
100,"If fossil energy is used a lot, carbon dioxide will be emitted excessively, strengthening the greenhouse effect, which will lead to global warming. Its effects will cause glaciers to melt and sea levels to rise, resulting in flooding at lower elevations. Other than that, there will be many environmental problems. But I want to approach it from a different perspective. Using a lot of fossil energy would mean not thinking about the environment as much. So I don't think we're going to develop alternative fuels either. Therefore, when we are on the verge of depletion, we think that there may be a scramble for fossil energy and a world war may break out again.",,
101,"oil depletion, environmental pollution",,
102,"When fossil fuels run out, the source of resources disappears.",,
103,"Global warming will worsen, resulting in bad consequences such as rising sea levels.",,
104,acceleration of global warming,,
105,The energy runs out.,,
106,The earth is getting hotter,,
107,an increase in carbon dioxide,,
108,"Global warming will get worse, and it will not be used when necessary",,
109,There will be no more fossil energy to use and it will cause serious environmental pollution.,,
110,"In the future, environmental pollution will become more severe, destroying the ozone layer and making it difficult to live",,
111,The environment is greatly reduced. It's not good for people to live.,,
112,Global warming intensifies due to higher concentrations of carbon dioxide,,
113,There will be many problems caused by global warming.,,
114,sea of fire,,
115,"One day, it will be depleted and global warming will intensify",,
116,"In the future, the temperature of the earth will rise further and global warming will worsen",,
117,"A lot of carbon dioxide will be produced, leading to rapid global warming.",,
118,"If fossil energy is used constantly by releasing pollutants, it can adversely affect the Earth's environment, creating an environment where life cannot live on Earth",,
119,The earth warms up.,,
120,The human race will be lost.,,
121,Global warming can kill everyone,,
122,"If fossil energy such as coal and oil were exhausted and fossil energy was used without any countermeasures, only global warming would have accelerated when it was depleted.",,
123,"If limited resources continue to be used, resources will be depleted and available resources will disappear",,
124,"In the future, the resources to be used will be exhausted, and it will be difficult to produce the necessary goods and achieve further development. And the need for all the resources will increase and the price will go up.",,
125,"A lot of carbon dioxide and sulfur dioxide occur, which intensifies global warming.",,
126,"Not only is it depleted and unusable, but it also releases a lot of carbon dioxide from burning fossil fuels into the atmosphere, causing global warming to accelerate.",,
127,"Global warming intensifies, causing the climate to exist only in summer and winter, and sea levels to rise.",,
128,"Global warming is getting bigger, causing abnormal weather conditions and increasing average temperatures Not only will the atmosphere be polluted, but the ozone layer will be destroyed and the UV index will be higher",,
129,"Because high-quality fossil energy is used first, if it continues to be used, only poor fossil energy remains later. And because fossil energy is finite, it quickly runs out.",,
130,have no fuel for the future,,
131,resource depletion,,
132,run out of energy,,
133,It's getting hard to live,,
134,"One day, fossil energy will be depleted and unavailable",,
135,"Because it is a finite resource, energy is depleted",,
136,It's getting worse,,
137,"Problems such as environmental destruction, global warming, and resource depletion occur",,
138,Nature gets dirty.,,
139,Lack of resources,,
140,the crisis of mankind due to exhaustion,,
141,"One day it will disappear, and mankind will no longer be able to use energy",,
142,Lack of resources,,
143,Environmental pollution such as air pollution and fine dust will become worse,,
144,Bad things happen.,,
145,Resources will run out,,
146,Coal and oil will disappear and you will feel great difficulty,,
147,The future cannot use resources,,
148,Ruined,,
149,"Fossil energy is depleted, and fossil energy is no longer used, and environmental pollution becomes severe",,
150,Global warming occurs.,,
151,The global environment is polluted,,
152,A lot of carbon dioxide will be released and global warming will worsen.,,
153,The earth is ruined by global warming due to high carbon dioxide.,,
154,Global warming will get worse.,,
155,"Since fossil energy is limited and environmental pollution is severe, if used continuously, resources will be depleted in the future and it will be a difficult environment for living organisms to live in.",,
156,It's impossible for people,,
157,It causes environmental pollution.,,
158,Global warming is caused by environmental pollution.,,
159,"Environmental pollution intensifies, lack of energy",,
160,the brightening of the future,,
161,The Earth's average temperature rises and all living things die.,,
162,environmental pollution,,
163,"Coal and oil are in a fixed amount, so we can't use them at any time, which is likely to cause a great deal of confusion",,
164,You don't know how the future will be ruined,,
165,"As carbon dioxide increases, countries will be inundated with acid rain and hail, and abnormal weather will continue to appear.There is a higher chance that the Earth will die down later.",,
166,Environmental pollution occurs.,,
167,Fossil energy is depleted,,
168,"The amount of carbon dioxide in the atmosphere will increase, and air pollution and global warming will become serious, and the human race on Earth will be destroyed.",,
169,"Not only does global warming become serious as carbon dioxide increases several times more than it is now, but fossil energy is depleted and there is no more energy to use.",,
170,Environmental problems or energy depletion caused by the increase in greenhouse gases,,
171,Global Warming Happens,,
172,Resources are depleted and the environment is polluted.,,
173,I don't know,,
174,I don't know,,
175,The fossil energy was depleted and could no longer be used.,,
176,become uninhabitable,,
177,"""",,
178,,,
179,,,
180,,,
181,I don't know.,,
182,,,
183,,,
184,"""",,
185,There are no resources left.,,
186,..;.,,
187,Resources run out.,,
188,"It will quickly run out and become difficult to use again, and it will have a fatal effect on environmental pollution.",,
189,I don't know,,
190,sugar contaminated with the environment,,
191,Chemical energy is gone,,
192,Global warming may make people unable to live on Earth.,,
193,Coal and oil are all gone,,
194,The earth is destroyed.,,
195,Resources are wasted.,,
196,Coal and oil disappear and resources disappear,,
197,We don't use coal or oil any moreThe resources are likely to be abundant,,
198,We're running out of fuel for future generations,,
199,It will cause inconvenience to your life by using up coal or oil.,,
200,It is inconvenient to live because we are out of resources,,
201,"You can save money, but the natural environment will be greatly affected.",,
202,It will be a resource-poor country.,,
203,There will be a shortage of resources,,
204,No more fossil energy is available,,
205,I don't know,,
206,Fossil energy will disappear in the future,,
207,"If you continue to use coal or oil, one day coal and oil will no longer be available, and fossil energy will no longer be available.",,
208,It becomes difficult to live because of lack of resources,,
209,I have no idea.,,
210,This is because it is easy to buy using fossil energy without using a heating lamp.,,
211,It's hard to live because of the lack of resources,,
212,The air gets bad. (Air Pollution),,
213,"Resources are depleted, and resources for future generations to use are lost",,
214,"In the future, fossil energy, such as coal and oil, will be depleted and everything that operates on fossil energy will not be available.",,
215,There is a shortage of resources and environmental pollution.,,
216,There is a shortage of resources.,,
217,Resources for future use will be lost,,
218,Oil and coal are gone,,
219,There will be many destruction of nature and warming on Earth,,
220,The environment is likely to be polluted.,,
221,Resources are depleted and disappearing.,,
222,"""",,
223,Lack of resources.,,
224,"Coal or oil is finite, but it is no longer available.  So energy is scarce, and the global environment is polluted",,
225,There is a problem of coal and oil shortages,,
226,It is difficult for the future to be sustainable development.,,
227,The future is going to hurt! Don't do it!,,
228,"Later on, resources eventually run out and affect the environment",,
229,It's hard because there's no energy to replace it when it's depleted,,
230,Develop new and renewable energy to prevent environmental pollution,,
231,Global warming,,
232,natural exhaustion,,
233,It causes environmental pollution,,
234,environmental destruction,,
235,More carbon dioxide emissions and faster global warming,,
236,"Climate abnormalities, ozone depletion, air pollution, and land pollution occur due to global warming.",,
237,The exhaustion of energy creates difficulties.,,
238,Environmental pollution is getting worse and global warming occurs,,
239,The environmental pollution is getting worse and the earth is destroyed.,,
240,The environment becomes polluted and difficult for humans to live in.,,
241,Environmental pollution problems and global warming intensifies.,,
242,"Later, it will be depleted and no longer be able to use energy, and the ecosystem will be destroyed.",,
243,Fossil energy will be added and global warming will intensify,,
244,The future will be a natural environment where air pollution and land pollution are severe,,
245,The environment is polluted.,,
246,Environmental pollution becomes more serious,,
247,"Over a long period of time, it will use up all of its energy generations.",,
248,The earth is likely to become environmental pollution.,,
249,Alternative energy will be needed due to environmental pollution caused by greenhouse gas generation as well as exhaustion of fossil fuels.,,
250,Fossil energy will one day be depleted and environmental pollution will intensify.,,
251,The sea level rises,,
252,Fossil energy is depleted and becomes unusable.,,
253,Oil and coal for later use are gone.,,
254,Environmental pollution will get worse,,
255,"In the future, there will be a shortage of coal or oil, and the things that work with it cannot work.",,
256,It's air pollution and squandering resources,,
257,"In the future, coal and oil will be needed",,
258,I don't know,,
259,I don't know,,
260,I think it would have changed,,
261,Coal and oil will be exhausted and the land will be devastated,,
262,I don't know,,
263,I don't know,,
264,The natural environment is not destroyed and there is no need to worry about volunteering,,
265,There is no oil left,,
266,can protect the environment,,
267,I think the future is going to get worse And we're going to use more fossil energy,,
268,The environment gets worse,,
269,be undestroyed,,
270,It's ruined,,
271,The future develops,,
272,Fossils will disappear,,
273,global pollution,,
274,The air polluter could die,,
275,Oil lamps are limited and cannot be used for a long time,,
276,The earth will perish,,
277,environmental pollution,,
278,Fossil energy is gone.,,
279,A great deal.,,
280,"We have no resources, and the country will be ruined",,
281,It's all dried up and you won't be able to lose later.,,
282,Global warming will melt the North and South Poles and cause natural disasters.,,
283,an energy depletion phenomenon of energy depletion,,
284,Global warming will intensify and fossil fuels will run out.,,
285,It will be difficult to live.,,
286,Global warming is progressing due to increased CO2 and other bad smoke is bad for your health.,,
287,"There is a lot of coal and oil, and the environment becomes dirty, making it difficult for humans to live",,
288,to be able to protect resources,,
289,We'll all die out of coal and oil,,
290,I don't know.,,
291,The earth is coming to an end.,,
292,Someday I'll run out,,
293,The environment is polluted,,
294,It's disappearing,,
295,a good change,,
296,"The air will get worse and suffer from energy problemsThe air in the city becomes quaint because of the fumes, so people have to buy air and drink it.",,
297,Life will be difficult because the environment is polluted and resources are depleted.,,
298,Resources are depleted and environmental pollution occurs.,,
299,You can't use coal or oil when you need it,,
300,"If resources are lost in the future and air pollution becomes severe, global warming will heat up the earth and destroy it",,
301,"In the future, there will be air pollution and a bit of lack of energy",,
302,It's all gone and it's all gone,,
303,I don't know.,,
304,The air will deteriorate and it will be hard to breathe.There will be greenhouse gases.,,
305,Don't know,,
306,One day no more oil or coal will be lost,,
307,Fossil energy will run out.,,
308,A lot of energy is gone.,,
309,The environment will be polluted and coal or oil will be lost,,
310,global warming due to pollution,,
311,"2) What happens in the future if you use a lot of fossil energy, such as coal or oil? *",,
312,Environmental pollution will destroy the world,,
313,I don't know.,,
314,L.,,
315,We're running out of fossil energy,,
316,We run out of fuel.,,
317,"Most of the resources are consumed, resulting in energy shortages.",,
318,All the energy is depleted.,,
319,environmental pollution,,
320,Fossil energy such as coal and oil is lost in the future,,
321,lack of fuel,,
322,Fossil energy will be lost and you won't be able to live.,,
323,The future environment will be polluted.,,
324,"Later, such things disappear and cannot be used.",,
325,Fossil energy such as coal and oil is depleted.,,
326,The environment is polluted.,,
327,"Due to lack of fossil energy, people will not be able to use electricity.",,
328,"Environmental pollution will worsen, and if fossil energy drops while using only fossil energy, the ecosystem may be destroyed.",,
329,Resources are reduced,,
330,Cars or electronics using fossil energy are likely to come out.,,
331,It will be an earth that has been irreversibly destroyed by coal and oil pollutants.,,
332,There will be more inconveniences in life due to the lack of coal or oil.,,
333,environmental pollution,,
334,"In the future, energy will be depleted and the environment will deteriorate",,
335,"In the future, it becomes a clean earth.",,
336,Technology will develop,,
337,"Coal, oil, and fossil energy will be exhausted and gone.",,
338,Global Warming Wors,,
339,We've used it up and our descendants won't be able to use it.,,
340,Fossil energy will be depleted and the environment will be further weakened.,,
341,I think there will be a day when I get sick and use up coal oil.,,
342,.,,
343,More carbon dioxide will increase global warming and change the climate.,,
344,The end is coming,,
345,Global warming,,
346,.,,
347,the disappearance of the future,,
348,Global Warming Happens,,
349,"Land will be devastated and lost, as it has been in the past and present, and competition between countries will also grow",,
350,The atmosphere is polluted and causes damage to mankind.,,
351,"Global warming will accelerate by emitting carbon dioxide and destroying smog and ozone, and the pace of future development will slow down.",,
352,Global warming will raise the temperature of the earth very high.,,
353,Global warming is getting worse,,
354,The earth searches.,,
355,.,,
356,The environment is polluted.,,
357,the intensification of global warming,,
358,망Network,,
359,Fuel depletion and global warming will intensify,,
360,The greenhouse effect increases.,,
361,"If depleted, great things can happen and the environment will be destroyed if we fail to prepare",,
362,The future becomes dark.,,
363,"Global warming will continue, eventually reaching the ice age.",,
364,"Oh, I'm running out of it's hard to use.",,
365,I'm running out,,
366,environmental destruction,,
367,Global warming is accelerated by the generation of greenhouse gases such as carbon dioxide.,,
368,The earth is sick.,,
369,The air gets worse and global warming gets worse,,
370,"Later, resources become scarce.",,
371,Lack of resources,,
372,"Increased carbon content in the air, global warming, fossil energy depletion",,
373,"There will be a lot of carbon dioxide, which will accelerate global warming.",,
374,"Greenhouse gas emissions destroy the environment, including global warming",,
375,"Global warming, environmental pollution, industrial development, etc",,
