306,"During the sunny day, the sandy beach was hotter than the sea water. As it became a sunless night, the sandy beach became cooler than the sea water. During the day, wind blew from the sea to the land, and at night, wind blew from the land to the sea. Use your knowledge of the relationship between air temperature, air pressure, and wind to explain your thoughts on the questions below.",,,
307,The water moves like a stir to create wind,,,
308,"Because of the temperature difference,",,,
309,on the waves,,,
310,The air pressure is different,,,
311,"Because the air is moving,",,,
312,There is a difference in temperature between the sea and the ground because air moves from a high atmospheric pressure to a low pressure.,,,
313,This is because the temperature difference between sand and seawater is severe.,,,
314,It's nourished by low pressure and high pressure,,,
315,I don't know.,,,
316,The temperature is different,,,
317,Because the sea is hotter than day at night.,,,
318,The waves are due to the tingling.,,,
319,I think it's because of the waves.,,,
320,I don't know.,,,
321,due to the current,,,
322,"During the day, when the air on the sandy beach heats up and goes up, the air on the sea side fills the remaining space, creating wind.",,,
323,"Because of the temperature difference,",,,
324,"During the day, sunlight is reflected in the sand, and the sand is hot, and during that time, the sea circulates to fill the remaining space, so the wind blows on the beach.",,,
325,"There is no mountain in the sea, so I think it will be windy.",,,
326,"The reason for the wind on the beach may be because of the air, temperature, and air pressure on the beach.",,,
327,Air becomes wind to cool off?,,,
328,"""Sand has a bigger temperature change than water, so during the day, cold water moves towards the hot wind.""",,,
329,"As we go, the wind blows to the land, and at night, the wind blows toward the sea.""",,,
330,"The temperature of the sea and the land is different, so the hot air on the land goes to the sea and the wind blows",,,
331,Because the wind blows everywhere.,,,
332,This is because the movement of the air has become stronger.,,,
333,It's because there's a wave.,,,
334,Because of the temperature,,,
335,The temperature of the sand and the sea is different,,,
336,It is small because the specific heat of the sea is larger.,,,
337,It's from a cool place to a hot place,,,
338,.,,,
339,"Water is a material that has a very high specific heat compared to sand. Therefore, when the temperature of the air is hot, there is a temperature difference between water and sand, and the wind blows from high to low pressure due to convection.",,,
340,Because the atmosphere is convectioned from high to low in the irreversible area,,,
341,The wind blows from low pressure to high pressure.,,,
342,.,,,
343,Because of the temperature difference,,,
344,"Water contains oxygen, exhales carbon dioxide, creating wind",,,
345,Because the temperature is high,,,
346,"Because the temperature of the beach is low due to the heat during the day, convection occurs due to the temperature difference, and wind occurs because it is opposite at night.",,,
347,"Land wind, sea wind. The air on the beach comes down and the air on the ocean goes up, so the wind goes from the beach to the ocean",,,
348,caused by the specific heat of the water,,,
349,by temperature,,,
350,Difference in temperature change,,,
351,Sea water evaporates into gas.,,,
352,.,,,
353,the movement of air,,,
354,"Since there's a temperature difference, of course there's wind. You don't know the wind, right? ㅉ",,,
355,"When the temperature difference between the sea and the land is large, it is mune",,,
356,a specific heat difference,,,
357,The difference in temperature between the land and the sea creates wind,,,
358,a barometric difference,,,
359,This is because rising and falling air currents are classified by the temperature difference of the beach.,,,
360,The sea is cold and the land is hot,,,
361,"Because of the temperature difference,",,,
362,a sea breeze,,,
363,It is because of the temperature difference between land and sea.,,,
364,The cause is the occurrence of sea and land winds caused by non-thermal differences.,,,
365,The temperature difference between the land and the sea creates a wind flow,,,
366,It is caused by the pressure difference.,,,
367,"Because of the difference between high and low pressure,",,,
368,It is windy to make up the energy difference.,,,
369,This is because the air moves because of the temperature difference between the sea and the land.,,,
370,The air pressure difference caused by the temperature difference between the land and the sea causes the wind to move from high pressure to low pressure,,,
371,Temperature difference due to the difference in specific heat between land and sea,,,
372,"This is because the specific heat of the ground and water is different, resulting in a temperature difference.",,,
373,Because it's the beach,,,
374,It is because of the difference in the heat between the sandy beach and the sea.,,,
375,"The wind blows from high pressure to low pressure, which is relative, not absolute.",,,
376,Because of the moon,,,
377,"On a sunny summer day, the sandy beach with a small specific heat becomes hot and the temperature of the air on the sandy beach increases. The high-temperature air tends to rise upward, so the air on the sandy beach rises, and the relatively low pressure on the sandy beach, and the wind blows from the sea with high specific heat toward the sandy beach.",,,
378,a land wind and a sea wind,,,
379,I don't know,,,
380,in the wind,,,
381,"Because sea waves, low pressure, high pressure, etc. make it",,,
382,The difference between the ocean and the land,,,
383,Temperature difference,,,
384,"""Difference in specific heat between land and sea water",,,
385,The air in the high places goes up,,,
386,"The air in the low places goes down.""",,,
387,Typhoon 'Sunset' Reappears,,,
388,"The temperature of the beach and the sea is different, so the land wind blows",,,
389,"Because the temperature of the sea and sand is different,",,,
390,the ebb and flow of the tide,,,
391,"The temperature is different between the sea and the land, so the gas circulates",,,
392,"Because of the difference in temperature, wind is generated on the beach.",,,
393,Because of the waves,,,
394,It's near the ocean,,,
395,"When the temperature rises, the air pressure decreases, which creates windThe difference between the temperature of the sea and the temperature of the land creates air movement.",,,
396,"This creates wind.""",,,
397,"Because of the heat difference between the land and the sea,",,,
398,This is because it occurs when moving from high pressure to low pressure.,,,
399,The hot air goes up. Wind is generated because the gas in the high temperature rises and the gas in the low temperature fills the space.,,,
400,"When the temperature rises, the air rises and becomes low pressure, and vice versa, it becomes high pressure and creates wind.",,,
401,Because of the temperature difference,,,
402,Because of the ebb and flow,,,
403,"The temperature of the land and the sea is different, so the wind blows from the cool sea to the land during the day and from the land to the sea at night",,,
404,Because of the waves,,,
405,The sea is strong,,,
406,"Because the sea is shaking from afar,",,,
407,The sea is strong,,,
408,Since it's the ocean,,,
409,I don't know.,,,
410,It's because of Hye-Byeon,,,
411,Because it's windy,,,
412,It's windy,,,
413,I don't know.,,,
414,The sun doesn't shine at night,,,
415,Because of the waves?,,,
416,The sun doesn't shine at night,,,
417,The wind is blowing from afar,,,
418,Because of the waves,,,
419,"As the earth rotates, the windmill rotates to form feet.",,,
420,It's because of the wind.,,,
421,I don't know.,,,
422,Because of the waves,,,
423,"High pressure and low pressure are created due to differences in temperature, so the wind direction is different at night and during the day.",,,
424,This is because the wind blows as the waves come.,,,
425,I don't know.,,,
426,I don't know.,,,
427,It is because of the convection phenomenon caused by the temperature difference between the beach and the sandy beach,,,
428,"This is because air rises as the temperature of the air on the sandy beach increases, and the sea water is lower than the sandy beach, so air moves toward the sandy beach where air is insufficient.",,,
429,Wind is generated by the temperature difference between seawater and sandy beaches.,,,
430,I don't understand.,,,
431,This is because the air pressure is different.,,,
432,"This is because the specific heat of seawater and sand is different, resulting in a difference in temperature between the two places.",,,
433,It is because of the temperature difference between land and sea.,,,
434,Because there's a big difference in air pressure on the beach,,,
435,This is because the wind blows from high pressure to low pressure.,,,
436,I don't know,,,
437,There will be wind at the beach because of the difference in air pressure.,,,
438,Because it's windy.,,,
439,Winds are created by differences in air pressure between the sea and the land.,,,
440,"During the day, the sandy beach is hotter than seawater, so the temperature of the gases above it also increases, which makes the density of the air lighter and rises. Since the place where the original air was located becomes low pressure, wind is generated as the air on the relatively cold seawater moves to fill the place.",,,
441,"During the day, when the temperature is higher on the land than on the sea and at night, when the temperature of the gas increases, the density of the gas becomes lighter and goes up, and wind is generated to fill this vacancy.",,,
442,"The specific heat in the sea is much larger than the specific heat in the sand, resulting in a temperature difference in the sea temperature during the day, which is smaller than the temperature in the sand, so the wind blows toward the sand at night.",,,
443,"Due to the difference in temperature and pressure in the air, the wind blows toward warmer seas.",,,
444,"The temperature of the seawater side and the sandy beach side is different, so the air on the higher side rises, and the air rises, and the air moves from the lower side to the higher side to fill the remaining empty space. This movement of air becomes wind.",,,
445,"Cold air goes down, hot air goes up, and air moves from high pressure to low pressure, and the sea has a temperature difference between the sandy beach and the sea, and when hot air goes up, it becomes low pressure, and when cold air goes down, it becomes high pressure, so wind blows.",,,
446,a sea breeze,,,
447,Because of the pressure difference between the sea and the beach,,,
448,due to the sea and land winds,,,
449,a drop in air pressure,,,
450,a barometric difference,,,
451,This is because air moves because the air pressure in the sea and the air pressure on the sand are different.,,,
452,I don't know,,,
453,I don't know,,,
454,(wink),,,
455,I don't know. I forgot.,,,
456,Because the temperature difference between sand and the sea is big,,,
457,Because of the temperature difference,,,
458,It is because the wind blows from high temperature to low temperature,,,
459,"Due to convection,",,,
460,...?,,,
461,Wind is created by the difference in specific heat between sand with small specific heat and water with large specific heat.,,,
462,the condition of being windy because of the waves,,,
463,The phenomenon of moving from cold air to hot air creates wind,,,
464,I don't know.,,,
465,There's a big difference in temperature,,,
466,I don't know.,,,
467,Air pressure changes due to temperature differences create wind,,,
468,"The land heats up faster than the sea, so the air rises and air comes from other places to fill the rising air, so that's the wind",,,
469,.,,,
470,It is caused by the temperature difference between the sea and the sandy beach.,,,
471,"The wind blows from relatively high pressure to low pressure, because there is a difference in air pressure due to the relative temperature on the beach.",,,
472,Convection Phenomenon Due to Temperature Difference Between Land,,,
473,"Because the specific heat of water is higher than the specific heat of sand, there is a temperature difference, and convection occurs, and there is a difference in air pressure and the wind blows",,,
474,"""The water is so hot that it heats up slowly and cools down, while sand on the beach heats up quickly and cools down quickly. During the day, the sand heats up faster and the sea water is relatively more",,,
475,"The temperature drops. The sea with low temperature becomes high pressure, and the sandy beach with high temperature becomes low pressure. The blast furnace wind blows from the sea toward the sandy beach.",,,
476,"At night, the sand cools down quickly, making the temperature lower than the sea, causing high pressure",,,
477,"The sea forms a low pressure. The blast furnace generates a land wind from land toward the sea.""",,,
478,be caused by sand and water,,,
479,Because the air is moving ^^,,,
480,Google,,,
481,"Wind goes up in the sky near the sun, and wind comes down from the sky far away from the sun, creating circulation and wind",,,
482,"Since the specific heat of the sandy beach is low, the degree of heat storage is small, but water has a large specific heat, so the degree of heat storage is large. The wind blows accordingly",,,
483,Air pressure difference occurred due to the temperature difference between land pressure difference and the sea,,,
484,"Warm air goes up and cold air moves to fill the empty space, creating wind.",,,
485,Warm air goes up and cold air seems to create wind to fill the empty space.,,,
486,The difference in temperature between sand and seawater creates wind as air circulates due to the difference in air pressure,,,
487,"Cold air is heavy, so warm air from the bottom is light and goes up, so warm sandy beaches and cold sea air circulate due to stomach properties, creating wind.",,,
488,"As the temperature of the earth rises due to solar heat, the warm air rises higher because it becomes lighter, and when the temperature decreases and becomes heavier, the air descends to the ground again, which is called convection",,,
489,"Earth's rotation, polar and equatorial temperature differences.the difference in specific heat between land and sea",,,
490,"During the day when the sun is shining, the sandy beach absorbs sunlight, so it is hot and the sea water is less hot. So the difference in temperature between the land and the sea creates wind",,,
491,This is because the temperature difference between the sea and the land is caused by the specific heat difference between water and sand.,,,
492,"Sand with a small specific heat is warmer during the day, and water with a large specific heat is warmer at night.",,,
493,"As the temperature warms, the volume of air expands, lowering the air pressure and rising upward.",,,
494,"Therefore, the area becomes low pressure. Winds blow from high-pressure areas to low-pressure areas, so winds blow into those areas.""During the day, the temperature of the seawater is higher than the temperature of the sandy beach, so the air on the sandy beach rises, and the air on the seawater descends, so the wind blows from sea to land.",,,
495,"At night, the temperature of the sandy beach and the sea water are low, so the air on the sandy beach decreases and the air of the sea rises, causing the wind to blow from land to sea.""",,,
496,the formation of low and high pressures due to changes in day and night temperatures in the sea and land,,,
497,"This is because the specific heat of seawater and sand is different, and the temperature difference between day and night, and the air on the seawater and sand is heated, and the degree of expansion and contraction is different, resulting in relatively low and high air pressure.",,,
498,"Because of the topography of our country,",,,
499,"Sand beaches and seawater have different specific heat, and accordingly, differences occur in cooling or heating each other. The atmosphere on the sandy beach or seawater increases the temperature in proportion to each, and the side where the temperature increases more becomes a relatively low pressure. The wind blows from high pressure to low pressure, so wind is generated by day and night on the beach.",,,
500,"The wind blows from high pressure to low pressure, and since the temperatures of the beach and the sandy beach are different, high pressure and low pressure occur, causing the wind to blow.",,,
501,It is caused by temperature differences between the sea and the land.,,,
502,Don't know,,,
503,The wind blows from a low temperature to a high temperature because the temperature difference between seawater and sand is severe every hour.,,,
504,.,,,
505,"""Wind is the flow of air.",,,
506,"The air on the sand and the air on the sea are different, so air flows.""",,,
507,"Air flows from high temperature to low temperature, because when land and sea are exposed to heat, the land is exposed to heat because there is no medium to resist heat, and the water and oxygen in it resist heat, resulting in a temperature difference relatively faster than the sea.",,,
508,It's because the wind moves in a direction full of waves,,,
509,The temperature difference caused by the specific heat of the water creates wind,,,
510,"During the day, air evaporates on the hot sandy beach, and cold air on the sea moves to the sandy beach to fill it.",,,
511,Because of the waves,,,
512,a tug-of-war between the moon and the earth,,,
513,This is because the temperature of the air is cold.,,,
514,The wind blew from the south,,,
515,The beach is cooler than other places and there are waves,,,
516,It's because the wind on the beach comes to the sea,,,
517,Because of the waves.,,,
518,"""The wind is cold because of the temperature of the sea",,,
519,"""It's turning to the side""",,,
520,Because of the waves.,,,
521,The wind is cooler on the sand than on the sea because of the temperature of the sea,,,
522,"If there's a temperature difference, it's windy",,,
523,Because of the waves,,,
524,The difference in temperature creates wind,,,
525,Water on the beach can cause wind,,,
526,Because of the air temperature and atmospheric pressure,,,
527,It is caused by the difference in air heat between the sea and the land,,,
528,This is because the wind blows whenever there is a temperature difference.,,,
529,"Because of the difference in temperature from the land, the air pressure is different and the wind blows",,,
530,Because of the atmospheric pressure,,,
531,Because of the waves,,,
532,Don't know,,,
533,The air pressure is different,,,
534,"The temperature changes on the beach are less, the temperature is lower, and the air pressure is high, so the wind blows toward the land.",,,
535,"During the day, there's a meat wind and in the evening, there's a sea wind",,,
536,The temperature of the ocean and the beach are different,,,
537,God blew the wind,,,
538,It's because there's a land wind during the day and a sea wind at night,,,
539,Because the air moves;;;;;;,,,
540,"Because the beach is wide,",,,
541,That happens because the air goes from cold to hot,,,
542,Because of the sea,,,
543,Because the earth rotates,,,
544,"During the day, there's a meat wind, and at night, there's",,,
545,sea smoldering,,,
546,"During the day, there is a land wind and at night, there is a sea wind",,,
547,the movement of air by the waves,,,
548,"Warm air goes up and cold air goes down, so air circulates and creates wind",,,
549,"The air in the high-pressure area rises, and the air moves to fill the air volume in the high-pressure area",,,
550,by the flow of air,,,
551,"Because the rate at which the temperature of the sandy beach and seawater changes is different, the air in the higher temperature rises and the air in the lower temperature moves to the higher temperature, creating wind.",,,
552,"""The wind moves from high pressure to low pressure, and then it creates wind, and when the warm wind goes up, it creates an empty space, which is created when cold air enters the empty space",,,
553,"""Things""",,,
554,It is windy at night because the hot air goes up and the cold air goes down,,,
555,Hot air goes up and cold air goes down,,,
556,"Warm air goes up and cold air goes down, creating wind.",,,
557,Because warm air goes up and cold air goes down,,,
558,"During the day, the wind blows from the sea to the land because it is warmer than the sea, and at night, the wind blows from the land to the sea because the land is warmer than the sea.",,,
559,It seems to be caused by air circulation due to the temperature difference.,,,
560,This is because the sea breeze blows.,,,
561,I don't know.,,,
562,Because the air in the sea keeps getting swollen?,,,
563,"""When the air from the sea comes to the land and the air from the land goes up to the sky, the air from the land becomes empty",,,
564,"""Because the air from the sea comes to the land.""",,,
565,Cold and hot air meet the gate.,,,
566,I don't know,,,
567,I don't know,,,
568,I don't know.,,,
569,This is because wind is generated by the temperature of the air.,,,
570,I don't know.,,,
571,I don't know.,,,
572,Because it is the wind from other countries.,,,
573,.,,,
574,There's a land wind near the sea,,,
575,"The sea water is cold, so the cold heat blows in the wind",,,
576,"Because the sand gets hot during the day, and the air in the sea moves to the land",,,
577,Because the wind blows everywhere.,,,
578,The heat from the water rises to the sky and creates a cold wind.,,,
579,Because the sand is hot and the sea is cool,,,
580,The ocean is cooler than sand,,,
581,I don't know,,,
582,It's going to go up well.,,,
583,I don't know.,,,
584,This is because the sea breeze blows.,,,
585,I don't know.,,,
586,Because the sea is cooler than sand On average.,,,
587,Because there are waves,,,
588,I don't know.,,,
589,yeyyeyeyeyeyeyyeyeyyyyeyeyyeyeyeyeyeyyyyyeyeyyeyeyeyyeeeeyyeyeyyeyyeeyeyeyeyeyyeyeyyyeeeyyeeyyeyeeyeyyeeyeyeyyeyyeyeyyeyyeyeyyeeyyeyeyyeyeyyeyer,,,
590,I don't know,,,
591,"During the day, the air on the land is hot, so the air goes up, and the air on the water blows to the beach",,,
592,I don't know.,,,
593,Just.I don't know.,,,
594,????????,,,
595,It's because of the waves.,,,
596,"Since the air moves from high pressure to low pressure, the hot sandy beach is low pressure, so wind flows from the sea to the sandy beach.",,,
597,Because of the waves,,,
598,I don't know,,,
599,This is because the moon makes the tide and the ebb.,,,
600,Because of the sea,,,
601,The wind is booming because of the low temperature on the beach,,,
602,?,,,
603,???,,,
604,This is because the sea heats up later than on land.,,,
605,Hot air and cold air meet,,,
606,The wind blows from afar,,,
607,It's windy.,,,
608,There's a difference in air pressure,,,
609,Because there's land and sea winds,,,
610,The cold air of the sea and the hot air of the ground meet,,,
611,The cold air from the sea comes to the beach,,,
612,It's because of the air flow of air,,,
613,There's water.,,,
614,The convection of air creates wind.,,,
615,It is caused by the direction in which the air travels.,,,
616,"The hot air on the beach goes up, and the cool air on the beach comes from there",,,
617,????????????????,,,
618,The sand creates hot heat,,,
619,There is a stronger wind as the waves hit.,,,
620,It is because the hot air on the beach goes up and the cool air on the side of the sea comes in,,,
621,It's when the low and high pressures meet and merge.,,,
622,Isn't the wind everywhere?,,,
623,"Because of the convection of air,",,,
624,??,,,
625,High pressure and low pressure meet to create wind,,,
626,"During the day, the land is hotter, so the air pressure is high, and the wind blows from the sea with low air pressure.",,,
627,Because the climate and temperature have changed,,,
628,It is because of the temperature change of the air.This is because the air sometimes goes up and down.,,,
629,The air can go up or down,,,
630,Different air comes together,,,
631,This is because the air can go up or down.,,,
632,I don't know.,,,
633,I don't know.,,,
634,I don't know,,,
635,The temperature of the land has dropped,,,
636,I don't know.,,,
637,Because of the sea breeze,,,
638,Because of the sea breeze,,,
639,in the wind,,,
640,Because it's windy,,,
641,a sea breeze,,,
642,It's caused by the evaporation of seawater?,,,
643,against the wind on land,,,
644,Wind is created because the temperature of the air is different from the land.,,,
645,Because of the temperature difference?,,,
646,"Because the air moves according to the temperature change,",,,
647,Because the earth rotates,,,
648,"The sea is cool, so it creates wind.",,,
649,I don't know,,,
650,Wind blew from the sea,,,
651,Because the beach is cold,,,
652,I don't know,,,
653,the circulation of seawater,,,
654,I do not remember.,,,
655,"Due to the difference in air pressure between the sea and the sandy beach, air moves to a place with low air pressure, creating wind.",,,
656,Because of the beach breeze,,,
657,This is because the atmosphere moves from the warm to the cold side.,,,
658,the movement of air,,,
659,"Unlike land that is quickly heated by sunlight, the sea that is slowly heated by sunlight blows from low-temperature sea to land during the day and from low-temperature land to sea at night.",,,
660,the difference in specific heat between land and sea,,,
661,This is because the temperature difference occurs because the sea and sandy beaches receive the same amount of solar heat and cool down at different speeds.,,,
662,a difference in temperature difference,,,
663,convection,,,
664,Because of the temperature difference between the sandy beach and the sea,,,
665,It's because of the steam,,,
666,It is the difference between temperature and atmospheric pressure.,,,
