630,"If you increase the intensity of electricity and speed up the flow of current, the compass needle will move more.",,
631,More undercurrents are likely to be needed.,,
632,The battery is further connected to allow a strong current to flow.,,
633,We need to add batteries,,
634,Use a more powerful battery. Use more batteries.,,
635,I don't know,,
636,cause the current to flow harder,,
637,Add batteries or use strong batteries,,
638,Add batteries.,,
639,Increase the number of batteries.,,
640,Add Battery,,
641,Add batteries to allow more current to flow.,,
642,Change the positions of the + and - poles of electricity.,,
643,Add a battery to allow more current to flow.,,
644,use more batteries,,
645,Add more batteries to make the current stronger,,
646,Add batteries and connect them in series to strengthen the current.,,
647,I don't know,,
648,Press and release the switch quickly,,
649,increase the electric current,,
650,Add more batteries.,,
651,I'm going to add one more electrical circuit,,
652,Increases the power of electrons?,,
653,Add an electrical circuit,,
654,.,,
655,It allows a stronger current to flow.,,
656,Add batteries.,,
657,Connect more batteries to make the current stronger.,,
658,Change the direction of the current.,,
659,The current needs to be stronger.,,
660,to increase the current,,
661,Serial battery connection,,
662,Add batteries.,,
663,Connect the batteries in series.,,
664,Take a magnet and put it on the compass and the needle will move more.,,
665,Forgetting,,
666,"The number of batteries can be connected more in series. The reason why the needle of the compass moves is due to the magnetic force due to the electric force, and since the intensity of the electric force and the intensity of the magnetic force are proportional, increase the number of batteries that can increase the intensity of the current.",,
667,I don't know,,
668,A circuit should be added to allow the compass to move due to friction between the N and S poles.,,
669,Turn on the electrical circuit,,
670,Let the same biographies meet,,
671,to make the current flow more strongly,,
672,Place the wires on the compass.,,
673,I don't know...,,
674,(I don't know),,
675,Switch on and off and repeat,,
676,Let's make more electrical circuits.,,
677,It allows an electric current to flow.,,
678,You have to press the switch more to make the current flow better,,
679,Connect the battery more by connecting it in series.,,
680,Maybe we can make more electricity flow,,
681,Add more batteries and batteries,,
682,Add batteries and close the switch,,
683,a lot of electricity,,
684,Add and connect circuits.,,
685,"If you connect multiple electrical circuits and place them on a compass, they will move more.",,
686,Add an electrical circuit.,,
687,Connect more batteries to increase the strength of electricity.,,
688,Connect two more wires.,,
689,Connect more electrical circuits.,,
690,N o m n o m n o m,,
691,I don't know,,
692,Connect one more battery in seriesput a magnet around,,
693,I don't know,,
694,Add wires to make more current flow.,,
695,"The compass moves according to the magnet, but when you make electricity flow through the wire, the needle in the compass moves",,
696,Use more electricity to make it move,,
697,Electricity and magnetism?,,
698,Add batteries.,,
699,"The compass moves according to the magnet, and the needle of the compass moves when current flows through the wire.",,
700,Use battery and cable lines to move,,
701,Experiment with two layers of wires.,,
702,use more electricity,,
703,No.,,
704,Add batteries,,
705,d,,
706,use more electricity,,
707,Using a magnet is... What do you think?,,
708,I think it would be good to use a magnet instead of electricity.,,
709,I think you can put a big magnet on the compass needle and turn it around.,,
710,Use a magnet to change the direction of the compass,,
711,Move the compass needle and wire in the direction,,
712,Let the electricity flow more,,
713,You can connect it with two electricity,,
714,"A few more batteries are connected in series to increase the intensity of the current, making the needle of the compass move more.",,
715,use more electricity,,
716,use a magnet,,
717,"""What should I do to make the compass needle move more without moving the compass (if you need anything, you can add it to the electrical circuit)? *",,
718,"""As the current becomes stronger, the magnetic field around the conductor becomes stronger, so the needle in the compass reacts more loudly by the stronger magnetic field, and the needle in the compass moves more.""",,
719,Connect more batteries to increase the current or change the metal used for conducting wires to lower resistance for better electrical conduction. Reduce resistance by shortening the length of the wire and thickening the head system.,,
720,"If the battery is possible, connecting a lot in series will make the current stronger, so the compass will move a lot.",,
721,Adding a diode to the electrical circuit and continuously changing the direction of the current by continuously changing the direction of the magnetic field can make the compass needle move more.,,
722,It makes electricity stronger.,,
723,"There is a way to add batteries. The addition of batteries will increase the amount of current flowing through the electrical circuit, thereby making the magnetic field force around the circuit more powerful, so the compass needle made of magnets will also move more.",,
724,"This experiment is important because if current flows through a wire, a magnetic field is generated around it. There was no magnetic field in the past, but when the electric current flows to the wire, the magnetic field is formed, so if you use a stronger battery or connect two batteries to make the current stronger, the magnetic field will become stronger and wider, and the needle in the compass will move more.",,
725,The electrical circuit is continuously energized Design and install a device that can be given and given.,,
726,I don't know. I don't know.I don't know. I don't know.I don't know. I don't know.I don't know. I don't know.I don't know. I don't know.I don't know. I don't know.I don't know. I don't know.I don't know. I don't know.I don't know. I don't know.I don't know. I don't know.I don't know. I don't know.I don't know. I don't know.I don't know. I don't know.I don't know. I don't know.,,
727,"The reason why the compass moves is that the compass needle, which is a magnet, moves because an electric current flows to form a magnetic field. There is a condition that an electric current must flow for the compass needle to move. In order for the compass to move more, more current must flow. In order to let more current flow, more batteries need to be added. Adding a battery will increase the amount of current flowing, so the compass will move more. This method can also make the compass needle move more, as more current can be seen if the wire is thickened.",,
728,Connect additional batteries in series.,,
729,"Increase the number of cells to increase the intensity of the current. Alternatively, the electric wire is changed to something made of a material with a small resistance to reduce the resistance and increase the strength of the current.",,
730,"The movement of the compass needle is affected by the intensity of the current. To make the needle move more, there is a way to increase the intensity of electricity by adding a battery.",,
731,"In a situation where the current in the electric circuit flows, if the pole pointed to by the compass is the same as the pole in the electric circuit, it will move a lot.",,
732,Move the red in reverse,,
733,an electromagnet,,
734,I use more batteries,,
735,We need to make the power of electricity stronger,,
736,Add an electromagnet,,
737,Add another battery.,,
738,Replacement of .+rang-seul,,
739,Use a powerful current or magnet,,
740,I don't know,,
741,Add more batteries.,,
742,an electric wire,,
743,Close the switch and the compass moves as the current flows,,
744,"The stronger the current, the more it will move For example, connect two batteries in series.",,
745,Raise the intensity of the magnetic force line by raising the intensity of the electron.,,
746,Increases the intensity of an electric current.,,
747,Add batteries in series.,,
748,"To move the compass, there are ways to change the wire to a material with less resistance and to make the wire shorter and thicker.",,
749,I don't know.,,
750,I didn't learned it yet,,
751,I don't know,,
752,Magnet,,
753,I didn't learn it.,,
754,Magnet,,
755,I didn't learn it,,
756,I don't know.,,
757,Turn it in the direction of the current,,
758,Move the magnet.,,
759,Add another battery,,
760,Add an electrical circuit,,
761,We need to increase the magnetic force,,
762,Add an electrical circuit.,,
763,Connect more batteries,,
764,Move the compass needle with a magnet.,,
765,Position the electrical circuit.,,
766,I don't know,,
767,Place a magnet near the electrical circuit (additionally),,
768,Place wires and compasses side by side to allow more current to flow.,,
769,No learning,,
770,"""Use batteries and electric wires to make electricity flow.",,
771,(The compass moves on current.),,
772,I don't know,,
773,Put more wires on the compass.,,
774,Light it up,,
775,increase the intensity of an electric current Connect more in series or increase the voltage.,,
776,Increase the intensity of the electric current.,,
777,It makes the current stronger.,,
778,Increase the voltage.,,
779,Put a magnet on it.,,
780,Add more batteries.,,
781,Insert more batteries.,,
782,Add the battery as a serial connection. Bring the wires closer together.,,
783,Use a stronger battery.,,
784,Increase the intensity of the current or bring the wire closer to the compass.,,
785,Increase the number of batteries.,,
786,Reduce resistance or connect cells in series.,,
787,Harder batteries,,
788,Increase the number of batteries.,,
789,Increase the current intensity.,,
790,Add batteries in series.,,
791,"Increase the voltage.Reduced resistance, increased battery voltage, increased current",,
792,He's doing it the opposite,,
793,move the front,,
794,"The needle of the compass is moved by a magnetic field flowing around the wire. Therefore, in order to move the needle of the compass larger, you can increase the intensity of the magnetic force flowing around the magnetic field, so you can use a battery with a higher voltage.",,
795,Connect the batteries to both sides,,
796,It uses a magnet.,,
797,It causes the current to flow hard.,,
798,Apply more power.,,
799,lift only three electric currents,,
800,Change the battery to something with a stronger current,,
801,It makes the battery stronger.,,
802,Use a stronger battery.,,
803,It allows an electric current to flow.,,
804,It gives a stronger current.,,
805,Power up the current.,,
806,Use more batteries,,
807,Turn the switch off and on quickly.,,
808,I think you can use a stronger battery.,,
809,Power up the current.,,
810,Use a battery with a higher voltage or connect the battery in series to allow a larger current to flow through the circuit.,,
811,Use stronger cells or connect more cells to allow larger currents to flow.,,
812,It sends the electric current harder,,
813,Add more batteries.,,
814,Change to a strong battery or connect several batteries.,,
815,It makes the cell stronger.,,
816,Reduce resistance by connecting more batteries or increasing the thickness of the wires.,,
817,Add a battery to increase the magnitude of the current.,,
818,Increase the voltage. (Connect the cells in series.),,
819,Add more batteries and connect them in series.,,
820,"If you add batteries in series to the electrical circuit to increase the voltage, the needle moves more.",,
821,I'm hungry,,
822,The battery is connected in parallel to amplify the intensity of the current.,,
823,"If a battery of higher voltage is used or additional batteries are connected in series to increase the voltage, the current will increase and the magnetic field around the wire will increase. A stronger magnetic field makes the compass needle move more.",,
824,Press the switch,,
825,Magnet,,
826,Additional batteries,,
827,make use of electricity,,
828,I don't know.,,
829,The cells are connected in series to increase the intensity of the current.,,
830,Connect additional batteries in series,,
831,cause a lot of electricity to flow,,
832,Add more batteries in series,,
833,I'm touching you touch it.,,
834,It increases the intensity of the current.,,
835,"""",,
836,It changes the flow of electric current,,
837,use more electricity,,
838,It makes electricity flow,,
839,ㅁㄹㅇ,,
840,Place the compass on the wire,,
841,"In this situation, the way to make the compass needle move more is if you install a device that turns the direct current battery into alternating current, you can observe more movement. If you install an alternating current, the compass poles are alternately pointed to the left and right, so you can see them continuously vibrating or rotating. But in this situation, if you make the frequency too high, you might not be able to rotate many angles, so if you have a free frequency, you will move more.",,
842,Turn the voltage up the voltage,,
843,I don't understand.,,
844,"If you add more electric circuit and move it, it will move a lot",,
845,"Change the position of the wire, such as changing the wire from the bottom to the top, or change the direction of the needle through the magnet by adding a magnet.",,
846,Move the wires from bottom to top.,,
847,"If I press the switch, the current will be blurred and I think it will move.",,
848,Install more circuits,,
849,Install electromagnets in various directions,,
850,Install electromagnets in various directions,,
851,to increase the current,,
852,Add an electromagnet and let current flow through the wire.,,
853,"Adding an electromagnet, current flowing through the wire",,
854,k,,
855,I don't know.,,
856,It allows a stronger current to flow,,
857,causing a stronger current to flow,,
858,.,,
859,Then let's add more,,
860,a strong battery,,
861,Increase the number of batteries.,,
862,The battery needs to be stronger.,,
863,with a strong electric current,,
864,strengthen the strength of the battery,,
865,Add an electric fan,,
866,Add batteries,,
867,.,,
868,Set up a front around.,,
869,Connect more complexly or apply more pressure,,
870,.,,
871,Add batteries.,,
872,Add more batteries,,
873,Turn up the power.,,
874,.,,
875,Add batteries.,,
876,You can't do that,,
877,It makes the current flow harder.,,
878,increase the electric current,,
879,Increase the voltage,,
880,What?,,
881,It sends electricity,,
882,Turns the strength of the cell into something stronger,,
883,It makes electricity stronger. Use two batteries.,,
884,Add more batteries to the electrical circuit.,,
885,Increase the voltage.,,
886,Add batteries.,,
887,increase the intensity of electricity,,
888,Connect more batteries with direct current,,
889,It causes the current to flow hard.,,
890,It makes the current flow stronger.Power cycle.,,
891,"increase the current, weaken the voltage",,
892,I don't know,,
893,Increase the amount of battery,,
894,Connect more cells in series.,,
895,Press and hold the switch.,,
896,I don't know.,,
897,Connect the batteries in series,,
898,sorry,,
899,to run out of electrically,,
900,M,,
901,"Increase the intensity of the current (use a stronger battery, use multiple batteries). )",,
902,All right.,,
903,Adjust the intensity of the current strongly.,,
904,"To make the needle move more, it allows a lot of current to flow.",,
905,All right.,,
906,Putting the electric wire connected to the battery on the compass,,
907,I don't know,,
908,We add a wire or something to an electrical circuit,,
909,I don't know.,,
910,?,,
911,I don't know.,,
912,It makes electricity flow more.,,
913,I don't know,,
914,a compositional book,,
915,I don't know.,,
916,I don't know.,,
917,I don't know,,
918,I don't know.,,
919,I don't know.,,
920,Change the direction of the current.,,
921,I don't know,,
922,We need a sound man and a wire.,,
923,Add an electrical circuit.,,
924,Change the direction of the current.,,
925,Add more electrical circuits,,
926,I don't know.,,
927,Add one more battery to strengthen the electricity.,,
928,Just press the switch,,
929,Just press the switch,,
930,It's moving with electronics,,
931,Just press the switch,,
932,Add an electrical circuit,,
933,contacting electrical wires that touch the batteries,,
934,It is to use a lot of magnets.,,
935,Add an electrical circuit.,,
936,"If you use more electrical circuits, the compass will run more",,
937,I don't know.,,
938,"If you use a lot of electrical circuits, the compass will turn",,
939,a battery circuit,,
940,I don't know,,
941,Add batteries.,,
942,I don't know.,,
943,I don't know.,,
944,We can make more electrical circuits,,
945,I don't know,,
946,I don't know,,
947,I don't know.,,
948,"Move what is under the compass without turning it all the time. (e.g., turn the desk around.",,
949,I don't know,,
950,Place the compass under the wire and close the switch to increase the current.,,
951,increase the intensity of an electric current,,
952,I don't know,,
953,increase the intensity of an electric current,,
954,battery,,
955,I don't know,,
956,Use something with stronger electricity.,,
957,I don't know.,,
958,Use an electrical circuit to allow current to flow,,
959,increase the intensity of an electric current,,
960,"Because compass needles respond to current, when current flows through the compass saliva, the compass saliva moves.",,
961,I don't know.,,
962,I don't know.,,
963,Increase the intensity of the current.,,
964,I don't know,,
965,I don't know.,,
966,I don't know,,
967,Keep the electricity closer,,
968,I don't know,,
969,Bring a lot of strong electricity and stick it on,,
970,Bring the current closer,,
971,by the force of the wind,,
972,Don't know,,
973,I haven't done it yet.,,
974,No learning,,
975,I don't know,,
976,I haven't learned it yet,,
977,I don't know,,
978,Make the current flow stronger or increase the switch to connect a lot of wires in many directions,,
979,No learning,,
980,Changing the direction of the current,,
981,I don't know,,
982,I don't know,,
983,I don't know,,
984,line,,
985,I don't know,,
986,Because the compass needle has to move to know the location.,,
987,increase the intensity of an electric current,,
988,I don't know,,
989,I don't know.Send the current to your compass,,
990,You have to let more current flow down,,
991,I don't know,,
992,Add batteries.,,
993,The other way around,,
994,Turn on the electricity.,,
995,an increase in electricity,,
996,Increases the voltage strength.,,
997,to provide more electricity,,
998,Turn up the electricity,,
999,Increase the power of electricity.,,
1000,Press and hit the switch repeatedly.,,
1001,It gives a larger current.,,
1002,Connect more cells to electrical circuits in series.,,
1003,Add one more battery and connect it in series.,,
1004,Add an electrical circuit,,
1005,send more electricity,,
1006,Connect more batteries in series.,,
1007,Connect the batteries,,
1008,M and D,,
1009,Increase the current.,,
1010,to install batteries to increase current,,
1011,Add batteries.,,
1012,Add batteries,,
1013,Connect in series or increase the number of batteries,,
1014,I don't know...............,,
1015,I don't know...............,,
1016,I don't know,,
1017,I don't know.,,
1018,I don't know,,
1019,I don't know,,
1020,I don't know,,
1021,It adds three more electrical current.,,
1022,increase the intensity of an electric current,,
1023,increase the electric current,,
1024,I don't know,,
1025,Add one more battery,,
1026,.,,
1027,Don't know,,
1028,I don't know,,
1029,Increase the amount of current,,
1030,Turn up the voltage,,
1031,I'm adding a pattery Turn up the voltage,,
1032,Flow the AC current,,
1033,We need to turn on the electricity★,,
1034,Add batteries,,
1035,Increase the voltage.,,
1036,Makes the current flow stronger or reduces resistance.,,
1037,Add batteries.,,
1038,Add batteries in series.,,
1039,"""I don't know",,
1040,"""",,
1041,h,,
1042,h,,
1043,I don't know,,
1044,.,,
1045,It's good for electricity,,
1046,to increase the current,,
1047,.,,
1048,Add batteries,,
1049,....,,
1050,I don't know,,
1051,Put the circuit underneath,,
1052,to increase the current by adding batteries,,
1053,Add more batteries,,
1054,Add more batteries.,,
1055,Add more batteries.,,
1056,Connect more batteries in series,,
1057,Move the direction,,
1058,I don't know.,,
1059,?,,
1060,It sends more electricity,,
1061,Add batteries,,
1062,I don't know.,,
1063,battery,,
1064,I don't know.,,
1065,I don't know.,,
1066,Connect more batteries,,
1067,Using Magnets,,
1068,It makes the current stronger,,
1069,a battery,,
1070,Add more batteries,,
1071,move the compass with one's fingers,,
1072,to increase the current,,
1073,Add batteries,,
1074,change the intensity of an electric current,,
1075,Add more cells in series.,,
1076,increase the amount of electric current,,
1077,The battery is further connected in series to increase the intensity of the current.,,
1078,"Increase the intensity of the current to increase the width of the needle shaking of the compass. Alternatively, if the current continues to change for a very short period of time, the direction indicated by the N pole of the compass will continue to move, and the object will continue to move in the opposite direction by acceleration, but the stone will increase over the same period of time.",,
1079,Add batteries,,
1080,I don't know.,,
1081,It's a mess,,
1082,give power to,,
1083,Increase the battery,,
1084,It sends more electricity,,
1085,Blowing the Wind,,
1086,I don't know any more,,
1087,I don't know any more,,
1088,Add more batteriesM and D,,
1089,to flow more electricity,,
1090,Connect the batteries in parallel,,
1091,Add batteries,,
1092,Add more batteries.,,
1093,Move the needle more,,
1094,It makes electricity flow,,
1095,Wire the compass to another position.,,
1096,I don't know.,,
1097,Increase the number of batteries by serial connection.,,
1098,Wind the coil a lot. Increase the intensity of the current.,,
1099,Increase the voltage.,,
1100,Apply a stronger current,,
1101,Increase the current strength,,
1102,Move the line below the compass. Change the direction of the battery.,,
1103,increase in the intensity of an electric current,,
1104,Increase the intensity of the current (additional battery),,
1105,Increases the intensity of an electric current.,,
1106,Use a battery with a large voltage value.,,
1107,Increase the voltage by connecting the batteries in series.,,
1108,Increase the battery voltage.,,
1109,Increase the intensity of the electric current. Reduce wire resistance.,,
1110,Increase the intensity of the electric current.,,
1111,Connect more batteries in series.,,
1112,Connect more batteries.,,
1113,Add batteries to increase the intensity of the electric current.,,
1114,More current must be allowed to flow. Put more batteries.,,
1115,Put a magnet on it,,
1116,Change the battery part to the car battery.,,
1117,Add batteries in series,,
1118,Use more batteries,,
1119,Add batteries,,
1120,It allows an electric current to flow.,,
1121,Add batteries,,
1122,strengthen the intensity of an electric current,,
1123,Add more batteries.,,
1124,strengthen an electric current,,
1125,Connect more wires,,
1126,L.,,
1127,Put a magnet on it,,
1128,Connect more batteries.,,
1129,Increase the intensity of the current.,,
1130,I don't know.,,
1131,I don't understand.,,
1132,It sends an electric current more strongly,,
1133,"If you press the switch and repeat it, it moves a lot",,
1134,"""1. Use a lot of batteries.",,
1135,"2. Use a strong battery.""",,
1136,I don't know,,
1137,All right.,,
1138,Strengthen electrical power,,
1139,I don't know.,,
1140,I have no idea.,,
1141,I don't know,,
1142,"""Make the current stronger",,
1143,"""It's flowing""",,
1144,I don't remember,,
1145,It sends electricity hard,,
1146,Insert the battery,,
1147,Add a wire,,
1148,More batteries are connected to strengthen the intensity of the flowing current.,,
1149,I don't know,,
1150,Touch the wires.,,
1151,It flows electricity,,
1152,I don't know,,
1153,The electric current flows strongly,,
1154,The electric current flows strongly.,,
1155,The electric current flows strongly.,,
1156,It sends an electric current stronger.,,
1157,"If you increase the amount of battery, it will move more.",,
1158,Place the electrical circuit in a reverse direction on the Nazi's.,,
1159,Add batteries.,,
1160,strengthen the magnetism,,
1161,"I'm sorry, friends",,
1162,Add more electrical circuits.,,
1163,All right.,,
1164,Send electricity here and there,,
1165,Add the battery to the electrical circuit.,,
1166,Change the direction of the current,,
1167,"""The direction of the current",,
1168,"""I'm changing it""",,
1169,Change the direction of the current,,
1170,Take a magnet and spin it around the compass,,
1171,Connect one more battery in series,,
1172,It makes it move with a magnet.,,
1173,"Shake it.""",,
1174,"First, we need to increase the strength, so prepare one more battery and add two more wires to increase the strength by connecting them in parallel",,
1175,Connect more batteries,,
1176,Add more battery connections to make the current stronger.,,
1177,Add an electrical circuit,,
1178,Take the electrical circuit's wires in a straight line to the compass consistent with the compass needle.,,
1179,Connect the current.,,
1180,"Increase voltage, increase power, or decrease resistance.",,
1181,It makes the compass needle move by making magnetic with the energy of the battery.,,
1182,increase the intensity of an electric current,,
1183,Lower the resistance and increase the voltage,,
1184,"I think if you attach a magnet with a very strong magnetic force, it can move around a lot.",,
1185,Lowering resistance,,
1186,Lower the resistance and increase the voltage,,
1187,I'm using more batteriesLower the resistance and increase the voltage,,
