376,"In the future, fossil energy such as coal and oil to be used will be depleted, and global warming will intensify due to increased greenhouse gases in the atmosphere.",,
377,a bad thing,,
378,The greenhouse effect will increase.,,
379,Resources are depleted and environmental pollution such as global warming worsens,,
380,run out of energy,,
381,"The increase in greenhouse gas emissions speeds up the progress of global warming, and because it is a finite energy resource, it will cause serious economic problems if it is depleted without developing alternative energy.",,
382,The earth is going to perish,,
383,natural exhaustion,,
384,.,,
385,.,,
386,I'm doomed.,,
387,Die.,,
388,Environmental pollution becomes severe and problems of resource depletion arise.,,
389,Fossil prices go up.,,
390,The coal is gone Global warming is severe,,
391,The amount of carbon dioxide will increase,,
392,"The demand for fossil energy will increase, and the supply will decrease, making it difficult to develop.",,
393,The earth is going to perish,,
394,The earth will perish one day.,,
395,Fossil Energy ExpensiveEnvironmental pollution becomes severe and fossils are depleted,,
396,run out of energy,,
397,resource depletion,,
398,Global warming,,
399,"It becomes more dependent on renewable energy, that is, nuclear power.",,
400,The energy runs out.,,
401,The environment will be destroyed and all life on Earth will die.,,
402,"""I can't use electricity such as cars, TVs, etc",,
403,"Destroy nature.""",,
404,"If we use the future, we don't have the resources to pass on to our descendants",,
405,lose one's footing,,
406,run out of resources,,
407,Oil is gone,,
408,"In the future, coal and oil will not be used.",,
409,h,,
410,I don't know.,,
411,"There will be a lot of smoke, air will be polluted, and animals will die",,
412,It's disappearing.,,
413,There are times when fire can't be used.,,
414,It's getting dark.,,
415,"""Life becomes uncomfortable",,
416,"Because there's no such thing as a car.""",,
417,bad environment,,
418,Oil or coal will go to waste,,
419,Nature is destroyed.,,
420,environmental pollution and the disappearance of coal and oil,,
421,You have to walk around,,
422,There's a lot of carbon dioxide.,,
423,I don't know.,,
424,There is no coal or oil in the future,,
425,ㅊ,,
426,The earth is coming to an end.,,
427,"Global warming will accelerate and glaciers will melt, making the entire planet an ocean.",,
428,Global warming is coming.,,
429,"Later, fossil energy will eventually run out and the environment will be destroyed.",,
430,Bad things happen,,
431,It will run out,,
432,Abnormal weather such as global warming occurs.,,
433,The earth is in pain.,,
434,Environmental pollution becomes serious.,,
435,The environment will be destroyed and fossil energy will be insufficient to exhaust energy.,,
436,Global warming gets worse.,,
437,"The concentration of carbon dioxide in the air increases, accelerating global warming",,
438,Global warming accelerates.,,
439,"The climate will be very polluted in the future. And if it's all depleted, this will eventually lead to a resource war or all countries will invest a fortune in renewable energy projects.",,
440,"Coal oil is made up of carbon hydrogen, which is the main culprit of global warming. Therefore, using a lot of fossil energy will intensify global warming.",,
441,I don't know.,,
442,Coal and oil will no longer be used.,,
443,"The use of fossil energy increases greenhouse gas emissions, accelerating global warming. This makes it impossible to live on Earth.",,
444,"""If we continue to use coal and oil a lot, greenhouse gas emissions will continue to increase",,
445,"As a result, global warming is accelerated and the environment of the Earth continues to be destroyed.""",,
446,There is a lot of greenhouse gases and global warming occurs.,,
447,"Resource war, becomes a desolate nature.",,
448,"Global warming becomes more rapid, and abnormal weather occurs more frequently, leading to the end of the world.",,
449,"If you use a lot of fossil energy, it hurts the environment due to exhaust gas generated while using it, and if you continue to use it, it will run out one day and you cannot prepare for it, so you need to replace it with renewable energy as soon as possible.",,
450,"Global pollution is rapidly disappearing, and the North and South Poles are disappearing",,
451,"Carbon dioxide is a greenhouse gas, but when it's generated a lot, the greenhouse effect gets worse",,
452,run out of energy,,
453,"""In the future, we may move into space",,
454,"""I don't know""",,
455,Global warming,,
456,"More carbon emissions will worsen global warming, melting glaciers and reducing land area.",,
457,ㄹ and ㅂ,,
458,I don't know,,
459,He he,,
460,Global warming accelerates and endangered animals become extinct.,,
461,More carbon dioxide,,
462,Global Warming Occurrence,,
463,The ozone layer is destroyed and the spacecraft enters,,
464,Global warming,,
465,?,,
466,Increased use of fossil fuels causes global warming.,,
467,Environmental pollution and no use of coal and oil,,
468,"Energy is depleted, and later fossil energy becomes unavailable and the environment is polluted",,
469,.,,
470,There will be a lot of carbon dioxide that will thicken the atmosphere and run out of fossil energy that we can use.,,
471,I don't think it's going to be good,,
472,The greenhouse effect strengthens and promotes global warming,,
473,Increased carbon monoxide destroys the ozone layer and causes global warming due to greenhouse gases,,
474,"In the process of burning coal and petroleum, a large amount of carbon dioxide is generated, which poses a great risk to the environment.",,
475,The future generation environment deteriorates.,,
476,"Although the Earth is balanced by carbon circulation, a large amount of carbon dioxide adds to the greenhouse effect, raising the average temperature of the Earth, melting glaciers, raising the sea level, flooding most islands. It also destroys the ozone layer, failing to block ultraviolet rays and becoming an uninhabitable earth.",,
477,Carbon dioxide from coal and oil accelerates global warming,,
478,"Greenhouse gases continue to be emitted, accelerating global warming, and eventually destroying the world",,
479,"Fossil energy resources may be depleted in the future, and exhaust gases from fossil energy use may be emitted, causing environmental pollution.",,
480,be contaminated,,
481,Global warming occurs due to the thickening of the ozone layer,,
482,1.23E+12,,
483,The environmental pollution will be severe difficulty breathing due to air pollution,,
484,Global warming intensifies and the atmosphere becomes dirty,,
485,The problem of global warming will be bigger because pollutants are released.,,
486,Global warming accelerates further,,
487,Global warming happens quickly,,
488,"As the CO2 content in the atmosphere increases, the greenhouse effect increases and the temperature of the atmosphere rises",,
489,.,,
490,There will be no global warming,,
491,Fossil energy runs out and becomes expensive,,
492,It's environmental pollution,,
493,The environment is destroyed,,
494,"The amount of fossil energy is insufficient. The ozone layer will be destroyed by the gas generated by fossil energy, increasing human exposure to ultraviolet rays.Global warming will become serious due to huge greenhouse gas emissions, making the Earth a nonliving environment.",,
495,"There is no future. (The average temperature of the Earth increases as carbon in the Earth moves to abstain, and the energy emitted from the Earth increases due to greenhouse gases, leaving it unable to release and remaining on Earth.) In addition, as the carbon content of abstention increases, the ozone layer will be destroyed and ultraviolet rays from the sun will not be able to be blocked, making it an environment in which living things cannot live, such as melting the surface and burning human flesh.",,
496,There is a lack of resources for power generation and the use of fossil fuels makes the environment worse.,,
497,resources run out The environment is destroyed,,
498,"The atmosphere turns into an environment unfit for human habitation, and as the atmosphere changes, soil and water resources also change in a chain. Eventually, in the future, the Earth will no longer be a suitable environment for humans to live in.",,
499,"If resources are diminished and future generations of offspring may not have enough to use, the worst-case war to take over them, or a nation-wide enterprise that already monopolizes them, can manipulate the price of resources at will and bring about economic chaos.",,
500,The environment will be polluted and resources will be lost and development will be cut off.,,
501,Don't know,,
502,"The environment will be polluted as it is, and resources will be depleted, which will be fatal to our lives.",,
503,Global warming will come sooner,,
504,"Using a lot of fossil energy releases a lot of greenhouse gases, accelerating global warming. Then, disaster disasters increase and eventually it becomes difficult to live.",,
505,The environment is polluted.,,
506,All the coal is gone,,
507,The ozone hole causes ultraviolet rays to enter,,
508,"When fossil energy is depleted, primitive times return",,
509,We're running out,,
510,The earth will come back to life when the West Yuna or coal falls,,
511,It's going to be hard to live because it's all depleted.,,
512,"There is no oil or coal, so chaos and humanity is likely to perish",,
513,The food is gone,,
514,You'll be in trouble,,
515,environmental pollution,,
516,"I can't move my car, so I stay at home, and I can't come to Korea for food, so I starve",,
517,environmental pollution,,
518,I don't think it's going to be alive,,
519,It's disappearing,,
520,"I can't ride a car, train, plane, etc. because I don't have enough oil",,
521,The world is doomed because oil is gone,,
522,It seems that coal or oil can be blown by fossil energy,,
523,Don't know,,
524,I don't know,,
525,The environment changes beautifully.,,
526,The sky will turn black and only the air will remain,,
527,The lives of future descendants become uncomfortable,,
528,The environment is polluted,,
529,Don't know,,
530,The electricity disappears. It's walking around.,,
531,Resources will become scarce faster and the maximum damage caused by environmental pollution will be accelerated.,,
532,Global warming,,
533,I'm running out of advice,,
534,That's nice,,
535,feel uncomfortable being depleted,,
536,"Fossil energy disappears, and everything that can be used as electricity or fossil energy becomes obsolete, causing damage to our lives and inconvenience.",,
537,I'm not gonna use it anymore,,
538,"Global warming becomes serious The North Pole, the South Pole, etc",,
539,h,,
540,......I don't know,,
541,I don't know.,,
542,I'm afraid I'm running out of coal or oil,,
543,Energy can be saved,,
544,"Not only will there be a lot of environmental pollution, but there will be a shortage of oil and coal, so things that we need in our lives, such as oil and electricity, will become scarce",,
545,We're running out of resources,,
546,Because global warming turns the earth into an uninhabitable environment,,
547,We can't use coal oil in the future,,
548,Resources run out.,,
549,We are doomed because of lack of resources,,
550,It will disappear and become unusable,,
551,Environmental pollution is getting worse and the world is ruined,,
552,The environment is polluted.,,
553,We won't be able to use it when we really need it,,
554,I'll study harder.,,
555,"It will be much hotter than now, and the ecosystem will change.",,
556,It will be difficult to live in the future due to lack of fossil energy.,,
557,There will be a shortage of resources.,,
558,I think the earth will change a little.,,
559,Environmental pollution is severe and exhausting.,,
560,People will be in a lot of trouble because coal and oil are gone.,,
561,"Because the amount is not constant, when it is cut off, there is little energy to replace it, which leads to confusion.",,
562,The environment will be destroyed.,,
563,I don't know.,,
564,The environment is becoming more polluted and the earth is likely to get hotter.,,
565,Coal or oil is gone and fossil energy cannot be created.,,
566,"If you rely on fossil energy, you won't be able to live if you run out of it",,
567,"In the future, fossil energy such as coal and oil will not be available",,
568,"""When fossil energy is scarce, there is not enough energy to use it",,
569,That can cause a lot of problems,,
570,The air pollution is getting worse and we need to buy oxygen,,
571,electromagnetic waves,,
572,"Earth's environment is dirty, there seems to be a war over fossil energy, and future generations will suffer from lack of energy",,
573,Fossil energy is gone,,
574,The earth could be ruined.,,
575,The air can get bad.,,
576,"In the future, the air can be bad.",,
577,The air pollution will get worse and coal and oil will gradually.,,
578,The environment and ecosystem will be destroyed and eventually even humans will be damaged.,,
579,I think it will be a hard earth for people to live in.,,
580,"Our descendants will not be able to see the fossils, and our descendants will not be able to use fossil energy.",,
581,Resources will run out.,,
582,"As the earth's ozone layer is pierced, there will be a lot of ultraviolet and visible light coming from the sun.",,
583,We're running out of energy and we're doomed,,
584,"Using a lot of fossil energy, such as coal and oil, may not have enough resources to use in the future, causing electricity cuts across the country and inconvenience to life.",,
585,"In the future, fossil energy will be lost and inconvenient.",,
586,Fossil energy is not available when it is absolutely necessary,,
587,Fossil energy will be lost in the future because it is limited,,
588,I don't know.,,
589,"In the future, oil and coal will be reduced and things that need oil and coal will not be available.",,
590,"If we don't develop renewable energy because it's a limited resource, there will be an energy crisis",,
591,"When resources are depleted and scarce, we feel uncomfortable in our lives",,
592,"In the future, fossil energy will be depleted and fossil energy will not be available.",,
593,"The environment will be polluted, fossil energy will gradually be depleted, and electricity will not be available, resulting in blackouts, and eventually a difficult world to live in.The environment is likely to be contaminated a lot, and it will cause great damage to future generations.",,
594,"The material from burning fossil fuels will contaminate the environment and run out of coal or oil, making it impossible to use it where necessary.",,
595,"If you use a lot of fossil energy, it can disappear altogether in the future.",,
596,The moment of disappearance will come.,,
597,"There's no coal and oil, so there's a blackout",,
598,"The environment will be dirty because it will harm Hankyung, which will prevent us from farming and cause a lot of damage.",,
599,The air is getting worse,,
600,"Resources such as coal and oil are depleted, making people's lives difficult.",,
601,"In the future, there won't be much fossil energy left, and then we'll have to live with new energy, not fossil energy",,
602,I'm running out of energy,,
603,"""We can only use coal or oil as much as we can, so if we use it a lot, we can use it in the future",,
604,"I think I might not be able to.""",,
605,Fossil energy' will run out and no longer develop.,,
606,Energy will run out and people will suffer from energy shortages and the natural environment will be damaged.,,
607,"Fossil energy is used up, and energy sources become scarce or disappear.",,
608,There seems to be no energy in the future,,
609,a global explosion,,
610,I'm doomed because I don't have money.,,
611,Oil or coal will disappear and you won't be able to create energy.,,
612,All resources will be exhausted and eventually all will be unavailable.,,
613,Unlearned,,
614,"Fossil energy costs a lot of money and manpower in the process of digging and burning, and fossil energy is at risk of drying up quickly, so it is better for the environment and us to use hydroelectric energy, solar energy, and 에너 energy rather than using a lot.",,
615,The earth is polluted and we cannot see the beautiful environment,,
616,Fossil energy is depleted and is no longer usable.,,
617,The fossil will run out of energy.And the environment will be polluted,,
618,There will be no land and war on fossil energy.,,
619,environmental pollution,,
620,"The earth is depleted of energy, so there is no energy available to mankind.  The Earth in Rigo is Contaminated",,
621,The environment gets worse.,,
622,"Fossil energy on Earth is lost, so there is no energy available to mankind",,
623,"Fossil energy such as coal and oil is limited, and it is not infinite, so if we continue to use this energy, we will run out of energy in the future, and we will not be able to ride vehicles that are moved to gasoline or petroleum. However, electric cars, whose electricity is energy, are likely to be able to ride. And, other energy, underwater energy, solar energy, seems to be available. Finally, if you burn oil, environmental pollution becomes worse.",,
624,Air pollution is getting worse and we cannot breathe clean air,,
625,"Of course, it would be nice, but if you use a lot of those things, environmental pollution or global warming will occur. And the inconvenience can be inconvenient because oil and coal are limited.",,
626,"There is no fossil energy to use later, we have to walk around",,
627,Coal or oil will one day reach a fixed amount and become unusable.,,
628,There is a risk of contamination.,,
629,I don't know,,
630,"Environmental pollution, exhaustion",,
631,resources run out,,
632,The environment is polluted.,,
633,I don't know.,,
634,Environmental pollution will get worse.,,
635,The ozone layer is destroyed and people get skin cancer.,,
636,I'm going to screw up,,
637,Later it will gradually disappear and things used for coal or oil will disappear,,
638,The natural environment will be destroyed and fossil energy will be depleted,,
639,"Carbon dioxide and methane gas in the air increase, which encourages global warming.",,
640,"Fossil fuels are often burned and used, so they are the main culprits of air pollution, and if you continue to dig for coal and oil, the environment may be destroyed and become uninhabitable.",,
641,"There will be no resources available in the future, which will have a lot of impact on daily life.",,
642,"If we use a lot of oil and coal, we will generate a lot of carbon dioxide, and global warming will worsen rapidly And I think there will be a lot of damage if I use up both oil and coal and start to be interested in renewable energy from then on",,
643,Environmental pollution will become more serious and live through all kinds of natural disasters.,,
644,Life will be inconvenient because of the depletion of energy.,,
645,"If it promotes global warming and runs out, it will be desperate to use alternative energy or find a place where new fossil energy is buried. The rich and the poor will get worse.",,
646,severe global warming,,
647,"If fossil energy is used a lot, it can be the main culprit of environmental pollution, and because of global warming, there will be islands and countries that will disappear due to rising temperatures and sea levels",,
648,"Fossil energy still causes a lot of damage (global warming, greenhouse gas emissions, etc.), but if you continue to use this energy, more global warming or greenhouse effects will occur, causing ecological disturbance and skin cancer, and the earth to deteriorate a lot",,
649,Earth's energy will be depleted and environmental pollution will become serious.,,
650,"Environmental pollution becomes more serious, and not only global warming, but also soil pollution can further damage the ecosystem, which can lead to loss of our habitat.",,
651,Global warming,,
652,"Later, all the energy will be exhausted and the energy to be used will disappear, making it difficult.",,
653,"Environmental pollution and global warming will accelerate and later run out of resources, making it difficult to use electricity.",,
654,"Environmental pollution, such as global warming, and later fossil energy will be depleted and no longer available.",,
655,Nature is so destroyed that it's east.It's gonna be hard for plants to live,,
656,"If fossil energy is used a lot, I think sinkholes will increase due to empty spaces created by taking out coal and oil that were buried in the ground",,
657,The Earth Sickens,,
658,Global warming and environmental pollution will intensify and become an environment where humans can no longer live,,
659,We're disappear.,,
660,Lower sea levels and promote desertification,,
661,It will perish.,,
662,I'm running out,,
663,"This will also run out, right?",,
664,"In the future, coal and oil will all disappear.",,
665,"Global warming and depletion, etc",,
666,"Since the amount of fossil energy resources is limited, if you continue to use it, it will all be depleted in the future.",,
667,Become a beggar.,,
668,"Global warming will intensify, temperatures will rise, polar glaciers will melt, sea levels will rise and disappear, and global temperatures will rise, affecting the ecosystem around the world.",,
669,Global warming intensifies due to the increase in greenhouse gases.,,
670,"If you use a lot of fossil energy, you may run out at some point and not be able to use it in the future, and you will run out of resources due to the use of a lot of fossil energy.",,
671,"The greenhouse effect increases, resulting in many changes in living things",,
672,The era of buying and selling oxygen due to air pollution comes. The respiratory disease becomes severe.,,
673,"Global warming accelerates, and there is no high-quality fossil fuel",,
674,There will be more smog-like phenomena and energy depletion.,,
675,"Fossil energy such as coal and oil has been steadily helping since the Industrial Revolution. However, if mankind continues to rely on fossil energy as it is now, it will soon run out. This is because fossil energy, such as coal and oil, is a finite resource. If that happens, there will be problems with the entire basic life that humans need. First of all, the clothes we're wearing now, the processed foods like canned tuna that we enjoy eating, the house we live in right now, will no longer be able to be created. This is because most of the basic food, clothing, and shelter life that humans need is fossil energy. In addition, oil and coal cause various environmental problems because they emit a lot of pollutants.",,
676,"In the future, the basic resources are depleted and the environmental problems become serious, which is costly",,
677,"Using fossil energy increases the greenhouse effect due to an increase in greenhouse gas emissions such as carbon dioxide. Therefore, global warming will intensify, resulting in flooding of low-lying areas due to rising sea levels, abnormal weather due to rising global average temperatures, and changes in ecosystems.",,
678,"In the future, coal or oil will all disappear and you will not be able to live.",,
679,"Eventually, fossil energy such as oil and coal will disappear in the future, and people will find other renewable energy.",,
680,"Later, the resources are exhausted.",,
681,I don't know ^^,,
682,"Fossil energy, such as coal and oil, is likely to be used up in the distant future and no longer available",,
683,"Due to lack of resources, I will live harder than now.",,
684,be unable to use fossil energy,,
685,be unable to develop autonomously,,
686,Fossil energy is likely to disappear and other enagies are likely to arise,,
687,"The environment will be very bad, and resources will be depleted, making it difficult for people to live in.",,
688,The environment is so polluted that life becomes uncomfortable.,,
689,"If we use too much coal or oil, we will lose coal or oil to use in the future, so our lives are very uncomfortable and if it is severe, everyone will die.",,
690,"The environment may deteriorate and the atmosphere may deteriorate, so you may have to carry an oxygen respirator.",,
691,"Coal and oil are lost, and all the oil, coal-related goods and goods that are used in our daily lives are not available",,
692,Things like coal and oil will eventually run out in the future because they have finiteness.Coal' oil may be lost in the future because the amount of resources is finite,,
693,I'm going to screw up,,
694,"In the future, coal or oil will disappear and solar power will be used to live.",,
695,Global warming will continue and disappear from Earth.,,
696,It's slowly disappearing.,,
697,"Because it is not infinite, if you continue to use it, it will run out and cause problems around the world.",,
698,"Coal and oil disappear, causing food shortages and not being able to ride cars.",,
699,"Fossil energy helps us a lot in our lives, so we can't use food and energy.",,
700,N and M,,
701,Fossils could have fallen and made life uncomfortable.,,
702,Global warming gets worse,,
703,It is because resources are lost and the earth is polluted,,
704,There's a lot of methane,,
705,It causes environmental pollution.,,
706,The environment is not good because of the air pollution,,
707,It's hard to live because of lack of coal,,
708,"The World's End, Kugungguㅜㅜㅜ~~~~ㅎㅇㄹ하ㅇㄿ~~",,
709,I think it will have a bad effect on the future because it will run out later.,,
710,The environment is not good because of the air pollution.,,
711,"Cars won't be able to drive because they don't have enough resources, so you have to save a lot",,
712,I think there will be a lot of coal and oil gone in the future.,,
713,The air is getting worse,,
714,"That's fine, but history may be a little off the mark",,
715,Global warming intensifies when factories are operated to use fossil energy,,
716,se,,
