547,"Light refracts to the slower side, and when light from the air enters the lens, it slows down in the middle, which is relatively thicker than at the edge, so the light refracts to the middle. Therefore, sunlight can concentrate light energy and thermal energy into one part by gathering into the middle part.",,,
548,"Convex lenses have the property of collecting light into one place. Therefore, when light is collected using a convex lens, light gathers in one place and generates heat. As heat is generated, the part where light is collected may catch fire or cause soot.",,,
549,"When sunlight is collected with convex lenses, sunlight gathers at one point.  The light passing through the top of the convex lens is refracted in a downward direction, the center is refracted in a straight line, and the bottom is refracted in an upward direction, so that light gathers at one point.",,,
550,"When sunlight is collected through a convex lens, light is collected in one focus. If you continue to shine sunlight on the convex lens, a large amount of heat will be collected in one focus. If this heat gathers more than a certain level, a fire is expected.",,,
551,"A convex lens refracts light and passes through a point, and this property can collect sunlight. Because of this, it is possible to collect brighter light than the surroundings.",,,
552,"""If you reflect light elsewhere, it heats up where it is reflected.",,,
553,"It's on fire.""",,,
554,It's hot,,,
555,The sunlight gathers in the middle,,,
556,It's getting hot,,,
557,The temperature rises at the point where the sunlight gathers,,,
558,Light and heat will come together.,,,
559,Heat generation,,,
560,It's very hot when you collect sunlight,,,
561,Gather more heat,,,
562,The sunlight is gathering,,,
563,Gather up,,,
564,Light gathers in the middle.,,,
565,Black paper catches fire,,,
566,There's a fire,,,
567,The temperature of the sunlight collection increases.,,,
568,It's burning,,,
569,"If you put it on the paper, it catches fire",,,
570,"Sunlight gathers in the middle, heat concentrates, and the temperature of the heat-burning material will rise",,,
571,The light is getting stronger,,,
572,There's a fire,,,
573,I don't know.,,,
574,There's a fire,,,
575,The sunlight is not gathering.,,,
576,It's on fire,,,
577,Light gathers in one place.,,,
578,It can burn black objects.,,,
579,The light is shining,,,
580,It's burning,,,
581,"Rather than collecting evenly as a whole, light will concentrate on the thick part in the middle.",,,
582,The temperature of the heat will rise and catch fire.,,,
583,There's a fire,,,
584,There is a danger of fire.,,,
585,The focus could be centered.,,,
586,Light gathers in one place and heats up,,,
587,It's getting hot,,,
588,There's a fire,,,
589,"Solar energy is concentrated at one point, and the temperature of the concentrated point rises.",,,
590,One part is getting hot. Burn ants with magnifying glass,,,
591,The light energy of sunlight gathers at a point and is higher than in normal conditions.,,,
592,Sunlight is gathering,,,
593,There's a fireThe light is gathering,,,
594,I don't know.,,,
595,It's getting hot,,,
596,I'm going to fart,,,
597,I don't know,,,
598,The paper burns,,,
599,fire,,,
600,I do not remember.,,,
601,Light gathers to generate heat,,,
602,to spread further,,,
603,to be able to burn many things,,,
604,be lit by the sun,,,
605,High energy is collected and paper can be burned.,,,
606,"The heat is collected and smoke is produced, creating a fire",,,
607,"""Large area heat concentrates on narrow areas or spreads to larger areas",,,
608,"When concentrated, the heat is high enough to burn paper that didn't burn",,,
609,"If it spreads to a larger area, the heat in the area where the light touches is likely to be lower than the first""",,,
610,to be able to burn matter,,,
611,"Radiation heat from sunlight is concentrated in one place, and the temperature there rises.",,,
612,Light gathers at a certain point.,,,
613,The temperature of the collection increases.,,,
614,I don't know.,,,
615,The amount of energy collected is concentrated in one point.,,,
616,Sunlight gathers and strengthens.,,,
617,I don't know,,,
618,the gathering of sunlight,,,
619,The light gathers and the place where the light gathers gets hot.,,,
620,The temperature of something in focus rises,,,
621,"If you collect sunlight with convex lenses, energy is concentrated, so you can ride black paper or ants.",,,
622,"When you put an object in focus, it catches fire.",,,
623,"A point where light gathers at a point is created, which increases the temperature.",,,
624,a fire could break out,,,
625,Let's see. Sexy,,,
626,Things look different.,,,
627,There's smoke.,,,
628,It heats up with smokeAnd there's a fire,,,
629,There will be a fire.,,,
630,Sunlight gathers well to generate heat.,,,
631,The temperature rises,,,
632,The embers are growing.,,,
633,The seat burns,,,
634,"Because light gathers at one point and heat energy gathers, it can light up.",,,
635,Paper can burn if you put it on paper.,,,
636,I think the light will be really hot.,,,
637,There's a fire,,,
638,Energy gathers in one place.,,,
639,It's about to be a fire,,,
640,It's on fire,,,
641,There's a fire,,,
642,Sunlight gathers in one place.,,,
643,"At one point, all the light that reaches the area of the convex lens is collected.",,,
644,I can see it well,,,
645,The collected part gets hot.,,,
646,Sunlight is concentrated in the middle.,,,
647,"The light is concentrated in one place and receives a lot of heat there, so the concentrated part may burn",,,
648,There's a fire.,,,
649,"When I see the sunlight, my eyes sting and I feel like I'm going to get rid of them, and I feel hot and paper-like burns",,,
650,The temperature of the part where the light is gathered increases.,,,
651,I can see it better,,,
652,The temperature of the sun's spots will rise,,,
653,The temperature rises,,,
654,The light gathers and heats up.,,,
655,"If you leave an object and reflect the sunlight as it is, the object burns.",,,
656,The sunlit part of the convex lens will burn.,,,
657,Fire or shadow,,,
658,The convex lens can burn ants if they collect sunlight weaker than the light from the Park Geun Hye princess.,,,
659,It gets hot and there's smoke and fire,,,
660,Only the middle part of the sun is likely to gather.,,,
661,Light gathers in one place,,,
662,The surroundings of the gathered light burn.,,,
663,The sunburned part burns,,,
664,Fever can cause burns.,,,
665,"When sunlight gathers, light gathers, and when sunlight gathers, heat from the sun gathers and catches fire.",,,
666,Bar,,,
667,The temperature rises at the gathering point and burns.,,,
668,heat generation,,,
669,There's a fire,,,
670,Light gathers in one place,,,
671,be gathered at one point,,,
672,the temperature rises,,,
673,It's getting hot,,,
674,The light is gathering,,,
675,It's on fire,,,
676,It's burning,,,
677,There's a fire,,,
678,I don't know.,,,
679,The intensity of the light that gathers at one point becomes stronger,,,
680,It's getting hot,,,
681,The energy is gathered in one point,,,
682,I can see it well,,,
683,There's a fire.,,,
684,Sunlight gathers in the middle and burns.,,,
685,Fireworks form,,,
686,be heated up,,,
687,Light gathers in the middle of the convex lens.,,,
688,to be able to burn something by the concentration of light,,,
689,Heat it up so it can burn.,,,
690,The collected part burns,,,
691,"The convex lens collects light into one place and generates heat, which can cause a fire if left for a long time",,,
692,Collecting light on paper catches fire.The light that passes through the convex lens will be collected and the paper-like material will burn.,,,
693,The paper burns / It gets hot,,,
694,It's on fire,,,
695,The paper burns,,,
696,Collecting light on paper catches fire.,,,
697,"If you continue to collect sunlight, you will catch fire.",,,
698,"When light passing through the convex lens gathers, materials such as paper burn.",,,
699,"When light passing through the convex lens gathers, materials such as paper burn.",,,
700,"When light passing through the convex lens gathers, materials such as paper burn.",,,
701,"Because convex lenses refract light, light is gathered to one side and the temperature of the paper will rise to the point of ignition.",,,
702,"If you put the paper under it, flames, fire, and smoke can come out of the paper.",,,
703,The light is gathered and burned,,,
704,Convex lenses can catch fire because light gathers in one place,,,
705,Smoke comes from where the light is gathered.,,,
706,"Where the light is gathered, there is smoke and then a fire",,,
707,Brightness changes and temperatures increase.,,,
708,"If you shoot a convex lens with light gathered on a white paper, the white paper burns",,,
709,"If you put it on black paper and shoot it, it'll burn. It'll take about an hour for a man to warm up",,,
710,"When the convex lens is illuminated on the white paper, the heat rises and burns on the white paper.",,,
711,"When you shoot a bullock lens with a collection of leaves on a white paper, the paper catches fire.",,,
712,Light gathers in the middle,,,
713,"By collecting light with a convex lens, the object in the middle of the convex lens burns.",,,
714,"What happens when you collect sunlight with a convex lens is that you can collect sunlight with a convex lens, so if you put it in one place and wait, the object burns",,,
715,Heat is generated,,,
716,Light gathers in the middle,,,
717,Sunlight gathers and the matter burns.,,,
718,The part where the light is gathered starts to burn.,,,
719,"Where the sunlight gathers, it catches fire.",,,
720,Sunlight gathers to generate heat,,,
721,It's on fire,,,
722,It's burning,,,
723,Sunlight is dispersed,,,
724,Sunlight is dispersed,,,
725,I don't know.,,,
726,The temperature is going up,,,
727,There's a fire,,,
728,Light gathers in one place,,,
729,It's on fire,,,
730,There's a fire,,,
731,Hot light forms in one place.,,,
732,Hot light forms in one place.,,,
733,The light is spreading.,,,
734,The light is reflected.,,,
735,The temperature rises at that point.,,,
736,The light gathers and the temperature of the gathered area rises,,,
737,The light spreads.,,,
738,Light gathers in one place,,,
739,apply properties to convex lenses,,,
740,I don't know,,,
741,I don't know.,,,
742,I don't know.,,,
743,"If you look at it, it's my real name",,,
744,Intensive heat transfer,,,
745,It's getting hot,,,
746,to be able to ride,,,
747,It's on fire,,,
748,Fire,,,
749,The heat gathers and the fire breaks out,,,
750,"Where the sunlight gathers, the substances burn",,,
751,Light gathers in one place,,,
752,There's a fire,,,
753,heat generation,,,
754,Collect a wide range of light into one place.,,,
755,Light can be concentrated in one place and burn an object.,,,
756,Light gathers at a point.,,,
757,It's on fire.,,,
758,I can see your eyes well You can see the refracted light coming into the retina as it gets into your eyes,,,
759,to be able to burn ants,,,
760,There's a fire,,,
761,The light deflects without going straight.,,,
762,The light is brought together.,,,
763,Gather the light,,,
764,The fire breaks out while heating,,,
765,Heated,,,
766,It's getting hot.,,,
767,"Things happen, such as light converges and the temperature at that point increases.",,,
768,the intensity of light,,,
769,Light gathers in focus and the object in focus burns,,,
770,It's getting hot.,,,
771,The temperature of the light receiving part increases.,,,
772,The gathering part gets hot.,,,
773,A fire can break out. A typical example is a magnifying glass that collects sunlight.,,,
774,Light gathers well.,,,
775,The light is gathering,,,
776,The light is gathered and burned,,,
777,It looks convex,,,
778,I don't understand.,,,
779,It looks big.,,,
780,There's a fire,,,
781,The light gathers and becomes stronger,,,
782,gather in one place,,,
783,I don't know.,,,
784,It's burning,,,
785,"When sunlight gathers into focus, it will spread further and further away from focus.",,,
786,The temperature rises.,,,
787,Sunlight gathers well.,,,
788,"The sun is incident parallel to the convex lens. Therefore, it is concentrated in focus.",,,
789,It catches fire.,,,
790,I don't know.,,,
791,"Sunlight gathers into the focus of the convex lens.As light gathers in one place, the target's heat rises.",,,
792,"Because energy is concentrated, something can be burned.",,,
793,wtf,,,
794,The light gathers.,,,
795,It's hot.,,,
796,Sunlight refracts and temperatures rise in one place,,,
797,A lot of light gathers at the point where sunlight gathers and a lot of heat is generated.,,,
798,The gathered part gets hot,,,
799,"When sunlight is collected, heat is concentrated in one place, which can burn substances.",,,
800,"The convex lens focuses the incoming light. When sunlight is collected, sunlight entering in various directions can be collected at the focal point of the convex lens, and the temperature can be raised a lot at that position.",,,
801,The place is on fire because the sunlight is condensed.,,,
802,It's on fire,,,
803,The sun's light energy is concentrated in a narrow area and the temperature rises.,,,
804,"Light energy gathers. It may be less, but it is omitted because there is not enough time.",,,
805,Sunlight gathers in one place.,,,
806,The light is gathered and it gets hot.,,,
807,"When you collect sunlight with a lens, things burn. (Sunlight energy contains heat energy)",,,
808,"Convex lenses have the property that straight light is refracted and collected at one point. Therefore, by bringing sunlight together into a single point with a convex lens, that point will be burned.",,,
809,"When sunlight is collected with convex lenses, light is refracted and gathered into one point, and when sunlight is collected into one point, solar energy is concentrated into one point, and the temperature gradually rises. Due to the increased temperature, the temperature rises above the ignition point and catches fire.",,,
810,"When sunlight is collected with a convex lens, if there is a de-material, oxygen is supplied and the temperature rises above the ignition point. If that happens, it will burn because it meets the conditions to catch fire.",,,
811,"If you collect sunlight using convex lenses, you can collect heat and burn materials.",,,
812,a shortage of time,,,
813,"When sunlight is collected, it becomes possible for the heat of sunlight to gather in one place and light it.",,,
814,Light collects and generates heat.,,,
815,"A convex lens is a lens that collects light. Therefore, when sunlight with strong heat energy is collected, the focus area becomes fire or hot.",,,
816,It's burning.,,,
817,I'm sorry.,,,
818,..,,,
819,The fire is burning,,,
820,It's coming together,,,
821,"As smoke gradually rises, certain parts burn black.",,,
822,Nothing happens.,,,
823,Flames and smoke.,,,
824,The temperature of the circumferential surface of the convex lens increases and a fire may occur.,,,
825,Fire,,,
826,A fire breaks out.,,,
827,It's burning,,,
828,M and D,,,
829,Sunlight gathers in one place.,,,
830,The light is spreading,,,
831,The sunlight collects and heats up the area,,,
832,There's a fire.,,,
833,I don't know.,,,
834,.,,,
835,I don't know.,,,
836,"If you put the paper on it, the paper burns",,,
837,There's a fire,,,
838,There's a fire,,,
839,There's a fire.,,,
840,spread without gathering together,,,
841,There's a fire,,,
842,Light gathers and becomes stronger,,,
843,A fire breaks out because of the heat,,,
844,It's burning,,,
845,The temperature rises where the light gathers,,,
846,There's a fire in the middle,,,
847,It's a target,,,
848,There's a fire,,,
849,Sunlight gathers in one place.,,,
850,The middle is hotter than the edge,,,
851,Light gathers and a fire breaks out,,,
852,It's burning.,,,
853,Flames fly.,,,
854,"As light gathers in the middle, it heats up or burns",,,
855,I only ride the seats where the sunlight is gathered.,,,
856,The heat of the gathered light rises,,,
857,There's a fire,,,
858,.............,,,
859,a fire breaks out,,,
860,The light is reflected and the light gathers in different positions,,,
861,The sunlight gathers in the middle,,,
862,The temperature rises and brightens.,,,
863,Light gathers.,,,
864,It's burning,,,
865,It's burning,,,
866,The paper burns because of light and heat,,,
867,The paper burns because of light and heat.,,,
868,Collect the light and heat it up.,,,
869,Nothing happens,,,
870,The collected sunlight may heat up and cause things to burn,,,
871,The collected part gets hot,,,
872,to be able to burn paper,,,
873,Objects with paper-like properties can be burned.,,,
874,The light gathers in the middle and the temperature rises,,,
875,The paper burns,,,
876,"When you collect sunlight with a convex lens, light gathers in the middle. If you gather like this, it can generate a lot of heat, so it catches fire.",,,
877,"If there is paper at the bottom, the light gathered in the middle will go down and the paper at the bottom will burn.",,,
878,The light gathers in the middle and the temperature rises,,,
879,"The lenses are convex, so they're gathered in the center.to be able to heat up",,,
880,A fire breaks out at the gathering place,,,
881,A fire breaks out at the gathering place,,,
882,Sunlight gathers in one place and heats up,,,
883,"Where the light goes, it will get hot",,,
884,"If there is anything to ride, it burns.",,,
885,The temperature of the thermometer increases when the desiccant is burned by the heat of light,,,
886,The temperature rises where it is gathered,,,
887,"When sunlight is collected with convex lenses, light is generated, and if you place the paper underneath it, you can see the paper burns",,,
888,"Hot light will form and put the paper underneath it, and the paper will burn.",,,
889,Put paper under it and it burns.,,,
890,"The paper underneath will burnBy collecting sunlight well, paper or de-materials can burn slowly.",,,
891,You can burn paper lanterns that burn well.,,,
892,I think I can burn paper if I collect sunlight with convex lenses.,,,
893,The heat is hot enough to make a hole in the paper.,,,
894,"If you put a black paper under the lens, the paper burns because of the lens",,,
895,Convex lenses have the property of refracting light and are likely to be reflected by sunlight.,,,
896,The paper burns because you can see the sunlight,,,
897,There's a fire,,,
898,Paper burns on fire,,,
899,I think we're going to gather in the middle,,,
900,It burns or gets hot,,,
901,Fire. Light up in the middle.,,,
902,The paper burns,,,
903,"If it's black paper, we can light it up",,,
904,I think I can collect the light,,,
905,"Due to the nature of the convex lens, it emits strong sunlight that also ignites.",,,
906,The temperature will be higher.,,,
907,It's because it spreads,,,
908,It can be concentrated in one place to heat and light paper.,,,
909,The paper heats up the paper.,,,
910,The paper is crooked,,,
911,Sunlight gathers in the middle of the convex.,,,
912,The light is bent to the thick part of the convex lens and the light is gathered in the middle,,,
913,"The places you have collected will turn hot and if you collect a lot, you will likely catch a fire.",,,
914,The heat is applied to the collected place and the part burns.,,,
915,"Because light gathers in thick parts, light gathers only in the middle.",,,
916,The collected part will be hotter than the others.,,,
917,a fiery man,,,
918,Light is concentrated in one place,,,
919,The light is gathering,,,
920,Light can gather at the edge and heat up to make a fire.,,,
921,The gathering place is hot,,,
922,There's a fire.,,,
923,"""I can make a fire.",,,
924,"""",,,
925,It burns under the sunlight of the de-matter under the convex lens.,,,
926,The temperature rises as heat gathers,,,
927,I have a fever and the paper burns,,,
928,Light gathers in one place and burns,,,
929,It's getting hot,,,
930,Sunlight is gathering,,,
931,"If you gather in the middle, it's much hotter than the rest. And if you collect heat, you can make fire",,,
932,I have no idea.,,,
933,I think convex lenses can burn if they get too close to the sunlight,,,
934,.,,,
935,I don't know,,,
936,.,,,
937,I think the lights will be reflected,,,
938,Sunlight gathers in the middle.,,,
939,"When the heat of the sun is concentrated and the paper is placed in the concentrated area, the paper burns.",,,
940,The temperature is going up,,,
941,Light will gather into one place.,,,
942,Light gathers in one place,,,
943,I don't know.,,,
944,I don't know,,,
945,..distant,,,
946,I don't know,,,
947,Put it on the paper and it will catch fire,,,
948,It's burning,,,
949,It's burning,,,
950,There's a fire.,,,
951,There's a fire,,,
952,There's a fire,,,
953,I can't collect sunlight,,,
954,It's refracting,,,
955,The light spreads.,,,
956,"If you put an object like black paper, heat can gather and burn.",,,
957,There's a fire,,,
958,Light collects and burns objects in some cases,,,
959,It's impossible,,,
960,"Collected light can burn objects at high temperatures, in some cases",,,
961,The light spreads.,,,
962,"Because convex lenses have the property of collecting light into one place, for example, paper can catch fire if there is paper where light is collected.",,,
963,Sunlight is gathering,,,
964,"The middle part is thicker than the edge, so light is refracted from the edge part and gathers to the center part, so light and heat gather. Therefore, collecting sunlight with convex lenses will make it brighter, and the temperature will rise.",,,
965,Smoke comes from the gathering,,,
966,Light gathers in one place and burns,,,
967,I don't know,,,
968,I don't know,,,
969,The light is reflected,,,
970,The light is likely to reflect.,,,
971,My eyes are shining,,,
972,I don't know,,,
973,I don't know,,,
974,I don't know because I didn't learn it,,,
975,I think there's going to be a refraction,,,
976,You have not learned refraction/refraction.,,,
977,I don't know.,,,
978,I think the sunlight will gather in the middle and catch fire,,,
979,I think the light will reflect,,,
980,I don't know because I didn't learn it.,,,
981,I don't know.,,,
982,to be able to cause a fire,,,
983,When you make a fire in the wild.,,,
984,I don't know.,,,
985,I don't know,,,
986,I think it'll look brighter.,,,
987,I don't know!,,,
988,My eyes are going to hurt.,,,
989,I don't know.I'm getting a fever,,,
990,Light gathers in one spot,,,
991,I don't know,,,
992,The light is refracted,,,
993,It's getting hot,,,
994,?,,,
995,It's getting hot,,,
996,It's refracting,,,
997,The part where the sunlight is gathered catches fire,,,
998,Collecting light,,,
999,Heat is generated,,,
1000,The temperature is getting hot,,,
1001,a fiery man,,,
1002,The fire is burning,,,
1003,There's a fire,,,
1004,The temperature of the place where the light is gathered increases,,,
1005,The convex lens gets hot.,,,
1006,"As it gathers, it burns when it's placed on black paper",,,
1007,Heat is generated in one area and can be burned if collected for a long time,,,
1008,The part burns because the light is concentrated in one place and energy is concentrated there.,,,
1009,There's a fire,,,
1010,I don't know,,,
1011,The ants are burning. I'll give you a ride on your head,,,
1012,I don't want to,,,
1013,"Since the middle part is thicker than the edge, it will refract sunlight and collect it in one place.",,,
1014,The middle part is getting hot,,,
1015,Well,,,
1016,Sunlight gathers at the focus of the convex lens.,,,
1017,It can burn ants.,,,
1018,The light is gathering,,,
1019,"Hair loss, hair loss",,,
1020,You can kill ants through the lens.,,,
1021,Heat is generated in the gathered area,,,
1022,Strong light gathers to generate heat,,,
1023,"Concentrating a point of light concentrates energy. With that energy, you can burn paper, etc",,,
1024,It's getting stronger,,,
1025,You can collect light and burn something like black paper.,,,
1026,"When sunlight is collected, sunlight is concentrated at the gathering point, so you can cook there and eat delicious pork belly, and if you can't make a fire, you can use convex lenses to make a fire.",,,
1027,Solar energy radiation increases at the point where sunlight gathers.,,,
1028,"When parallel sunlight passes through the convex lens, the focus is focused on the convex side.",,,
1029,Light collection temperature rises in focus very hot fire can occur,,,
1030,The leaves can be burned. Heat is generated at the focal point of the convex lens.,,,
1031,"The convex lens focuses on one point, and when sunlight is collected, the heat of sunlight gathers in one step, generating heat that can burn objects.",,,
1032,"Light is refracted to the thick side, and when a convex lens is used, when divided into the lower part of the upper part of the lens, the light on the upper part is bent to the middle part, and the light on the lower part is bent to the middle part. Using this phenomenon, I think it can help people observe in real life or use energy by using magnifiers or lenses that collect light.",,,
1033,"A convex lens has the property of refracting light and collecting it at a point, and when it collects light with this convex lens, a large amount of energy will be collected at the intersection of the refractive lines, and it will be dangerous if it is directed toward life.",,,
1034,"When sunlight is collected with convex lenses, the light is collected and heat is increased, and the smell will cause uncomfortable people to open their windows with frowns, and the need for hospitals around them will increase, and the economy will circulate and follow better policies.",,,
1035,It's on fire,,,
1036,It's getting hot,,,
1037,It's hot,,,
1038,I don't know.,,,
1039,The part where the sunlight directly meets gets hot,,,
1040,to be able to make a fire,,,
1041,There's a fire,,,
1042,It's burning,,,
1043,Light gathers in the middle to generate heat.,,,
1044,They gather in one place,,,
1045,That part could get very hot and cause a fire,,,
