493,I don't know,
494,I don't knowUnderstanding...,
495,by misjudgment,
496,I can find other acquaintances and evidence,
497,To be able to work even with a disability.,
498,I don't know,
499,"The first may make a mistake, the second may supplement the statement, and the third may try to determine the innocence and guilt",
500,Because I have to think about other people's opinions and listen to the opinions of the few,
501,I don't know,
502,in order to be precise,
503,I don't know,
504,I don't know...,
505,--,
506,It could be unfair,
507,M and D,
508,"I can't believe I beat Company A with a disability, so I think I'm leading it to the law Company A is, you can't believe your company lost and you can't handle it.",
509,"If I do it more than three times, I can continue",
510,I don't know,
511,It could be unfair,
512,I don't know.,
513,have no idea,
514,So that people with intestines can work,
515,"To give other people a chance,",
516,I don't know.,
517,To give you a chance to admit your mistakes?,
518,To make it fair so that one person doesn't feel wronged,
519,Three trials will help you better understand your mistakes,
520,There's still a lot of discrimination,
521,I don't know.,
522,It's against the law and it's unfair,
523,Don't do this again,
524,It's not good to do too much...,
525,I don't know.,
526,I don't know.,
527,I don't know.,
528,I don't understand.,
529,Oh my god,
530,This is to prevent problems from occurring during the trial process and causing unfair damage.,
531,It is a system to ensure that no one is unfair about the trial decision as much as possible.,
532,in order to guarantee the human rights of the people,
533,"This is because errors can occur during the trial, causing innocent victims.",
534,"The most valid conclusion can be drawn through several trials to determine whether the outcome of the trial is correct or not. If there is no three-trial system, more and more people will be sentenced unfairly and criminals will be found not guilty even after committing crimes.",
535,It is to ensure that the rights of the people are not violated and that they are secured,
536,This is to reduce situations in which a single trial cannot produce a perfect ruling and the human rights of the people can be ignored.,
537,This is to prevent misjudgments caused by the presiding judge's mistakes as much as possible.,
538,To respect human rights and make it a fair trial,
539,"Since the judge is also a person, he may make a biased trial or make mistakes. Therefore, in order to ensure human rights more accurately and without errors, a three-trial system is implemented to allow up to three trials to reduce human rights that are violated by wrong judgment.",
540,"Since a single trial may lead to unfair results, it is possible to have several trials to make a judgment that is fair.",
541,"The reason for operating the three-trial system is that there is a possibility that both sides will have unacceptable results, such as misunderstandings or corruption during the trial.",
542,"Once a trial is made, the judgment cannot always be accurate. Therefore, in order to minimize unfair people through three opportunities, a three-trial system is operated that allows up to three trials.",
543,This is to minimize the violation of the human rights of the suspect due to a misjudgment.,
544,"Since there may be cases where the results of the first and second trials are wrong and can be unfairly damaged, trials are conducted up to three times to prevent this.",
545,"Most trials are conducted fairly. However, there are factors that will be disadvantageous in trials such as lack of evidence, or political meddling. Therefore, the judiciary provides an opportunity to be tried up to three times, allowing fairness to be maintained under any circumstances.",
546,"Since judges are also human, there may be judgments, mistakes, or misjudgments based on individual emotions, so they are operated a system that allows them to be tried up to three times to minimize them so that all citizens can receive a fair trial.",
547,"The reason for having three rulings: the first judgment of the district court, the second judgment of the high court, and the third judgment of the Supreme Court is necessary for the people to make a proper judgment that is not unfair. If a judgment is found guilty or not, three chances are given to prevent damage to the defendant in advance if the judgment is wrong.",
548,"Humans cannot always be objective because they have their own subjective thoughts and feelings. Judges can sometimes make judgments biased against their emotions, which can damage the person on trial. Judges can be tried up to three times to minimize the possibility of making errors and guarantee the human rights of those on trial.",
549,"Judges are also operating a three-trial system on the premise that they can make mistakes because they are not machines, and it is also to relieve unfair victims who may arise from such mistakes.",
550,"Since judges are also human, they can make mistakes in the trial process, and they want to guarantee the basic rights of the people by eliminating situations in which those who participate in the trial cannot accept the outcome of the trial or feel unfair about the outcome.",
551,"The three-trial system is one that guarantees a fair trial. It is a system that allows people to face up to three trials for those who cannot recognize the results in a single trial, and it stems from the reason that there are no people who suffer unfairness and damage as a result of the trial.",
552,"This is for the rights of the victims. There can be people who are unfairly damaged by the wrong judgment of the court, and through three trials, such a system is operated to minimize such injustice and protect people's human rights.",
553,"This is because the person who applied for or received the trial may feel unfair. If all results are determined in a single trial, the person who has requested or received the trial there may be very disadvantageous to the person who has not yet said or said anything.",
554,I am talking about an unjustified charge,
555,for the sake of fairness,
556,the three-trial system,
557,To prevent unfairness?,
558,To reduce the number of people who have been falsely accused,
559,in order to prevent an unfair judgment,
560,a fair judgment,
561,To guarantee basic rights,
562,"This is because fairness and unfair people should not come out, and each judge has a different focus on the case, so it has to go through a fairer and more objective process",
563,So that I don't feel wronged,
564,I shouldn't be upset,
565,To relieve the injustice.,
566,To make a fairer trial.,
567,a three-seam system,
568,"To repeatedly prove the right or wrong of the trial results through three trials,",
569,in order to make a more definite trial,
570,To prevent unfair situations from occurring,
571,The reason for running the three-trial system is for a fairer trial,
572,I can't judge perfectly by one trial,
573,You can't be tried wrong,
574,I don't know.,
575,To make accurate and correct judgments,
576,a three-plate system,
577,for a trial to err on the side of judgment,
578,This is to enable it to work in the public's favor because rulings may be unfavorable in the first and second trials.,
579,This is to make the trial fairer.,
580,It's to make Hong Gil Dong feel better,
581,Yeah.,
582,"This is because after the first trial, there can be enough new facts or evidence found.",
583,It's to solve the injustice.,
584,Just to be sure,
585,In order to make a fair trial,
586,A total of three trials can be made due to the suspect's unfairness and the principle of presumption of innocence.,
587,To prevent unfair trials,
588,To avoid unfair trial results,
589,To protect the people,
590,To make sure that no one is wronged by a single trial.,
591,This is to relieve this injustice because the results of the first and second trials can be unfair.,
592,To minimize the number of people who are falsely accused,
593,the third trialTo give an accurate answer,
594,I don't know.,
595,the third edition,
596,"I think I know, but I don't know.",
597,ㅗ,
598,I'm sleepy,
599,Don't know,
600,I'm not sure I can make a decision on a trial,
601,To ensure that a single trial is not unjustified or unjustified,
602,It is to prevent unfairness from occurring in one wrong trial.,
603,"To make a fairer trial,",
604,Maybe there's something wrong with it's wrong,
605,the three-trial system,
606,"Trial is done by a person, so you can make mistakes. Therefore, by introducing the three-trial system, it is possible to reduce the probability of unfair misjudgment.",
607,I don't know,
608,So that there is no unfair or unfortunate bias,
609,This is because it can be judged unfair.,
610,This is to prevent unfair people from appearing due to the trial.,
611,It is to prevent unfairness from happening.,
612,It's unfair,
613,To prevent a judgment against the person who filed the suit,
614,for the sake of fairness,
615,"The appeal system, for the sake of fair judgment.",
616,This is because the plate can give a wrong answer.,
617,To get rid of the injustice,
618,To get a fair trial,
619,To relieve people who are falsely accused,
620,The trial is conducted three times to prevent unfairness.,
621,It is to make a fair judgment without anyone being wronged.,
622,It is possible to avoid unfair judgments and make more legitimate judgments through three trials.,
623,in order not to be falsely accused,
624,Let's see. Sexy,
625,It's to get a fair plate.,
626,I'm trying to fit in,
627,I don't know,
628,"To be accurate and to release the victim's resentment,",
629,"People are too noble and precious to decide at once, so they give people a chance to live a little better after several opportunities.",
630,It gives a chance for a fair and just trial.,
631,The reason for operating the three-trial system is that judging a person's guilt through a single trial can be a mistake or misunderstanding by a judge.,
632,Because there could be more evidence,
633,This is to make a judgment as fair as possible to both the accused and the person who filed the lawsuit.,
634,This is because it is a matter that requires careful decision.,
635,Because all men have equal rights.,
636,Because people have equal rights,
637,To make a reasonable judgment and prevent unfair cases from occurring,
638,To give you a chance,
639,Because I respect people,
640,for the sake of the people,
641,It is to prevent unfair trials.,
642,"This is because unfair judgments can be made, and innocent people can be harmed and human rights violated",
643,Because people don't admit it,
644,It is to make a proper judgment.,
645,Trials are made three times for accurate and just judgment.,
646,"Since the judge who leads the trial and concludes is a person, there is a variable that a single trial is a mistake, so the reliability and accuracy of the judgment can be reduced. That's why we run this system",
647,Don't discriminate against people with disabilities,
648,It's because the rules of the law and privacy are uncomfortable or difficult,
649,"This is because trials are also done by humans, so they may not always be able to make the right judgment.",
650,I didn't admit it,
651,To make sure no one is wronged,
652,Because it's the law,
653,"If the trial is over, if it is unfair, the trial is made to be held again.",
654,This is because they respect the rights of the people.,
655,It's not easy to tell what's real if you do it once,
656,For more accurate results and evidence,
657,"To lose by money in the first trial, to lose by power in the second trial, and to lose by connections in the last third trial.",
658,"When the result is unfair or not true, in order to solve the unfairness,",
659,This is because it needs to be tried several times to know exactly.,
660,It's to protect an innocent person,
661,It's hard to judge once or twice,
662,Just in case the trial went wrong,
663,They are tried three times because they can live unjustly.,
664,"A single trial can lead to an unfair ruling, which allows the person on trial to try again if he or she doesn't want to",
665,Don't know,
666,Because I have to check if it goes wrong.,
667,Doctor Strange,
668,I don't want to be restrained,
669,Just in case I misjudged it,
670,in dissatisfaction with the ruling,
671,To make sure there's no one who's innocent,
672,in order to protect the rights of the people,
673,It is to prevent misjudgment.,
674,in order to make a more serious decision,
675,for the protection of the basic rights of the people,
676,I'm not sure,
677,I don't know.,
678,It's to reduce misjudgment as much as possible,
679,It could be unfair,
680,To present injustice to an unjust judgment,
681,"If the injustice is not resolved, it is to go to the appeal and make it clear.",
682,To live in a better world.,
683,You might get punished unfairly because of a misjudgment,
684,"""Because you might feel bad about it",
685,"""",
686,"in order to prevent misjudgment, etc",
687,This is because it can make a wrong decision.,
688,It's because there could be a bad decisions,
689,"It guarantees the people their right to freedom, so if they think something is wrong, they run it to fix it.",
690,in order to see exactly,
691,I don't know.,
692,To get fair treatment for your skillsThis is because only one or two trials can lead to unfairness.,
693,"""For those who feel wronged,",
694,"""I thought it would be 1 vs 1 if we had 2 trials.""",
695,I might change my mind if I wear a garage or accidentally,
696,"If the trial ends at once, it's so unfair",
697,So that humans don't feel wronged,
698,It's because one person can be misunderstood and get a wrong trial,
699,I'll try three times to make sure there's nothing wrong,
700,The reason why a case is tried up to three times is not to make it unfair.,
701,This is because there is something that can be unfair by trial as No. 1.,
702,"""If you don't do that, the wrongdoer won't get more trials, or the trial of a serious case will be",
703,"This is because once held, there can be innocent victims in the trial.""",
704,"This is because once the victim receives it, there are cases where the victim loses a single trial because he cannot talk at once. Therefore, Korea, which wants a fair trial, has a three-trial system.",
705,It's because it can be unfair,
706,"You can't end the trial unjustly, so you have to stand trial up to three times",
707,This is because there may be errors in the trial.,
708,One or two trials can lead to errors in the trial and the victim can be falsely accused.,
709,It is to be precise.,
710,It is to run this system to protect fair trials and the freedom and rights of the people,
711,Who is right or who is not is to find another proof.,
712,Everyone has human rights.,
713,Humans can be tried three times because they have rights.,
714,It's because it's more efficient to let them go on trial once and if they feel unfair.,
715,This is because there may be people who want to benefit from filing lawsuits several times.,
716,It is to find another proof of who is right and who is not.,
717,"For those who lost only one trial,",
718,It's settled by law,
719,"Because of the people who couldn't find the criminal and went to prison,",
720,"This is because there may be someone who is unfair, there may be no witnesses or evidence, but it may have occurred, and the law may have been strange before, but the law may have changed now.",
721,It is to protect fair trials and the freedom and rights of the people.,
722,"In order to prevent unfair punishment or non-punishment,",
723,It's to protect justice and the freedom and rights of the rights of the people,
724,There might be people who are upset,
725,To make sure the trial runs well,
726,To make sure the trial runs well,
727,I don't know.,
728,It could be a false charge,
729,I don't know,
730,To carry out a fair and equitable trial,
731,I can't remember,
732,It's hard to tell if a trial is guilty or not,
733,to make sure,
734,to make sure,
735,This is because one trial can lead to unfair people.,
736,the three-trial system,
737,a three-trial,
738,a three-seam system,
739,a three-seam system,
740,"Considering the situation that can be falsely accused, they are given up to three chances.",
741,Because I ran a social system,
742,I don't know,
743,I don't know.,
744,I don't know.,
745,in order to minimize mistakes,
746,"To review and state the case more specifically,",
747,I don't know.,
748,It's because there could be a misjudgment,
749,"In order to reduce those reasons, there may be someone who is falsely accused of the outcome of the trial",
750,I'm trying to judge you exactly,
751,the three-trial system,
752,a three-seam edition,
753,a three-seam edition,
754,There could be a misjudgment,
755,a three-trial trial,
756,The three-trial system. Not to make unfair or hasty judgments.,
757,This is for a more honest and fair judgment because new evidence may be found or the accused may have an injustice.,
758,To accept the opinions of many people,
759,This is to prevent unfair punishment by trial.,
760,a three-seam system,
761,It's to reduce possible damage because the trial may have gone awry,
762,I'm trying to reduce the number of people who are innocent,
763,It's to make sure there's no one who's wronged,
764,Because the trial could go wrong,
765,There's a possibility that there's an error in judgment to judge by one trial,
766,for a fair trial,
767,in order to be fair,
768,in order to ensure the fairness of the trial,
769,"Since there may have been a problem during the trial process, the people have the right to a fair trial, so the three-trial system is operated.",
770,in order to make the trial fair,
771,"To guarantee the basic rights of the people by giving them an opportunity in consideration of the case where the judgment of the trial is wrong,",
772,It could lead to a wrong decision,
773,"In order to get a proper punishment,",
774,It could lead to a wrong decision,
775,To prevent a wrong decision as much as possible,
776,"In order to prevent unfair cases from occurring due to incorrect trial results,",
777,Improve fairness,
778,"In order to reduce the number of people who are falsely accused by one trial,",
779,a tremendous law,
780,I don't understand.,
781,"To minimize misjudgments or mistakes that occur in a trial,",
782,the three-trial system,
783,I could have an unfair experience,
784,We tried to relieve the injustice through the 3rd trial system,
785,To prevent an unfair judgment,
786,the three-trial system,
787,This is to prevent innocent people from being unfairly damaged.,
788,This is because judges can judge or make mistakes with subjective views.,
789,To guarantee the rights of the people.,
790,"In order to prevent unfair judgments, a three-trial system is implemented to create a fair trial.",
791,It is to make a clean trial without any problems.To give you a chance,
792,It is to prevent misjudgment.,
793,This is because it is possible to make an incorrect judgment in one plate.,
794,"It can be judged incorrectly during the trial process and can be judged incorrectly, so it can be unfair, so it can be tried three times.",
795,yes,
796,for a fair trial,
797,This is because there may be errors in the trial. This is because the outcome of the trial may vary depending on the judge.,
798,I think there may be a judge's mistake in one trial and there is evidence to be found afterwards.,
799,"Because you can be dissatisfied with the outcome of the trial and the judge is a human being, all of your subjects are not excluded, so you can do it up to three times.",
800,There are so many people,
801,"If the case is closed with only one trial, the trial cannot be corrected when the trial is not fair or the presiding judge makes a mistake. In other words, in order to make a fairest judgment as much as possible, one case can be tried up to three times.",
802,To prevent unfair trial results,
803,It is to ensure a fair trial and to ensure the rights of the people more clearly.,
804,the three-trial system,
805,the three-trial system,
806,"The reason for operating the three-trial system is to operate it for fair trials up to three times because only one trial can lead to unfair people. It may be less, but it is omitted because there is not enough time.",
807,"""One or two trials will result in unfairness or damage",
808,"It operates a system that allows people to receive up to three trials because they can have a ram.""",
809,". The first trial is a local court, so the results of the trial may not be good, so the three-trial system is implemented for a fair trial.",
810,"This is because a judge must be able to be tried again when he makes a wrong trial. All humans can make wrong judgments, and if the trial is made only once, if the trial is wrong, it is easy to have an unfair victim. To prevent this, trials are allowed up to three times.",
811,"In Korea, a system that requires up to three trials on a case is called a three-trial system. For example, it can be said that it is against accuracy that the result came out after only one trial. Korea operates a three-trial system to produce more accurate results.",
812,"In order to prevent people from being judged unfairly at the minimum when they are tried, a three-trial system is in place that allows them to stand trial up to three times.",
813,"In Korea, the reason why a case can be tried up to three times may be that one trial may lead to a single trial. In order to reduce such people as much as possible, Korea operates a three-trial system in which one case can be tried up to three times.",
814,"A single trial alone cannot make a fair judgment. Then, since the rights of the people may be violated, a three-trial system that can operate three trials will be established to make fair judgments to more effectively guarantee the rights of the people.",
815,"The reason for using the three-trial system is that the jurisdiction of the judge acts, which is to guarantee the right to be tried fairly through three trials even if the jurisdiction of the judge acts.",
816,The three-trial system is aimed at reducing the fairness of the law and the mistakes of prosecutors in trials as much as possible and ensuring people's human rights.,
817,"In the case of one trial, judges, prosecutors, and police can also make mistakes because they are human, so they are tried three times.",
818,"If the case is judged on a one-time trial, a judge can make a different judgment from the average person with subjective thoughts and make an unfair judgment. Therefore, the fairness of the trial can be further strengthened by going through several trials. Therefore, such a system is necessary and should not be eliminated.",
819,"If Hong Gil-dong fails to effectively reveal that his hand impairment is not related to his work in the first trial, or he may not receive a fair judgment by a judge's misjudgment. As a solution to this, such a system is operated for the most fair judgment so that there are no unfair people.",
820,I'm sorry.,
821,...,
822,"If I lose the trial, I'm afraid I'll keep trying to drag it down to the",
823,in order to be precise,
824,I try not to make it happen,
825,This is because the plaintiff or the defendant may be in an unfair situation due to unfair results when the trial is conducted only once.,
826,in order to make an accurate judgment,
827,This is because a single trial may cause disadvantages and may be dissatisfied with the decision.,
828,Because the people have freedom,
829,The move is aimed at maximizing the victim's or perpetrator's injustice.,
830,for the rights of the people,
831,M and D,
832,This is because it may be unfair if the victim loses the trial.,
833,so as not to be falsely accused,
834,"If you continue to be tried in one case, you can't be tried in another case",
835,Because a person can be falsely accused.,
836,Isn't it because you have that much right? I don't know,
837,I don't know.,
838,I don't know.,
839,"To make it fair and not unfair,",
840,It might be unfair if I do it once,
841,"Because every time, the statements are different",
842,It could be unfair,
843,in order to make an accurate judgment,
844,It's because the perpetrator may be falsely accused,
845,to be able to judge fairly,
846,"And if you do more, you have to continue the wrong trial without grounds",
847,"To be fair to the people who are really innocent,",
848,You don't like the trial or it could go wrong,
849,I don't know.,
850,I'll tell you to do 0 evaluationIn,
851,It's because you have to be so careful,
852,This is because one trial can cause unfair damage.,
853,"Unlike the first trial, the next trial may have other evidence or clues or may be considered different",
854,"To make sure that something unfair doesn't happen,",
855,I don't know,
856,"This is because the evidence may not be accurate, and if you do it once, the victim may be judged unfairly.",
857,"""",
858,One verdict could be either the perpetrator or the victim,
859,"In order to make a more accurate trial,",
860,One trial alone can lead to a wrong trial,
861,Because the trial could go wrong.,
862,..............,
863,The trial could go wrong,
864,It takes into account that the outcome of the trial may have been wrong,
865,"Because if you do the first trial, you can raise questions and complaints, and the trial may not be right",
866,"To prevent the victim from receiving an unfair judgment,",
867,.,
868,"If a decision is made in one trial, it may be unfair for the reason of losing once.",
869,It could be unfair because you lost once,
870,"Because once the trial is over, there's a possibility of unfairness",
871,"This is because if the trial is over once, something unfair may happen.",
872,This is because unfair victims can come out.,
873,We need to hear a lot of opinions,
874,To make it more obvious,
875,"To get a better trial,",
876,It could be unfair,
877,Because there could be something unfair.,
878,It could be unfair,
879,It could be unfair,
