717,Environmental pollution occurs,,
718,Environmental pollution is likely to get worse.,,
719,It is likely to cause a bad tendency for the environment. Pollution will destroy nature and make it difficult to live.,,
720,"The world is likely to end in the future as ice in the Antarctic and the Arctic melts and air pollution, environmental pollution, and natural disasters are at risk.",,
721,because of environmental pollution,,
722,"The environment will be polluted, and people will refrain from wearing masks and going outside, and there will be many accidents.",,
723,I don't think I can use the air,,
724,"If I use a lot of coal and oil, I think a lot of oil and coal will disappear",,
725,Forests will be destroyed and various animals and plants will be extinct.,,
726,The environment was polluted and the fresh air disappeared,,
727,"Fossil energy is limited compared to renewable energy, so it will all disappear and environmental pollution will become serious.",,
728,"If fossil energy is used a lot, greenhouse gases such as carbon dioxide are generated from burning fossil fuels, which will accelerate global warming, and various natural disasters such as sea level rise, glacial thaw, abnormal climate, and acid rain will cause harmful effects on humans",,
729,"When carbon inside coal or oil burns, it is oxidized to carbon dioxide, a greenhouse gas, which will strengthen the greenhouse effect and cause global warming.  Global warming will cause polar glaciers to melt, and coastal lowlands to be flooded as sea levels rise. And as the Earth's environment changes, the unadaptable creatures will become extinct, and biodiversity will decrease. In addition, there will be more natural disasters such as floods, heat waves, droughts, and heavy snow.",,
730,"If environmental pollution occurs a lot, causing damage to future generations, and using a lot of fossil energy, it will be difficult to develop and change the next technology because you are only used to it.",,
731,"If fossil energy such as coal and oil is used a lot, global warming will intensify due to greenhouse gas emissions, which will cause a lot of environmental problems and disrupt the ecosystem. This will adversely affect human life. In addition, air pollution, water pollution, and soil pollution such as smog will occur due to pollutants and harmful substances generated in the process of using fossil fuels, which will adversely affect human life.",,
732,Oil or coal is depleted and air is polluted.,,
733,"Since fossil energy emits a lot of greenhouse gases when burned, it is the main culprit of global warming, and it also emits substances that cause acid rain or fine dust such as nitrogen oxides and sulfur oxides. Therefore, if fossil energy is used a lot, the Earth, which has become more destructive to the environment, will become a planet where few living things can live.",,
734,"If large amounts of fossil energy are used continuously, fossil energy with limited reserves will be depleted in decades. The main component of fossil fuels is carbon, which will increase the concentration of carbon dioxide in the atmosphere if it combines with oxygen in the air to produce carbon dioxide in the process of burning fossil energy, which will lead to an increase in the average temperature of the Earth. In addition, various pollutants are mixed in the fumes from factories or transportation that use fossil energy, which will increase the generation of fine dust or acid rain. In addition, petroleum is used in various materials, including plastic, and if fossil energy is used a lot depending on fossil energy, it will cause confusion because it will not be able to find alternatives when fossil energy is depleted in the future.",,
735,"Using a lot of fossil energy increases the amount of greenhouse gases emitted by burning fossil fuels, which increases the greenhouse effect, which intensifies global warming. As global warming worsens, polar glaciers will melt, sea levels will rise, and submerged areas will increase, and research will be conducted to live in new areas and terrain to expand the space for people to live in. There will also be extinct species and new evolutionary species in the ecosystem",,
736,"Since the amount of fossil fuels is not infinite, it will be insufficient in the future, and global warming will intensify, doubling the amount damaged by global warming now, and various phenomena that have adverse effects will occur. And on a global level, countries around the world will make promises to come up with solutions to global warming.",,
737,"Fossil energy, such as coal and oil, can be used to obtain energy, but also environmental pollutants such as carbon dioxide, which pollute the environment. These greenhouse gases are also called global warming greenhouse gases, which will increase the average temperature of the Earth, and the damage caused by themselves.",,
738,"The use of fossil energy such as coal and oil creates excessive greenhouse gases. Over-exhausted greenhouse gases will accelerate global warming, and as the average temperature of the Earth rises, the melting speed of glaciers will also accelerate, raising sea levels. Rising sea levels will cause flooded areas, and changes in ocean currents can lead to changes in weather and climate",,
739,"If ""fossil energy"" such as coal and oil is used a lot, greenhouse gases such as carbon dioxide will generate a lot of global temperatures, melting many areas of glaciers, destroying the Arctic ecosystem, and increasing the volume of the Earth's oceans due to thermal expansion, resulting in cities with higher average sea levels. In addition, the amount of carbon dioxide in the atmosphere increases, and when it rains, it combines with carbon dioxide in the air to produce acid rain. Because of this, the soil will be acidified, which will severely damage agriculture and adversely affect the ecosystem.",,
740,"The high use of fossil energy such as coal and oil has a great impact on the Earth's environment. It will cause global warming, which will raise the temperature of the Earth, and various social problems will also be accompanied. In addition, because the reserves of fossil energy are limited, if we continue to use fossil energy, if resources are depleted someday and we cannot find many energy sources to replace them, the energy needed for our lives may be insufficient.",,
741,"Greenhouse gases cause water molecules to expand and glaciers to melt, causing global warming, rising sea levels, causing several islands to disappear and melting Arctic and Antarctic glaciers to disappear, causing creatures to disappear and weather changes due to seawater temperature changes. The loss of Earth's ability to self-purify itself can also cause many serious problems.",,
742,Global warming is coming,,
743,I can't do many activities,,
744,Environmental pollution or money is very expensive,,
745,Environmental problems arise in the future,,
746,There may be a shortage of coal and oil.,,
747,Energy is not available because resources are depleted.,,
748,"Later on, your grandchildren won't be able to take care of you",,
749,Coal oil is likely to run out and live off less energy.,,
750,"In the future, coal and oil may become scarce",,
751,"It's likely that environmentally harmful substances will come out, destroying the natural environment and producing bad results.",,
752,We need a lot of fossil fuels.,,
753,"If you keep going through fossil energy, there will be a problem where you make fossil energy, so you won't be able to use a lot of fossil energy",,
754,"There will be a lot of greenhouse gases such as carbon dioxide, which will promote further change or global warming, resulting in ecosystem destruction.",,
755,"The increase in carbon dioxide content in the atmosphere will cause excessive greenhouse effect, which will promote global warming.",,
756,"Due to the increase in carbon dioxide, environmental pollution is caused by global warming and the use of fossil energy.",,
757,The greenhouse effect gets worse.,,
758,"The process of power generation is to burn coal or oil, make water vapor with that heat, and turn turbines with that steam to make energy. In the process, the carbon in coal and oil is burned, and carbon dioxide is produced, and global warming is intensifying",,
759,I don't know.,,
760,"Due to resource depletion, the economy becomes uncomfortable because it cannot make products using fossil energy.",,
761,have problems in one's life,,
762,Global warming gets worse and oil drops,,
763,It will be depleted and life will be difficult.,,
764,Global warming gets worse and oil drops,,
765,The country is doomed,,
766,Problems arise in life.,,
767,Not available to future generations,,
768,Resources run out.,,
769,It's running out,,
770,Life becomes difficult,,
771,run out,,
772,Fossil energy is depleted.,,
773,Life becomes very uncomfortable because resources are depleted,,
774,Transportation is not available.,,
775,"The environment is destroyed, oil and coal are depleted.",,
776,The end of mankind,,
777,The environment will be polluted and resources will be depleted in the future,,
778,It will be difficult to live because of the depletion of resources.,,
779,The world may be polluted and need to buy air,,
780,There will be many inconveniences and difficulties in the future.,,
781,I don't know,,
782,"Fossil energy such as coal and oil may pollute the environment, polluting the Earth and quickly disappearing resources, making it impossible to use fossil energy later.",,
783,Ruined,,
784,There is so much carbon dioxide in the air that the Earth is getting hotter and hotter. It will run out again and there will be nothing to use in future generations,,
785,"When resources are depleted, energy costs increase and damage from environmental pollution increases.",,
786,Energy can no longer be obtained by resource depletion.,,
787,The earth is coming to an end.,,
788,"The greenhouse effect intensifies, causing great problems for mankind.",,
789,Global warming becomes more active because the environment is polluted.,,
790,Energy resources have been depleted and carbon dioxide has increased.,,
791,Air pollution will occur.It's going to be lacking.,,
792,Accelerating Global Warming,,
793,The earth becomes difficult due to environmental pollution.,,
794,suffering from environmental pollution / resource depletion,,
795,It runs out.,,
796,The environment is destroyed.,,
797,The exhaustion of fossil fuels and environmental pollution become serious.,,
798,The environment is polluted and resources are depleted.,,
799,Global warming destroys the ecosystem.,,
800,Fossil energy sources are depleted in the future,,
801,destruction of the natural environment,,
802,"When the environment is destroyed and fossil energy is exhausted, it is difficult to respond quickly if you use a lot of fossil energy",,
803,"In the case of fossil fuels, it must be burned to obtain energy, and greenhouse gases such as carbon dioxide are generated as well as energy as products of combustion. These greenhouse gases prevent Earth's radiation energy from escaping the Earth, resulting in global warming, which increases the Earth's temperature gradually. As the Earth's average temperature rises, glaciers melt, and more abnormal climates occur, causing damage such as flooding of dwellings due to rising sea levels, more frequent typhoons, droughts, heat waves, and damage to marine ecosystems caused by the Eligno phenomenon.",,
804,It is difficult for future generations to live because of resource depletion,,
805,It will gradually dry up and eventually all will be consumed.,,
806,Harmful substances such as carbon dioxide are created to promote global warming.,,
807,"Not only does it sustain global warming, but it also causes resource depletion.",,
808,There will be more carbon dioxide in the atmosphere and fossil energy will be depleted,,
809,Carbon dioxide from burning fossil fuels changes the Earth's atmosphere composition and causes fatal damage.,,
810,"A lot of gases such as carbon dioxide that cause warming are released, and the average temperature of the Earth rises.",,
811,"Empty spaces are created in the space where oil was present, resulting in sinkholes, reducing the usable crust area.",,
812,"When the environment is very polluted and energy is depleted, it becomes difficult.",,
813,"The increase in CO2 emissions will accelerate global warming, which is likely to result in food shortages",,
814,The increase in greenhouse gases can cause problems such as rising sea levels as the average temperature rises.,,
815,"Global warming, resource depletion",,
816,Carbon dioxide is generated and global warming occurs.,,
817,Using a lot of fossil energy can lead to war due to the lack of fossil energy in the future and promote global warming.,,
818,"The emission of greenhouse gases pollutes the air and increases the greenhouse effect, which increases the temperature of the earth, causing glaciers to melt and raise sea levels.",,
819,"If fossil energy is used a lot, global warming will intensify because greenhouse gases such as carbon dioxide emitted during use will increase in the atmosphere.",,
820,Global warming intensifies due to increased emissions of greenhouse gases.,,
821,Environmental pollution can occur,,
822,"Nothing happens, it's just fossil energy exhaustion.",,
823,"The emission of greenhouse gases is high, which is the main cause of global warming.",,
824,The use of fossil energy pollutes the atmosphere and runs out of energy and is no longer available.,,
825,"Right now, the news was noisy due to fine dust from China. If you continue to use fossil energy, it will be a lifelong problem, not a temporary one",,
826,"The use of fossil energy releases carbon dioxide, which is the main cause of global warming, so global warming will occur.",,
827,"One day, resources will be depleted and there will be a shortage of energy resources, and global warming will gradually worsen due to increased carbon dioxide emissions.",,
828,Resources run out.,,
829,"Burning coal and oil produces a lot of greenhouse gases such as carbon dioxide. As a result, the greenhouse effect increases and accelerates global warming.",,
830,Used up,,
831,"Global warming, or the destruction of the ozone layer, has so far accelerated as the use of coal and oil increases. In addition, the scarcity of resources also plays a major role because fossil energy never has a short lifespan to be created. Therefore, there is a possibility that the amount of resources will be reduced in the future, and the amount of resources will cause major social and economic changes and confusion, and many of them, including ecosystems, will be confused in the environmental part.",,
832,"Since the amount of coal and oil is limited, if the amount is depleted, power generation cannot be generated, the environment is destroyed by pollutants during power generation, and global warming will be accelerated by greenhouse gases.",,
833,Global warming accelerates,,
834,The water level is going up,,
835,environmental pollution,,
836,The environment is destroyed and resources are depleted,,
837,The gap between the rich and the poor is likely to widen as the price goes up due to the shortage,,
838,"Environmental pollution becomes serious, and ecosystems are destroyed.",,
839,"Natural environment is destroyed and natural disasters occur unpredictably frequently, affecting our lives",,
840,Global warming,,
841,"First, until oil and coal prices soar and all the cars, ships and planes that are now stopped and other sources of energy are found, a global recession arrives",,
842,..I don't know.,,
843,Global warming will accelerate as carbon dioxide dissolved in the sea comes out into the atmosphere as problems and temperatures increase due to oxides generated in the process of burning fossil energy.,,
844,"Nature is destroyed, and various disasters come, and the residential environment we live in is destroyed",,
845,Global warming comes and future energy sources become scarce,,
846,It causes environmental pollution,,
847,"We're running out of energy, and we're running out of energy",,
848,Global warming intensifies,,
849,""" In terms of economics, fossil energy is more efficient than other energy sources, but if you use it a lot, you'll run out in a few years, and if you run out of resources, the rate of research and development in humans will drop dramatically. The fact that knowledge is not generated faster now, which is a knowledge-based economy, can cause economic stagnation.",,
850,"It is already prevalent in the environment, but when fossil energy is burned, carbon dioxide accelerates global warming, and global warming causes a lot of damage such as El Nino, Lannina, ozone holes, and ecosystem destruction. This environmental damage also leads to economic losses.",,
851,"Therefore, if you use a lot of fossil energy, you can develop with economic benefits right now, but in the long run, you can see it as a big loss.""",,
852,Extinction of mankind,,
853,"""It will fall and run out and use up.",,
854,"Without countermeasures or other alternatives, I am more afraid that there will be a huge crisis around the world and how it will affect the Earth and the environment if it runs out. I think it's a problem because I don't know it.",,
855,"I don't know what will happen, but I think it's a problem to write recklessly without thinking about what will happen later. """,,
856,"There is not much fossil energy left to use in the future, so I think I will feel a lot of inconvenience in my life.",,
857,"If you use coal or oil a lot, it will not only become rare but also have a negative impact on the environment",,
858,Coal or oil will be cut and have a bad environmental impact.,,
859,"Fossil energy will be resource depletion, and I think in the distant future we will be fossil energy in this era.",,
860,It's all running out,,
861,I can't see the earth again with fresh air,,
862,I can't see the earth again with fresh air,,
863,Fossil energy doesn't go away,,
864,The environment is becoming increasingly destructive and difficult to live in,,
865,Continuous development is impossible due to environmental destruction and the living environment is gradually deteriorating,,
866,With the letter K-in this,,
867,I don't know.,,
868,the global warming will get serious,,
869,Fossil energy disappears,,
870,Fossil energy is depleted.,,
871,Global warming is hurting the earth,,
872,Global warming is getting worse,,
873,Global warming will intensify.,,
874,The environment becomes dirty.,,
875,Environment preserved,,
876,Global warming will intensify and energy depletion will occur,,
877,Global warming occurs,,
878,Global warming gets worse,,
879,.,,
880,"The Earth's CO2 concentration rises so high that the ozone layer is destroyed and UV rays cannot be blocked, causing the Earth to die",,
881,Later things like fossil energy are no longer available.,,
882,"As carbon dioxide increases, environmental pollution progresses rapidly, so I think I will buy air and drink it.",,
883,"Global warming will worsen, which will have a great impact on the natural ecosystem, and on the human world.",,
884,Resource depletion and environmental pollution,,
885,Global warming occurs due to the increase in the amount of carbon dioxide in the atmosphere.,,
886,Global warming causes temperatures to rise and people are unable to liveable,,
887,The environment is deteriorating and resources are depleted.,,
888,OMG wow this is very hard question,,
889,"Eventually, coal and oil will be depleted and fossil energy will be lost.",,
890,"Fossil energy is depleted and environmental pollution becomes more severe, causing global warming.Global warming is getting serious",,
891,Environmental pollution becomes serious and fossil energy is depleted,,
892,I'm going to screw up,,
893,Life on Earth will be shortened,,
894,Carbon dioxide produced in the process of using coal and oil causes global warming.,,
895,The earth is coming to an end.,,
896,We can no longer live on this planet.,,
897,"Eventually, there will be a day when fossil energy is depleted",,
898,Global warming is likely to be further accelerated by carbon dioxide.,,
899,Global warming will be severe,,
900,"When the environment is destroyed and all the limited fossil energy is depleted, energy becomes unavailable.",,
901,"As greenhouse gases increase, the temperature of the earth rises, and fine dust increases, lung diseases increase rapidly, and ozone layer destruction, etc",,
902,Resource depletion and global warming intensified.,,
903,Fossil fuels disappear. The environment is destroyed. Global Warming Accelerates,,
904,"Due to global warming, both the North and South Poles will melt and a tsunami will occur",,
905,Energy depletion is easy and causes environmental pollution,,
906,Global warming will get worse and later fossil energy will be depleted.,,
907,Global warming occurs,,
908,I don't know.,,
909,Global warming.,,
910,sorry,,
911,The air becomes murky and resources are depleted,,
912,the global warming will get serious,,
913,"As resources are depleted, infrastructure that currently uses fossil fuels will collapse, leading to global turmoil, and the rapid greenhouse effect will greatly increase the frequency of abnormal climates.",,
914,I'm running out,,
915,"Carbon dioxide is generated in the process of burning coal or petroleum into usable energy, so if fossil energy is used a lot, it can cause disasters such as ozone layer destruction, global warming, and abnormal climate.",,
916,"The concentration of carbon dioxide increases, the ozone layer is destroyed, and fossil energy such as coal and oil is depleted, making it difficult to use.",,
917,I'm doomed,,
918,The future will run out of energy and nothing to use,,
919,Resources like fossil energy disappear a lot,,
920,Global warming gets worse,,
921,The earth is destroyed!!!!!!!!!!!!!!!!!!!!!!!!!!!!!!!!!!!!!!!!!!!!!!!!!!!!!!!!!!!!!!!!,,
922,"Later, I think the country will collapse without being able to use it.",,
923,a shortage of resources,,
924,air pollution,,
925,횾뇨ㅗㅈㄴ토ㅛㅁㄷ홍ㄱㅎㄱㅎㄷㄱㅎㄷㄷ교,,
926,take a liking to the view of Huaqiao,,
927,The country is doomed,,
928,Environmental pollution will continue and one day it will run out,,
929,The earth is sick,,
930,I don't know.,,
931,Fossil energy will be used in the future.,,
932,Fossil energy will disappear and the environment will deteriorate.,,
933,I think it's going to be a mystery,,
934,Carbon dioxide becomes depleted and global warming accelerates.,,
935,"""Earth resources run out over time",,
936,"It burns fossil energy, oil, or coal",,
937,"Global warming occurs.""",,
938,"Environmental pollution will be worse than it is now, and eventually, resources will be depleted and energy will not be available.",,
939,Fossil energy cars are invented,,
940,The earth is coming to an end,,
941,The use of fossil fuels increases air pollution.,,
942,"Carbon dioxide from burning fossil energy causes a greenhouse effect, making C4 photosynthesis impossible. In the worst case scenario, all life on Earth goes extinct",,
943,"Dioxidation from burning fossil energy causes the greenhouse effect, making C4 photosynthesis impossible, and in the worst case, all life on Earth is dangerous",,
944,The environment is destroyed and the earth is destroyed,,
945,"Fossil energy is burned, resulting in a greenhouse effect due to greenhouse gases, making C4 photosynthesis impossible, and in the worst case, all life on Earth is dangerous.",,
946,Global warming is getting worse and pollution such as air pollution.,,
947,The world is in trouble as the energy runs out,,
948,The earth is slowly coming to an earth is dying.,,
949,Global warming is getting worse and pollution such as air pollution.,,
950,Oil becomes expensive and the environment is greatly destroyed,,
951,"In the future, life will be difficult because fossil fuels are depleted.",,
952,Coal becomes expensive and the environment is greatly destroyed,,
953,More energy than electricity,,
954,I don't know.,,
955,It will be depleted and unusable.,,
956,"Using up fossil energy, it will be a dark place without electricity in the future",,
957,There will be no shortage of fuel.,,
958,I think I'll use a lot of fossil energy,,
959,I don't know,,
960,I don't know,,
961,I don't know.,,
962,the destruction of the earth,,
963,I don't know,,
964,Life becomes uncomfortable because coal and oil are running out.,,
965,There will be a lot of carbon dioxide and global warming,,
966,environmental pollution,,
967,"Carbon dioxide will be produced by using a lot of coal or oil, which will attract the environment.",,
968,"""If we use a lot of fossil energy, our nature will be destroyed in the future",,
969,"Our lives are not good.""",,
970,"Even if fossil energy is depleted, humans will be able to use fossil energy in the future because humans are now developing infinite energy resources to be used as new sources of energy",,
971,Even breathing becomes difficult because the air is so polluted.,,
972,"In the future, the air will be bad, and if coal and oil are exhausted, the world will be dark.",,
973,Environmental pollution is getting worse.,,
974,Environmental pollution becomes serious and the surge in fine dust also damages health.,,
975,Using fossil energy can improve the environment and develop faster than now.,,
976,All mankind will die,,
977,The air is bad and climate change is likely to be serious.,,
978,Using fossil energy can improve the environment and develop faster than now,,
979,I don't know,,
980,I don't know.,,
981,I don't know,,
982,You can't use fossil energy when you need it,,
983,I don't know,,
984,No cars or trains will operate because of the lack of resources,,
985,The environment is destroyed.,,
986,"Eventually, the Earth becomes ill and eventually the Earth dies.",,
987,Don't know,,
988,I don't know.,,
