409,Because cloth reacts to hot things.,,
410,This is because there is heat left on the iron plate.,,
411,Because of the heat,,
412,This is because the temperature has increased.,,
413,"A hot iron touches and heats up the heat, causing a fire.",,
414,My temperature is high,,
415,I don't understand.,,
416,This is because the hot iron transferred heat.,,
417,with a strong temperature,,
418,This is because the heat keeps coming out.,,
419,Because the iron is very hot.,,
420,The iron was hot and the iron plate burned.,,
421,Because of the heat,,
422,The iron was heated up,,
423,The iron gate caught fire when the heat was transferred to the iron plate.,,
424,The iron is hot,,
425,It's made of cloth.,,
426,The iron is hot,,
427,"The heat of the iron is transferred to the plate, causing a fire.",,
428,This is because the hot iron transferred heat.,,
429,This is because the fire was quickly transferred from the iron to the iron plate.,,
430,The hot iron burns when it touches the clothes,,
431,It's hot,,
432,"Because of the high temperature of the iron, it reached the ignition point",,
433,High temperatures are applied to the air,,
434,The iron plate was heated by the iron,,
435,The hot iron burned the cloth,,
436,The heat of the iron went up so fast that the fire broke out because of friction with the cloth,,
437,There is a heat transferor for heat to travel.I,,
438,"As the heat on the iron moves to the iron plate, the temperature at which the fabric is burned rises, and the iron plate is burned.",,
439,The heat of the iron seems to have caused the fire.,,
440,It's so hot that it,,
441,It's an iron that's heating up,,
442,"Too hot heat is applied and it combines with oxygen in the air, causing a fire",,
443,The iron is hot,,
444,I sprayed water and didn't catch fire. I just burned the iron plate,,
445,It's because the temperature has risen to the temperature where the fire starts,,
446,Tom when the temperature is above a certain temperature,,
447,It's because the iron plate is so hot that it's because it's hot,,
448,"The hot iron stays on the cloth, but it gets hot and burns",,
449,"This is because if the temperature exceeds a certain temperature, it catches fire.",,
450,"Because the fabric is weak against heat, it puts on an iron that has a lot of heat",,
451,Because heat is conducted,,
452,This is because the heat remaining on the iron was conducted to the iron plate.,,
453,It's because the heat is transferred,,
454,"Since the cloth is burnt, the ironing board is burnt",,
455,The hot iron causes the fabric to get hotter and burn.,,
456,Cloth catches fire easily,,
457,The heat was higher than the constant temperature and caught fire,,
458,Because the heat of the iron is too hot.,,
459,It must have caught fire because of the high temperature,,
460,I don't know.,,
461,The continuous time and friction of the hot heat of the iron,,
462,It's too hot,,
463,???????,,
464,It's hot,,
465,in a fever,,
466,The iron plate burns because of the heat as the iron heats up.,,
467,It's because of the heat,,
468,Because the iron was hot and the iron plate kept getting hot,,
469,The iron is hot,,
470,The fire is coming out,,
471,It's too hot,,
472,The iron is hot,,
473,The weather is hot and the iron is heated.,,
474,This may be because the iron is already heated.,,
475,The iron is hot.,,
476,It's so hot,,
477,"I get on the ironing board, too",,
478,Iron plates are materials that don't burn easily,,
479,The iron has enough heat,,
480,The iron burns the clothes by heating.,,
481,Iron is a gate that can move heat,,
482,"Because the iron is a steam iron, it makes water evaporate",,
483,"I got a fever, so I rode it together",,
484,The iron already has enough heat,,
485,The iron has enough heat,,
486,The temperature got too high,,
487,"It was because there was a cloth iron plate, air, and hot heat needed in case of a fire.",,
488,The heat gathered,,
489,I put a hot iron on the stream,,
490,The moisture is gone,,
491,The heat from the iron moves to the iron plate,,
492,The heat from the iron moves to the iron plate,,
493,The heat of the iron moves,,
494,The heat is shiftingThe heat is shifting,,
495,The heat moves to the ironing board,,
496,The heat of the iron moves to the cloth iron plate and catches fire.,,
497,The heat is shifting,,
498,...,,
499,"This is because the temperature of the iron is higher than the ignition point of the cloth, there is enough oxygen around it, and the cloth is a burning material.",,
500,The iron is too hot,,
501,The iron is hot,,
502,I don't know,,
503,It's too hot,,
504,Because the iron has hot heat and the iron plate is cloth,,
505,The iron is hot,,
506,"""Because of heat transfer,",,
507,"""",,
508,Because the iron is hot.,,
509,Because of the heat transfer...,,
510,--,,
511,The heat moved from the iron.,,
512,M and D,,
513,I think it's because the heat is too hot.,,
514,It's getting hot,,
515,This is because the heat on the iron moved to a cloth iron plate.,,
516,Because of the heat,,
517,I don't know.,,
518,I don't know.,,
519,"Because irons iron clothes with hot temperature,",,
520,I don't know.,,
521,"""Because the cloth was burned",,
522,"""",,
523,The iron is hot,,
524,The iron is hot,,
525,"Because the iron is hot by heating it up,",,
526,The fabric burns,,
527,"The iron is not lit, but the iron plate can burn because it is hot.",,
528,The iron is hot,,
529,"Since the heat goes up,",,
530,The fire spread,,
531,"I had to turn off the iron, but it just went away",,
532,I don't know,,
533,I don't know,,
534,I don't understand.,,
535,lol,,
536,This is because the temperature increased and heat was generated.,,
537,The hot iron kept sticking to the cloth iron plate and caught fire.,,
538,"In order to catch fire, you need oxygen, something to burn, and fire, but the fabric will burn, and the oxygen is in the air, and there was a hot iron instead of fire, so the iron plate burned.",,
539,"The conditions for fire are that the material to be burned, sufficient temperature, and oxygen, where the iron provided sufficient temperature.",,
540,"Three conditions are needed to be combustible. They are heat, oxygen, and de-materials. Oxygen was usually satisfied because it existed everywhere on Earth, and heat was satisfied because the iron was hot. Finally, the fabric could be burned, so the last conditions were met. Therefore, although it was not lit, the ironing board could be lit.",,
541,"""The heat released from the iron accumulated, causing the iron plate to burn",,
542,"""",,
543,This is because the iron itself generates high heat and the temperature rises above the ignition point.,,
544,This is because the hot iron raised the temperature of the cloth iron plate.,,
545,The temperature of the iron is so high that the temperature of the iron plate increases gradually and the iron plate burns,,
546,"When the fabric on top burned and directly contacted the fire, rapid oxidation occurred, causing the metal iron plate to change black.",,
547,"In order to catch fire, three conditions are required: temperature above the ignition point, de-material, and oxygen, and the iron plate was ignited because it met the three conditions even if it was not directly lit.",,
548,"If you keep applying hot heat to the cloth iron plate, the temperature rises and exceeds the temperature that catches fire, and it catches fire.",,
549,The fabric burns better,,
550,This is because the temperature of the iron was higher than the ignition point of the iron plate.,,
551,"This is because there is an iron plate that was oxygen and de-material, and the temperature of the iron plate became higher than the ignition point due to the iron.",,
552,"Since the de-material fabric was under the hot iron, and there was a hot iron that reached the ignition point, there was an element that satisfied the firing conditions, so it caught fire and the iron plate burned.",,
553,I'm sorry.,,
554,"Fire is caused by a lot of energy (heat), and when air is supplied, it catches fire. Therefore, since the dam is hot, heat is supplied, and air is supplied, so fire may occur.",,
555,"High heat is generated by the iron, and as a result, the temperature of the iron plate increases rapidly, thereby increasing reactivity with oxygen. Since the combustion reaction is a bond with oxygen, the use of an iron may cause combustion and fire.",,
556,"For combustion, a temperature higher than oxygen and the firing point is required, and the temperature of the iron plate rises above the firing point by the hot iron, and because there was oxygen, the combustion conditions were met and the iron plate burned.",,
557,"The temperature of the fabric iron plate increases due to the hot iron, and the temperature of the iron plate increases to the burning point of the fabric, satisfying the three conditions of fire: temperature, de-material, and oxygen.",,
558,"If the temperature of each material increases above a certain temperature, it will catch fire and burn even if it is not directly lit.",,
559,"This is because the hot iron was located in one place for a long time and raised the temperature above the ignition point of the cloth. Each substance has its own ignition point, which fires when the temperature rises above the ignition point.",,
560,"De-materials, oxygen, and sufficient temperature are required to cause a fire. The iron plate has de-materials, and oxygen around it. In conclusion, the hot iron was still on the iron plate, so it reached a sufficient temperature and the leg plate burned.",,
561,under the heat,,
562,The fire broke out at a certain temperature,,
563,There's a heat on the iron,,
564,I don't know,,
565,.,,
566,"Each material fires at a certain temperature, because the cloth reaches that temperature through the iron.",,
567,direct contact with fire,,
568,It's heated up to the heating point,,
569,"Now that you've heated it up, go",,
570,It's hot,,
571,It's hot,,
572,It's because they're different in nature.,,
573,Fire occurs when the temperature is above a certain temperature.,,
574,The iron is hot,,
575,I don't know.,,
576,Because the iron plate is made of non-burnable material,,
577,The iron heats up and reaches the ignition point,,
578,?,,
579,The temperature goes up above the ignition point,,
580,The heat keeps going,,
581,It's because of the fever.,,
582,The temperature of the iron is high,,
583,The temperature of the iron was higher than the firing temperature of the cloth and caught fire.,,
584,"There's no fire, but the temperature is high.",,
585,It's because of electricity and water vapor.,,
586,It is because of the constant heat applied.,,
587,It's hot,,
588,I'll heat. I'll heat it up,,
589,"The temperature didn't rise to the point of fire, but the iron seemed to burn with a constant supply of heat.",,
590,It is because it has high conductivity and oxygen.,,
591,heated up,,
592,Because it gets hotter as time goes by.,,
593,The iron plate hasn't been heated enough to catch fire yetIt's not hot enough to catch fire,,
594,It's not the temperature at which the iron plate catches fire,,
595,Because the iron is hot,,
596,This is because the temperature of the hot iron was higher than the ignition point of the iron sheet fabric.,,
597,It is because of the hot heat of the iron or the heat of electricity.,,
598,"This is because the hot iron supplied heat energy enough to reach a temperature above the firing point of the cloth, and there was enough oxygen.",,
599,The fabric is heat transferreduced,,
600,"Because of the heat and water in the iron,",,
601,It's hot,,
602,It's hot,,
603,yo,,
604,I'm done with a lighter,,
605,Because the iron is hot,,
606,It's hot,,
607,heat conduction,,
608,"When the noodles are heated to high temperatures, they start to burn and start to catch fire",,
609,The temperature of the hot iron exceeded the ignition point,,
610,"This is because it burns when there is de-material, oxygen, and temperature above a certain standard.",,
611,This is because the ironing board is weak at hot temperatures.,,
612,"""",,
613,The iron is hot,,
614,The hot steam raised the temperature.,,
615,It's because the temperature is high,,
616,"Heat reaches the ignition point of the fabric and the ignition point of the iron is not reached, so the fabric is burned",,
617,"It's because the cloth on the ironing board, not the ironing board, caught on fire",,
618,"Because there was oxygen, and the iron plate became a temperature above the ignition point, and there was a de-material called an iron plate, so all three conditions of combustion were met.",,
619,"This is because even if the temperature rises above a certain temperature, it catches fire.",,
620,This is because the steam in the iron is heated up more than the burning point of the iron plate.,,
621,Because the heat is transferred to the iron plate,,
622,This is because it received high heat in a continuously narrow range.,,
623,This is because heat was applied to the iron plate and the temperature was as high as the fire.,,
624,I'll put a hot iron,,
625,I don't know,,
626,"Because the iron is hot,",,
627,The temperature of the iron plate exceeded the ignition point,,
628,This is because the iron plate has crossed the ignition point.,,
629,"There was a de-material called an iron plate, and as the iron was continuously heated, the temperature increased to a temperature above the firing point, so the iron plate burned.",,
630,"This is because enough heat is supplied, enough oxygen exists to burn the substance, and de-materials exist.",,
631,It's because the cloth has reached the burnable temperature,,
632,Let's see. Sexy,,
633,This is because the iron plate has a higher bong point than the cloth.,,
634,I think the iron is burning because of the heat.,,
635,Because the heat is heated in a state of heat dissipation,,
636,"It is because the temperature of the water is high, although the fire may not occur well.",,
637,"If the cotton fabric continues to receive heat for a certain amount of time, it will catch fire",,
638,"Due to the temperature above the ignition point,",,
639,"Since the iron applied heat to the cloth of a certain area for a long time, the cloth lost its characteristics to maintain the state, and a fire occurred when it met oxygen in the air.",,
640,Because the iron plate was already hot,,
641,It's because the iron produces heat,,
642,"The heat of the hot iron is getting hotter and hotter, so it seems to have burned.",,
643,The reason is that the heat of the iron remained the same.,,
644,It's made of fabric,,
645,"As strong heat energy was supplied, oxygen was blocked, creating an environment in which fire could catch fire.",,
646,The heat on the ironing board is gone,,
647,The bottom of the iron is still hot,,
648,There's heat on the iron,,
649,"This is because there are de-materials and oxygen, and the temperature is above the ignition point.",,
650,This is because the conduction heat of the iron is higher than the temperature of the combustion point of the fabric and the fabric is burned.,,
651,It's getting heated up,,
652,This is because electrical energy has been converted into thermal energy.,,
653,The high temperature of the iron burned the iron plate.,,
654,"The fabric was burned out, so the iron plate under the fabric was used to keep the fire burning, so the iron plate was also burned.",,
655,The reason why the iron plate was on fire was that the hot iron was not cooled down and was placed directly on the iron plate.,,
656,"It is because the electrical cord is operated without removing it, and then it is placed on the clothes.",,
657,"This is because the heat generated from the iron is continuously transferred to the iron plate, and the temperature of the iron plate is high enough to burn.",,
658,Because of the heat,,
659,The hot heat caused the iron to burn,,
660,"Because of the heat of the iron,",,
661,"There must be oxygen and hot objects to catch fire.However, there is oxygen and hot objects on the iron plate, so there is a fire.",,
662,Because the iron plate is cloth.,,
663,"The heat kept coming out of the iron, and the heat burned the cloth.",,
664,"The reason why the iron gets hot is that it puts water inside and allows water to heat up, so that some moisture and carbon dioxide combine to create a fire",,
665,It's hot,,
666,"The hot iron was in the cloth for a long time and the heat of the iron moved to the cloth, causing the fire",,
667,"Because of the heat of the iron,",,
668,The heat energy of the iron came out and the cloth burned,,
669,The heat is generated by electricity,,
670,"Heat energy (hot iron) continued to touch a cloth that was easy to transfer heat, so heat was transferred and burned.",,
671,"This is because if heat is continuously concentrated in one place, it causes a fire.",,
672,"If a hot temperature is applied to the point where it is on fire even if it does not catch fire, particles of an object are destroyed by high heat, and particles around it are destroyed, so that they burn as they grow in size.",,
673,burn with a lot of heat,,
674,It's because it doesn't rise to the temperature of the fire.,,
675,Seongsu is the best,,
676,It's hot,,
677,beyond the point of burning,,
678,"When the temperature rises above the ignition point, the network burns",,
679,The temperature goes up above the ignition point,,
680,"Because the iron is heated,",,
681,It is because of the heat of the iron.,,
682,"Because the iron made the temperature of the fabric above the ignition point,",,
683,We reached the point of ignition,,
684,It's at the burning temperature,,
685,"You get to the ignition point, you meet oxygen,",,
686,This is because the minimum temperature of the fire was met and energy as much as the temperature was increased,,
687,The temperature went up,,
688,The heat is continuously applied,,
689,"The fabric catches fire easily, but if you keep pressing it with an iron, the temperature goes up and it catches fire",,
690,The iron plate is hot and causes a fire.,,
691,"This is because the temperature, which is the burning point of the iron plate, was reached by an iron.",,
692,It's because the temperature went up above the ignition pointThe temperature went up,,
693,The hot iron caught fire beyond a certain temperature,,
694,The temperature went up,,
695,This is because it has exceeded a certain temperature that can cause a fire.,,
696,"""I've reached the point of ignition",,
697,"""",,
698,"Irons are used for clothing because of the hot temperature, which causes the temperature to rise above the ignition point and burn",,
699,It's on top of the cloth,,
700,The hot iron would have caught fire easily because of its high heat.,,
701,"""Because the ironing board is hot",,
702,"Or I think there's something that catches fire or something that might catch fire.""",,
703,It's heated up and slowly starts to burn,,
704,heat conduction occurs,,
705,"The iron was heated by heat on the bottom of the iron and the iron became hot, causing the iron to burn. And it's heated to a temperature above the ignition point",,
706,"As the temperature of the iron gradually increased, it seems to have caught fire because it exceeded the ignition point of the iron plate.",,
707,Because the hot iron already has heat,,
708,Because the iron is already hot.,,
709,"It's because the more you have an iron, the hotter it gets",,
710,"""The temperature of the hot iron reaches the cloth, and the temperature of the cloth rises to the point of ignition of the cloth",,
711,"I got on.""",,
712,"The heat on the hot iron is heated on the iron plate, which causes a fire.",,
713,A hot iron will easily catch fire because of its high heat,,
714,"The iron had a temperature above the ignition point, so the iron plate caught fire",,
715,This is because the temperature of the iron touching the iron plate exceeded the ignition point of the iron plate.,,
716,The temperature of the iron is above the ignition point,,
717,"This is because when an iron touches the cloth for a long time while there is a temperature, the cloth also heats up.",,
718,The hot iron heats the cloth iron plate and burns the iron plate,,
719,"It was burned because there was hot heat, dehydration, and air",,
720,"The heat on the iron heats the cloth, causing the temperature to rise more than the original temperature of the cloth and ignite the cloth.",,
721,"This is because the iron on the iron plate was heated and the temperature increased, and the iron caught fire and caught fire on the iron plate.",,
722,"""Each substance has an ignition point. When a certain amount of ignition point temperature is reached,",,
723,"It gets too hot to catch fire.""",,
724,"In the condition of catching fire, there needs to be de-materials, temperatures above the ignition point, and oxygen to catch fire, but by leaving the iron plate as it is, it becomes a temperature above the ignition point and catches fire.",,
725,"Irons use electricity, but electricity becomes energy, which causes materials to burn.",,
726,The temperature of the iron was so high that it burned,,
727,"When the iron heats up, wood paper burns",,
728,Because it went up on the ignition point and caught fire.,,
729,The plate on which the hot iron was placed was burned by the hot heat.,,
730,"The iron sends out heat, and oxygen and heat meet and catch fire.",,
731,"The hot iron provided the iron plate with a temperature above the ignition point of the iron plate, causing the iron plate to catch fire",,
732,The iron part on the bottom of the iron is heated and the iron part becomes hot and the iron plate burns,,
733,The fabric caught fire and the fire was carried away,,
734,The heat transferred and caught fire,,
735,The heat transferred and caught fire,,
736,I don't know,,
737,It depends on the burning point,,
738,It's because the heat is too hot,,
739,"If oxygen is present and desiccant is present, it can be burned",,
740,"Because of the fabric, the fabric burns easily, so if the hot iron stays on the iron plate, the temperature will rise and fire",,
741,I don't know.,,
742,This is because the temperature of the iron was high and dry.,,
743,This is because the temperature of the iron was high and dry.,,
744,It's because the temperature has risen,,
745,heat conduction,,
746,"""The heat of the cloth and the heat of the iron are the same",,
747,"The power to endure is different.""",,
748,It burns because of heat conduction,,
749,"There's a hot iron, so it's heated up",,
750,This is because contacting cloth-like cotton materials at hot temperatures increases the temperature.,,
751,I was so heated by the heat,,
752,I don't know,,
753,I don't know.,,
754,Mullayoung,,
755,The temperature goes up higher than the burning point,,
756,Firing due to heat,,
757,The iron is too hot,,
758,The temperature is higher than the ignition point,,
759,a hot fever,,
760,There needs to be oxygen,,
761,"The temperature is high, so it's beyond the boiling point",,
762,I don't know,,
763,Thermal conduction,,
764,It's blocked,,
765,Temperature rises and heats up leaving a fire,,
766,The conditions of the temperature reached the burning temperature by the temperature of the iron and the condition that oxygen in the air was needed were both satisfied and caught fire.,,
767,"The iron is heated to a high temperature, when the heat is concentrated on the cloth and it burns",,
768,This is because the temperature of the cloth has reached its limit.,,
769,The fabric caught fire because of the high temperature.,,
770,"If you reach the boiling point of the iron plate, the object is going to be liquid and the iron plate burns",,
771,"As the iron heated up, the heat energy that it could have was exceeded, so it was transferred to the iron plate and the fire started",,
772,"Because if you have a fever, you get a fire",,
773,"The temperature of the cloth has increased, so I think it is because of...?",,
774,We reached the point of ignition,,
775,"Heat of the hot iron is transferred to a cloth with a relatively low temperature by conduction, and the cloth is burned by reaching a temperature above the firing point.",,
776,"There was temperature above the ignition point, de-materials, and oxygen",,
777,The temperature of the iron plate was higher than the ignition point due to the heat,,
778,"This is because heat is conducted from the iron to the iron plate, so the temperature of the iron plate rose above the ignition point.",,
779,Because the temperature is above the ignition point.,,
780,at a temperature above the ignition point,,
781,"Since the iron plate has reached a temperature above the ignition point,",,
782,It's hot,,
783,The temperature rises above the ignition point,,
784,a temperature above the ignition point,,
785,The iron plate burned because it kept supplying heat to maintain the temperature.,,
786,"Because the iron plate was heated,",,
787,The temperature above the ignition point is provided,,
788,We reached the point of ignition,,
789,The iron will be hot,,
790,I don't understand.,,
791,The fabric of the iron plate can't stand the heat transferred to the iron plateThe temperature went up,,
792,The hot iron caught fire beyond a certain temperature,,
793,The temperature went up,,
794,This is because it has exceeded a certain temperature that can cause a fire.,,
795,"""I've reached the point of ignition",,
796,"""",,
797,"Irons are used for clothing because of the hot temperature, which causes the temperature to rise above the ignition point and burn",,
798,It's on top of the cloth,,
799,The hot iron would have caught fire easily because of its high heat.,,
800,"""Because the ironing board is hot",,
801,"Or I think there's something that catches fire or something that might catch fire.""",,
802,It's heated up and slowly starts to burn,,
803,heat conduction occurs,,
804,"The iron was heated by heat on the bottom of the iron and the iron became hot, causing the iron to burn. And it's heated to a temperature above the ignition point",,
