1046,"My eyes hurt for now my eyes hurt. When you focus on black paper with convex lenses, sunlight gathers there and receives heat, causing the paper to get scorched or burned.",,,
1047,The sunlight gathers in one spot,,,
1048,It can catch fire.,,,
1049,My clothes burn better because they are black,,,
1050,Sunlight gathers in one place and traps paper in and causes a fire,,,
1051,The sun will be concentrated in one place and burn where the convex lens is illuminated,,,
1052,"Because light is concentrated in one place, the temperature at that point becomes very high.",,,
1053,"The statue is formed by turning 180 degrees, and the color is larger and clearer.  Magnifier, car side mirror",,,
1054,"If you put paper in a place that collects sunlight, it will burn",,,
1055,De-materials catch fire,,,
1056,The light is gathering,,,
1057,The sunlight gathers in one spot,,,
1058,The sunlight gathers. The part where the light gathers gets hot.,,,
1059,Strong energy is generated,,,
1060,to be able to burn matter,,,
1061,It's getting hot,,,
1062,Light gathers in one spot,,,
1063,A fire breaks out in the gathering area,,,
1064,There is a gathering point,,,
1065,The energy of light comes together and it gets hotter,,,
1066,Put black paper on it burns,,,
1067,The boil burns,,,
1068,the temperature of the substances below it rises,,,
1069,It's hot,,,
1070,It gathers in one point.,,,
1071,There's a fire,,,
1072,The light is spreading,,,
1073,"If you collect sunlight with a convex lens, there is a fire.",,,
1074,Sunlight gathers at one point and the material underneath burns.,,,
1075,"The sunlight, which originally spread over a large area, is refracted by convex lenses, which concentrates on a smaller area, and the narrow area where the sunlight touches is heated at a faster rate.",,,
1076,"Because convex lenses have the property of refracting light to the thick side of the lens, light gathers and the temperature is concentrated in one place. Therefore, there is smoke or fire.",,,
1077,The light gathers and the gathering place heats up. There will be a fire in the end.,,,
1078,It can be hot and on fire!,,,
1079,"Because light refraction occurs in convex lenses, when sunlight is collected, the light gathers at a point and over time, the temperature of the area rises, generating heat, which can cause a fire (in the case of paper, the area burns black)",,,
1080,"Sunlight will gather and heat will be concentrated in one place. If the temperature of the point where heat is collected increases and lasts for a long time, a fire may occur.",,,
1081,"Collecting sunlight with convex lenses increases the brightness and temperature of the area. . As light passes through the lens, it is bent toward the thick side of the lens because the center of the lens is thicker than the edge, so the light is bent toward the center of the lens.",,,
1082,"All sunlight directed to the convex lens gathers in the middle of the lens, becoming one strong light. Therefore, stronger light and heat will be generated than when light is dispersed. When I was young, I did a science experiment on magnifying glass. It was an activity where a magnifying glass was placed on a white paper to shine sunlight, and the results of the experiment at that time are still memorable. The paper became more and more scorched, and eventually a fire broke out. Perhaps if I had been shining on my hand, my hand would have burned.",,,
1083,"The sunlight that passes through the convex lens gathers in focus. Through this, it can be seen that the convex lens has a characteristic of collecting light. Thus, if you collect sunlight with a convex lens, it will be gathered into one part, and if a lot of light is exposed to a certain space for a long time, only a certain part will be heated. In other words, certain parts where light is gathered will be burned by heat.",,,
1084,"When light is refracted with a convex lens to pass through a point to collect light, the area of light collected becomes smaller when sunlight is collected with a convex lens, and the brightness of that part becomes brighter. Also, the temperature of the sunlight collection increases.",,,
1085,"As sunlight passes through the convex lens, the light deflects inward from the center and gathers into focus. At this time, if there is a substance that can be burned, such as paper, at the point where light gathers, the substance can burn and cause a fire.",,,
1086,"A convex lens refracts incoming light so that the focus is focused in one direction. Therefore, using a convex lens, light can be collected in one direction. Therefore, when sunlight is collected with convex lenses, light can gather in one direction and ignite it.",,,
1087,"When light is incident in a direction parallel to the plane where the convex lens is erected, it is concentrated in the middle of the convex lens with a relatively large density to create a focus. The temperature at the focal point will rise.",,,
1088,"The convex lens refracts and collects light because the center of the lens is thicker than the edge. Therefore, it is possible to collect sunlight with a convex lens and apply hotter heat than usual where the sunlight passes through this lens. For example, if you place the paper underneath the convex lens and let the sunlight shine, the paper can burn with increasing heat.Sunlight gathers, heat from sunlight gathers, so it can be used to heat up.",,,
1089,"Convex lenses are thick in the middle, so they have the property of collecting them into one point. The solar energy gathered in such a way gradually increases the temperature of that part and concentrates heat. At this time, if you put paper or wood, which is a burning substance, concentrated heat causes a fire.",,,
1090,"A convex lens has a convex thicker center than an edge of the lens. Thus, when sunlight passes through the convex lens, the light refracts and bends toward the center and gathers.",,,
1091,"When light gathers, heat is generated and if the heat persists, it can burn any small material. Combustion using larger convex lenses will reduce the use of fossil fuels currently in use, which will save energy and reduce environmental pollution.",,,
1092,"There will be a fire in the middle. Because convex lenses have the property of refracting light, sunlight refracts and passes when sunlight is reflected, and convex lenses have the property of collecting light, so light is refracted toward the focus and light will gather in one place. At this time, energy is generated as light gathers momentarily, which will generate heat and cause fire.",,,
1093,"One interesting experiment is that when sunlight is collected with a magnifying glass, it catches fire. Magnifying glasses are also a typical example of convex lenses. It can be seen that when sunlight is collected with convex lenses, sunlight is collected and caught on fire.",,,
1094,"The convex lens is refracted to a central portion where the incident light is thicker than the edge of the lens. Therefore, when sunlight is collected with a convex lens, the intensity of light becomes stronger than before sunlight is collected.",,,
1095,It collects sunlight and generates heat. Put black paper on it burns.,,,
1096,Let's go! Let's go,,,
1097,Who cares?,,,
1098,Burnable substances slowly catch fire,,,
1099,Sunlight gathers in the middle of the convex lens and the paper with the magnifying glass burns,,,
1100,The paper burns.,,,
1101,Sunlight gathers in the middle of the convex lens and burns paper with magnifying glass,,,
1102,The paper burns,,,
1103,to be able to burn paper by making a fire,,,
1104,"If you keep collecting sunlight on black, it will burn",,,
1105,The paper burns,,,
1106,Put it on paper and the paper burns.,,,
1107,The paper burns.,,,
1108,I don't know because I haven't tried it on,,,
1109,"When sunlight is collected with convex lenses, the sunlight is concentrated in one place, so a fire will occur over time.",,,
1110,to be able to burn paper by making a fire,,,
1111,There's a fire,,,
1112,It's on fire,,,
1113,"When the sunlight collection becomes smaller, the light becomes brighter and hotter, and when the area becomes larger, the light becomes lighter and the temperature decreases",,,
1114,The place where sunlight is collected burns.,,,
1115,"When a block lens collects sunlight, it causes a fire.",,,
1116,There's a fire.,,,
1117,There's a fire,,,
1118,spark,,,
1119,"A convex lens serves to refract light and collect it at a point. Therefore, when sunlight is collected with convex lenses, sunlight gathers at one point, so a lot of heat is generated, and when the paper is brought over, the paper is scorched by fire. Because it is so dangerous, you should be careful of accidents such as bringing your hands.",,,
1120,"Sunlight gathers in one place and generates heat, causing a fire",,,
1121,The light is gathering,,,
1122,"If there is a paper, the paper catches fire and burns the paper.",,,
1123,The spot where the sunlight is gathered is burned.,,,
1124,The sun-collected part burns.,,,
1125,The sunlight gathers.,,,
1126,Light gathers well because it is collected in thick parts.,,,
1127,"The paper burns because it is gathered in one place, which is sunlight.",,,
1128,The part where the light is gathered gets hot,,,
1129,"The part where the sunlight gathered is hot,",,,
1130,Time will catch fire,,,
1131,Light refracts.,,,
1132,The part where the sunlight is gathered gets hot,,,
1133,The sunlight is gathering,,,
1134,"In some cases, when sunlight is trapped in a convex lens, it gets hotter and burns.",,,
1135,Sunlight gathers with convex lenses.,,,
1136,There's a fire,,,
1137,Sunlight can gather and cause a small fire.,,,
1138,There's a fire.,,,
1139,The temperature of the collection increases,,,
1140,The paper burns if there is a piece of paper at the paper burns,,,
1141,"As the sunlight gathers, there is fire and smoke",,,
1142,Sunlight is collected in the middle of the convex lens and the middle part gets hot.,,,
1143,You can collect sunlight.,,,
1144,I think the convex lens will get hot,,,
1145,"Sunlight gathers at one point, where smoke comes out and matter burns.",,,
1146,Evaluation Only. Created with Aspose.Cells for Python via Java.Copyright 2003 - 2022 Aspose Pty Ltd.,,,
