,1) How can I make the compass needle move more without moving the compass (you can add it to the electrical circuit if you need something)? ,q25_electricity,q25_magnetic
0,Use more batteries,,
1,It sends more current.,,
2,I don't know,,
3,side by side,,
4,More electricity,,
5,shake a compass wildly,,
6,The electricity is empty,,
7,Use more electricity.,,
8,You have to move it.,,
9,You can add positive and negative poles on both sides,,
10,It sends more electricity,,
11,I'll open up more electricity,,
12,Install more electrical circuits.,,
13,I think it will move more if we let more current flow.,,
14,emit a lot of static electricity,,
15,I don't know,,
16,cause more current to flow,,
17,You have to move the compass,,
18,It gives a lot of electricity.,,
19,I've folded the seedlings.,,
20,.,,
21,I think we should let more current flow.,,
22,It's blowing,,
23,It's blowing,,
24,You can put in a stronger battery.,,
25,I don't know,,
26,Put a magnet on it',,
27,Put a magnet on it',,
28,You can put a magnet on it,,
29,It allows more current to flow.,,
30,I don't know.,,
31,It sends more electricity,,
32,We need to send more electricity.,,
33,Increase the current.,,
34,to move more magnets from the inscription,,
35,the force of a magnet's electron,,
36,I don't know,,
37,cause more current to flow,,
38,Because it's more challenging,,
39,Turn the compass.,,
40,Make more switches and close them,,
41,Install more batteries,,
42,cause more current to flow,,
43,Close the switch to keep the current flowing.,,
44,Close the switch to keep the current flowing,,
45,Close the switch to allow more current to flow.,,
46,Connect the battery count,,
47,I don't have it.,,
48,Move the electrical circuit.,,
49,All right.,,
50,ㅇㄴㄹ,,
51,It allows more current to flow.,,
52,It gives electricity,,
53,Add Iron,,
54,We need to put in more electricity,,
55,I don't know.,,
56,Real rice thief,,
57,I don't know.,,
58,All right.,,
59,Compass:...................,,
60,I'm not sure about that.,,
61,Add more batteries to increase the power of electricity.,,
62,Place the magnet facing the compass needle.,,
63,It makes the electricity go up a lot,,
64,I'm sorry,,
65,I don't know,,
66,The electricity was transmitted to the compass,,
67,I don't know.,,
68,Don't know,,
69,Connect a lot of batteries,,
70,It increases the current.,,
71,Power up the current.,,
72,Put on another battery.,,
73,an additional battery,,
74,Connect several batteries in series.,,
75,Use stronger cells and weaker wires.,,
76,Increase the current intensity or increase the number of wires.,,
77,a stronger current,,
78,Replace with a strong battery.,,
79,"If you add more batteries to the electric circuit and increase the amount of current, the compass needle will move more.",,
80,It makes the current flow harder.,,
81,Increase the battery power of the electrical circuit.,,
82,Add more batteries.,,
83,Bring the compass closer to the wire.,,
84,"More batteries can be added to increase the intensity of the current, making the compass needle move more.",,
85,More batteries are installed at direct power to flow a stronger current.,,
86,h,,
87,Connect more batteries in series to increase power.,,
88,.,,
89,"The needle in the compass is influenced by the Earth's magnetic field and is then driven by the magnetic field of electric wires. In order to make the compass needle move more, the magnetic field of the wire must be increased, so a stronger current must be sent to the wire, i.e. the number of cells connected in series must be increased.",,
90,The compass contains a magnet because it is a tool that locates through a magnetic field.,,
91,"And the current has a magnetic force as the electricity flows. Compass affected by magnetic force is influenced by magnetic force according to the flow of current, and thus it may be difficult to determine the position of the original work. Therefore, if current is sent to the electric circuit, the needle of the compass moves. As the current increases, the magnetic force becomes stronger, so if more batteries are connected in series to the electrical circuit and a stronger current flows, the compass needle can be moved more without moving the compass.""",,
92,"Stronger current,",,
93,.,,
94,"It is an electromagnetic field that makes the compass move, and it can be said that it is due to a conducting wire through which current flows. Therefore, connecting more batteries in series so that more current can flow through the wire will allow the needle to move more.",,
95,"By adding a battery and connecting the battery in series, the intensity of the current is increased and the magnitude of the magnetic field is increased, thereby making the needle of the compass move more.",,
96,Change the direction of the current by placing the wire completely in reverse or inserting the tongs in reverse.,,
97,"By increasing the voltage of the battery, the intensity of the current passing through the electric circuit is increased.",,
98,"The battery is further connected in series to increase the intensity of the current.As electric current flows through an electric wire, a magnetic field is formed around the electric wire, so the compass needle will be attracted to the magnetic field and move.",,
99,"It flows a stronger current, making electromagnetic induction more likely. In order to allow a higher current to flow, a battery may be changed or added, and there is a method of reducing resistance by changing a material of an electric wire to allow more current to flow.",,
100,"Since the current will flow using a battery and an electric wire, a magnetic field will naturally be formed. Therefore, because the compass moves under the influence of the magnetic field, the needle of the compass will move more because of the magnetic field formed next to it.",,
101,Increase the voltage.,,
102,Put on more batteries.,,
103,Connect the batteries in series to increase the battery's current.,,
104,Increases the intensity of an electric current.,,
105,Increases the intensity of an electric current.,,
106,Makes the electrical circuit stronger,,
107,a powerful battery,,
108,a stronger voltage,,
109,Add more batteries.,,
110,I don't understand.,,
111,I really don't know this either. This is serious.,,
112,I don't know.,,
113,Add a magnet?,,
114,Turn the electricity up,,
115,Turn up the voltage,,
116,Install one more electrical circuit across the existing circuit,,
117,The battery needs to be added.,,
118,to make the current flow stronger,,
119,Put in more batteries.,,
120,I can't explain.,,
121,I don't know.,,
122,to flow an electric current,,
123,Increase the battery and change the current direction from time to time to time,,
124,I don't know,,
125,Press and release the switch of the electrical circuit continuously.,,
126,Connect more batteries. Connect a battery that has a stronger current.,,
127,Thicken the wires and increase the voltage of the battery.,,
128,Add batteries or place magnets around the compass,,
129,.,,
130,I don't know.,,
131,I don't know.,,
132,Connect more batteries in parallel,,
133,Turn on the switch,,
134,cause the current to flow harder,,
135,Increase power cooling by adding batteries,,
136,I don't know.,,
137,Press the switch.,,
138,I don't know,,
139,I'm so sorry,,
140,"If you add an electrical circuit, more current will flow and work better.",,
141,It gives you stronger electricity.,,
142,Connect more batteries,,
143,It allows current to flow. It increases the amount of battery,,
144,Bring a magnet to the side.,,
145,Add more electrical circuits and use batteries with strong electricity,,
146,I don't know,,
147,"Mall,m",,
148,No learning,,
149,It increases the power of the battery harder,,
150,I have no idea.,,
151,I don't know about this,,
152,Change the battery to a stronger one.,,
153,Turn the electricity off and on and on and on and on,,
154,Add Battery,,
155,Power up the current.,,
156,Power up the current.,,
157,It allows an electric current to flow.,,
158,Add more batteries.,,
159,increase the intensity of an electric current,,
160,Bringing a magnet to the dam,,
161,Change to a battery with a large voltage,,
162,It makes electricity work better,,
163,The magnet moves more than the needle of the needle moves more,,
164,You should try it yourself ^-^;^ㅡ^;,,
165,You can use a magnet.,,
166,It makes electricity flow more.,,
167,Use a stronger battery,,
168,Increase the voltage size by adding batteries.,,
169,Increase the power of the electrical circuit.,,
170,Blow more batteries to increase the current intensity,,
171,I don't know.,,
172,I don't know.,,
173,I don't know.,,
174,I don't know,,
175,You can take a magnet and face it.,,
176,I don't know.,,
177,I don't know.,,
178,Increase the battery.,,
179,..;.,,
180,electricity,,
181,Add the number of batteries.,,
182,I don't know,,
183,We need to make the current stronger,,
184,Connect a lot of batteries,,
185,Add batteries.,,
186,Connect several batteries,,
187,It uses a magnet.,,
188,You can put a metal on it,,
189,Add batteries,,
190,It changes the direction of electricity,,
191,Change the direction of existence,,
192,Move the wires,,
193,Add more batteries.,,
194,an electromagnet,,
195,Place compasses around the wire,,
196,I don't know.,,
197,"It changes the flow of electric currentAs electric current flows through an electric wire, a magnetic field is formed around the electric wire, so the compass needle will be attracted to the magnetic field and move.",,
198,"It flows a stronger current, making electromagnetic induction more likely. In order to allow a higher current to flow, a battery may be changed or added, and there is a method of reducing resistance by changing a material of an electric wire to allow more current to flow.",,
199,"Since the current will flow using a battery and an electric wire, a magnetic field will naturally be formed. Therefore, because the compass moves under the influence of the magnetic field, the needle of the compass will move more because of the magnetic field formed next to it.",,
200,Increase the voltage.,,
201,Put on more batteries.,,
202,Connect the batteries in series to increase the battery's current.,,
203,Increases the intensity of an electric current.,,
204,Increases the intensity of an electric current.,,
205,Makes the electrical circuit stronger,,
206,a powerful battery,,
207,a stronger voltage,,
208,Add more batteries.,,
209,I don't understand.,,
210,I really don't know this either. This is serious.,,
211,I don't know.,,
212,Add a magnet?,,
213,Turn the electricity up,,
214,Turn up the voltage,,
215,Install one more electrical circuit across the existing circuit,,
216,The battery needs to be added.,,
217,to make the current flow stronger,,
218,Put in more batteries.,,
219,I can't explain.,,
220,I don't know.,,
221,to flow an electric current,,
222,Increase the battery and change the current direction from time to time to time,,
223,I don't know,,
224,Press and release the switch of the electrical circuit continuously.,,
225,Connect more batteries. Connect a battery that has a stronger current.,,
226,Thicken the wires and increase the voltage of the battery.,,
227,Add batteries or place magnets around the compass,,
228,.,,
229,I don't know.,,
230,I don't know.,,
231,Connect more batteries in parallel,,
232,Turn on the switch,,
233,cause the current to flow harder,,
234,Increase power cooling by adding batteries,,
235,I don't know.,,
236,Press the switch.,,
237,I don't know,,
238,I'm so sorry,,
239,"If you add an electrical circuit, more current will flow and work better.",,
240,It gives you stronger electricity.,,
241,Connect more batteries,,
242,It allows current to flow. It increases the amount of battery,,
243,Bring a magnet to the side.,,
244,Add more electrical circuits and use batteries with strong electricity,,
245,I don't know,,
246,"Mall,m",,
247,No learning,,
248,It increases the power of the battery harder,,
249,I have no idea.,,
250,I don't know about this,,
251,Change the battery to a stronger one.,,
252,Turn the electricity off and on and on and on and on,,
253,Add Battery,,
254,Power up the current.,,
255,Power up the current.,,
256,It allows an electric current to flow.,,
257,Add more batteries.,,
258,increase the intensity of an electric current,,
259,Bringing a magnet to the dam,,
260,Change to a battery with a large voltage,,
261,It makes electricity work better,,
262,The magnet moves more than the needle of the needle moves more,,
263,You should try it yourself ^-^;^ㅡ^;,,
264,You can use a magnet.,,
265,It makes electricity flow more.,,
266,Use a stronger battery,,
267,Increase the voltage size by adding batteries.,,
268,Increase the power of the electrical circuit.,,
269,Blow more batteries to increase the current intensity,,
270,I don't know.,,
271,I don't know.,,
272,I don't know.,,
273,I don't know,,
274,You can take a magnet and face it.,,
275,I don't know.,,
276,I don't know.,,
277,Increase the battery.,,
278,..;.,,
279,electricity,,
280,Add the number of batteries.,,
281,I don't know,,
282,We need to make the current stronger,,
283,Connect a lot of batteries,,
284,Add batteries.,,
285,Connect several batteries,,
286,It uses a magnet.,,
287,You can put a metal on it,,
288,Add batteries,,
289,It changes the direction of electricity,,
290,Change the direction of existence,,
291,Move the wires,,
292,Add more batteries.,,
293,an electromagnet,,
294,Place compasses around the wire,,
295,I don't know.,,
296,It changes the flow of electric currentI don't know,,
297,Don't know,,
298,cause more current to flow,,
299,I don't know.,,
300,I don't know,,
301,Close the switch and let more current flow,,
302,Lemon,,
303,1) How can I make the compass needle move more without moving the compass (you can add it to the electrical circuit if you need something)? *,,
304,use the direction of the current,,
305,Connect more electrons,,
306,Right,,
307,It makes the electricity stronger,,
308,to allow electricity to flow into the compass,,
309,Connect more batteries.,,
310,Connect one more battery.,,
311,cause more current to flow,,
312,I don't know.,,
313,All right.,,
314,Install more batteries.,,
315,More current needs to be sent.,,
316,Move the wires further.,,
317,I don't know. I'm sorry. ^^,,
318,Increase the electrical circuit.,,
319,It allows the current to flow more.,,
320,It sends the same ratio of current to the cathode and anode,,
321,Add an electrical circuit,,
322,Use an electrical circuit.,,
323,"The electric circuit connected in this way flows well, so the compass needle must have moved.",,
324,Hold the compass and leave the needle alone to move?,,
325,Magnet,,
326,The electrical circuit moves with a magnet,,
327,Use a stronger current.,,
328,Place the magnet next to it.,,
329,"Because compass needles are metal, they can be moved using magnets.",,
330,Add an electrical circuit,,
331,Put a magnet next to you,,
332,Add batteries,,
333,It sends out a lot of electricity.,,
334,.,,
335,Connect the battery further in a straight line.,,
336,Changes the direction in which the current flows.,,
337,Turn on the electricity.,,
338,.,,
339,Connect in series,,
340,Allow more current to flow,,
341,.,,
342,Power up the electric current.,,
343,The current flows more strongly.,,
344,There's a magnetic field,,
345,More electricity. an increase in battery capacity.,,
346,You just have to do well.,,
347,.,,
348,.,,
349,Add batteries.,,
350,to increase the current intensity with a whistle,,
351,I don't know.,,
352,Add more batteries.,,
353,Use a strong battery,,
354,I ask the teacher.,,
355,Increases the intensity of the current.,,
356,I recommend putting a magnet,,
357,increase the intensity of an electric current,,
358,It flows an electric current,,
359,Place several batteries.,,
360,increase the electric current,,
361,use a stronger battery,,
362,The amount of current must be increased.,,
363,Press the swatch to allow current to flow,,
364,strengthen the intensity of an electric current,,
365,strengthen the intensity of an electric current Attach one more battery.,,
366,Increase the strength of the battery,,
367,"Add battery, write low resistance wires",,
368,Connect more cells in series.,,
369,I don't know.,,
370,It makes the current flow harder. It converts batteries into high-voltage batteries,,
371,Connect more batteries.,,
372,increase the power,,
373,"As the intensity of the magnetic field generated by the current increases, the compass needle moves more, and the resistance must be reduced to increase the current. Therefore, the cross-sectional area is increased by increasing the thickness of the electric wire of the electric furnace.",,
374,I don't know.,,
375,I don't know,,
376,I don't know.,,
377,.,,
378,I don't know.,,
379,Power up,,
380,Put more batteries in series,,
381,electricity,,
382,with a strong rectification,,
383,Change the direction of the current,,
384,It allows more current to flow.,,
385,Change from serial to parallel,,
386,It makes the current flow harder.,,
387,Turn up the voltage,,
388,Connect the batteries in series,,
389,to increase the current,,
390,Add batteries in series,,
391,It's hard,,
392,It allows more current to flow.,,
393,Increase the intensity of the current.,,
394,Connect more batteries.,,
395,Connect all the batteriesa battery,,
396,Increase the voltage by adding batteries,,
397,I don't know.,,
398,turn on the electrical circuit strongly,,
399,Make sure that the compass needle and the dotted line are aligned,,
400,Break the compass and ask the expert to make it again,,
401,I don't know.,,
402,I don't know.,,
403,?,,
404,Put iron on the compass.,,
405,I don't know.,,
406,I don't know.,,
407,Using a magnet,,
408,Turn on the switch,,
409,Move the needle with a magnet.,,
410,I don't know.,,
411,Because there's a magnet,,
412,It allows electricity to flow from both sides.,,
413,I don't know.,,
414,Don't know,,
415,ㅊ,,
416,Change the direction of the batteries.,,
417,The current flows a little more strongly.,,
418,The current needs to flow harder.,,
419,Apply a higher voltage.,,
420,Add more batteries in series,,
421,Increase the intensity of an electric current.,,
422,It makes the current flow harder.,,
423,Increase the voltage.,,
424,Increase the voltage.,,
425,Add batteries.(Strengthen the current.),,
426,It allows more current to flow.,,
427,It sends an electric current more strongly,,
428,The current flows and then cuts off.,,
429,"You can use the magnetic field, but you don't need it, and it moves a lot if you just shake it hard. The end",,
430,It blurs a stronger current. Add an electrical circuit.,,
431,I don't know.,,
432,Connect several batteries in series.,,
433,Connect more cells in series.,,
434,Increase the number of batteries to strengthen the current.,,
435,Increase the current (in series of batteries),,
436,Open and close the swoosh.,,
437,Add batteries.,,
438,"A magnetic field flows around the current, and the larger the force, the greater the force of the magnetic field, so if a battery is added and connected in series, the needle of the compass moves more.",,
439,?,,
440,Remove the needle from the compass and turn it around,,
441,Add more electricity,,
442,Using Magnets,,
443,Connect additional batteries in series,,
444,Add batteries.,,
445,Don't know,,
446,I don't know,,
447,He he,,
448,Put in more batteries.,,
449,I don't know.,,
450,Use stronger batteries,,
451,It sends the electric current harder,,
452,coil a compass,,
453,?,,
454,Use a more powerful battery.,,
455,Add batteries. Add batteries,,
456,use a battery with a strong current,,
457,.,,
458,Add more batteries.,,
459,I think we can add a magnet,,
460,Increase the voltage by adding batteries,,
461,increase the intensity of an electric current,,
462,Increases the amount of electric current.,,
463,Increase the voltage.,,
464,Increase the intensity of the current.,,
465,Add more batteries,,
466,Add batteries.,,
467,Add more batteries.,,
468,I don't know...,,
469,Increase the number of batteries,,
470,"""I'm done",,
471,"""",,
472,Add more batteries,,
473,Increase the voltage of the battery to increase the intensity of the current.,,
474,Place the current-carrying wires on both sides and press the right and left switches alternately.,,
475,"Connect the batteries in series and make them stronger, allowing more current to flow",,
476,Connect the batteries in series and make them stronger so that more batteries flow,,
477,Install a tool that can resist electricity,,
478,.,,
479,Use more batteries,,
480,I don't know.,,
481,Add more electrical circuits to supply more electricity,,
482,Press the switch.,,
483,Connect more batteries.,,
484,Add batteries.,,
485,Connect more batteries in series.,,
486,"If you put more batteries together, the compass moves because of the power of the batteries",,
487,Connect additional batteries in series.,,
488,That's right?,,
489,Use the cell as a stronger one.,,
490,Don't know,,
491,Further connect the cells in a series structure.,,
492,You can use the poles of the magnet,,
493,It increases the intensity of the current flowing through the electrical circuit,,
494,Increase the power of electricity by adding batteries.use a magnet,,
495,It allows more current to flow.,,
496,Repeat after connecting the electrical circuit,,
497,an asterisk,,
498,use electricity to generate magnetic force,,
499,Electricity is applied to the compass.,,
500,Remove the battery and turn it into electricity,,
501,Magnet,,
502,All right.,,
503,battery,,
504,I don't know.,,
505,battery,,
506,I don't understand.,,
507,"""",,
508,"""I don't know""",,
509,Add a lot of electrical circuits,,
510,I don't know.,,
511,The compass can be tested without moving,,
512,Don't know,,
513,I don't know.,,
514,I don't know.,,
515,"""I'm holding a magnet",,
516,"""",,
517,Add an electrical circuit,,
518,I don't know.,,
519,Add batteries,,
520,Add more batteries.,,
521,Uncover the compass and turn the needle with the propeller.,,
522,Battery,,
523,?,,
524,to bring an iron-based on the iron stuff,,
525,Don't know,,
526,"Change the positions of the N and S poles of the wire, change the direction of the current.",,
527,Add a magnet.,,
528,battery,,
529,damn,,
530,Change the flow,,
531,Add an electrical circuit to move the needle more,,
532,Hmm? What?,,
533,You can add it,,
534,Magnet,,
535,change the direction of an electric current,,
536,"""Sends more current",,
537,"All you need is a battery that sends you more energy.""",,
538,Add more batteries,,
539,It allows an electric current to flow.,,
540,Press the switch,,
541,to increase the current,,
542,You need to have more magnetism,,
543,It sends out greater energy.,,
544,Changing the ice direction of electric current in an electric circuit,,
545,I don't know yet.,,
546,Connect the same pole to the compass using one more battery.,,
547,It makes the current flowing stronger.,,
548,It allows the current to flow more.,,
549,Turn around.,,
550,Move more wires,,
551,Connect a lot of batteries.,,
552,send more electricity,,
553,Use stronger magnets.,,
554,I don't know.,,
555,I think we need to put more wires and batteries.,,
556,I opened the switch Close and repeat.,,
557,causing more current to flow,,
558,Repeat the switch a lot,,
559,causing more current to flow,,
560,I think we can make more electricity flow,,
561,use a magnet,,
562,increase the amount of electricity,,
563,It makes the current flow strongly.,,
564,Replace batteries with new ones or change electricity.,,
565,The current flow is better attached so that it can move well.,,
566,"If you play more accurately side by side, you will move more.",,
567,It uses more batteries.,,
568,You'll just have to let more current flow.,,
569,I don't know.,,
570,I don't know.,,
571,I don't know.,,
572,"If the current moves in many directions, the needle on the compass will move more.",,
573,Keep turning the desk,,
574,I don't know.,,
575,Abbreviate electrical current.,,
576,I don't know,,
577,?,,
578,I don't know.,,
579,I don't know,,
580,I don't know.,,
581,???????????????????????????????????????????????????????????????????????????,,
582,Increase the temperature of the electrical circuit.,,
583,Add batteries.,,
584,It uses electricity and magnets to make it fail.,,
585,Put a magnet in.,,
586,You can use electricity.,,
587,I don't know,,
588,I'm going to put on more batteries,,
589,Add more batteries to the electrical circuit because more electricity is needed.,,
590,"water, sunlight, soil",,
591,Electricity is enhanced by adding electric wires to the electrical circuit.,,
592,to send an electric current through,,
593,It makes the magnet biggerUse magnets or throttle (?).,,
594,Add the amount of current.,,
595,Make the magnet stronger and buy the necessary tools.,,
596,"I don't know, but I think we can just put the magnet and spin it around.",,
597,to use a car battery,,
598,Use a magnet.,,
599,Put a magnet on it.,,
600,Add more batteries.,,
601,Close the switch to change the direction in which the current flows.,,
602,unlearned,,
603,You can use centrifugal force to close and open the switch at the right timing.,,
604,"If it doesn't move, we'll add more electrical circuits",,
605,cause a stronger current to flow,,
606,I didn't even learn,,
607,Connect the car battery.,,
608,"If you let the electricity flow fast and a lot,",,
609,Add batteries,,
610,It sends more electric current.,,
611,make electricity stronger,,
612,"Add another battery. Instead of connecting in series, connect in parallel so that you can receive more force.",,
613,Add batteries or substances with current flow electricity,,
614,Try moving the switch.,,
615,Put the batteries in,,
616,Move the desk.,,
617,Add more batteries.,,
618,I don't know.,,
619,I don't know.,,
620,I don't know,,
621,Increases the magnitude of the current.,,
622,.,,
623,Connect several batteries.,,
624,I don't know,,
625,It makes the current flow more,,
626,Let's say the battery is strong,,
627,Bring a magnet.,,
628,Increase the amount of current flowing through the wire.,,
629,It makes the current flow harder.,,
