979,The wind blows when the atmosphere moves from a high place to a strange place.,,,
980,I don't know.,,,
981,Because the water comes toward the sand and creates wind,,,
982,Wind blows when the atmosphere moves from a high atmospheric pressure to a low atmosphere.,,,
983,I don't know,,,
984,I don't know.,,,
985,It's cool,,,
986,"Because the temperature of the air changes,",,,
987,The wind is blowing.,,,
988,I don't know. Sorry,,,
989,Because the temperature of the air changesI don't know,,,
990,Don't know,,,
991,I don't know,,,
992,I don't know.,,,
993,I don't know,,,
994,It's because the wind comes from the land,,,
995,I don't know,,,
996,"Because the air keeps moving,",,,
997,the act of the waves whistling and the air blowing,,,
998,The direction of the wind is different between day and night on the sea and land,,,
999,The cool ocean creates wind on the beach,,,
1000,The wind blew from the other side,,,
1001,I don't know,,,
1002,It's very humid,,,
1003,I don't know,,,
1004,It's because the sea is cold and cool.,,,
1005,Because I'm with water,,,
1006,The wind blows towards the land and the waves go towards the land,,,
1007,It's because there's a wave.,,,
1008,"The water is the wind, and it's the worm",,,
1009,The sea water on the beach became steam and that steam became wind,,,
1010,"There are many natural disasters in the sea, such as rising sea levels, and a few minor disasters occur in the deep sea, such as the Pacific Ocean, and they push the air away",,,
1011,a difference in temperature,,,
1012,It's because of the sea breeze.,,,
1013,Convection occurs because of the temperature difference between the sea and the land,,,
1014,"Because of the temperature difference between the continents and the oceans,",,,
1015,This is because the temperature moves from high to low.,,,
1016,a barometric difference,,,
1017,Because it's windy,,,
1018,This is because the air pressure of the land and the sea is different.,,,
1019,air pressure difference due to temperature difference,,,
1020,"Entropy increases. Therefore, it moves from a place with a lot of air to a place with less air.",,,
1021,The temperature of the ocean and the temperature of the land are different,,,
1022,There is a temperature difference between the land and the sea This is because air flows from high temperature to low temperature.,,,
1023,"The hot air rises up and the cold air fills it, and the wind blows.",,,
1024,Because of the difference in temperature between the sea and the land,,,
1025,This is because the difference in temperature between the sea and the land creates a difference in atmospheric pressure.,,,
1026,Because of the difference in air pressure due to temperature difference,,,
1027,"""This is because the heat capacity of the sea is greater than that of the land. Heat capacity refers to the amount of heat required to raise the temperature of a material by 1℃. In other words, the higher the heat capacity of the sea than the land, is that to raise the temperature of the sea by 1℃, you need more heat than to raise the temperature of the land by 1℃. Therefore, when the sun shines equally on a hot summer day, the sea water with high heat capacity is cool, and sand or rocks with low heat capacity are hot.",,,
1028,"During the day, land air, which has a smaller heat capacity like sand, becomes hotter than sea air and expands and rises upward, which reduces air pressure on land. So the wind blows from the high pressure sea to the low pressure land. What is the direction of the wind on land and in the sea at night?""",,,
1029,High pressure produces wind,,,
1030,"Because there is a temperature difference between land and the sea, the wind blows from low heat to high",,,
1031,I think it is because the temperature difference between the sea and the land causes convection.,,,
1032,The Temperature Difference Between Sand and Sea Water,,,
1033,the temperature difference between sand and the sea,,,
1034,Because of the waves,,,
1035,Because of the waves,,,
1036,"The sea bounces down under the hot sun and the water evaporates upward, creating wind",,,
1037,It's an anvil,,,
1038,Is there a reason?,,,
1039,I don't know,,,
1040,People flow from low temperature to high temperature,,,
1041,I don't know.,,,
1042,a sea breeze from the sea,,,
1043,"Because of the sea breeze and the land breeze,",,,
1044,I don't know,,,
1045,"Because of the Earth's energy,",,,
1046,by the waves,,,
1047,It is because the temperature of the sea and land are different.,,,
1048,"Rising air currents occur in high temperatures, causing winds to blow at relative low pressures",,,
1049,Because there is a relatively difference between the temperature of the land and the temperature of the sea,,,
1050,Wind is created by waves,,,
1051,The wind is created by the waves.,,,
1052,"Because of the difference in specific heat between sand and seawater,",,,
1053,the difference between the tides,,,
1054,This is because air convection occurred due to the temperature difference between the land and the sea.,,,
1055,This is because of the difference in specific heat between the sea and the land.,,,
1056,"Air pressure difference is caused by the temperature difference, and wind is generated from high to low pressure",,,
1057,It is because of the difference in specific heat.,,,
1058,This is because the atmospheric pressure of the upper air varies due to the specific heat difference between the land and the sea.,,,
1059,I just don't know,,,
1060,h,,,
1061,h,,,
1062,The wind from the beach is blowing to the land,,,
1063,.,,,
1064,"In the process of changing from low pressure to high pressure, the temperature of the air changes and the direction of the wind changes",,,
1065,"Because the wind blows from cold to hot.Cold is higher pressure, so the wind blows from higher pressure to lower pressure",,,
1066,I don't know.,,,
1067,"Because of the air pressure, the temperature goes up",,,
1068,Q=cmt,,,
1069,It moves from high pressure to low pressure,,,
1070,Because the wind goes from a cool place to a warm place,,,
1071,It's because of the difference in air pressure,,,
1072,Because the temperature of the air is different,,,
1073,"This is because there is a difference in specific heat between the land and the sea, so the land heats up quickly and cools down quickly, but the seawater slowly heats up and cools down, resulting in a temperature difference.",,,
1074,This is because of the difference in temperature between the sand on land and the sea water.,,,
1075,Because of the difference in air pressure between the sea and the land,,,
1076,It is because of the difference in the heat of the sea water,,,
1077,I don't know.,,,
1078,The wind blows from low temperature to high temperature,,,
1079,T,,,
1080,"Because of the circulation of air,",,,
1081,I don't know.,,,
1082,The difference in air pressure caused by the difference in temperature between the sea and the land causes air to move,,,
1083,I don't know.,,,
1084,I don't know.,,,
1085,"Because of the difference in specific heat between water and sand, the temperature is different and wind is generated",,,
1086,"During the day, the temperature of the land is higher than that of the sea, and at night, the temperature of the sea is higher than that of the land, so wind is generated due to the difference in air pressure",,,
1087,The wind blows everywhere.,,,
1088,"The beach becomes hotter than the sea, so the beach becomes low pressure and the sea becomes high pressure, causing the wind to blow due to convection.Yeah.",,,
1089,Because of the waves,,,
1090,It's because of the waves,,,
1091,Because of the waves,,,
1092,"During the day, the temperature of the sea is high at night on land, so wind is formed due to the difference in air pressure between the land and the sea",,,
1093,"The specific heat of the land is lower than the specific heat of the sea, so the sea does not have much difference in temperature during the day, while the temperature difference on the land is greater than that of the sea. Also, hot air rises and cold air falls. Therefore, during the day, the temperature of the land is higher than the temperature of the sea, so the air rises, and the air on the sea flows to the land, and at night, the temperature of the land rises, and the air on the land blows from the sea toward the land.",,,
1094,ebb and flow,,,
1095,"During the day, rising air currents occur on land with higher temperatures, creating wind as the air in the sea moves to the land, and at night, rising air currents occur in the sea, creating wind as the air on the land moves to the sea.",,,
1096,"Since the specific heat of the land is smaller than that of seawater, the temperature change is more severe per heat. Since the temperature of the beach is lower in the daytime than the ground, the ground has a low pressure, resulting in an upward airflow, and a convection phenomenon in which air is trying to fill the empty space, so wind blows from the sea to the land.",,,
1097,"Because the air moves according to the temperature,",,,
1098,I don't know.,,,
1099,from the sea,,,
1100,due to the temperature difference,,,
1101,The sea is cold,,,
1102,"During the day, the ground heats up faster, causing a difference in temperature between the ground and the sea, and at night, the water cools later, causing a difference in temperature from the ground.So the air goes up in the hot place and the cold air blows to fill it",,,
1103,with the waves,,,
1104,"It's less hot than the land, so to move the wind to a hot place",,,
1105,"It's less hot than the land, so to move the wind to a hot place",,,
1106,I wanted it to be windy,,,
1107,"During the day, the water was hot on the beach and evaporated, so the space was empty, and wind was created to fill the space with the air on the sandy beach.",,,
1108,It's because they have different specific heat,,,
1109,The wind blew from the sea,,,
1110,"Due to the temperature difference between the sandy beach and the sea,",,,
1111,"This is because the specific heat of sand on the sandy beach and water in the sea is different, so the wind blows from low temperature to high temperature.",,,
1112,Please search on Naver Knowledge Base,,,
1113,"Due to changes in sea water temperature,",,,
1114,"Because the temperature of the air on the sandy beach and the sea water is different and the air pressure is different, wind is generated in seawater lower than the temperature of the air on the sandy beach.",,,
1115,The air is convectioned,,,
1116,This is because of the difference in temperature due to the difference in specific heat between land and sea.,,,
1117,the movement of air due to the difference in specific heat between land and sea,,,
1118,air pressure difference,,,
1119,the difference in the specific heat between the sandy beach and the sea,,,
1120,"Since the high-yield on the land side, which has a smaller specific heat than the sea, is relatively heated, the temperature rises and the wind blows to make up for it.",,,
1121,Because of the temperature difference between the land and the sea,,,
1122,"Temperature difference due to specific heat difference between water and land, Wind formation due to high temperature rise and low temperature drop",,,
1123,"Since the specific heat of the sand is smaller than the specific heat of the sea, the air temperature difference is generated, resulting in wind due to the pressure difference.",,,
1124,"When the air in the high temperature rises above due to the difference in specific heat between land and sea that rises and falls faster, it moves in a cold place to fill the air in that area. This is how wind is wind.",,,
1125,"The specific heat of the water and sand varies, resulting in a different temperature of the air that can be heated, resulting in a pressure difference",,,
1126,"During the day, land with high temperatures lowers pressure, and seas with low temperatures increase pressure, causing wind to blow due to pressure differences.",,,
1127,"Temperature difference due to specific heat difference, resulting in wind due to pressure difference",,,
1128,caused by the specific heat difference between water and sand,,,
1129,To resolve the air pressure difference caused by the heat difference between the sea and the land,,,
1130,The difference in temperature between sandy beaches and seawater decreases the air pressure in places with high temperatures and increases the air pressure in places with low temperatures (relatively),,,
1131,"When the air rises, the wind blows to fill the void",,,
1132,"There is a temperature difference due to the difference in specific heat between the land and the sea, which causes a difference in air pressure due to the difference in temperature of the air, causing",,,
1133,This is because the sea heats up slower than the land.,,,
1134,"It is because of the temperature difference between the sea and the land.""",,,
1135,"Because of the temperature difference,",,,
1136,The air pressure is different between the ocean and the land,,,
1137,I don't understand.,,,
1138,It is because the air on the land has been exposed,,,
1139,in the wind,,,
1140,Because the wind blows from land to sea,,,
1141,The wind moves from high to low pressure,,,
1142,"The pressure in the air on the shore is reduced, and the wind blows to remove the pressure difference on the beach.",,,
1143,The wind is caused by a difference in air pressure.,,,
1144,"The temperature of the sea and land is different, so the wind blows due to the convection of the air.",,,
1145,It's because of the wind,,,
1146,It's because there's a difference between the temperature of the land and the temperature,,,
1147,Because of the moon,,,
1148,This is because land and sea winds blow due to temperature differences between the sea and land.,,,
1149,It's because high pressure and low pressure are created,,,
1150,This is because there is a difference between the sea and the land.,,,
1151,The wind is generated by the current.,,,
1152,"Because of the Earth's rotation, the moon exists",,,
1153,"The temperature is different on the sea side and on the land side, so the air rises on the high side, and the wind blows on the other side to fill it",,,
1154,The ocean is cooler than the land,,,
1155,Solar energy,,,
1156,water stain,,,
1157,I don't know,,,
1158,I don't know.,,,
1159,I have no idea.,,,
1160,on the waves,,,
1161,the movement of high and low pressures,,,
1162,Atmospheric pressure differences,,,
1163,Moe.,,,
1164,the wind from Pato,,,
1165,Because of marine energy,,,
1166,"Oh, I knew but I forgot What a fool...",,,
1167,Swoosh,,,
1168,be caused by waves,,,
1169,I don't know.,,,
1170,Because of the energy?,,,
1171,"The air pressure difference is caused by the temperature of the air, and the air moves from high pressure to low pressure to wind",,,
1172,It is the difference in air pressure caused by the temperature difference between sand and the sea.,,,
1173,It is the difference in air pressure caused by the temperature difference between sand and the sea.,,,
1174,I don't understand.,,,
1175,"The hot air of the seawater rises up and cold air from the land comes toward the sea to fill the bottom, and the wind blows.",,,
1176,Because of the difference between high and low pressure.,,,
1177,"The air pressure changes due to the difference in air temperature, and the wind blows.",,,
1178,Because you're here...,,,
1179,around the moon,,,
1180,I don't know.,,,
1181,There's land and sea,,,
1182,Too long to explain,,,
1183,"Because the temperature of the ocean is higher than that of the land,",,,
1184,"At low tide, the wind comes in",,,
1185,The wind came over from the ebb and flow,,,
1186,"At low tide, the wind comes in",,,
1187,Because of the difference in densityThe water in the sea is blowing in the wind,,,
1188,"""There was steam coming up from the sea below",,,
1189,"Because the wind is coming from the north.""",,,
1190,"We usually go to the beach in the summer, and people want to be cool, which is why we get wind",,,
1191,"It's cool when the wind blows, but the cool wind feels good.""",,,
1192,"Because of the difference between the tides,",,,
1193,It is due to movement according to the weight of air due to temperature.,,,
1194,There's land and sea,,,
1195,"When the temperature of the surface rises, the air above it naturally rises. As a result, the acupressure close to the surface decreases, and the amount decreases as the air rises.",,,
1196,I don't know.,,,
1197,"In places where the temperature is high, the air rises, so the wind blows in places where the temperature is high.",,,
1198,"Due to the influence of the east-west wind, the west-west wind and the east-west wind meet to create a wind blowing from the beach.",,,
1199,"Due to the influence of the east-west wind, the west-west wind and the east-west wind meet to create a wind from the beach",,,
1200,Because of the temperature difference,,,
1201,The waves move and make the wind,,,
1202,in the wind,,,
1203,Because of the water,,,
1204,"The water in the sea evaporates and becomes steam and becomes heavy Air moves from a heavy place to a light place, creating wind",,,
1205,Because of the temperature difference,,,
1206,It's because of the water on the beach.,,,
1207,Because of the sea breeze,,,
1208,That's because the waves are rising in the water.,,,
1209,"As the heat of the sandy beach evaporates at night, it becomes low pressure, and the high-pressure air in the sea moves to low pressure, and the wind blows",,,
1210,"On the sand side, the heat rises due to the continuous sunlight, but the sea continues to convect and the heat is constant, so the wind blows",,,
1211,the rotation of the earth,,,
1212,"When the warm wind goes up, there is an empty space because cold air enters the empty space.",,,
1213,,,,
1214,"""",,,
1215,It is because of the temperature difference between land and sea.,,,
1216,Wind is created by the temperature difference between air on land and the sea.,,,
1217,Air movement due to temperature differences: Air movement from hot seas to cold lands compared to land,,,
1218,"Wind is the relative movement of air to the surface of the earth, which blows when there is a pressure difference at the place. Smaller causes of air pressure differences are caused by a kind of difference in hydrothermal capacity, such as the difference in the degree to which the sea and land are warmed by sunlight, and local ones are blown from high to low",,,
1219,"The wind blows when there is a pressure difference in the place. Smaller causes of air pressure differences are caused by a kind of difference in hydrothermal capacity, such as the degree of warming of the sea and land by sunlight, and local ones are blowing from high to low.",,,
1220,The temperature of the beach is higher than that of the land,,,
1221,on account of the wind,,,
1222,"Warm air has the property of rising up, so other air finds the space to fill the empty space, which is the wind.",,,
1223,Because there is a difference in temperature between the beach and the land,,,
1224,"""When the warm wind goes up, there is an empty space, because when cold air enters the empty space, there is wind",,,
1225,"""",,,
1226,"""1. Because it is hot during the day and cold at night because of the sunlight.""",,,
1227,"2. Because it gets cold at night and the temperature gets lower""",,,
1228,Because there is a temperature difference between the sandy beach and the sea,,,
1229,Because of the pressure difference between the sand and the sea,,,
1230,in the wind,,,
1231,The air temperature and air pressure are different,,,
1232,"Because of the difference in air pressure, there is wind on the beach.",,,
1233,the influence of ocean waves,,,
1234,The air pressure is causing the wind to blow hotter,,,
1235,"The air on the sandy beach rises because it is hot, and the air in the sea goes down because it is cold and blows from the sea.",,,
1236,"Because of the difference in atmospheric pressure, the wind blows from high pressure to low pressure",,,
1237,"The sandy beach quickly cools and heats up, so during the day, the temperature of the sandy beach is higher than that of the sea, so the sandy beach becomes low pressure, and the sea is high pressure, but the wind blows from high pressure to low pressure, so the wind blows on the beach.",,,
1238,Because it's cold,,,
1239,여Aftermath of heat,,,
1240,I don't know,,,
1241,I don't know,,,
1242,Because there is a temperature difference between the sea and the land,,,
1243,The wind wanted to blow there,,,
1244,a difference in temperature difference,,,
1245,Because the wind is blowing,,,
1246,I don't know,,,
1247,It's because the air is moving,,,
1248,I don't know.,,,
1249,This is because the temperature is low.,,,
1250,I don't know.,,,
1251,I don't know,,,
1252,convection,,,
1253,convection phenomenon,,,
1254,This is because the temperature difference occurs and the air moves from a warm place to a low temperature place.,,,
1255,There's a big difference in temperature,,,
1256,I hope it's windy. Forget me. Get rid of the weather,,,
1257,Because of the temperature difference.,,,
1258,Because the direction is different.,,,
1259,This is because air moves from high pressure to low pressure.,,,
1260,It is because of the temperature difference between the sea and the land.,,,
1261,"The wind moves from high pressure to low pressure, when the wind blows.",,,
1262,"During the day, the land temperature is higher than the sea",,,
1263,It is because of the sea.,,,
1264,"Because the earth rotates from west to east, the wind is also affected by this",,,
1265,It's because the beach is strong,,,
1266,at the end of the rope,,,
1267,"""The difference in atmospheric pressure is also true",,,
1268,"Wind moves from high pressure to low pressure, and that's when wind is created",,,
1269,"My opinion is that when the warm wind goes up, there is an empty space, which is created when cold air enters the empty space",,,
1270,"That's the wind.""",,,
1271,The air is moving,,,
1272,This is because the air pressure is high.,,,
1273,It is because of the difference in air pressure.,,,
1274,Because the temperature difference is big,,,
1275,Sea water touches the wind,,,
1276,It's because the temperature difference is severe,,,
1277,Because it's the sea.,,,
1278,Because of the waves,,,
1279,This is because there is a difference in air pressure.,,,
1280,I don't know,,,
1281,I don't know,,,
1282,It's caused by the wind,,,
1283,I don't know,,,
1284,I don't know,,,
1285,I don't know,,,
1286,I knowI don't know,,,
1287,I don't know,,,
1288,naturally,,,
1289,The wind was all over the water,,,
1290,I don't know,,,
1291,Because of the atmospheric pressure,,,
1292,There's no heat on the beach,,,
1293,Because it's the ocean,,,
1294,The ocean is so cool,,,
1295,I have no idea.,,,
1296,"During the day, the land is hot and at night, the land is cooler",,,
1297,It is because of the temperature difference between day and night.,,,
1298,The cold air goes up and moves to the warm air,,,
1299,The water is cold,,,
1300,It is caused by the sea.,,,
1301,Wind is produced by the influence of air.,,,
1302,"Since it blows from a low temperature to a high temperature,",,,
1303,This is because air moves to places where temperatures are high,,,
1304,Because of the temperature difference,,,
1305,The sea is cold,,,
1306,It's because the water from the sea goes to land,,,
1307,There's the air of the country,,,
1308,The wind blows from cold to hot,,,
1309,Since it's the beach,,,
1310,"Since there's wind,",,,
1311,X,,,
1312,The temperature difference between the land and the sea,,,
1313,a difference in temperature difference,,,
1314,the air goes up,,,
1315,It's inside the earth,,,
1316,This is because air flows due to the temperature difference between land and sea,,,
1317,"High pressure, low pressure",,,
1318,"The beach has a lower temperature than the sandy beach, so it is high pressure, while the sandy beach becomes low pressure, so the wind blows",,,
1319,"Because of the circulation of air,",,,
1320,It's because of the temperature difference between water and land,,,
1321,Wave.,,,
1322,"Because of the difference between land and sea,",,,
1323,"Sand with a large specific heat rises during the day due to its high temperature Therefore, wind blows from the low pressure sea to the high pressure land",,,
1324,This is to balance the heat because the temperature of the beach is higher than that of the sandy beach.,,,
1325,"The temperature of the beach is higher than that of the sandy beach, so the heat is balanced",,,
1326,The difference in heat between the land and the sea creates wind,,,
1327,The difference in temperature between land and sea creates wind,,,
1328,This is because the land is small in specific heat and the sea is large in specific heat.,,,
1329,This is because of the difference in air pressure between the land and the sea,,,
1330,"The sea is mainly composed of water, and the land is mainly composed of solids, so the sea has a large specific heat. Even if the same heat energy is received during the day, the temperature difference that changes is larger than that of the sea, resulting in a difference in air pressure, causing a circulation of the atmosphere and blowing wind.",,,
1331,"A temperature difference occurs due to the difference in specific heat, resulting in a difference in atmospheric pressure, which generates wind from a high atmospheric pressure to a low atmosphere.",,,
1332,"Because of the difference in air pressure between the heat of the sea and land,",,,
1333,It seems to be caused by temperature changes in the sea and land.,,,
1334,the difference between land and sea temperature,,,
1335,Specific heat difference.>_<,,,
1336,This is because of the difference in specific heat between land and sea.,,,
1337,"Because of the non-train on land and sea,",,,
1338,convection due to temperature differences,,,
1339,"Because of the temperature difference between the land and the sea,",,,
