,1. The sentences below misunderstand the meaning of 'human dignity'. So humans are not the real reason for dignity. So what is the real reason for human dignity?,q56_Features,q56_Unique
0,I don't know.,,
1,I don't understand.,,
2,Human dignity cannot be judged because of social requirements because it is a right to be respected from birth,,
3,I don't know.,,
4,I can think about it,,
5,I don't know.,,
6,I don't know.,,
7,Toto,,
8,individual human rights,,
9,I don't know,,
10,Because there is life.,,
11,"Human rights, regardless of skin color, religion, culture, etc",,
12,Because I have emotions,,
13,"There is not a human existence for a particular reason, but because it is a human being, there is a human survival.",,
14,There is too much discrimination,,
15,This is because humans are worth being respected for their existence.,,
16,Just because women and black people are not good looking doesn't mean that they don't have dignity just because they don't have power because they don't have a good university.,,
17,What you see is not everything,,
18,"""I'm a human being, so I'm dignified",,
19,"""",,
20,Because humans are all life. Human beings are dignified just by being alive.,,
21,"The human dignity in the sentence is wrong because it is expressed as dignity by a particular person, a particular organ, etc., rather than being respected as a human being",,
22,Everyone is dignified.It's because we live equally without discrimination,,
23,This is because everyone is born in the world and has the right to enjoy as a person equally.,,
24,Human dignity is a right that must be protected because it is a right naturally picked up by any human being.,,
25,"This is because they claim to have reason and let humans live in their favor by changing the environment. Since there are many individuals called humans and they have continued to develop, they are dignified not to cause harm to humans",,
26,Because there is an ideology that a person is worthy of his existence and that his personality should be respected.,,
27,We're people who care about each other,,
28,"I think humans are dignified because they are human. He is more intelligent than most animals and plants, and has the power to develop the times by using things around him This is because they have learned to live in cooperation with other humans and know how to respect and care for each other.",,
29,Because he has an ego and has a much better ability to think for himself than other animals,,
30,Humans are dignified because they are something that won't hurt anyone's eyes.,,
31,It's because you're precious living beings,,
32,"The reason for human dignity is not determined by gender, power, or race, but by honesty or sincerity.",,
33,"""All men are equal",,
34,"""",,
35,This is because they judged it only by its appearance.,,
36,Because it's different from what it looks like,,
37,Human beings cannot be called human dignity just because they are superior.,,
38,respect for people,,
39,I can breathe,,
40,Because humans are more capable than animals,,
41,"Because humans are creatures, they cannot judge by their appearance.",,
42,You can't judge a book by its cover,,
43,"Human beings are the reason why human dignity is human dignity, even if nothing is outstanding.",,
44,"White, man, wealth, age, good looks, power, good college, no dignity. Everyone thinks it's dignity",,
45,"Animals live according to their instincts, because humans can think and act rationally.",,
46,It is dignified because it is human,,
47,Because I'm a precious and valuable person,,
48,Dignity is ourselves because it is precious and precious.,,
49,Because I'm a man of great importance,,
50,I don't understand people,,
51,Humans can be dignified just by being human.,,
52,"A person who knows how to live for others, cares for others, and has a good mindset can be said to be a person of dignity.",,
53,"Because humans are rational, smart, and moral.",,
54,Everyone is dignified.,,
55,This is because you can think for yourself and put it into action and have reason.,,
56,He is dignified because he is kind and considerate,,
57,be strong,,
58,Because I can think for myself,,
59,"The idea of evaluating a person by gender, race, property, age, appearance, and power education does not seem right. It is not important to look outward, but it is important to look inward and think of people with dignity.",,
60,I can think and relate to it,,
61,It's dignified because of the right mindset.,,
62,You shouldn't judge just by the appearance.,,
63,I can be considerate and respectful for others,,
64,Because I'm a human being,,
65,Because there's only one person in the world,,
66,Because I'm a human being human,,
67,It's because he's alive and has feelings,,
68,M and D,,
69,The reason why humans are precious is because they are life,,
70,This is because human dignity is a value that people have only because they are human.,,
71,Don't just look at the human form from the outside. Human dignity comes from within.,,
72,I don't know,,
73,"Like the sentences above, a person who is not prejudiced is dignified.",,
74,"Like the sentences above, a person who is not prejudiced is dignified.",,
75,Human beings are precious beings that are one and only,,
76,Because he's smart,,
77,I don't know,,
78,The person who can take care of himself while thinking of others is the most dignified.,,
79,Because each and every creation of God is a different creation,,
80,This is because each person has a different idea.,,
81,I think human beings are dignified because they have different ideas and ideas and think that they have nothing to throw away,,
82,It's Mongla,,
83,"I can talk, I can make things, and I understand things well",,
84,You can hide and think about what you've done,,
85,be dignified because one is human,,
86,Because I'm a human being,,
87,Because of G,,
88,Each human being is dignified because it is the only precious thing in the world and will never be in the world again.,,
89,Because I'm a human being,,
90,"""Because you are the only one living in this world",,
91,"""",,
92,Because humans are humans,,
93,Just the existence of a person,,
94,Humans are just a kind of animal.It is not special or dignified because it is human.,,
95,be dignified because one is human,,
96,Because humans are humans,,
97,"Life is very precious, one by one. People are dignified because they are ""life.""",,
98,FIt's because people are considerate of others and everyone's human rights exist,,
99,"Men, whites, property, age, appearance, power, even if not a good university, human beings are dignified",,
100,People are moral people,,
101,Because every human being is dignified without a specific standard,,
102,"This is because they have done actions through their thoughts and given them to anyone or people, and even if they are not successful, they have dignity from the time they fly.",,
103,A man is dignified because he is a precious person with a precious life.,,
104,Because it's a precious life.,,
105,Man is dignified because he has morality.,,
106,This is because each person has a distinct personality and each person's charm is different.,,
107,This is because each person has different thoughts and personalities.,,
108,Because humans exist on this planet.,,
109,"This is because humans can communicate, talk, and respect people.",,
110,It is because there is a human right as a person who should be loved and live in society,,
111,a man of great value,,
112,Because it is valuable and precious.,,
113,A person who is a person and knows how to be considerate and respectful of others is truly a John Mian,,
114,"A man's dignity is not a condition of dignity, but a man who knows he's precious",,
115,Man is dignified because he is a creature,,
116,Because they're all different lives,,
117,This is because human beings are all different in appearance from what they think of each and every one by person.,,
118,Human beings are dignified to admit their mistakes.,,
119,Human beings are dignified only because they are human Human beings themselves should be respected,,
120,Human beings are dignified only because they are human,,
121,have a long life span,,
122,It is dignified because I set my goal and move on.,,
123,be dignified in man's own right,,
124,"Oh, my",,
125,"Human beings are born with rights, so they are dignified",,
126,I think it is the real reason why humans are dignified because they are human and have reason to think.,,
127,Human beings are born with dignity.,,
128,Human beings are dignified by themselves.,,
129,Human beings are all born with dignity,,
130,Because we all have the same human rights,,
131,We are unique and precious,,
132,Because I'm a human being,,
133,I don't know.,,
134,Human beings are born with dignity.,,
135,Because people have human rights from birth.,,
136,Man is dignified because he is precious since he was born,,
137,Because it's a personality.,,
138,Because humans can think,,
139,"Human beings are creatures, so they are dignified in themselves.",,
140,Something with a good personality,,
141,Because humans need to be respected by themselves,,
142,"Since humans are born with human dignity from being born as humans, they do not need social conditions such as power, age, and property.",,
143,.,,
144,"Humans are human beings, so they are dignified by themselves, regardless of special external reasons, education, race, age, etc.",,
145,"Humans are dignified because ""human"" itself is life without any conditions",,
146,Human beings are dignified because they are human.,,
147,"People are born with human rights and dignity, and their human rights are natural human rights, and all humans are equal, and all human beings are the same, so human dignity is the same and should not be discriminated against.",,
148,All human beings are dignified because they have been granted human rights since birth,,
149,"Humans all have human rights, and they all think humans are dignified because they are all equal.",,
150,Because I'm a person,,
151,be dignified because one is a person,,
152,Human beings think that living is dignity,,
153,We were born equal,,
154,Because I'm a human being,,
155,It's because everyone is living a community life and thinking and doing things together,,
156,"Human beings are human beings, so their existence itself is dignified. Regardless of gender, social status, or educational background, humans are dignified in themselves.",,
157,It's alive,,
158,Because I'm a human being human,,
159,I don't know,,
160,have dignity as a human being,,
161,"Humans have no difference in dignity according to gender, property, age, appearance, and power. Human beings are dignified just because they are human",,
162,Because I'm a person,,
163,Because I'm a human being,,
164,I think the reason why humans are dignified is just because they are human.,,
165,Human beings have dignity by themselves,,
166,Human beings are dignified as human beings,,
167,Human beings are dignified just because they are human.,,
168,It's because I have human rights,,
169,"Human beings are not only those above them, but everyone is dignified in their own right.",,
170,"Humans think they are the strongest, most dignified beings.",,
171,I don't know.,,
172,Because I was born as a human,,
173,Human beings are dignified only because they are human,,
174,"Humans are dignified just because they are human, and cannot infringe on other people's freedom and rights. And people are born with human rights.",,
175,This is because humans are dignified just because they are human.,,
176,"Since human dignity is human, dignity has the right to live a minimal human life.",,
177,It can be said that humans are dignified only by their existence.,,
178,Because it's human.,,
179,"On human dignity, we rely on ourselves without any specific conditions to work hard on that particular task.",,
180,Human beings are dignified because they are human.,,
181,Human beings are dignified in themselves because they are human.,,
182,Because it's human.,,
183,Human beings themselves are dignified.,,
184,"Human beings are dignified by themselves. Therefore, there is no reason.",,
185,"Human beings have natural rights, and everyone has the same dignity. Authorization is dignified in itself, and its value cannot be determined by gender, race, property level, age, appearance, power, and academic background.",,
186,Every human being is dignified. be dignified because one is human,,
187,Humans are dignified because they all have life and have thoughts and strengths in any situation.,,
188,Because humans are thinking animals.,,
189,Human beings are dignified by themselves.,,
190,Human beings are very strict in themselves,,
191,This is because he has the ability to protect and judge himself.,,
192,"Man is not dignified. However, for one's own benefit, they are subjugated by themselves under the social system and only make themselves dignified under the premise of the law.",,
193,Man is not dignified.,,
194,Human beings are dignified beings in their own right.,,
195,"All living things, matter, exist. Some animals have intelligence, such as making tools. However, only humans ask themselves why they exist. Therefore, it can be said that only humans who give meaning to their existence exist unlike other beings, and thus all humans are dignified.",,
196,Human beings are dignified because they are human. Human beings are dignified in their own.,,
197,Because humans are living creatures.Man is dignified because he was born as a human.,,
198,Because I'm a human being,,
199,be dignified because one is human,,
200,I don't understand.,,
201,It's basically a person,,
202,"Because you're human, do you need words?",,
203,We can love each other and feel joy,,
204,..,,
205,Because I'm a human being,,
206,It's alive,,
207,Human beings have a value for dignity because they are human.,,
208,"""Because this is about prejudice, man is not dignified, man is dignified in his own way",,
209,"""",,
210,I don't know.,,
211,The specs should be good,,
212,Human beings,,
213,"""Because I'm just a human being.I think I'm just a human being with dignity.",,
214,"""",,
215,"They're creatures, they're intelligent, they think for themselves, they act for themselves, they realize themselves, they live with others",,
216,Human beings are dignified as human beings,,
217,survive on human grounds,,
218,"Humans are dignified beings just by being human, regardless of race, age, or property.",,
219,"Regardless of race, nationality, or property, humans are all dignified just because they are human.",,
220,Things like freedom and equality are human dignity.,,
221,Hah!,,
222,Because it's human.,,
223,Because humans are humans. The reason for dignity is self-evident.,,
224,Because I'm a human being human,,
225,Human beings are dignified because they think and have their own opinions,,
226,Because it's worth everything,,
227,I don't know,,
228,Humans are all equal and dignified for no reason,,
229,"Human dignity is a man-made justice. We believe that human dignity should be established of course, but in fact, human dignity is contradictory because it is created by the hope that full and rich people will maintain their happiness.We are just the same creatures as all animals on Earth that cannot survive permanently.",,
230,Man is dignified because he was born as a human.,,
231,Human beings are dignified by their existence alone,,
232,the greatest creature,,
233,The reason why humans are dignified is that their existence itself is valuable.,,
234,Human beings are dignified by their existence alone,,
235,have human rights,,
236,"Since I was born, I'm breathing and living,",,
237,Human beings are dignified in their mere existence. Because every human being has dignity.,,
238,Human beings have dignity just because they are human,,
239,Because I was born,,
240,"In fact, humans are not dignified",,
241,Because I'm a human.,,
242,No.,,
243,Because he's a human being human.,,
244,Because I'm a human being,,
245,Human beings are dignified because they are human.,,
246,Human beings are dignified just because they are human and have dignity,,
247,Because people have dignity just because they are human from birth,,
248,Because I was born as a human,,
249,"In fact, humans are not dignified",,
250,Human beings are dignified just because they are human,,
251,"Everyone has human dignity, and even if gender, skin color, appearance, age, etc. are different, human dignity is essential, so human dignity is different from person to person and each person is good at different things",,
252,Moe.,,
253,Because I'm a human being human,,
254,It's a precious creature from heaven!,,
255,I don't know,,
256,Human beings are dignified in themselves because they are human,,
257,This is because humans are dignified in their existence.,,
258,Human beings are dignified simply because they are human beings.,,
259,I don't understand.,,
260,Human beings themselves are dignified.,,
261,Because there is life.,,
262,Because I'm a human being,,
263,Human beings themselves have dignity,,
264,Because I'm a human being,,
265,I don't know.,,
266,be dignified in man's own right,,
267,?,,
268,All human beings are dignified by their birth.,,
269,Dignity is nothing,,
270,All men are dignified,,
271,Human beings are dignified because they can do everything,,
272,Because humans are creatures.,,
273,"Humans are dignified just because they are human, regardless of gender, nationality, or race.",,
274,My mom made me born,,
275,It is dignified because it has human thoughts and is conscientious.,,
276,"This is because it is a life, a precious child of someone, and a person who deserves to be respected.",,
277,Because I'm thinking,,
278,"Because I'm in this world,",,
279,be dignified because one is a man.,,
280,"""Because human dignity has the right idea",,
281,"""",,
282,The reason why humans are dignified is that they have the ability to think right and make judgments.,,
283,"This is because humans are not dignified under any conditions, but because humans are dignified just because they are born.",,
284,Because they are all precious,,
285,People themselves are dignified,,
286,a person's warm heart toward others,,
287,"Humans have their own human rights, their own values, and all human rights, so humans are dignified.",,
288,Because they are all precious beings.,,
289,"A man is a man, a white man, a rich man, an old man, a good-looking man, a powerful man, and a man who does not have dignity after graduating from a good university is dignified in itself.",,
290,Go to the mountains and exercise men,,
291,Because humans deserve respect and are precious,,
292,thinking and speaking,,
293,Because humans are humans.,,
294,"For man is a precious life made by God and given by heaven, and a warrant for all things",,
295,I was able to think and talk,,
296,be dignified because one is humanBecause it's all fair.,,
297,Because humans are humans,,
298,be dignified because it is a life,,
299,"Humans have their own shortcomings and strengths, so they are different depending on the individual and everyone is precious",,
300,Because I was born with life.,,
301,It's alive,,
302,"Everyone has their own personality, strengths and weaknesses, and everyone is dignified.",,
303,It's dignity because it's a person.,,
304,Because he's alive,,
305,be dignified as a human being,,
306,Because they have lives and they all have human rights.,,
307,"""Because he has life and deserves respect",,
308,"""",,
309,"Because they're all thoughtful, emotional, and talkative lives",,
310,Human beings themselves are dignified,,
311,"Because you're considerate, respectful, and think?",,
312,It is because humans are precious creatures from heaven and have the ability to do so,,
313,It is wrong to judge a person's dignity on any condition.Because it depends on the person.,,
314,a man of moral high opinion,,
315,It is dignified because it does what it should do as a human being.,,
316,"Human dignity is not classified by human gender, race, power, and wealth.",,
317,"The meaning of human dignity I thought is ordinary to do everything in daily life that talks, eats, and wraps without treating humans.""",,
318,There is a certain possibility in human nature.,,
319,All men are dignified.,,
320,"Human dignity is not based on gender, physical difference, property, age, and power, but every human being has dignity.",,
321,"Humans cannot evaluate the high and low of dignity according to nationality, person, age, appearance, power, and property. Dignity is something that applies equally to everyone.",,
322,Because humans can share thoughts and help others,,
323,These are all visible.,,
324,"For example, ""H"" respects people."""" That's the right answer.""",,
325,be due to one's moral character,,
326,Someone who can think and respect others,,
327,"This is because humans can think with their heads and act at their disposal, not according to instinct.",,
328,Human beings live by doing good things,,
329,Because all human beings are precious.,,
330,"Since humans are worthy and deserve to be respected by themselves from birth,",,
331,It's because I can respect and be considerate of someone,,
332,"Unlike animals, they have thoughts and live according to reason",,
333,This is because humans can think differently from animals and make their own lives.,,
334,It's because it has an ego unlike animals,,
335,"Unlike animals, humans feel precious and think a lot",,
336,"The reason why humans are dignified is that unlike other animals, they have intelligence to think about.",,
337,"You can use tools and have excellent ability to solve problems. It is also because there is a language, so we can have a conversation.",,
338,This is because humans have intelligence that can think differently from other animals and reason that can translate the idea into action.,,
339,The reason why humans are dignified is that they have the intelligence to think differently from other animals and can carry out what they think.,,
340,"Unlike other creatures, humans can use tools and do things that animals cannot do.",,
341,"It is because he knows how to use tools, is more intelligent than other living things, and is more capable of knowing and solving certain problems",,
342,A man who treats people equally is dignified.,,
343,Human beings are precious lives,,
344,"Human beings have emotions, they can do what robots can't do, and they can develop many things",,
345,Man is dignified because he is born as a man,,
346,"""The reason why people are dignified is that unlike animals, they use tools, and animals live instinctively, but people live with their own ideas.",,
347,"""",,
348,Human beings are dignified because they are human,,
349,G,,
350,A man who is a living and driven man is worthy of dignity,,
351,Because I am precious myself.,,
352,It's dignified because there's only one in the world.,,
353,Because we're all the same human beings,,
354,be dignified because one is a person,,
355,Because I can think,,
356,have power and dignity,,
357,We're the same people and we live in the same world,,
358,Because I was born.,,
359,be dignified because one has power,,
360,The reason why humans are so respectful is that they can think,,
361,Each and every one of us is dignified because we have different values,,
362,Because I have power,,
363,"You can think, you can talk, you can talk to other peoples",,
364,That's because humans were born one in 4.5 billion minutes.,,
365,The reason why humans are dignified is that they can think and judge,,
366,"Because humans are all different, they have different values and different thoughts. Therefore, all human beings are dignified.",,
367,be dignified because one is a man,,
368,I don't know.,,
369,I have emotions,,
370,I don't have it's,,
371,E,,
372,Yukmingwan Middle School,,
373,F,,
374,Man is dignified because he cannot be changed by anything and is the only one in the world.,,
375,"Human dignity is not determined by standards, but there is dignity because it is human itself. Since human dignity must be equal, these sentences are not based on equality, so they are not the real reason for human dignity.",,
376,"This is because everything, such as gender, status, and age, is irrelevant and is a thinking entity.",,
377,"All human beings are dignified. So it is not right to weigh dignity by any standard. Humans live in a community while living in this world, and everyone lives equally. So all human beings are dignified.",,
378,"Human beings have dignity just by being human. Therefore, human beings are dignified.",,
379,"Humans are dignified regardless of gender, race, or ability because they are dignified in themselves.",,
380,Of course human beings are dignified because they were born as human beings,,
381,"Since all humans are equal and born with natural rights, it is impossible to judge humans on a specific basis, so all humans are dignified.",,
382,"Human dignity is gender, race, education, private property, age, appearance.It is not because of power, but because of dignity as a person himself.",,
383,There is no reason for human dignity. The reason a person is dignified is just because he is.,,
384,Because it's just human.,,
385,"Humans are not dignified only when certain conditions are satisfied, but they are dignified beings that deserve respect from their birth itself.",,
386,Human beings are dignified by themselves.,,
387,"It is dignified that it exists regardless of gender, race, property, age, appearance, power, study, etc.",,
388,"The reason why I think humans are dignified is that humans are living creatures and have a wide variety of emotions and reason at the same time. In addition, humans can control and control themselves and try to live accordingly with their values.",,
389,"Humans are dignified because they are all equal and guaranteed human rights regardless of gender, occupation, religion, race, degree of wealth, education, and class.",,
