451,Bakery stores will offer better products and better services because they are trying to attract consumers competitively. It can be a good thing for consumers because it will eventually provide better services and products to consumers.,,,,
452,It can give consumers better things because different bakeries compete and try to make better things,,,,
453,Consumers can get better quality goods.,,,,
454,Consumers can get better bread or services because bakeries compete with each other and try to do better.,,,,
455,It is more cost-effective.,,,,
456,It will provide higher quality services to consumers and lower prices.,,,,
457,You can compare the prices of the two places and go to a cheaper place to buy them.,,,,
458,"In order to secure a consumer base, the two companies will try to provide better services to consumers.",,,,
459,I can see where is better and where is better,,,,
460,a decline in prices It tastes better. Can prevent a bakery's monopoly.,,,,
461,"If you compete, you will try to sell better facilities and at better prices, so consumers can enjoy better rights",,,,
462,The price of the product will be cheaper because they compete with each other,,,,
463,You can compare the price and taste.,,,,
464,Compete with each other to increase the quality of the confectionery or lower the price,,,,
465,I don't know.,,,,
466,You can get new confectionery and solutions from competition.,,,,
467,I can see the knowledge I didn't know.,,,,
468,"Near the bakery,",,,,
469,It's better to lower the price in competition,,,,
470,I can tell which place is more delicious,,,,
471,You can buy it cheaply when you lower the price to attract more customers.,,,,
472,You can eat more delicious bread,,,,
473,Cheaper and better quality,,,,
474,You can get a good one,,,,
475,You can get more variety of things you need,,,,
476,We all buy two stores,,,,
477,You can eat a lot of different foods and compare them to each other at a more delicious bakery,,,,
478,Convenient.,,,,
479,There will be more events and discounts to attract more customers.,,,,
480,You can get better products.,,,,
481,You'll think it's rude,,,,
482,"""You can eat cheaper and better things, you can get better service",,,,
483,"""",,,,
484,to be able to spend better,,,,
485,"Because we think about how to sell to consumers in a better way while competing with each other, if we compete with each other, the price can be lowered and we will try to provide better services to each other. Therefore, consumers can buy products with better service and lower prices.",,,,
486,You can spend better.,,,,
487,The price goes down,,,,
488,Consumers can get a lot of slack,,,,
489,You can find out the characteristics of the two bakeries by going to both bakery A and bakery B.,,,,
490,You can get the girl you want,,,,
491,I feel like I'm going to be harmed,,,,
492,Consumers can benefit more.,,,,
493,You can buy things cheaply by lowering the price to attract a lot of consumers from each other. And you can get new things.,,,,
494,You can get a better one.lower prices to use and attract customers,,,,
495,"""Even if one bakery disappears, you can go to another bakery and buy bread.""",,,,
496,Because many people go to delicious bakery,,,,
497,You can eat various kinds of bread.,,,,
498,You can go to a bakery with more delicious snacks,,,,
499,I can buy more bread,,,,
500,Consumers can buy things at a low price because they lower the price if they compete with each other,,,,
501,You can buy things at a lower price.,,,,
502,"Bakery stores compete with each other, lowering prices, and consumers buy things at cheaper prices.",,,,
503,It's getting cheaper,,,,
504,provide good service to consumers,,,,
505,"""Many bakeries make better products to sell to consumers than other bakeries",,,,
506,"It's going to lower the price, and consumers are going to go around a lot of bakeries, quality, price",,,,
507,"You will be able to buy a low product.""",,,,
508,"Consumers can eat at many bakeries, so they can feel many drinks.",,,,
509,They compete with each other and try to develop themselves better than competing bakeries.,,,,
510,I think I can buy many things,,,,
511,You can buy good things.,,,,
512,You can buy a better one,,,,
513,Consumers can easily choose a better bakery.,,,,
514,You can buy the same thing cheaply.,,,,
515,You can buy better ingredients and cheaper prices.,,,,
516,"The price can be reduced. Also, there are many new menus.",,,,
517,You can eat better and more delicious bread.,,,,
518,Consumers can buy things at a lower price,,,,
519,to be able to eat various breads,,,,
520,Consumers can buy food cheaper and get a lot of services.,,,,
521,You can buy good products at a cheaper price than before.,,,,
522,You can buy things cheaply.,,,,
523,It is good because bakery shops compete with each other and give consumers a lot of benefit.,,,,
524,"If several bakeries compete with each other, it will be good for consumers because they try to attract consumers in many ways, such as good service in stores and lower prices.",,,,
525,You can choose the most delicious and cheaper bread.,,,,
526,You can buy better things.,,,,
527,I went to eat many kinds of food.,,,,
528,Consumers can choose a better bakery and spend better,,,,
529,"You can buy items at a better, cheaper price.",,,,
530,You can eat it at a delicious and cheaper bakery.,,,,
531,I can make other bread and eat various kinds of bread.,,,,
532,You can buy cheap food and get good services.,,,,
533,You can buy things that you need to buy at a little cheaper.,,,,
534,The two stores compete to lower the price so that they can pay less,,,,
535,The good thing about competing with each other is that more consumers will be able to walk in various ways.,,,,
536,"You can buy better quality items cheaply because you compete for prices, services, products, etc.",,,,
537,"Their bakery needs to be better in many ways than other bakeries to attract more consumers, so they will manage store facilities and menus harder and better to create a better environment for consumers.",,,,
538,It is offered to consumers with better quality and better prices,,,,
539,Better service and quality products can be consumed.,,,,
540,You can get various benefits,,,,
541,You can get better products and get cheaper.,,,,
542,"Bakery stores will compete with each other to bring in consumers by lowering prices or improving quality, which will allow consumers to make more profits at the same price.",,,,
543,Consumers can purchase cheaper and higher-quality products because they try to provide better services and are likely to sell them cheaper.,,,,
544,There's more to choose from,,,,
545,"As the service and quality of products of bakeries increase, consumers have a wider range of choices.",,,,
546,to be able to live a better life than before,,,,
547,You can choose and choose and buy the same product at a cheaper price.,,,,
548,We can compare products to each other,,,,
549,"If you compete, you can compete with higher quality and prices to make profits between bakery stores, so that consumers can get higher quality and reasonable prices",,,,
550,Bakery stores will offer better products and better services because they are trying to attract consumers competitively. It can be a good thing for consumers because it will eventually provide better services and products to consumers.,,,,
551,It can give consumers better things because different bakeries compete and try to make better things,,,,
552,Consumers can get better quality goods.,,,,
553,Consumers can get better bread or services because bakeries compete with each other and try to do better.,,,,
554,It is more cost-effective.,,,,
555,It will provide higher quality services to consumers and lower prices.,,,,
556,You can compare the prices of the two places and go to a cheaper place to buy them.,,,,
557,"In order to secure a consumer base, the two companies will try to provide better services to consumers.",,,,
558,I can see where is better and where is better,,,,
559,a decline in prices It tastes better. Can prevent a bakery's monopoly.,,,,
560,"If you compete, you will try to sell better facilities and at better prices, so consumers can enjoy better rights",,,,
561,The price of the product will be cheaper because they compete with each other,,,,
562,You can compare the price and taste.,,,,
563,Compete with each other to increase the quality of the confectionery or lower the price,,,,
564,I don't know.,,,,
565,You can get new confectionery and solutions from competition.,,,,
566,I can see the knowledge I didn't know.,,,,
567,"Near the bakery,",,,,
568,It's better to lower the price in competition,,,,
569,I can tell which place is more delicious,,,,
570,You can buy it cheaply when you lower the price to attract more customers.,,,,
571,You can eat more delicious bread,,,,
572,Cheaper and better quality,,,,
573,You can get a good one,,,,
574,You can get more variety of things you need,,,,
575,We all buy two stores,,,,
576,You can eat a lot of different foods and compare them to each other at a more delicious bakery,,,,
577,Convenient.,,,,
578,There will be more events and discounts to attract more customers.,,,,
579,You can get better products.,,,,
580,You'll think it's rude,,,,
581,"""You can eat cheaper and better things, you can get better service",,,,
582,"""",,,,
583,to be able to spend better,,,,
584,"Because we think about how to sell to consumers in a better way while competing with each other, if we compete with each other, the price can be lowered and we will try to provide better services to each other. Therefore, consumers can buy products with better service and lower prices.",,,,
585,You can spend better.,,,,
586,The price goes down,,,,
587,Consumers can get a lot of slack,,,,
588,You can find out the characteristics of the two bakeries by going to both bakery A and bakery B.,,,,
589,You can get the girl you want,,,,
590,I feel like I'm going to be harmed,,,,
591,Consumers can benefit more.,,,,
592,You can buy things cheaply by lowering the price to attract a lot of consumers from each other. And you can get new things.,,,,
593,You can get a better one.You can buy it at a lower price,,,,
594,I think I can buy a better product,,,,
595,Consumers can use better quality items because they want to compete and create better quality.,,,,
596,Consumers will buy products with better quality and better service.,,,,
597,to be able to eat cheaply,,,,
598,You can eat bread at a more delicious and cheaper price.,,,,
599,This is because consumers can purchase better quality and cheaper bread due to competition from bakeries due to increased choices.,,,,
600,It can benefit consumers with better quality products and cheaper prices to consumers,,,,
601,Better products and lower prices are good for consumers,,,,
602,There are many kinds of bread.,,,,
603,"""Bakery stores offer quality products to attract consumers, so consumers are cheap",,,,
604,"You can buy quality goods.""",,,,
605,You can get better service.,,,,
606,"In the process of competition, the price of the product decreases and the quality increases.",,,,
607,to be able to buy at a lower price,,,,
608,It's getting cheaper,,,,
609,There are more delicious and cheaper products and they have a lot of sales,,,,
610,Knock it off.,,,,
611,You can get a lot of information.,,,,
612,There's a lot to eat,,,,
613,.,,,,
614,Don't know,,,,
615,The price is getting lower and lower and lower,,,,
616,I don't know.,,,,
617,"Several bakeries will compete to sell their products, allowing consumers to consume better products",,,,
618,The price goes down.,,,,
619,be available at a lower price,,,,
620,"By competing, we provide a better environment, service, etc. to consumers",,,,
621,The price of goods never goes up,,,,
622,the cheaper the price,,,,
623,Consumers can compare the two and choose a better bakery and the bakery wants to be better to be chosen,,,,
624,The number of choices increases,,,,
625,Consumers can eat better quality bread.,,,,
626,I can sell that quality product at a lower price.,,,,
627,The price goes down and the quality of the goods goes up.,,,,
628,I don't know.,,,,
629,It's better because the price is lower.,,,,
630,It is beneficial for consumers to make decisions that compete with each other and lower prices.,,,,
631,Consumers' consumption power is increased by the price reduction caused by the competition of the bakery!,,,,
632,You can get better quality,,,,
633,You can get better products.,,,,
634,Better quality goods can be obtained at a lower price,,,,
635,You can buy cheap and good products.,,,,
636,"Competition has reduced prices, allowing consumers to purchase goods at lower prices and use them as better services.",,,,
637,Consumers' convenience increases because they strive to provide better quality services to consumers through competition.,,,,
638,You can buy it at a reasonable price.,,,,
639,Let's see. Sexy,,,,
640,You can get more relief.,,,,
641,You can eat bread that is cheaper and better.,,,,
642,to be able to eat bread cheaply,,,,
643,"As bakeries lower prices and hold many events to sell their products, consumers can buy them cheaper.",,,,
644,"Competition among bakeries improves the quality of bread and lowers the price, allowing consumers to get better services.",,,,
645,Consumers can buy better products at lower prices.,,,,
646,"While economizing with each other, there is a willingness to develop each other's products, so that many bakeries can provide high-quality products to consumers at a low price.",,,,
647,Lowering prices to sell cheaper than other stores,,,,
648,"In order to promote consumer purchases, such as lower prices and better services due to competition with each other, we will establish strategies that are favorable to consumers.",,,,
649,You can buy it while comparing.,,,,
650,Consumers can buy cheaper because they sell at a lower price to sell more to each other.,,,,
651,The price could be cheaper,,,,
652,Consumers can get better products because they compete with each other and make efforts to increase the quality of the products or adjust prices to attract more consumers.,,,,
653,The price is getting cheaper,,,,
654,You can buy it cheaper,,,,
655,to be able to buy something cheaper,,,,
656,The price of bread gets cheaper and the quality gets better.,,,,
657,"There are more options for consumers to choose from. The amount of consumption is constant, but the amount of supply is constant, so bread can be purchased at a low price.",,,,
658,I can make the interior better,,,,
659,Consumers can purchase goods at low prices because they increase competitiveness by lowering prices.,,,,
660,You can receive cheap and high-quality products.,,,,
661,Consumers can get better products at lower prices because bakeries compete to lower prices or develop better products.,,,,
662,Consumers can taste more bread.,,,,
663,It benefits consumers more.,,,,
664,It will be possible to purchase quality products at low prices.,,,,
665,We can gather the ingredients faster,,,,
666,I will try to sell better products,,,,
667,to be able to buy cheaply,,,,
668,"The two bakeries will try to attract customers to each other.However, customers will go to better places and grow further to attract customers.",,,,
669,We lowered the price to compete with each other.,,,,
670,Consumers can buy better things.,,,,
671,It's better because the price is lower,,,,
672,"You can also feel that money is good and eat jam at this store and milk at that store, and you can alienate the two stores, and you can see the dog fight caused by the evolution of the conflict between the two stores. I was born in the year of the dog",,,,
673,You can choose what you want from many bakeries,,,,
674,You can taste bread in a different taste.,,,,
675,to improve in quality and become cheaper,,,,
676,"Since it's cheap,",,,,
677,Consumers benefit from being able to buy better products cheaply,,,,
678,You can buy things for less money.,,,,
679,"If the price of a product is lowered due to competition, consumers can buy the product with a lower amount of money, and the quality of the product is higher, making consumers more satisfied.",,,,
680,h,,,,
681,You can buy things at a low price.,,,,
682,a cheap meal,,,,
683,You can buy it cheaper,,,,
684,Both consumers can choose good ones because they give good ones to each other,,,,
685,I can buy a better product,,,,
686,good quality,,,,
687,You can buy more,,,,
688,Bread is delicious,,,,
689,"You can meet cheaper prices, good service, and good quality products",,,,
690,to be able to buy quality products,,,,
691,a drop in price,,,,
692,the opposite sexThe consumption price decreases,,,,
693,The price goes down,,,,
694,You can get a higher level of service,,,,
695,Consumers benefit more from competing stores,,,,
696,Other consumer competitors fall apart.,,,,
697,You can buy it cheaper because the price goes down.,,,,
698,Bread gets cheaper,,,,
699,You will be able to buy better bread,,,,
700,The price is going down,,,,
701,You can get better and better products,,,,
702,The price of the product becomes cheaper.,,,,
703,It's cheaper and you can get the service,,,,
704,"Confectionery shops are in many families, so cheap bakeries unconditionally attract the attention of consumers Therefore, each household is trying to sell more deliciously and cheaply, so it costs less money, so consumers can benefit",,,,
705,be available at a lower price,,,,
706,"If they compete with each other, stores will lower prices or hold events to attract more consumers. Then consumers will be able to benefit greatly, such as buying things cheaper.",,,,
707,I think it'll be uncomfortable and it'll be burdensome if we ask each other to come,,,,
708,"To make it more delicious, consumers can eat it more deliciously and cheaply",,,,
709,"I'm going to change the price to buy more and more, so it's a good profit...Haha",,,,
710,"As prices decrease as they compete, consumers can buy things at cheaper prices.",,,,
711,"Many kinds of food are produced, so consumers can buy and eat something else, not always.",,,,
712,Consumers can buy things cheaper.,,,,
713,Consumers can buy things cheaper.,,,,
714,You can buy things cheaper.,,,,
715,You can compare and buy better products.,,,,
716,"They can sell each other cheaply to make any profit to their bakery. Then, consumers can get a huge profit and buy it cheaper than bread bought from other stores. It's another price, but you can buy better bread.",,,,
717,to be able to get it cheaper,,,,
718,You can taste bread from various bakeries,,,,
719,You can get better products or buy them cheaply.,,,,
720,You can get better products or get cheaper.,,,,
721,You can eat cleaner and more delicious things cheaply.,,,,
722,It's getting cheaper,,,,
723,"If there is a competition, bakery A will give a discount, bakery B will give a discount, so consumers can buy bread on loan cheaper",,,,
724,You can buy it cleaner and better.,,,,
725,"As stores compete, they can eat delicious bread because they make new bread.",,,,
726,The opportunity to taste bread from various bakeries and distinguish which places are cheap and expensive,,,,
727,"Both can be delicious, so you can eat them evenly, and they can be cheaper.",,,,
728,Discounts allow consumers to buy more bread.,,,,
729,It's getting cheaper,,,,
730,More bakeries can compare prices and go to cheaper places,,,,
731,Better products will come out,,,,
732,They benefit from lower prices or better service.,,,,
733,"The price becomes cheaper, various products are developed, and merchants become friendly.",,,,
734,Consumers Can Buy Better Products,,,,
735,"The price is reduced, various products are developed, and merchants become friendly",,,,
736,to be able to buy better products  It provides us with a better service,,,,
737,to be able to get things at a lower price,,,,
738,to be able to get things at a lower price,,,,
739,I don't know.,,,,
740,It's getting cheaper,,,,
741,to be able to buy cheaply,,,,
742,We can promote each other's good points and achieve mutually beneficial development,,,,
743,I don't know.,,,,
744,to be able to eat better quality bread,,,,
745,"Bakery stores are further developed, allowing consumers to welcome higher-quality bakeries.",,,,
746,"Bakery stores are further developed, allowing consumers to welcome higher-quality bakeries.",,,,
747,"When you compete, the price decreases or the quality of the product improves, so the consumer benefits",,,,
748,have a wide range of choices,,,,
749,You can buy quality products or get good services.,,,,
750,to be able to receive better service,,,,
751,It is a good profit because the price of bread at the bakery decreases through competition.,,,,
752,Economic activities become active,,,,
753,give rights to consumers,,,,
754,I don't know,,,,
755,I don't know.,,,,
756,I don't know.,,,,
757,to be cheaper or better served,,,,
758,Profitable,,,,
759,·ㆍ,,,,
760,Competition could lead to price cuts,,,,
761,You can receive new products and services that consumers can be more satisfied with,,,,
762,to be able to buy by comparison,,,,
763,I don't know,,,,
764,You can choose a better product,,,,
765,Diversity,,,,
766,It's getting cheaper,,,,
767,Better quality and quantity can be compared and bought,,,,
768,to be able to reap more benefits,,,,
769,We can properly meet the needs of consumers because we will meet the needs of consumers to attract each other.,,,,
770,"Since bakeries will try to attract more customers to each other, they can consume better quality bread.",,,,
771,You can buy cheaper products with better quality.,,,,
772,"If you compete with each other, it's a personal gain for the consumer because you want to further develop each other's strengths",,,,
773,Consumers can gain more benefits or profits from activities such as discounts to avoid losing customers in the competition,,,,
774,You can buy better service and better quality confectionery,,,,
775,You can expect the price to go down and there will be various benefits.,,,,
776,It is advantageous to consumers in terms of service and price because it prevents monopolies,,,,
777,The price becomes cheaper.,,,,
778,Prices go down and quality goes up,,,,
779,Cheaper. Better,,,,
780,The bread becomes delicious.,,,,
781,The price goes down and the quality goes up.,,,,
782,We're trying to make each other better,,,,
783,"The two bakeries make efforts to reduce prices or increase quality in order to attract consumers from each other, resulting in benefits for consumers.",,,,
784,Cheap prices. You can buy quality goods.,,,,
785,The bread becomes delicious.,,,,
786,You can experience various advanced products.,,,,
787,mutually beneficial to consumers It's because it gives you a price or increases the quality of the product,,,,
788,Better quality services can be provided to consumers.,,,,
789,The price goes down,,,,
790,to be able to buy good products at a lower price,,,,
791,drinkingI don't understand.,,,,
792,Bakery stores lower prices or increase the quality of their products to sell more to each other.,,,,
793,"It's getting cheaper, so it pays off",,,,
794,to be able to buy a cheap product,,,,
795,Price goes down or quality goes up (benefits go back to consumers),,,,
796,I don't know.,,,,
797,"Competition may lower prices, so you can buy them cheaply",,,,
798,Better quality products can be supplied at lower prices.,,,,
799,"They include service improvement, product quality improvement, and price reduction.",,,,
800,You can buy better quality products and get more benefits.,,,,
801,"When suppliers compete, there are advantages for consumers in various ways, such as the quality of goods or services and the cost of consumers.",,,,
802,have access to better quality products and benefits,,,,
803,I don't know.,,,,
804,The price goes down. The quality of the product improves.,,,,
805,Prices go down and quality goes up.,,,,
806,Consumers can get cheaper products and better quality products because prices can be lowered or quality can be improved in the process of competition,,,,
807,GH and S,,,,
808,The quality of the product increases and the choice is wider.,,,,
809,It gets cheaper and tastier. I try my best,,,,
810,Various kinds of bread and prices will not get expensive often.,,,,
811,Better quality products for consumers make greater profits for companies.,,,,
812,Cheaper and higher quality to increase the number of customers,,,,
813,It is better for consumers because they lower prices or improve services to sell more competitively to each other.,,,,
814,You can get better services or buy things cheaply.,,,,
815,This is because several bakeries compete with each other and struggle to provide better products and services.,,,,
816,a fall in prices,,,,
817,Goods can be consumed at reasonable prices.,,,,
818,"The quality of goods increases and prices fall. It may be less, but it is omitted because there is not enough time.",,,,
819,It makes better products cheaper.,,,,
820,. It's good to choose,,,,
821,"What's good for consumers is that if several bakeries compete with each other, the price of goods decreases.",,,,
822,"If several bakeries compete with each other, they will offer more benefits, such as lowering product prices or offering many services such as 1+1 to sell more products to consumers. Therefore, consumers will be able to use it to receive many benefits.",,,,
823,"If several bakeries compete with each other, they invest more in technology development to provide consumers with factors to consume their products than other bakeries, and prices are also competitive, allowing consumers to consume better products at lower prices.",,,,
824,"If they compete with each other, the bakery will lower their prices due to competitive sentiment, and consumers will be able to buy low-priced food",,,,
825,"As several bakeries compete with each other, bakeries will try to develop better products. Therefore, consumers can consume better products.",,,,
826,a lack of time,,,,
