1188,You have to use electricity.,,
1189,Put a lot of batteries in the electrical circuit and let a lot of current flow out,,
1190,It allows more current to flow.,,
1191,Connect the batteries in series,,
1192,cause an electric current to flow,,
1193,Put more batteries so that more electricity flows.,,
1194,Add one more battery.,,
1195,Lower the resistance and increase the voltage,,
1196,Lower resistance and increase current.,,
1197,Lower the resistance and increase the voltage,,
1198,"Connect more batteries in series to the original electrical circuit, making the current stronger, causing the compass needle to move more",,
1199,"As much as the electric wires are added in series to the compass, a lot of switches are added to flow a lot of current.",,
1200,Connect the batteries in series,,
1201,"If you use a magnet, you can move more.",,
1202,Add one more battery in series.,,
1203,Add batteries to increase the intensity of the current.,,
1204,Make the current stronger or connect one more battery in series to the original electrical circuit.,,
1205,"""1. Make sure electricity flows.",,
1206,"2. Prepare a lot of supplies.""",,
1207,Add batteries and wires to the electrical circuit.,,
1208,"Connect batteries to electrical circuits in series.""",,
1209,Increase the current intensity,,
1210,reverse the circuit,,
1211,Turn the electrical circuit from side to side,,
1212,"If you want the compass to move more needles in the compass without moving it, you need to add batteries as much as you move more.",,
1213,Change the direction of the compass,,
1214,I don't know.,,
1215,Add reproduction,,
1216,Increase the number of batteries,,
1217,It allows more current to flow.And increase the number of cells.,,
1218,.-.ㅡ,,
1219,처The first time,,
1220,I don't know,,
1221,Don't know,,
1222,to make the current stronger,,
1223,I don't know,,
1224,Put it on various sides and put it on the side that moves a lot.,,
1225,Blur the current hard.,,
1226,I don't know,,
1227,I don't know,,
1228,I don't know.,,
1229,I don't know.,,
1230,Connect in parallel,,
1231,A lot of voltage!,,
1232,Additional battery,,
1233,Add batteries,,
1234,It sends an electric current more strongly.,,
1235,Increase the number of batteries,,
1236,Change the battery voltage to a stronger one,,
1237,Add a lot of batteries or use a wire with a higher electrical power.,,
1238,I don't know.,,
1239,It makes the current flow harder.,,
1240,I'm bringing a magnet,,
1241,It allows more current to flow.,,
1242,Because of the n pole and the s pole,,
1243,"""㉠Create an electrical circuit by connecting cells, pincer wires, switches, and wires.",,
1244,Align the compass needle north-south and bring the wires of the electrical circuit straight to the compass consistent with the compass needle.,,
1245,Open and close the switch to observe the movement of the compass needle.,,
1246,"Change the direction in which the current flows and repeat the experiment.""",,
1247,Close the switch and let the current flow harder,,
1248,I'm going counterclockwise,,
1249,I don't know,,
1250,Add an electrical circuit.,,
1251,I don't know,,
1252,It moves using an electrical circuit.,,
1253,It sends out a stronger current.,,
1254,"If you bring the electric wire close to the compass,",,
1255,Turn the compass,,
1256,"""",,
1257,"The more electricity you wind, the stronger the electromagnetic induction, so the stronger the magnetic field becomes and the more it moves.""",,
1258,You may need a magnet or a metal object rubbed against the magnet.,,
1259,I don't know,,
1260,"""The reason the compass needle moves is because of the influence of (magnetic field) or (electric field).The N pole of the compass needle refers to the S pole of the bar magnet, and the S pole refers to the N pole of the bar magnet.Connecting the direction indicated by the N pole of the compass leaves the N pole of the bar magnet and enters the S pole.",,
1261,"Needle placed under the enamel line: ·If the current is north-south, the N pole turns west.·If the current is in the north-south direction, the N pole returns to the east",,
1262,"Needle placed on the enamel line: ·If the current is north-south, the N pole turns east.",,
1263,"·If the current is in the north-south direction, the N pole returns to the west.",,
1264,"Connecting the battery in the opposite direction will change the direction of the current and reverse the needle in the compass.""",,
1265,Change the direction of the current.,,
1266,I don't know,,
1267,Put the magnet close to the compass.,,
1268,The needle moves in the direction of the magnetic field formed on the enamel line.,,
1269,It sends out a slightly stronger current.,,
1270,It moves with an electromagnet.,,
1271,It allows more current to flow.,,
1272,It moves with a magnet or a metal object.,,
1273,I don't know,,
1274,use a magnet,,
1275,electricity,,
1276,I have no idea.,,
1277,Get close to the electronics,,
1278,keep the wires from side by side,,
1279,I'm turning it,,
1280,I need an electrical circuit.,,
1281,I don't know,,
1282,Move the line.,,
1283,"If you let more current flow, the needle will move more.",,
1284,What...?,,
1285,I'm turning it,,
1286,It sends a lot of electricity.Connect more wires to the compass.,,
1287,Add more electrical circuits to allow stronger currents to flow,,
1288,Add more electricity,,
1289,It sends a stronger current,,
1290,Changing directions,,
1291,Using the power of electricity,,
1292,I think we can put the compass under the wire and adjust the direction so that the compass needle and the wire are side by side,,
1293,"When electrons and wires are moved, the compass moves by electrical action.",,
1294,Shake the wires,,
1295,I don't know.,,
1296,I don't know.,,
1297,More battery connections,,
1298,I don't know.,,
1299,increase the intensity of an electric current,,
1300,Connect more batteries in series,,
1301,increase the intensity of an electric current,,
1302,Strong current flow,,
1303,Connect several batteries,,
1304,It will increase the power.,,
1305,"It uses a magnet.""",,
1306,Put a magnet on it',,
1307,be in a state of confusion,,
1308,increase the electric current,,
1309,Connect more batteries,,
1310,It causes a stronger current to flow.,,
1311,cause a stronger current to flow,,
1312,Add more batteries to increase the intensity of the current,,
1313,to make the current stronger,,
1314,increase the intensity of an electric current,,
1315,increase the intensity of an electric current,,
1316,Increase the intensity of an electric current.,,
1317,Connect more batteries in series to increase the amount of current.,,
1318,Turn up the voltage,,
1319,Yeah.,,
1320,The electric current?,,
1321,Add the battery in the serial direction.,,
1322,ㅗ,,
1323,Put a magnet on it,,
1324,I don't know.,,
1325,Add batteries,,
1326,I don't understand.,,
1327,"""Connect in a series structure.",,
1328,"""",,
1329,Connect the batteries in series,,
1330,Connect the batteries in series and cycle the switch.,,
1331,Do not connect the poles of the battery in reverse.,,
1332,I don't know.,,
1333,"V=IR. Therefore, to increase the intensity of the current, there is a way to equalize the voltage and reduce the resistance.",,
1334,"V=IR. Therefore, to increase the intensity of the current, there is a way to equalize the voltage and reduce the resistance.",,
1335,Increase the power.,,
1336,strengthen an electric current,,
1337,increase the intensity of an electric current,,
1338,I'm tired,,
1339,It increases the current,,
1340,Turn the voltage up.,,
1341,increase the strength of the rectification stream,,
1342,The cells are connected more in series to make the current thinner.,,
1343,Evaluation Only. Created with Aspose.Cells for Python via Java.Copyright 2003 - 2022 Aspose Pty Ltd.,,
