827,This is because many bakeries are trying to start a price race or sell better quality products to get them to buy snacks from their bakery,,,,
828,I can eat something more delicious That's so sweet.,,,,
829,"First, if you monopolize all markets alone, there are no competitors selling the same product, so consumers who no longer develop technology or need the product at a little bit will have no choice but to buy the product. However, if competition is carried out, the profit margin will fall due to competition if technology development or price reduction is not carried out. And it's good that consumers get good quality products at a low price in the middle.",,,,
830,Provide better products and prices to consumers to attract more consumers to each other.,,,,
831,I'm sorry.,,,,
832,..good quality,,,,
833,"If we try to get better with each other, consumers can eat better bread.",,,,
834,have a choice,,,,
835,You can eat cheaper bread and taste more kinds and flavors.,,,,
836,You can buy it cheaply.,,,,
837,"You can get better service, etc.",,,,
838,Consumers are provided with opportunities to experience more products and can compare products.,,,,
839,LOL,,,,
840,Consumers can enjoy a variety of flavors.,,,,
841,I don't know,,,,
842,M and D,,,,
843,You can buy things cheaper.,,,,
844,You can buy it cheap,,,,
845,can be consumed by comparison,,,,
846,Make a profit.,,,,
847,I don't know.,,,,
848,.,,,,
849,to be able to eat bread cheaply,,,,
850,I can see where is better by comparing,,,,
851,to be able to enjoy various things,,,,
852,I can see many things,,,,
853,You can enjoy a variety of bread.,,,,
854,The performance of the product is much better,,,,
855,The performance of the product is good,,,,
856,Product performance improves,,,,
857,You have more choices,,,,
858,The price goes down,,,,
859,You get better quality,,,,
860,I don't know.,,,,
861,"Since it's cheap, there are a lot of muk-ggings and real rice",,,,
862,I eat various kinds of bread,,,,
863,You can get better service at various bakeries.,,,,
864,We will try to provide better service to each other so that consumers can buy or eat in a better environment,,,,
865,"As stores compete with each other, consumers can find better stores.",,,,
866,I went to Moru,,,,
867,You can eat while comparing.,,,,
868,The condition of the product improves or the price becomes cheaper,,,,
869,We can compete with each other and develop more,,,,
870,You can get better service,,,,
871,You can choose which bakery to go to,,,,
872,to be able to choose,,,,
873,Make it more beneficial to consumers,,,,
874,You can buy bread at a lower price,,,,
875,You can get a new service,,,,
876,You can be treated well.,,,,
877,The price goes down.,,,,
878,to be able to get something new,,,,
879,to be able to get something new,,,,
880,have a chance to choose,,,,
881,There are many opportunities to choose.,,,,
882,This is because we can try many breads because we develop and sell new breads,,,,
883,Bread becomes cheaper,,,,
884,I can eat something more delicious,,,,
885,to be able to receive better service,,,,
886,"The price of bread is getting cheaper, which is much better for consumers",,,,
887,"The price of bread is getting cheaper, which is much better for consumers.",,,,
888,Consumers can eat delicious bread because a bakery and b bakery make each other more delicious bread when they compete,,,,
889,The bread is getting cheaper and will benefit consumers,,,,
890,"If you compete, you can buy it cheaply because you want to reduce the price of each other.It is possible to provide consumers with more delicious and better facilities by researching interior cooking by consuming that it will be better than other bakeries by competing.",,,,
891,I'm glad there are more kinds to buy,,,,
892,The people have the right to...,,,,
893,Better service and cheaper bread are available,,,,
894,I can eat both bakery A and bakery B,,,,
895,"To compete, we try to make more delicious bread for each other, so that better and more delicious bread comes to consumers",,,,
896,Facilities and services will be better to attract customers to each other,,,,
897,You can taste various kinds of bread.,,,,
898,"If there is a competitive store next to one's store, it will be competitive and pursue something better than the other's store, so consumers will be able to buy better things.",,,,
899,to be able to eat bread at a cheaper price,,,,
900,You can see more kinds of bread and choose the best bread for yourself,,,,
901,You can choose to go to the more delicious bakery among many bakeries or buy bread at a cheaper place.,,,,
902,You can buy bread at the cheaper of the two.,,,,
903,You can buy bread at a cheaper place,,,,
904,"If you think your store should be better than other stores and try to make it better, consumers will benefit from the consumer's point of view because they can buy it more cost-effectively.",,,,
905,You can eat new bread because you say you will win if you do economy.,,,,
906,"Each bakery sells different bread, so you can eat different breads when you want to eat different breads",,,,
907,You have the opportunity to buy more bread and you can buy it cheaper,,,,
908,"While competing with each other, bakeries can reduce the price of bread to sell well to each other, so they can buy bread more cheaply and deliciously.",,,,
909,I think the consumer will be very good at choosing better bread.,,,,
910,You can buy it cheaply,,,,
911,Don't know,,,,
912,More to promote,,,,
913,to be able to buy cheaply,,,,
914,We can spend more wisely.,,,,
915,"e.g. A is 1,000 won and B is 1,100 won",,,,
916,You can buy products cheaply. You can buy quality products.,,,,
917,.,,,,
918,"You can make a profit (service improvement, etc.)",,,,
919,It's cheaper and better,,,,
920,"""There is a possibility that we will be able to implement what is beneficial to consumers",,,,
921,"""",,,,
922,You can eat food made of cheaper and better quality.,,,,
923,be likely to benefit,,,,
924,You can go to many stores and buy cheap things.,,,,
925,This is because bakery parallels are maintained.,,,,
926,...,,,,
927,I don't know,,,,
928,There may be new bread,,,,
929,have access to a variety of things,,,,
930,You can know more by looking at what someone else has done other than what I think.,,,,
931,We can compare the products of the two stores and buy better products.,,,,
932,"And you can buy it cheaper.""",,,,
933,You can buy it cheaper.,,,,
934,You can buy it cheaper,,,,
935,They sell at a low price to make each other cheap and attract people,,,,
936,The economy develops.,,,,
937,Consumers can buy the same product at a lower price.,,,,
938,"The price is cheap, so you can buy less money",,,,
939,You can sell more.,,,,
940,The bakery gives you a better price to sell more items The buyer can buy the same 수-ㄴ,,,,
941,Consumers can enjoy delicious bread.,,,,
942,The price becomes cheaper.,,,,
943,The price is getting cheaper and the quality is getting better,,,,
944,be available at a low price,,,,
945,become cheaper,,,,
946,become cheaper,,,,
947,"When bakeries compete, bakeries offer better services and products at better prices to sell more items.  And you can buy other products cheaper and people can choose where they want to go.",,,,
948,"The more competitive our competitors are, the more convenient we are, the cheaper our consumers enjoy goods and services",,,,
949,Good things can happen if you advertise or divide advertisements,,,,
950,.,,,,
951,I don't know,,,,
952,I don't know.,,,,
953,Consumers can get more variety of confectionery.,,,,
954,You can get better service.,,,,
955,You can purchase qualitatively better items and receive various information as an item.,,,,
956,to be able to eat better bread,,,,
957,I don't know,,,,
958,have access to better and better products,,,,
959,"If you only pursue good things to win while competing with each other, the bakery itself will change for the better, and the bakery, which has changed for the better, will help consumers to consume more satisfactory and efficiently.",,,,
960,I don't know,,,,
961,You can get better quality goods and services.,,,,
962,I don't know,,,,
963,The price goes down,,,,
964,become cheaper,,,,
965,We can choose better quality products.,,,,
966,"""",,,,
967,You can buy goods at a relatively lower price than when there is only one bakery.,,,,
968,to be able to buy at a better price that is better and cheaper,,,,
969,You can get more services from the bakery,,,,
970,You can get bread cheaper,,,,
971,Various services are available,,,,
972,Consumers can buy the best bread because they work hard for each other's best quality products.,,,,
973,The good thing for consumers is that they can make better quality bread and lower prices to sell more.,,,,
974,to be able to get a better product or service,,,,
975,You can get better service and get quality products.,,,,
976,I don't know.,,,,
977,You can get better service and quality,,,,
978,"Competition allows companies to continue to develop and upgrade to produce better products through development, allowing consumers to purchase good quality products",,,,
979,"When several bakeries compete, the likelihood of price competition increases. Therefore, the overall price of the product will decrease and consequently benefit the consumer.",,,,
980,become cheaper,,,,
981,"In order to gain an upper hand in competition, bakeries try to increase sales by lowering prices and increasing the quality of services and products. Therefore, from the perspective of consumers, competition works well to improve the quality of goods they will consume.",,,,
982,become cheaper,,,,
983,be available at a low price,,,,
984,You can work harder,,,,
985,You can feel a different taste.,,,,
986,You can make money and consumers can eat deliciously,,,,
987,I don't know,,,,
988,Consumers can eat more bread,,,,
989,I could eat it deliciouslyI don't know,,,,
990,We can earn each other's profits,,,,
991,You can buy better quality and cheaper products,,,,
992,Consumers can buy good products.,,,,
993,"When consumers spend a lot of money, they are cat-and-",,,,
994,"Thanks to the competition of various bakeries, consumers benefit by providing services to consumers",,,,
995,You can buy various products,,,,
996,I don't know.,,,,
997,Consumers can eat unique bread.,,,,
998,"You can know more kinds of bread, and if you have cheaper ones, you can buy better",,,,
999,You can see that there are many different kinds of bread.,,,,
1000,You can buy many things,,,,
1001,You can eat bread that you don't have at the bakery you used to go to.,,,,
1002,You can buy better products,,,,
1003,If a bakery does well...Other bakeries could be ruined.,,,,
1004,"By making various products, consumers can buy products that suit themselves among more products.",,,,
1005,The price is going down,,,,
1006,I can eat a lot of delicious bread,,,,
1007,You can eat a variety of bread,,,,
1008,It's getting cheaper,,,,
1009,It gets cheaper,,,,
1010,improve in quality,,,,
1011,I doubt it.,,,,
1012,We can provide better quality products to our customers,,,,
1013,to be able to benefit,,,,
1014,"receive better products, benefits and services",,,,
1015,Economic activity becomes active,,,,
1016,to know the information of each bakery,,,,
1017,The price could be cheaper,,,,
1018,a good profit at a lower price,,,,
1019,"I can see, compare, and consume many different products",,,,
1020,You can get better services and products,,,,
1021,You can buy better products and good prices.,,,,
1022,It benefits consumers a lot and can be purchased at a cheaper price and good quality.,,,,
1023,"You can compare and buy various products, and you can buy them at relatively low prices because they are on sale",,,,
1024,Better quality and price of goods to attract more customers as they compete with each other,,,,
1025,A sense of competition and motivation to work harder.,,,,
1026,I don't know.,,,,
1027,I don't know,,,,
1028,The quality of the product will improve and the product will be sold at a reasonable price,,,,
1029,You're right,,,,
1030,"According to the principle of supply and demand, it is possible to reduce the price of the product by enhancing sound competition between bakeries.",,,,
1031,You can choose more products,,,,
1032,to get better quality products,,,,
1033,Consumers can be given better choices and environments.,,,,
1034,Consumers will be able to purchase better quality products at lower prices.,,,,
1035,Cheap,,,,
1036,Free things make you bald,,,,
1037,"I don't think monopolies are beneficial in everything in our lives. Therefore, the market structure of the competitive system can be seen as more beneficial for consumers because there may be a feeling of coercion in the case of stores that have monopolies than those that do not.",,,,
1038,The price goes down.,,,,
1039,"Due to price competition, you can get products at low prices and get good quality products.",,,,
1040,Competition improves the quality of goods and lowers prices.,,,,
1041,"Because they try to sell things, the price is cheap and the quality is bad",,,,
1042,We will compete with each other and try to sell better quality products at lower prices.,,,,
1043,"If we compete with each other, we have more opportunities to choose between here and there, so it is good for consumers to compete with each other.",,,,
1044,"The price of the product is lowered, so you can purchase the product at a lower price.",,,,
1045,I don't care about dirty liberal arts I feel dirty.,,,,
1046,It consumer very profit Use survival strategy due to competition More interest and benefits to consumers Consumer happiness Customer satisfaction,,,,
1047,The price is reduced. The quality of the goods is improved.,,,,
1048,"If several bakeries compete, they will produce their own unique products, and then more diverse products will be commercialized on the market. This is because consumers can access more diverse products.",,,,
1049,"""As two different companies compete, they will offer better quality products and services to consumers to sell more products, increasing the variety of products and services that consumers can consume, increasing the number of products that they can choose, and if different companies compete, they can get the products they want.",,,,
1050,"+As companies try to match consumers' preferences, such as conducting surveys on types that suit consumers' preferences, companies can know about consumers without directly requesting them.""",,,,
1051,"In order to sell goods to consumers, the quality and price of goods will be improved in a more beneficial direction to consumers. Taking the above problem as an example, Bakery A will take actions such as changing the interior or developing new products to increase competitiveness in preparation for customers to flock to Bakery B due to the promotion of Bakery B. This will allow consumers to purchase new menus at a more reasonable and affordable price.",,,,
1052,"The quality of the bakery that consumers will use will increase, such as lowering prices, improving product quality, and producing new products to attract consumers from each other.",,,,
1053,I lower the price to sell more,,,,
1054,"By competing with the bakery, the price of the product decreases or many kinds of products are created, so you can taste and experience many things",,,,
1055,"The price keeps going down, so you can buy it cheaply",,,,
1056,I don't know.,,,,
1057,to be able to buy something cheap,,,,
1058,The benefits of consumers increase,,,,
1059,It's getting cheaper,,,,
1060,"If you compete with each other, the price may go down or you may have an event Then it's more profitable for consumers",,,,
1061,You can eat bread cheaper.,,,,
1062,We will work hard to provide better service to each other at a lower price,,,,
1063,"You can eat it cheaply. Stores also develop new menus through competition, so you can enjoy a variety of menus. If one store is off, you can go to another store.",,,,
1064,"Consumers can buy things at a lower price. Furthermore, as the price of goods becomes cheaper, consumers can receive better quality goods.",,,,
1065,"If bakeries compete with each other, they will try to provide higher quality goods and services to be chosen by consumers, so consumers can consume higher quality goods",,,,
1066,Two bakeries try to make cheaper and higher quality confectionery with each other in order to get consumers to consume it at their own bakery.,,,,
1067,"It is beneficial for consumers because prices may be lowered due to competition, or they may compete with various events to sell a lot at bakeries.",,,,
1068,"Compete and compete to attract customers to their stores, so that consumers can buy things cheaper And the development of various menus of bread and the quality of ingredients are improved due to competition, so we can eat better bread",,,,
1069,You can choose the most delicious confectionery of each bakery and eat it,,,,
1070,"If there is a competitor, the price will be lowered and the quality of the product will be improved in order to sell each other's products well. It also helps increase product diversity.",,,,
1071,"It is a cause of developing the quality and efficiency of products while competing with each other, and from the perspective of consumers, it is possible to select and purchase quality products and it is effective, which makes economic activities active. Economic revitalization, diversification of commodities.",,,,
1072,Consumers can buy bread at a lower price or eat better quality bread,,,,
1073,The price goes down. to be able to get better service,,,,
1074,a fall in prices,,,,
1075,"Competition improves the quality and price of the product, so you can spend better",,,,
1076,to be able to get better quality products,,,,
1077,It's getting cheaper,,,,
1078,There are benefits such as lowering prices to attract consumers while competing,,,,
1079,The price goes down,,,,
1080,Can buy it at a low price,,,,
1081,You can get better service at a better price,,,,
1082,You can buy good quality goods at a low price.,,,,
1083,You can get better service,,,,
1084,Prices run in competition. Consumers can buy cheaply,,,,
1085,There will be competition in terms of price and quality,,,,
1086,to be able to enjoy better benefits,,,,
1087,It's getting cheaper,,,,
1088,Consumers can buy things at a low price.I don't know,,,,
1089,We can earn each other's profits,,,,
1090,You can buy better quality and cheaper products,,,,
1091,Consumers can buy good products.,,,,
1092,"When consumers spend a lot of money, they are cat-and-",,,,
1093,"Thanks to the competition of various bakeries, consumers benefit by providing services to consumers",,,,
1094,You can buy various products,,,,
1095,I don't know.,,,,
1096,Consumers can eat unique bread.,,,,
1097,"You can know more kinds of bread, and if you have cheaper ones, you can buy better",,,,
1098,You can see that there are many different kinds of bread.,,,,
1099,You can buy many things,,,,
1100,You can eat bread that you don't have at the bakery you used to go to.,,,,
1101,You can buy better products,,,,
1102,If a bakery does well...Other bakeries could be ruined.,,,,
1103,"By making various products, consumers can buy products that suit themselves among more products.",,,,
1104,The price is going down,,,,
1105,I can eat a lot of delicious bread,,,,
1106,You can eat a variety of bread,,,,
1107,It's getting cheaper,,,,
1108,It gets cheaper,,,,
1109,improve in quality,,,,
1110,I doubt it.,,,,
1111,We can provide better quality products to our customers,,,,
1112,to be able to benefit,,,,
1113,"receive better products, benefits and services",,,,
1114,Economic activity becomes active,,,,
1115,to know the information of each bakery,,,,
1116,The price could be cheaper,,,,
1117,a good profit at a lower price,,,,
1118,"I can see, compare, and consume many different products",,,,
1119,You can get better services and products,,,,
1120,You can buy better products and good prices.,,,,
1121,It benefits consumers a lot and can be purchased at a cheaper price and good quality.,,,,
1122,"You can compare and buy various products, and you can buy them at relatively low prices because they are on sale",,,,
1123,Better quality and price of goods to attract more customers as they compete with each other,,,,
1124,A sense of competition and motivation to work harder.,,,,
1125,I don't know.,,,,
1126,I don't know,,,,
1127,The quality of the product will improve and the product will be sold at a reasonable price,,,,
1128,You're right,,,,
1129,"According to the principle of supply and demand, it is possible to reduce the price of the product by enhancing sound competition between bakeries.",,,,
1130,You can choose more products,,,,
1131,to get better quality products,,,,
1132,Consumers can be given better choices and environments.,,,,
1133,Consumers will be able to purchase better quality products at lower prices.,,,,
1134,Cheap,,,,
1135,Free things make you bald,,,,
1136,"I don't think monopolies are beneficial in everything in our lives. Therefore, the market structure of the competitive system can be seen as more beneficial for consumers because there may be a feeling of coercion in the case of stores that have monopolies than those that do not.",,,,
1137,The price goes down.,,,,
1138,"Due to price competition, you can get products at low prices and get good quality products.",,,,
1139,Competition improves the quality of goods and lowers prices.,,,,
1140,"Because they try to sell things, the price is cheap and the quality is bad",,,,
1141,We will compete with each other and try to sell better quality products at lower prices.,,,,
1142,"If we compete with each other, we have more opportunities to choose between here and there, so it is good for consumers to compete with each other.",,,,
1143,"The price of the product is lowered, so you can purchase the product at a lower price.",,,,
1144,I don't care about dirty liberal arts I feel dirty.,,,,
1145,It consumer very profit Use survival strategy due to competition More interest and benefits to consumers Consumer happiness Customer satisfaction,,,,
1146,The price is reduced. The quality of the goods is improved.,,,,
1147,"If several bakeries compete, they will produce their own unique products, and then more diverse products will be commercialized on the market. This is because consumers can access more diverse products.",,,,
1148,"""As two different companies compete, they will offer better quality products and services to consumers to sell more products, increasing the variety of products and services that consumers can consume, increasing the number of products that they can choose, and if different companies compete, they can get the products they want.",,,,
1149,"+As companies try to match consumers' preferences, such as conducting surveys on types that suit consumers' preferences, companies can know about consumers without directly requesting them.""",,,,
1150,"In order to sell goods to consumers, the quality and price of goods will be improved in a more beneficial direction to consumers. Taking the above problem as an example, Bakery A will take actions such as changing the interior or developing new products to increase competitiveness in preparation for customers to flock to Bakery B due to the promotion of Bakery B. This will allow consumers to purchase new menus at a more reasonable and affordable price.",,,,
1151,"The quality of the bakery that consumers will use will increase, such as lowering prices, improving product quality, and producing new products to attract consumers from each other.",,,,
1152,I lower the price to sell more,,,,
1153,"By competing with the bakery, the price of the product decreases or many kinds of products are created, so you can taste and experience many things",,,,
1154,"The price keeps going down, so you can buy it cheaply",,,,
1155,I don't know.,,,,
1156,to be able to buy something cheap,,,,
1157,The benefits of consumers increase,,,,
1158,It's getting cheaper,,,,
1159,"If you compete with each other, the price may go down or you may have an event Then it's more profitable for consumers",,,,
1160,You can eat bread cheaper.,,,,
1161,We will work hard to provide better service to each other at a lower price,,,,
1162,"You can eat it cheaply. Stores also develop new menus through competition, so you can enjoy a variety of menus. If one store is off, you can go to another store.",,,,
1163,"Consumers can buy things at a lower price. Furthermore, as the price of goods becomes cheaper, consumers can receive better quality goods.",,,,
1164,"If bakeries compete with each other, they will try to provide higher quality goods and services to be chosen by consumers, so consumers can consume higher quality goods",,,,
1165,Two bakeries try to make cheaper and higher quality confectionery with each other in order to get consumers to consume it at their own bakery.,,,,
1166,"It is beneficial for consumers because prices may be lowered due to competition, or they may compete with various events to sell a lot at bakeries.",,,,
1167,"Compete and compete to attract customers to their stores, so that consumers can buy things cheaper And the development of various menus of bread and the quality of ingredients are improved due to competition, so we can eat better bread",,,,
1168,You can choose the most delicious confectionery of each bakery and eat it,,,,
1169,"If there is a competitor, the price will be lowered and the quality of the product will be improved in order to sell each other's products well. It also helps increase product diversity.",,,,
1170,"It is a cause of developing the quality and efficiency of products while competing with each other, and from the perspective of consumers, it is possible to select and purchase quality products and it is effective, which makes economic activities active. Economic revitalization, diversification of commodities.",,,,
1171,Consumers can buy bread at a lower price or eat better quality bread,,,,
